[32m[I 2022-11-08 10:01:13,248][0m Trial 1725 finished with value: 0.0018069444569762674 and parameters: {'nlayers': 14, 'hidden_size': 72, 'dropout': 0.1395954783122883, 'learning_rate': 0.007527558526056428, 'batch_size': 9822, 'optimizer_name': 'Adam'}. Best is trial 1569 with value: 0.001761963053552708.[0m
[32m[I 2022-11-08 10:01:32,552][0m Trial 1726 finished with value: 0.0019183894333466276 and parameters: {'nlayers': 9, 'hidden_size': 100, 'dropout': 0.1463645219292671, 'learning_rate': 0.0021726372760189636, 'batch_size': 9252, 'optimizer_name': 'RMSprop'}. Best is trial 1569 with value: 0.001761963053552708.[0m
[32m[I 2022-11-08 10:02:02,035][0m Trial 1727 finished with value: 0.001771901720567825 and parameters: {'nlayers': 19, 'hidden_size': 162, 'dropout': 0.18050775266430386, 'learning_rate': 0.002452227900076638, 'batch_size': 9994, 'optimizer_name': 'Adam'}. Best is trial 1569 with value: 0.001761963053552708.[0m
[32m[I 2022-11-08 10:02:26,243][0m Trial 1728 finished with value: 0.0017720922326841275 and parameters: {'nlayers': 16, 'hidden_size': 92, 'dropout': 0.3934024447420702, 'learning_rate': 0.0018573544478444907, 'batch_size': 9996, 'optimizer_name': 'Adam'}. Best is trial 1569 with value: 0.001761963053552708.[0m
[32m[I 2022-11-08 10:02:46,583][0m Trial 1729 finished with value: 0.0018504177871157095 and parameters: {'nlayers': 8, 'hidden_size': 107, 'dropout': 0.42314599842597456, 'learning_rate': 0.0015704289660509294, 'batch_size': 9568, 'optimizer_name': 'Adam'}. Best is trial 1569 with value: 0.001761963053552708.[0m
[32m[I 2022-11-08 10:03:18,132][0m Trial 1730 finished with value: 0.0017749315229491852 and parameters: {'nlayers': 35, 'hidden_size': 111, 'dropout': 0.15646241684761544, 'learning_rate': 0.0073633231552333025, 'batch_size': 9994, 'optimizer_name': 'Adam'}. Best is trial 1569 with value: 0.001761963053552708.[0m
[32m[I 2022-11-08 10:03:47,290][0m Trial 1731 finished with value: 0.0018356122635189499 and parameters: {'nlayers': 31, 'hidden_size': 114, 'dropout': 0.12089240408957776, 'learning_rate': 0.0019948177878188335, 'batch_size': 9682, 'optimizer_name': 'Adam'}. Best is trial 1569 with value: 0.001761963053552708.[0m
[32m[I 2022-11-08 10:04:09,661][0m Trial 1732 finished with value: 0.0018024662998931715 and parameters: {'nlayers': 12, 'hidden_size': 103, 'dropout': 0.40727341405405504, 'learning_rate': 0.0022067390517169355, 'batch_size': 9820, 'optimizer_name': 'Adam'}. Best is trial 1569 with value: 0.001761963053552708.[0m
[32m[I 2022-11-08 10:04:44,747][0m Trial 1733 finished with value: 0.001778486200153416 and parameters: {'nlayers': 49, 'hidden_size': 94, 'dropout': 0.1339838903533212, 'learning_rate': 0.0010229078689324871, 'batch_size': 9993, 'optimizer_name': 'Adam'}. Best is trial 1569 with value: 0.001761963053552708.[0m
[32m[I 2022-11-08 10:05:20,338][0m Trial 1734 finished with value: 0.0017770279794931411 and parameters: {'nlayers': 43, 'hidden_size': 119, 'dropout': 0.4869114737544199, 'learning_rate': 0.002488208327916472, 'batch_size': 10000, 'optimizer_name': 'Adam'}. Best is trial 1569 with value: 0.001761963053552708.[0m
[32m[I 2022-11-08 10:05:57,824][0m Trial 1735 finished with value: 0.0018891848916087145 and parameters: {'nlayers': 22, 'hidden_size': 272, 'dropout': 0.16459621744432737, 'learning_rate': 0.005986475502770902, 'batch_size': 9430, 'optimizer_name': 'Adam'}. Best is trial 1569 with value: 0.001761963053552708.[0m
[32m[I 2022-11-08 10:06:36,027][0m Trial 1736 finished with value: 0.0018378491249631623 and parameters: {'nlayers': 77, 'hidden_size': 75, 'dropout': 0.4691317658149742, 'learning_rate': 0.002130849233552102, 'batch_size': 9691, 'optimizer_name': 'SGD'}. Best is trial 1569 with value: 0.001761963053552708.[0m
[32m[I 2022-11-08 10:07:13,462][0m Trial 1737 finished with value: 0.0018356876663811385 and parameters: {'nlayers': 38, 'hidden_size': 158, 'dropout': 0.17318001896213212, 'learning_rate': 0.0017422833867413497, 'batch_size': 9692, 'optimizer_name': 'Adam'}. Best is trial 1569 with value: 0.001761963053552708.[0m
[32m[I 2022-11-08 10:07:35,386][0m Trial 1738 finished with value: 0.0018048794319611933 and parameters: {'nlayers': 14, 'hidden_size': 55, 'dropout': 0.4533455294967742, 'learning_rate': 0.0023353061242607793, 'batch_size': 9813, 'optimizer_name': 'RMSprop'}. Best is trial 1569 with value: 0.001761963053552708.[0m
[32m[I 2022-11-08 10:08:46,021][0m Trial 1739 finished with value: 0.0018603335487764059 and parameters: {'nlayers': 74, 'hidden_size': 206, 'dropout': 0.15278641097613568, 'learning_rate': 0.0019560341328682274, 'batch_size': 9567, 'optimizer_name': 'Adam'}. Best is trial 1569 with value: 0.001761963053552708.[0m
[32m[I 2022-11-08 10:09:08,056][0m Trial 1740 finished with value: 0.0018857897809855845 and parameters: {'nlayers': 24, 'hidden_size': 66, 'dropout': 0.41843618320446757, 'learning_rate': 0.0016262589412409515, 'batch_size': 9412, 'optimizer_name': 'Adam'}. Best is trial 1569 with value: 0.001761963053552708.[0m
[32m[I 2022-11-08 10:09:30,126][0m Trial 1741 finished with value: 0.0018117278236515668 and parameters: {'nlayers': 11, 'hidden_size': 99, 'dropout': 0.147492459015397, 'learning_rate': 0.007120548996997198, 'batch_size': 9800, 'optimizer_name': 'Adam'}. Best is trial 1569 with value: 0.001761963053552708.[0m
[32m[I 2022-11-08 10:10:04,316][0m Trial 1742 finished with value: 0.0018090983735700407 and parameters: {'nlayers': 51, 'hidden_size': 89, 'dropout': 0.16363167698018427, 'learning_rate': 0.00670761606363289, 'batch_size': 9819, 'optimizer_name': 'Adam'}. Best is trial 1569 with value: 0.001761963053552708.[0m
[32m[I 2022-11-08 10:10:28,199][0m Trial 1743 finished with value: 0.001771532907427782 and parameters: {'nlayers': 16, 'hidden_size': 84, 'dropout': 0.42578530305963946, 'learning_rate': 0.002532938799610818, 'batch_size': 9999, 'optimizer_name': 'Adam'}. Best is trial 1569 with value: 0.001761963053552708.[0m
[32m[I 2022-11-08 10:10:48,365][0m Trial 1744 finished with value: 0.0018311856979784096 and parameters: {'nlayers': 7, 'hidden_size': 106, 'dropout': 0.12682513642330184, 'learning_rate': 0.005551046051177843, 'batch_size': 9657, 'optimizer_name': 'Adam'}. Best is trial 1569 with value: 0.001761963053552708.[0m
[32m[I 2022-11-08 10:11:32,061][0m Trial 1745 finished with value: 0.0017978580181508494 and parameters: {'nlayers': 68, 'hidden_size': 118, 'dropout': 0.1785923862271284, 'learning_rate': 0.0022042994773474253, 'batch_size': 9836, 'optimizer_name': 'Adam'}. Best is trial 1569 with value: 0.001761963053552708.[0m
[32m[I 2022-11-08 10:11:56,361][0m Trial 1746 finished with value: 0.001855718953603731 and parameters: {'nlayers': 20, 'hidden_size': 111, 'dropout': 0.3380262088937779, 'learning_rate': 0.007727145659405103, 'batch_size': 9561, 'optimizer_name': 'Adam'}. Best is trial 1569 with value: 0.001761963053552708.[0m
[32m[I 2022-11-08 10:12:21,712][0m Trial 1747 finished with value: 0.0017991637073965063 and parameters: {'nlayers': 18, 'hidden_size': 124, 'dropout': 0.3848214450857439, 'learning_rate': 0.0018706048896166105, 'batch_size': 9830, 'optimizer_name': 'Adam'}. Best is trial 1569 with value: 0.001761963053552708.[0m
[32m[I 2022-11-08 10:12:31,928][0m Trial 1748 finished with value: 0.009563573481648886 and parameters: {'nlayers': 71, 'hidden_size': 97, 'dropout': 0.40400318289225, 'learning_rate': 0.0023721544284389592, 'batch_size': 1851, 'optimizer_name': 'Adam'}. Best is trial 1569 with value: 0.001761963053552708.[0m
[32m[I 2022-11-08 10:12:38,401][0m Trial 1749 finished with value: 0.00795664374768413 and parameters: {'nlayers': 45, 'hidden_size': 76, 'dropout': 0.14118202820437534, 'learning_rate': 0.0020883596617038923, 'batch_size': 2228, 'optimizer_name': 'Adam'}. Best is trial 1569 with value: 0.001761963053552708.[0m
[32m[I 2022-11-08 10:12:56,292][0m Trial 1750 finished with value: 0.0019545053018262364 and parameters: {'nlayers': 12, 'hidden_size': 10, 'dropout': 0.15854471767483147, 'learning_rate': 0.0014566847418631319, 'batch_size': 9066, 'optimizer_name': 'RMSprop'}. Best is trial 1569 with value: 0.001761963053552708.[0m
[32m[I 2022-11-08 10:13:28,865][0m Trial 1751 finished with value: 0.001772820162379545 and parameters: {'nlayers': 41, 'hidden_size': 103, 'dropout': 0.37176859100167914, 'learning_rate': 0.002565950264138217, 'batch_size': 9995, 'optimizer_name': 'Adam'}. Best is trial 1569 with value: 0.001761963053552708.[0m
[32m[I 2022-11-08 10:13:59,974][0m Trial 1752 finished with value: 0.001836386724426891 and parameters: {'nlayers': 13, 'hidden_size': 288, 'dropout': 0.17097076818930096, 'learning_rate': 0.0007314971554990462, 'batch_size': 9673, 'optimizer_name': 'Adam'}. Best is trial 1569 with value: 0.001761963053552708.[0m
[32m[I 2022-11-08 10:14:21,048][0m Trial 1753 finished with value: 0.001894342356999172 and parameters: {'nlayers': 17, 'hidden_size': 67, 'dropout': 0.45991515138789046, 'learning_rate': 0.0017801831551985357, 'batch_size': 9364, 'optimizer_name': 'Adam'}. Best is trial 1569 with value: 0.001761963053552708.[0m
[32m[I 2022-11-08 10:15:00,791][0m Trial 1754 finished with value: 0.001800710990093175 and parameters: {'nlayers': 66, 'hidden_size': 91, 'dropout': 0.41457713781085476, 'learning_rate': 0.002271938986685998, 'batch_size': 9835, 'optimizer_name': 'Adam'}. Best is trial 1569 with value: 0.001761963053552708.[0m
[32m[I 2022-11-08 10:15:24,963][0m Trial 1755 finished with value: 0.0017723098187001393 and parameters: {'nlayers': 14, 'hidden_size': 109, 'dropout': 0.1340815319951352, 'learning_rate': 0.00758889987726974, 'batch_size': 9993, 'optimizer_name': 'Adam'}. Best is trial 1569 with value: 0.001761963053552708.[0m
[32m[I 2022-11-08 10:15:29,562][0m Trial 1756 finished with value: 0.004064611847171344 and parameters: {'nlayers': 9, 'hidden_size': 79, 'dropout': 0.11893506760935497, 'learning_rate': 0.0012112357555167125, 'batch_size': 4377, 'optimizer_name': 'Adam'}. Best is trial 1569 with value: 0.001761963053552708.[0m
[32m[I 2022-11-08 10:15:50,168][0m Trial 1757 finished with value: 0.0018650219486300297 and parameters: {'nlayers': 10, 'hidden_size': 101, 'dropout': 0.15462466768945862, 'learning_rate': 0.00847423418325394, 'batch_size': 9518, 'optimizer_name': 'Adam'}. Best is trial 1569 with value: 0.001761963053552708.[0m
[32m[I 2022-11-08 10:16:16,152][0m Trial 1758 finished with value: 0.0018327268233320484 and parameters: {'nlayers': 16, 'hidden_size': 155, 'dropout': 0.1937182702382351, 'learning_rate': 0.0019293579319160903, 'batch_size': 9659, 'optimizer_name': 'Adam'}. Best is trial 1569 with value: 0.001761963053552708.[0m
[32m[I 2022-11-08 10:16:36,462][0m Trial 1759 finished with value: 0.0018085156142693746 and parameters: {'nlayers': 3, 'hidden_size': 115, 'dropout': 0.16588107013342412, 'learning_rate': 0.006932952720732754, 'batch_size': 9993, 'optimizer_name': 'SGD'}. Best is trial 1569 with value: 0.001761963053552708.[0m
[32m[I 2022-11-08 10:17:06,214][0m Trial 1760 finished with value: 0.001802637572568035 and parameters: {'nlayers': 47, 'hidden_size': 59, 'dropout': 0.4792583381786145, 'learning_rate': 0.0020735886496731533, 'batch_size': 9826, 'optimizer_name': 'Adam'}. Best is trial 1569 with value: 0.001761963053552708.[0m
[32m[I 2022-11-08 10:17:27,652][0m Trial 1761 finished with value: 0.001887903768900906 and parameters: {'nlayers': 20, 'hidden_size': 25, 'dropout': 0.43868797789119296, 'learning_rate': 0.0002428753271797229, 'batch_size': 9693, 'optimizer_name': 'Adam'}. Best is trial 1569 with value: 0.001761963053552708.[0m
[32m[I 2022-11-08 10:17:52,962][0m Trial 1762 finished with value: 0.0018069570897179072 and parameters: {'nlayers': 23, 'hidden_size': 86, 'dropout': 0.42880055417155594, 'learning_rate': 0.007331358452036996, 'batch_size': 9833, 'optimizer_name': 'Adam'}. Best is trial 1569 with value: 0.001761963053552708.[0m
[32m[I 2022-11-08 10:18:27,721][0m Trial 1763 finished with value: 0.00177540291005698 and parameters: {'nlayers': 43, 'hidden_size': 123, 'dropout': 0.149666191440376, 'learning_rate': 0.004537733520929774, 'batch_size': 9995, 'optimizer_name': 'RMSprop'}. Best is trial 1569 with value: 0.001761963053552708.[0m
[32m[I 2022-11-08 10:18:48,763][0m Trial 1764 finished with value: 0.0017747261607195003 and parameters: {'nlayers': 6, 'hidden_size': 95, 'dropout': 0.18021815899800558, 'learning_rate': 0.0023705724753531393, 'batch_size': 9997, 'optimizer_name': 'Adam'}. Best is trial 1569 with value: 0.001761963053552708.[0m
[32m[I 2022-11-08 10:19:25,874][0m Trial 1765 finished with value: 0.0018682151196394686 and parameters: {'nlayers': 39, 'hidden_size': 165, 'dropout': 0.17168749672466374, 'learning_rate': 0.004068340244804568, 'batch_size': 9513, 'optimizer_name': 'Adam'}. Best is trial 1569 with value: 0.001761963053552708.[0m
[32m[I 2022-11-08 10:19:51,518][0m Trial 1766 finished with value: 0.001825573174191555 and parameters: {'nlayers': 26, 'hidden_size': 105, 'dropout': 0.1442977618113627, 'learning_rate': 0.0016727632635342425, 'batch_size': 9685, 'optimizer_name': 'Adam'}. Best is trial 1569 with value: 0.001761963053552708.[0m
[32m[I 2022-11-08 10:20:25,574][0m Trial 1767 finished with value: 0.0018070536461639716 and parameters: {'nlayers': 69, 'hidden_size': 68, 'dropout': 0.16054039815368984, 'learning_rate': 0.0025187299504977542, 'batch_size': 9821, 'optimizer_name': 'Adam'}. Best is trial 1569 with value: 0.001761963053552708.[0m
[32m[I 2022-11-08 10:21:04,717][0m Trial 1768 finished with value: 0.001915625908129857 and parameters: {'nlayers': 73, 'hidden_size': 113, 'dropout': 0.1282283017909826, 'learning_rate': 0.0009199135018768086, 'batch_size': 9228, 'optimizer_name': 'Adam'}. Best is trial 1569 with value: 0.001761963053552708.[0m
[32m[I 2022-11-08 10:21:27,226][0m Trial 1769 finished with value: 0.0018634491354640465 and parameters: {'nlayers': 18, 'hidden_size': 93, 'dropout': 0.39599261526790386, 'learning_rate': 0.0063496932054229694, 'batch_size': 9516, 'optimizer_name': 'Adam'}. Best is trial 1569 with value: 0.001761963053552708.[0m
[32m[I 2022-11-08 10:21:55,946][0m Trial 1770 finished with value: 0.0018002361328769765 and parameters: {'nlayers': 14, 'hidden_size': 216, 'dropout': 0.1856067519422374, 'learning_rate': 0.0021087317584827514, 'batch_size': 9839, 'optimizer_name': 'Adam'}. Best is trial 1569 with value: 0.001761963053552708.[0m
[32m[I 2022-11-08 10:22:15,512][0m Trial 1771 finished with value: 0.001829794833502231 and parameters: {'nlayers': 12, 'hidden_size': 48, 'dropout': 0.4074296851434764, 'learning_rate': 0.002268315414698718, 'batch_size': 9679, 'optimizer_name': 'Adam'}. Best is trial 1569 with value: 0.001761963053552708.[0m
[32m[I 2022-11-08 10:22:38,492][0m Trial 1772 finished with value: 0.0020955528310064734 and parameters: {'nlayers': 37, 'hidden_size': 99, 'dropout': 0.15401613093134037, 'learning_rate': 0.0026450759221970273, 'batch_size': 8450, 'optimizer_name': 'Adam'}. Best is trial 1569 with value: 0.001761963053552708.[0m
[32m[I 2022-11-08 10:23:01,496][0m Trial 1773 finished with value: 0.001805896399634419 and parameters: {'nlayers': 15, 'hidden_size': 107, 'dropout': 0.1647883631148639, 'learning_rate': 0.00202818995360632, 'batch_size': 9828, 'optimizer_name': 'Adam'}. Best is trial 1569 with value: 0.001761963053552708.[0m
[32m[I 2022-11-08 10:23:28,382][0m Trial 1774 finished with value: 0.0018278051649279036 and parameters: {'nlayers': 34, 'hidden_size': 82, 'dropout': 0.1387951961896132, 'learning_rate': 0.001496648184569437, 'batch_size': 9670, 'optimizer_name': 'Adam'}. Best is trial 1569 with value: 0.001761963053552708.[0m
[32m[I 2022-11-08 10:23:49,761][0m Trial 1775 finished with value: 0.0017770494828110628 and parameters: {'nlayers': 10, 'hidden_size': 61, 'dropout': 0.29942711124175114, 'learning_rate': 0.0018208121811256102, 'batch_size': 9994, 'optimizer_name': 'RMSprop'}. Best is trial 1569 with value: 0.001761963053552708.[0m
[32m[I 2022-11-08 10:24:15,664][0m Trial 1776 finished with value: 0.0018974609881531248 and parameters: {'nlayers': 28, 'hidden_size': 117, 'dropout': 0.41237367728374047, 'learning_rate': 0.002401029858532621, 'batch_size': 9362, 'optimizer_name': 'Adam'}. Best is trial 1569 with value: 0.001761963053552708.[0m
[32m[I 2022-11-08 10:24:56,123][0m Trial 1777 finished with value: 0.0017729971706867218 and parameters: {'nlayers': 42, 'hidden_size': 159, 'dropout': 0.44821502544591585, 'learning_rate': 0.0022136961706669136, 'batch_size': 10000, 'optimizer_name': 'Adam'}. Best is trial 1569 with value: 0.001761963053552708.[0m
[32m[I 2022-11-08 10:25:20,729][0m Trial 1778 finished with value: 0.0017764205913299487 and parameters: {'nlayers': 7, 'hidden_size': 236, 'dropout': 0.42134230530210115, 'learning_rate': 0.002610120862274311, 'batch_size': 9997, 'optimizer_name': 'Adam'}. Best is trial 1569 with value: 0.001761963053552708.[0m
[32m[I 2022-11-08 10:26:07,166][0m Trial 1779 finished with value: 0.0018588649420129503 and parameters: {'nlayers': 79, 'hidden_size': 126, 'dropout': 0.3783285513609102, 'learning_rate': 0.0019276004230680658, 'batch_size': 9549, 'optimizer_name': 'Adam'}. Best is trial 1569 with value: 0.001761963053552708.[0m
[32m[I 2022-11-08 10:26:30,327][0m Trial 1780 finished with value: 0.0018108165481824628 and parameters: {'nlayers': 19, 'hidden_size': 88, 'dropout': 0.28574797083871856, 'learning_rate': 0.0016687212546868484, 'batch_size': 9802, 'optimizer_name': 'Adam'}. Best is trial 1569 with value: 0.001761963053552708.[0m
[32m[I 2022-11-08 10:27:09,353][0m Trial 1781 finished with value: 0.0017881956368684768 and parameters: {'nlayers': 67, 'hidden_size': 101, 'dropout': 0.11686064043071442, 'learning_rate': 0.002410709048813874, 'batch_size': 10000, 'optimizer_name': 'SGD'}. Best is trial 1569 with value: 0.001761963053552708.[0m
[32m[I 2022-11-08 10:27:35,990][0m Trial 1782 finished with value: 0.0018268131547845767 and parameters: {'nlayers': 21, 'hidden_size': 152, 'dropout': 0.36457672386205797, 'learning_rate': 0.007150582842956015, 'batch_size': 9689, 'optimizer_name': 'Adam'}. Best is trial 1569 with value: 0.001761963053552708.[0m
[32m[I 2022-11-08 10:28:08,981][0m Trial 1783 finished with value: 0.001811797927377614 and parameters: {'nlayers': 71, 'hidden_size': 72, 'dropout': 0.35262291073524477, 'learning_rate': 0.007814632729536714, 'batch_size': 9803, 'optimizer_name': 'Adam'}. Best is trial 1569 with value: 0.001761963053552708.[0m
[32m[I 2022-11-08 10:28:31,964][0m Trial 1784 finished with value: 0.0017725526570987586 and parameters: {'nlayers': 12, 'hidden_size': 109, 'dropout': 0.14867281770987137, 'learning_rate': 0.0005226620982357272, 'batch_size': 9996, 'optimizer_name': 'Adam'}. Best is trial 1569 with value: 0.001761963053552708.[0m
[32m[I 2022-11-08 10:30:17,080][0m Trial 1785 finished with value: 0.0018860953258015604 and parameters: {'nlayers': 87, 'hidden_size': 278, 'dropout': 0.1583789851067926, 'learning_rate': 0.002191234538814307, 'batch_size': 9422, 'optimizer_name': 'Adam'}. Best is trial 1569 with value: 0.001761963053552708.[0m
[32m[I 2022-11-08 10:30:41,756][0m Trial 1786 finished with value: 0.001770177484452814 and parameters: {'nlayers': 17, 'hidden_size': 120, 'dropout': 0.16950336658621326, 'learning_rate': 0.0013839093339755486, 'batch_size': 9999, 'optimizer_name': 'Adam'}. Best is trial 1569 with value: 0.001761963053552708.[0m
[32m[I 2022-11-08 10:31:02,995][0m Trial 1787 finished with value: 0.0018347198311813018 and parameters: {'nlayers': 15, 'hidden_size': 54, 'dropout': 0.4930336847311151, 'learning_rate': 0.007468671698330159, 'batch_size': 9678, 'optimizer_name': 'Adam'}. Best is trial 1569 with value: 0.001761963053552708.[0m
[32m[I 2022-11-08 10:31:33,522][0m Trial 1788 finished with value: 0.0018642011097291774 and parameters: {'nlayers': 45, 'hidden_size': 95, 'dropout': 0.4315930613345196, 'learning_rate': 0.0019308066884593945, 'batch_size': 9519, 'optimizer_name': 'RMSprop'}. Best is trial 1569 with value: 0.001761963053552708.[0m
[32m[I 2022-11-08 10:32:04,902][0m Trial 1789 finished with value: 0.001808645690763702 and parameters: {'nlayers': 40, 'hidden_size': 113, 'dropout': 0.17192481393199774, 'learning_rate': 0.0026785352054867597, 'batch_size': 9817, 'optimizer_name': 'Adam'}. Best is trial 1569 with value: 0.001761963053552708.[0m
[32m[I 2022-11-08 10:32:27,044][0m Trial 1790 finished with value: 0.001772221404314041 and parameters: {'nlayers': 9, 'hidden_size': 102, 'dropout': 0.1800641191849439, 'learning_rate': 0.0024341994623508535, 'batch_size': 10000, 'optimizer_name': 'Adam'}. Best is trial 1569 with value: 0.001761963053552708.[0m
[32m[I 2022-11-08 10:33:06,488][0m Trial 1791 finished with value: 0.001828703475999694 and parameters: {'nlayers': 82, 'hidden_size': 79, 'dropout': 0.46829149426708144, 'learning_rate': 0.008028156114788684, 'batch_size': 9668, 'optimizer_name': 'Adam'}. Best is trial 1569 with value: 0.001761963053552708.[0m
[32m[I 2022-11-08 10:33:26,790][0m Trial 1792 finished with value: 0.0019279654629886411 and parameters: {'nlayers': 13, 'hidden_size': 128, 'dropout': 0.3985087187950998, 'learning_rate': 0.0020822408872292193, 'batch_size': 9160, 'optimizer_name': 'Adam'}. Best is trial 1569 with value: 0.001761963053552708.[0m
[32m[I 2022-11-08 10:33:48,396][0m Trial 1793 finished with value: 0.0018022870684767673 and parameters: {'nlayers': 11, 'hidden_size': 91, 'dropout': 0.13459023127284198, 'learning_rate': 0.0017580661124439044, 'batch_size': 9818, 'optimizer_name': 'Adam'}. Best is trial 1569 with value: 0.001761963053552708.[0m
