[32m[I 2022-11-08 03:42:08,961][0m Trial 1035 finished with value: 0.0018524621104360841 and parameters: {'nlayers': 10, 'hidden_size': 70, 'dropout': 0.16899335097501267, 'learning_rate': 0.006500212427093096, 'batch_size': 9614, 'optimizer_name': 'Adam'}. Best is trial 899 with value: 0.0017655460917727903.[0m
[32m[I 2022-11-08 03:42:29,786][0m Trial 1036 finished with value: 0.001803827049822704 and parameters: {'nlayers': 7, 'hidden_size': 90, 'dropout': 0.15516413490919628, 'learning_rate': 0.002848267107708712, 'batch_size': 9827, 'optimizer_name': 'Adam'}. Best is trial 899 with value: 0.0017655460917727903.[0m
[32m[I 2022-11-08 03:43:07,262][0m Trial 1037 finished with value: 0.0018308399671902826 and parameters: {'nlayers': 40, 'hidden_size': 154, 'dropout': 0.14443983113314213, 'learning_rate': 0.0006046145880413029, 'batch_size': 9672, 'optimizer_name': 'RMSprop'}. Best is trial 899 with value: 0.0017655460917727903.[0m
[32m[I 2022-11-08 03:43:39,525][0m Trial 1038 finished with value: 0.0018951032909617247 and parameters: {'nlayers': 35, 'hidden_size': 147, 'dropout': 0.11784351527963277, 'learning_rate': 0.0015923761413726245, 'batch_size': 9318, 'optimizer_name': 'Adam'}. Best is trial 899 with value: 0.0017655460917727903.[0m
[32m[I 2022-11-08 03:44:00,987][0m Trial 1039 finished with value: 0.00177129465682643 and parameters: {'nlayers': 12, 'hidden_size': 56, 'dropout': 0.16308199558633427, 'learning_rate': 0.003083345133033816, 'batch_size': 9996, 'optimizer_name': 'Adam'}. Best is trial 899 with value: 0.0017655460917727903.[0m
[32m[I 2022-11-08 03:44:06,948][0m Trial 1040 finished with value: 0.005441344146953012 and parameters: {'nlayers': 17, 'hidden_size': 167, 'dropout': 0.13772249393777622, 'learning_rate': 0.002326929369494665, 'batch_size': 3271, 'optimizer_name': 'Adam'}. Best is trial 899 with value: 0.0017655460917727903.[0m
[32m[I 2022-11-08 03:44:31,252][0m Trial 1041 finished with value: 0.0018047391365076174 and parameters: {'nlayers': 19, 'hidden_size': 77, 'dropout': 0.15456414267419263, 'learning_rate': 0.0019600862650721662, 'batch_size': 9803, 'optimizer_name': 'Adam'}. Best is trial 899 with value: 0.0017655460917727903.[0m
[32m[I 2022-11-08 03:44:53,057][0m Trial 1042 finished with value: 0.0018676183608124768 and parameters: {'nlayers': 14, 'hidden_size': 93, 'dropout': 0.1311230705470747, 'learning_rate': 0.002548078982610084, 'batch_size': 9502, 'optimizer_name': 'Adam'}. Best is trial 899 with value: 0.0017655460917727903.[0m
[32m[I 2022-11-08 03:45:14,595][0m Trial 1043 finished with value: 0.001810977368835429 and parameters: {'nlayers': 9, 'hidden_size': 85, 'dropout': 0.10500401408521036, 'learning_rate': 0.007339906439023047, 'batch_size': 9802, 'optimizer_name': 'Adam'}. Best is trial 899 with value: 0.0017655460917727903.[0m
[32m[I 2022-11-08 03:45:23,602][0m Trial 1044 finished with value: 0.003335142705354002 and parameters: {'nlayers': 21, 'hidden_size': 108, 'dropout': 0.10043836071504189, 'learning_rate': 0.0027279812700373475, 'batch_size': 5346, 'optimizer_name': 'Adam'}. Best is trial 899 with value: 0.0017655460917727903.[0m
[32m[I 2022-11-08 03:45:48,448][0m Trial 1045 finished with value: 0.0018370860812581648 and parameters: {'nlayers': 16, 'hidden_size': 137, 'dropout': 0.16153377886805345, 'learning_rate': 0.0014858541677226676, 'batch_size': 9666, 'optimizer_name': 'Adam'}. Best is trial 899 with value: 0.0017655460917727903.[0m
[32m[I 2022-11-08 03:46:14,957][0m Trial 1046 finished with value: 0.0018055172317475005 and parameters: {'nlayers': 24, 'hidden_size': 102, 'dropout': 0.15065842039039637, 'learning_rate': 0.00689869620024968, 'batch_size': 9831, 'optimizer_name': 'Adam'}. Best is trial 899 with value: 0.0017655460917727903.[0m
[32m[I 2022-11-08 03:46:36,052][0m Trial 1047 finished with value: 0.0018740680761460348 and parameters: {'nlayers': 12, 'hidden_size': 94, 'dropout': 0.16856663326445784, 'learning_rate': 0.0022068544108406565, 'batch_size': 9454, 'optimizer_name': 'Adam'}. Best is trial 899 with value: 0.0017655460917727903.[0m
[32m[I 2022-11-08 03:47:39,846][0m Trial 1048 finished with value: 0.001801947918287315 and parameters: {'nlayers': 55, 'hidden_size': 232, 'dropout': 0.1215099509093094, 'learning_rate': 0.0017723786766132808, 'batch_size': 9835, 'optimizer_name': 'Adam'}. Best is trial 899 with value: 0.0017655460917727903.[0m
[32m[I 2022-11-08 03:48:21,704][0m Trial 1049 finished with value: 0.0017726383745383988 and parameters: {'nlayers': 62, 'hidden_size': 113, 'dropout': 0.14008142333383994, 'learning_rate': 0.0024638501410008838, 'batch_size': 9992, 'optimizer_name': 'Adam'}. Best is trial 899 with value: 0.0017655460917727903.[0m
[32m[I 2022-11-08 03:49:14,906][0m Trial 1050 finished with value: 0.00177108150174941 and parameters: {'nlayers': 42, 'hidden_size': 221, 'dropout': 0.16848819641458637, 'learning_rate': 0.0020165499221677695, 'batch_size': 9995, 'optimizer_name': 'Adam'}. Best is trial 899 with value: 0.0017655460917727903.[0m
[32m[I 2022-11-08 03:49:49,054][0m Trial 1051 finished with value: 0.0018429323610951187 and parameters: {'nlayers': 59, 'hidden_size': 74, 'dropout': 0.15595124462194576, 'learning_rate': 0.002282184184138582, 'batch_size': 9652, 'optimizer_name': 'Adam'}. Best is trial 899 with value: 0.0017655460917727903.[0m
[32m[I 2022-11-08 03:50:11,145][0m Trial 1052 finished with value: 0.0019415064424174928 and parameters: {'nlayers': 13, 'hidden_size': 157, 'dropout': 0.14529600254980912, 'learning_rate': 0.0018643817172906232, 'batch_size': 9109, 'optimizer_name': 'Adam'}. Best is trial 899 with value: 0.0017655460917727903.[0m
[32m[I 2022-11-08 03:50:35,057][0m Trial 1053 finished with value: 0.0018060956918425743 and parameters: {'nlayers': 18, 'hidden_size': 86, 'dropout': 0.10976453394213409, 'learning_rate': 0.006326944432359972, 'batch_size': 9816, 'optimizer_name': 'Adam'}. Best is trial 899 with value: 0.0017655460917727903.[0m
[32m[I 2022-11-08 03:50:35,612][0m Trial 1054 finished with value: 0.021629754453897476 and parameters: {'nlayers': 4, 'hidden_size': 64, 'dropout': 0.1636313769203549, 'learning_rate': 0.002681100289380551, 'batch_size': 824, 'optimizer_name': 'Adam'}. Best is trial 899 with value: 0.0017655460917727903.[0m
[32m[I 2022-11-08 03:51:08,056][0m Trial 1055 finished with value: 0.0018416261991886912 and parameters: {'nlayers': 38, 'hidden_size': 144, 'dropout': 0.12600222928628194, 'learning_rate': 0.004452093045352063, 'batch_size': 9644, 'optimizer_name': 'Adam'}. Best is trial 899 with value: 0.0017655460917727903.[0m
[32m[I 2022-11-08 03:51:35,801][0m Trial 1056 finished with value: 0.001774029224517526 and parameters: {'nlayers': 15, 'hidden_size': 172, 'dropout': 0.2832098401942428, 'learning_rate': 0.002442603614108739, 'batch_size': 9993, 'optimizer_name': 'RMSprop'}. Best is trial 899 with value: 0.0017655460917727903.[0m
[32m[I 2022-11-08 03:52:01,530][0m Trial 1057 finished with value: 0.001810506605956168 and parameters: {'nlayers': 11, 'hidden_size': 189, 'dropout': 0.14894328119317565, 'learning_rate': 0.0021692693026501672, 'batch_size': 9810, 'optimizer_name': 'Adam'}. Best is trial 899 with value: 0.0017655460917727903.[0m
[32m[I 2022-11-08 03:52:27,900][0m Trial 1058 finished with value: 0.001769496688246727 and parameters: {'nlayers': 22, 'hidden_size': 97, 'dropout': 0.1709155859592296, 'learning_rate': 0.002027635514024629, 'batch_size': 10000, 'optimizer_name': 'Adam'}. Best is trial 899 with value: 0.0017655460917727903.[0m
[32m[I 2022-11-08 03:52:53,048][0m Trial 1059 finished with value: 0.0018677419165887184 and parameters: {'nlayers': 25, 'hidden_size': 89, 'dropout': 0.17130455145129425, 'learning_rate': 0.002855354351843107, 'batch_size': 9512, 'optimizer_name': 'Adam'}. Best is trial 899 with value: 0.0017655460917727903.[0m
[32m[I 2022-11-08 03:53:18,883][0m Trial 1060 finished with value: 0.0017693479983037319 and parameters: {'nlayers': 24, 'hidden_size': 96, 'dropout': 0.1756420477770241, 'learning_rate': 0.0024833451225977268, 'batch_size': 9998, 'optimizer_name': 'Adam'}. Best is trial 899 with value: 0.0017655460917727903.[0m
[32m[I 2022-11-08 03:53:43,608][0m Trial 1061 finished with value: 0.001893868251006608 and parameters: {'nlayers': 24, 'hidden_size': 94, 'dropout': 0.17405493191213764, 'learning_rate': 0.0026251795686900495, 'batch_size': 9343, 'optimizer_name': 'Adam'}. Best is trial 899 with value: 0.0017655460917727903.[0m
[32m[I 2022-11-08 03:54:09,805][0m Trial 1062 finished with value: 0.0018316864357375152 and parameters: {'nlayers': 28, 'hidden_size': 82, 'dropout': 0.17688346949464656, 'learning_rate': 0.0031352473938291844, 'batch_size': 9674, 'optimizer_name': 'Adam'}. Best is trial 899 with value: 0.0017655460917727903.[0m
[32m[I 2022-11-08 03:54:36,935][0m Trial 1063 finished with value: 0.0017738950403959042 and parameters: {'nlayers': 25, 'hidden_size': 97, 'dropout': 0.17206784977500786, 'learning_rate': 0.0025056675331039005, 'batch_size': 9998, 'optimizer_name': 'Adam'}. Best is trial 899 with value: 0.0017655460917727903.[0m
[32m[I 2022-11-08 03:55:02,136][0m Trial 1064 finished with value: 0.0018003520083254996 and parameters: {'nlayers': 23, 'hidden_size': 81, 'dropout': 0.18003564890661614, 'learning_rate': 0.0028647758974517526, 'batch_size': 9817, 'optimizer_name': 'Adam'}. Best is trial 899 with value: 0.0017655460917727903.[0m
[32m[I 2022-11-08 03:55:29,101][0m Trial 1065 finished with value: 0.0018247090420632991 and parameters: {'nlayers': 29, 'hidden_size': 90, 'dropout': 0.16926162759356975, 'learning_rate': 0.002373399492285349, 'batch_size': 9699, 'optimizer_name': 'Adam'}. Best is trial 899 with value: 0.0017655460917727903.[0m
[32m[I 2022-11-08 03:55:53,466][0m Trial 1066 finished with value: 0.0018642428836305657 and parameters: {'nlayers': 22, 'hidden_size': 89, 'dropout': 0.16520804179373086, 'learning_rate': 0.002698752432293389, 'batch_size': 9521, 'optimizer_name': 'Adam'}. Best is trial 899 with value: 0.0017655460917727903.[0m
[32m[I 2022-11-08 03:56:20,480][0m Trial 1067 finished with value: 0.0018454425619113932 and parameters: {'nlayers': 27, 'hidden_size': 101, 'dropout': 0.18556028219316462, 'learning_rate': 8.491337530833133e-05, 'batch_size': 9841, 'optimizer_name': 'Adam'}. Best is trial 899 with value: 0.0017655460917727903.[0m
[32m[I 2022-11-08 03:56:45,698][0m Trial 1068 finished with value: 0.0017746437449796813 and parameters: {'nlayers': 22, 'hidden_size': 96, 'dropout': 0.17554134899493645, 'learning_rate': 0.003334638341323565, 'batch_size': 9996, 'optimizer_name': 'Adam'}. Best is trial 899 with value: 0.0017655460917727903.[0m
[32m[I 2022-11-08 03:57:11,009][0m Trial 1069 finished with value: 0.0018355195298120402 and parameters: {'nlayers': 25, 'hidden_size': 86, 'dropout': 0.16455397259902924, 'learning_rate': 0.002452934870866713, 'batch_size': 9667, 'optimizer_name': 'Adam'}. Best is trial 899 with value: 0.0017655460917727903.[0m
[32m[I 2022-11-08 03:57:39,106][0m Trial 1070 finished with value: 0.0017727662682533265 and parameters: {'nlayers': 26, 'hidden_size': 93, 'dropout': 0.15881383847459854, 'learning_rate': 0.005908859985252626, 'batch_size': 10000, 'optimizer_name': 'Adam'}. Best is trial 899 with value: 0.0017655460917727903.[0m
[32m[I 2022-11-08 03:58:09,514][0m Trial 1071 finished with value: 0.0018062072563453252 and parameters: {'nlayers': 22, 'hidden_size': 161, 'dropout': 0.17174679417431488, 'learning_rate': 0.002627957140428504, 'batch_size': 9812, 'optimizer_name': 'Adam'}. Best is trial 899 with value: 0.0017655460917727903.[0m
[32m[I 2022-11-08 03:58:31,713][0m Trial 1072 finished with value: 0.0018950311571372376 and parameters: {'nlayers': 24, 'hidden_size': 72, 'dropout': 0.16056205742865953, 'learning_rate': 0.00295576267081825, 'batch_size': 9356, 'optimizer_name': 'Adam'}. Best is trial 899 with value: 0.0017655460917727903.[0m
[32m[I 2022-11-08 03:58:55,624][0m Trial 1073 finished with value: 0.0018562876849519917 and parameters: {'nlayers': 20, 'hidden_size': 102, 'dropout': 0.1813788422592031, 'learning_rate': 0.0022710224469106007, 'batch_size': 9539, 'optimizer_name': 'Adam'}. Best is trial 899 with value: 0.0017655460917727903.[0m
[32m[I 2022-11-08 03:59:22,155][0m Trial 1074 finished with value: 0.0018111981562441912 and parameters: {'nlayers': 27, 'hidden_size': 82, 'dropout': 0.17551861519093934, 'learning_rate': 0.002191984004134733, 'batch_size': 9806, 'optimizer_name': 'Adam'}. Best is trial 899 with value: 0.0017655460917727903.[0m
[32m[I 2022-11-08 03:59:53,787][0m Trial 1075 finished with value: 0.0018320231460333364 and parameters: {'nlayers': 22, 'hidden_size': 183, 'dropout': 0.15893609632961062, 'learning_rate': 0.002552435905137571, 'batch_size': 9684, 'optimizer_name': 'Adam'}. Best is trial 899 with value: 0.0017655460917727903.[0m
[32m[I 2022-11-08 04:00:31,002][0m Trial 1076 finished with value: 0.001808498483329459 and parameters: {'nlayers': 24, 'hidden_size': 215, 'dropout': 0.16882742879914014, 'learning_rate': 0.002759106151022502, 'batch_size': 9822, 'optimizer_name': 'Adam'}. Best is trial 899 with value: 0.0017655460917727903.[0m
[32m[I 2022-11-08 04:00:59,660][0m Trial 1077 finished with value: 0.0017705395242226512 and parameters: {'nlayers': 20, 'hidden_size': 151, 'dropout': 0.18868046038923464, 'learning_rate': 0.002363707596058905, 'batch_size': 9994, 'optimizer_name': 'RMSprop'}. Best is trial 899 with value: 0.0017655460917727903.[0m
[32m[I 2022-11-08 04:01:24,540][0m Trial 1078 finished with value: 0.0018445742897283117 and parameters: {'nlayers': 23, 'hidden_size': 99, 'dropout': 0.15706607916709903, 'learning_rate': 0.0003598702298869762, 'batch_size': 9574, 'optimizer_name': 'Adam'}. Best is trial 899 with value: 0.0017655460917727903.[0m
[32m[I 2022-11-08 04:01:47,296][0m Trial 1079 finished with value: 0.0019230220714558334 and parameters: {'nlayers': 20, 'hidden_size': 91, 'dropout': 0.16775930917635437, 'learning_rate': 0.0022678572592640545, 'batch_size': 9219, 'optimizer_name': 'Adam'}. Best is trial 899 with value: 0.0017655460917727903.[0m
[32m[I 2022-11-08 04:02:11,818][0m Trial 1080 finished with value: 0.0018051063588427273 and parameters: {'nlayers': 21, 'hidden_size': 104, 'dropout': 0.1532800389691661, 'learning_rate': 0.0020701079055521175, 'batch_size': 9822, 'optimizer_name': 'Adam'}. Best is trial 899 with value: 0.0017655460917727903.[0m
[32m[I 2022-11-08 04:02:38,412][0m Trial 1081 finished with value: 0.0017772989280701447 and parameters: {'nlayers': 25, 'hidden_size': 78, 'dropout': 0.1765575580231708, 'learning_rate': 0.0031110187995915637, 'batch_size': 9999, 'optimizer_name': 'Adam'}. Best is trial 899 with value: 0.0017655460917727903.[0m
[32m[I 2022-11-08 04:03:08,706][0m Trial 1082 finished with value: 0.0018293408891302619 and parameters: {'nlayers': 22, 'hidden_size': 166, 'dropout': 0.16403170128776334, 'learning_rate': 0.0025346289993465037, 'batch_size': 9673, 'optimizer_name': 'Adam'}. Best is trial 899 with value: 0.0017655460917727903.[0m
[32m[I 2022-11-08 04:03:33,203][0m Trial 1083 finished with value: 0.001804567742978968 and parameters: {'nlayers': 20, 'hidden_size': 86, 'dropout': 0.14355432072582763, 'learning_rate': 0.002708590517203234, 'batch_size': 9820, 'optimizer_name': 'Adam'}. Best is trial 899 with value: 0.0017655460917727903.[0m
[32m[I 2022-11-08 04:03:57,122][0m Trial 1084 finished with value: 0.0018669225827876318 and parameters: {'nlayers': 26, 'hidden_size': 96, 'dropout': 0.15305421348815143, 'learning_rate': 0.0020838114424827515, 'batch_size': 9496, 'optimizer_name': 'Adam'}. Best is trial 899 with value: 0.0017655460917727903.[0m
[32m[I 2022-11-08 04:04:22,946][0m Trial 1085 finished with value: 0.0018170808653117782 and parameters: {'nlayers': 30, 'hidden_size': 55, 'dropout': 0.16248943144591282, 'learning_rate': 0.0023449541346234944, 'batch_size': 9808, 'optimizer_name': 'Adam'}. Best is trial 899 with value: 0.0017655460917727903.[0m
[32m[I 2022-11-08 04:04:45,972][0m Trial 1086 finished with value: 0.001827542850918852 and parameters: {'nlayers': 20, 'hidden_size': 63, 'dropout': 0.17529987230006985, 'learning_rate': 0.0029074220765802155, 'batch_size': 9697, 'optimizer_name': 'Adam'}. Best is trial 899 with value: 0.0017655460917727903.[0m
[32m[I 2022-11-08 04:05:10,260][0m Trial 1087 finished with value: 0.0018835266262476318 and parameters: {'nlayers': 23, 'hidden_size': 92, 'dropout': 0.13649862407691946, 'learning_rate': 0.0025232766552546085, 'batch_size': 9422, 'optimizer_name': 'Adam'}. Best is trial 899 with value: 0.0017655460917727903.[0m
[32m[I 2022-11-08 04:05:33,748][0m Trial 1088 finished with value: 0.0018087256234992238 and parameters: {'nlayers': 18, 'hidden_size': 71, 'dropout': 0.15018007615191262, 'learning_rate': 0.002162425733119555, 'batch_size': 9826, 'optimizer_name': 'Adam'}. Best is trial 899 with value: 0.0017655460917727903.[0m
[32m[I 2022-11-08 04:06:05,932][0m Trial 1089 finished with value: 0.0018340865628971726 and parameters: {'nlayers': 21, 'hidden_size': 200, 'dropout': 0.16895202278200308, 'learning_rate': 0.0019367541799454996, 'batch_size': 9654, 'optimizer_name': 'Adam'}. Best is trial 899 with value: 0.0017655460917727903.[0m
[32m[I 2022-11-08 04:06:31,277][0m Trial 1090 finished with value: 0.001778150136896474 and parameters: {'nlayers': 19, 'hidden_size': 99, 'dropout': 0.1578703557479149, 'learning_rate': 0.002399651674529383, 'batch_size': 9992, 'optimizer_name': 'Adam'}. Best is trial 899 with value: 0.0017655460917727903.[0m
[32m[I 2022-11-08 04:06:55,029][0m Trial 1091 finished with value: 0.0018064495163561916 and parameters: {'nlayers': 18, 'hidden_size': 77, 'dropout': 0.32906247841081004, 'learning_rate': 0.0036604078796324832, 'batch_size': 9823, 'optimizer_name': 'Adam'}. Best is trial 899 with value: 0.0017655460917727903.[0m
[32m[I 2022-11-08 04:07:25,896][0m Trial 1092 finished with value: 0.0018505880215758752 and parameters: {'nlayers': 26, 'hidden_size': 159, 'dropout': 0.26750660813072447, 'learning_rate': 0.002757146518828318, 'batch_size': 9569, 'optimizer_name': 'Adam'}. Best is trial 899 with value: 0.0017655460917727903.[0m
[32m[I 2022-11-08 04:07:59,409][0m Trial 1093 finished with value: 0.001771082004904747 and parameters: {'nlayers': 23, 'hidden_size': 175, 'dropout': 0.18313290833443865, 'learning_rate': 0.002243480899579952, 'batch_size': 10000, 'optimizer_name': 'Adam'}. Best is trial 899 with value: 0.0017655460917727903.[0m
[32m[I 2022-11-08 04:08:23,639][0m Trial 1094 finished with value: 0.0018043268706234524 and parameters: {'nlayers': 17, 'hidden_size': 105, 'dropout': 0.1669562424634197, 'learning_rate': 0.0041882063431761, 'batch_size': 9811, 'optimizer_name': 'Adam'}. Best is trial 899 with value: 0.0017655460917727903.[0m
[32m[I 2022-11-08 04:08:49,328][0m Trial 1095 finished with value: 0.0018958677807788943 and parameters: {'nlayers': 28, 'hidden_size': 92, 'dropout': 0.1457728254841881, 'learning_rate': 0.002524396457114332, 'batch_size': 9346, 'optimizer_name': 'Adam'}. Best is trial 899 with value: 0.0017655460917727903.[0m
[32m[I 2022-11-08 04:09:14,680][0m Trial 1096 finished with value: 0.001779958298618087 and parameters: {'nlayers': 21, 'hidden_size': 84, 'dropout': 0.11452919593936753, 'learning_rate': 0.0019028182244252548, 'batch_size': 9994, 'optimizer_name': 'Adam'}. Best is trial 899 with value: 0.0017655460917727903.[0m
[32m[I 2022-11-08 04:10:04,950][0m Trial 1097 finished with value: 0.0017667448911705974 and parameters: {'nlayers': 68, 'hidden_size': 152, 'dropout': 0.15717352692640624, 'learning_rate': 0.0020988438664953785, 'batch_size': 9999, 'optimizer_name': 'Adam'}. Best is trial 899 with value: 0.0017655460917727903.[0m
[32m[I 2022-11-08 04:10:57,452][0m Trial 1098 finished with value: 0.0018365489258781976 and parameters: {'nlayers': 68, 'hidden_size': 155, 'dropout': 0.15740758859112197, 'learning_rate': 0.002389775695274817, 'batch_size': 9656, 'optimizer_name': 'Adam'}. Best is trial 899 with value: 0.0017655460917727903.[0m
[32m[I 2022-11-08 04:11:47,987][0m Trial 1099 finished with value: 0.0017759040203731665 and parameters: {'nlayers': 70, 'hidden_size': 152, 'dropout': 0.15146127427704745, 'learning_rate': 0.002975450966215945, 'batch_size': 9998, 'optimizer_name': 'RMSprop'}. Best is trial 899 with value: 0.0017655460917727903.[0m
[32m[I 2022-11-08 04:12:37,599][0m Trial 1100 finished with value: 0.0018265761782500156 and parameters: {'nlayers': 67, 'hidden_size': 147, 'dropout': 0.15880334103536567, 'learning_rate': 0.0026480298430442226, 'batch_size': 9692, 'optimizer_name': 'Adam'}. Best is trial 899 with value: 0.0017655460917727903.[0m
[32m[I 2022-11-08 04:13:08,607][0m Trial 1101 finished with value: 0.002632966259000704 and parameters: {'nlayers': 65, 'hidden_size': 150, 'dropout': 0.14315750253839216, 'learning_rate': 0.0067600831332474375, 'batch_size': 6738, 'optimizer_name': 'Adam'}. Best is trial 899 with value: 0.0017655460917727903.[0m
[32m[I 2022-11-08 04:14:00,503][0m Trial 1102 finished with value: 0.001800437524896562 and parameters: {'nlayers': 64, 'hidden_size': 155, 'dropout': 0.16450066271449798, 'learning_rate': 0.002139550521390516, 'batch_size': 9836, 'optimizer_name': 'Adam'}. Best is trial 899 with value: 0.0017655460917727903.[0m
[32m[I 2022-11-08 04:14:52,428][0m Trial 1103 finished with value: 0.001867405608053142 and parameters: {'nlayers': 71, 'hidden_size': 156, 'dropout': 0.13338371396092855, 'learning_rate': 0.00279495115244842, 'batch_size': 9495, 'optimizer_name': 'Adam'}. Best is trial 899 with value: 0.0017655460917727903.[0m
