[32m[I 2022-11-07 22:07:14,452][0m Trial 345 finished with value: 0.0018042231742677807 and parameters: {'nlayers': 19, 'hidden_size': 144, 'dropout': 0.15898596479791302, 'learning_rate': 0.00037005560271662487, 'batch_size': 9817, 'optimizer_name': 'Adam'}. Best is trial 318 with value: 0.001767210723471942.[0m
[32m[I 2022-11-07 22:07:43,554][0m Trial 346 finished with value: 0.0017706569701433181 and parameters: {'nlayers': 21, 'hidden_size': 149, 'dropout': 0.16568476629925938, 'learning_rate': 0.002128011213279343, 'batch_size': 10000, 'optimizer_name': 'Adam'}. Best is trial 318 with value: 0.001767210723471942.[0m
[32m[I 2022-11-07 22:08:11,353][0m Trial 347 finished with value: 0.0018358816246845302 and parameters: {'nlayers': 22, 'hidden_size': 149, 'dropout': 0.16964378160689605, 'learning_rate': 0.0022007813947304503, 'batch_size': 9666, 'optimizer_name': 'RMSprop'}. Best is trial 318 with value: 0.001767210723471942.[0m
[32m[I 2022-11-07 22:08:37,016][0m Trial 348 finished with value: 0.0018657382408861617 and parameters: {'nlayers': 20, 'hidden_size': 141, 'dropout': 0.17188297996882565, 'learning_rate': 0.0020199242639799943, 'batch_size': 9490, 'optimizer_name': 'Adam'}. Best is trial 318 with value: 0.001767210723471942.[0m
[32m[I 2022-11-07 22:09:05,624][0m Trial 349 finished with value: 0.001809846572631096 and parameters: {'nlayers': 22, 'hidden_size': 150, 'dropout': 0.16219530911159685, 'learning_rate': 0.0023487957435455306, 'batch_size': 9814, 'optimizer_name': 'Adam'}. Best is trial 318 with value: 0.001767210723471942.[0m
[32m[I 2022-11-07 22:09:40,052][0m Trial 350 finished with value: 0.001806365870243789 and parameters: {'nlayers': 20, 'hidden_size': 223, 'dropout': 0.1790907524299216, 'learning_rate': 0.0017413620849794254, 'batch_size': 9813, 'optimizer_name': 'Adam'}. Best is trial 318 with value: 0.001767210723471942.[0m
[32m[I 2022-11-07 22:10:06,179][0m Trial 351 finished with value: 0.0017788126207459504 and parameters: {'nlayers': 18, 'hidden_size': 136, 'dropout': 0.1089781220293518, 'learning_rate': 0.0025175476144499147, 'batch_size': 9995, 'optimizer_name': 'Adam'}. Best is trial 318 with value: 0.001767210723471942.[0m
[32m[I 2022-11-07 22:10:35,469][0m Trial 352 finished with value: 0.0017947596818208694 and parameters: {'nlayers': 23, 'hidden_size': 143, 'dropout': 0.15727628643076969, 'learning_rate': 5.29208652204397e-05, 'batch_size': 10000, 'optimizer_name': 'Adam'}. Best is trial 318 with value: 0.001767210723471942.[0m
[32m[I 2022-11-07 22:11:07,087][0m Trial 353 finished with value: 0.0018355067989845458 and parameters: {'nlayers': 18, 'hidden_size': 226, 'dropout': 0.1710658442520515, 'learning_rate': 0.002323222342512642, 'batch_size': 9658, 'optimizer_name': 'SGD'}. Best is trial 318 with value: 0.001767210723471942.[0m
[32m[I 2022-11-07 22:11:30,840][0m Trial 354 finished with value: 0.0018992091915424369 and parameters: {'nlayers': 16, 'hidden_size': 150, 'dropout': 0.164651501989419, 'learning_rate': 0.0018943109335515227, 'batch_size': 9324, 'optimizer_name': 'Adam'}. Best is trial 318 with value: 0.001767210723471942.[0m
[32m[I 2022-11-07 22:11:57,413][0m Trial 355 finished with value: 0.00181085994727264 and parameters: {'nlayers': 20, 'hidden_size': 130, 'dropout': 0.15565989502849414, 'learning_rate': 0.0021165975704446256, 'batch_size': 9810, 'optimizer_name': 'Adam'}. Best is trial 318 with value: 0.001767210723471942.[0m
[32m[I 2022-11-07 22:12:32,000][0m Trial 356 finished with value: 0.0018585879028342259 and parameters: {'nlayers': 22, 'hidden_size': 232, 'dropout': 0.13407795925738808, 'learning_rate': 0.00021410094368920756, 'batch_size': 9560, 'optimizer_name': 'Adam'}. Best is trial 318 with value: 0.001767210723471942.[0m
[32m[I 2022-11-07 22:12:57,573][0m Trial 357 finished with value: 0.0017749566812904514 and parameters: {'nlayers': 13, 'hidden_size': 157, 'dropout': 0.16692835607124767, 'learning_rate': 0.001405010449544294, 'batch_size': 9996, 'optimizer_name': 'Adam'}. Best is trial 318 with value: 0.001767210723471942.[0m
[32m[I 2022-11-07 22:13:25,781][0m Trial 358 finished with value: 0.0018318408294213438 and parameters: {'nlayers': 24, 'hidden_size': 137, 'dropout': 0.17855071851438992, 'learning_rate': 0.0025485743071680723, 'batch_size': 9695, 'optimizer_name': 'Adam'}. Best is trial 318 with value: 0.001767210723471942.[0m
[32m[I 2022-11-07 22:14:00,568][0m Trial 359 finished with value: 0.0018139185378018444 and parameters: {'nlayers': 43, 'hidden_size': 144, 'dropout': 0.15393968366599164, 'learning_rate': 0.0021635833294695664, 'batch_size': 9791, 'optimizer_name': 'Adam'}. Best is trial 318 with value: 0.001767210723471942.[0m
[32m[I 2022-11-07 22:14:23,262][0m Trial 360 finished with value: 0.001875953643701465 and parameters: {'nlayers': 19, 'hidden_size': 98, 'dropout': 0.13824326425183456, 'learning_rate': 0.0026532239558178915, 'batch_size': 9462, 'optimizer_name': 'RMSprop'}. Best is trial 318 with value: 0.001767210723471942.[0m
[32m[I 2022-11-07 22:14:39,738][0m Trial 361 finished with value: 0.0036363521906045766 and parameters: {'nlayers': 45, 'hidden_size': 155, 'dropout': 0.16225669559707906, 'learning_rate': 0.0017597119435407693, 'batch_size': 4875, 'optimizer_name': 'Adam'}. Best is trial 318 with value: 0.001767210723471942.[0m
[32m[I 2022-11-07 22:15:00,079][0m Trial 362 finished with value: 0.0019415194933690913 and parameters: {'nlayers': 12, 'hidden_size': 123, 'dropout': 0.15084750592261936, 'learning_rate': 0.0023263447751428806, 'batch_size': 9133, 'optimizer_name': 'Adam'}. Best is trial 318 with value: 0.001767210723471942.[0m
[32m[I 2022-11-07 22:15:50,008][0m Trial 363 finished with value: 0.0018128802788970693 and parameters: {'nlayers': 41, 'hidden_size': 214, 'dropout': 0.11600397463262295, 'learning_rate': 0.0027833492158882015, 'batch_size': 9813, 'optimizer_name': 'Adam'}. Best is trial 318 with value: 0.001767210723471942.[0m
[32m[I 2022-11-07 22:16:24,743][0m Trial 364 finished with value: 0.001845557742304616 and parameters: {'nlayers': 48, 'hidden_size': 117, 'dropout': 0.12603265356141757, 'learning_rate': 0.002047717348859872, 'batch_size': 9625, 'optimizer_name': 'Adam'}. Best is trial 318 with value: 0.001767210723471942.[0m
[32m[I 2022-11-07 22:16:48,441][0m Trial 365 finished with value: 0.0018041714989468637 and parameters: {'nlayers': 17, 'hidden_size': 92, 'dropout': 0.17519212396075415, 'learning_rate': 0.00250558014604781, 'batch_size': 9816, 'optimizer_name': 'Adam'}. Best is trial 318 with value: 0.001767210723471942.[0m
[32m[I 2022-11-07 22:16:53,877][0m Trial 366 finished with value: 0.00456329264122641 and parameters: {'nlayers': 14, 'hidden_size': 130, 'dropout': 0.14362193356185815, 'learning_rate': 0.0015797067085167571, 'batch_size': 3865, 'optimizer_name': 'Adam'}. Best is trial 318 with value: 0.001767210723471942.[0m
[32m[I 2022-11-07 22:17:18,679][0m Trial 367 finished with value: 0.0017731476217508317 and parameters: {'nlayers': 7, 'hidden_size': 236, 'dropout': 0.1557689337698116, 'learning_rate': 0.0012260005771795783, 'batch_size': 10000, 'optimizer_name': 'Adam'}. Best is trial 318 with value: 0.001767210723471942.[0m
[32m[I 2022-11-07 22:17:43,627][0m Trial 368 finished with value: 0.0018021496009205564 and parameters: {'nlayers': 20, 'hidden_size': 105, 'dropout': 0.18366839344573713, 'learning_rate': 0.002334381569394987, 'batch_size': 9827, 'optimizer_name': 'Adam'}. Best is trial 318 with value: 0.001767210723471942.[0m
[32m[I 2022-11-07 22:18:11,350][0m Trial 369 finished with value: 0.0018519871263786981 and parameters: {'nlayers': 22, 'hidden_size': 147, 'dropout': 0.28387621227903514, 'learning_rate': 0.0019232774805958905, 'batch_size': 9572, 'optimizer_name': 'Adam'}. Best is trial 318 with value: 0.001767210723471942.[0m
[32m[I 2022-11-07 22:18:48,666][0m Trial 370 finished with value: 0.0018134162194874822 and parameters: {'nlayers': 44, 'hidden_size': 137, 'dropout': 0.16783665374662998, 'learning_rate': 0.0003568032391240764, 'batch_size': 9800, 'optimizer_name': 'Adam'}. Best is trial 318 with value: 0.001767210723471942.[0m
[32m[I 2022-11-07 22:19:16,258][0m Trial 371 finished with value: 0.0018907709431490564 and parameters: {'nlayers': 25, 'hidden_size': 152, 'dropout': 0.13686307912613224, 'learning_rate': 0.0026186844967447534, 'batch_size': 9374, 'optimizer_name': 'Adam'}. Best is trial 318 with value: 0.001767210723471942.[0m
[32m[I 2022-11-07 22:19:42,595][0m Trial 372 finished with value: 0.0018351944491236353 and parameters: {'nlayers': 16, 'hidden_size': 163, 'dropout': 0.1586148346579839, 'learning_rate': 0.0014217880727778445, 'batch_size': 9660, 'optimizer_name': 'RMSprop'}. Best is trial 318 with value: 0.001767210723471942.[0m
[32m[I 2022-11-07 22:20:27,056][0m Trial 373 finished with value: 0.0017783105044900057 and parameters: {'nlayers': 71, 'hidden_size': 111, 'dropout': 0.15050205587168428, 'learning_rate': 0.0029399705759484956, 'batch_size': 9980, 'optimizer_name': 'Adam'}. Best is trial 318 with value: 0.001767210723471942.[0m
[32m[I 2022-11-07 22:20:49,398][0m Trial 374 finished with value: 0.0018077556701803139 and parameters: {'nlayers': 10, 'hidden_size': 127, 'dropout': 0.12179213348103436, 'learning_rate': 0.002112508858158234, 'batch_size': 9818, 'optimizer_name': 'Adam'}. Best is trial 318 with value: 0.001767210723471942.[0m
[32m[I 2022-11-07 22:21:26,433][0m Trial 375 finished with value: 0.001793850642198847 and parameters: {'nlayers': 41, 'hidden_size': 143, 'dropout': 0.16881135503927455, 'learning_rate': 0.0010277771097730024, 'batch_size': 9997, 'optimizer_name': 'SGD'}. Best is trial 318 with value: 0.001767210723471942.[0m
[32m[I 2022-11-07 22:21:59,215][0m Trial 376 finished with value: 0.0018636573752394234 and parameters: {'nlayers': 47, 'hidden_size': 120, 'dropout': 0.4481648780039066, 'learning_rate': 0.0016571090818683083, 'batch_size': 9510, 'optimizer_name': 'Adam'}. Best is trial 318 with value: 0.001767210723471942.[0m
[32m[I 2022-11-07 22:22:29,230][0m Trial 377 finished with value: 0.0017730034451800918 and parameters: {'nlayers': 21, 'hidden_size': 159, 'dropout': 0.13904454606365846, 'learning_rate': 0.0005725790155909584, 'batch_size': 9997, 'optimizer_name': 'Adam'}. Best is trial 318 with value: 0.001767210723471942.[0m
[32m[I 2022-11-07 22:23:22,147][0m Trial 378 finished with value: 0.0018302994601027127 and parameters: {'nlayers': 50, 'hidden_size': 201, 'dropout': 0.13139795674492535, 'learning_rate': 0.0023962183454718437, 'batch_size': 9671, 'optimizer_name': 'Adam'}. Best is trial 318 with value: 0.001767210723471942.[0m
[32m[I 2022-11-07 22:23:48,894][0m Trial 379 finished with value: 0.0017712455617041052 and parameters: {'nlayers': 24, 'hidden_size': 102, 'dropout': 0.16233917193154723, 'learning_rate': 0.002180882785298186, 'batch_size': 9996, 'optimizer_name': 'Adam'}. Best is trial 318 with value: 0.001767210723471942.[0m
[32m[I 2022-11-07 22:24:12,671][0m Trial 380 finished with value: 0.0018077146991179887 and parameters: {'nlayers': 18, 'hidden_size': 100, 'dropout': 0.17777772685597087, 'learning_rate': 0.0021577672608088603, 'batch_size': 9803, 'optimizer_name': 'Adam'}. Best is trial 318 with value: 0.001767210723471942.[0m
[32m[I 2022-11-07 22:24:48,748][0m Trial 381 finished with value: 0.0018288827059678655 and parameters: {'nlayers': 57, 'hidden_size': 94, 'dropout': 0.16303238605776202, 'learning_rate': 0.0019026261836822844, 'batch_size': 9660, 'optimizer_name': 'Adam'}. Best is trial 318 with value: 0.001767210723471942.[0m
[32m[I 2022-11-07 22:25:15,956][0m Trial 382 finished with value: 0.0018045171652750042 and parameters: {'nlayers': 25, 'hidden_size': 109, 'dropout': 0.17332016139970216, 'learning_rate': 0.0021851706072687775, 'batch_size': 9832, 'optimizer_name': 'Adam'}. Best is trial 318 with value: 0.001767210723471942.[0m
[32m[I 2022-11-07 22:25:54,607][0m Trial 383 finished with value: 0.0018655204232748677 and parameters: {'nlayers': 77, 'hidden_size': 104, 'dropout': 0.16102503859783523, 'learning_rate': 0.0017900067666773733, 'batch_size': 9467, 'optimizer_name': 'Adam'}. Best is trial 318 with value: 0.001767210723471942.[0m
[32m[I 2022-11-07 22:26:20,976][0m Trial 384 finished with value: 0.0017707516554952454 and parameters: {'nlayers': 23, 'hidden_size': 89, 'dropout': 0.18522775306459593, 'learning_rate': 0.0012776349170264315, 'batch_size': 9998, 'optimizer_name': 'Adam'}. Best is trial 318 with value: 0.001767210723471942.[0m
[32m[I 2022-11-07 22:27:03,875][0m Trial 385 finished with value: 0.0019194028699720228 and parameters: {'nlayers': 86, 'hidden_size': 95, 'dropout': 0.18832344829354977, 'learning_rate': 0.001365226490456531, 'batch_size': 9250, 'optimizer_name': 'RMSprop'}. Best is trial 318 with value: 0.001767210723471942.[0m
[32m[I 2022-11-07 22:27:29,426][0m Trial 386 finished with value: 0.0018234692095973966 and parameters: {'nlayers': 22, 'hidden_size': 91, 'dropout': 0.17609926273194187, 'learning_rate': 0.0012029642342056151, 'batch_size': 9715, 'optimizer_name': 'Adam'}. Best is trial 318 with value: 0.001767210723471942.[0m
[32m[I 2022-11-07 22:27:53,704][0m Trial 387 finished with value: 0.0017696224948098294 and parameters: {'nlayers': 16, 'hidden_size': 89, 'dropout': 0.1839037489998689, 'learning_rate': 0.0011195198107719637, 'batch_size': 9999, 'optimizer_name': 'Adam'}. Best is trial 318 with value: 0.001767210723471942.[0m
[32m[I 2022-11-07 22:28:16,096][0m Trial 388 finished with value: 0.0018030058018735685 and parameters: {'nlayers': 15, 'hidden_size': 76, 'dropout': 0.3062742287633725, 'learning_rate': 0.001045143084585246, 'batch_size': 9816, 'optimizer_name': 'Adam'}. Best is trial 318 with value: 0.001767210723471942.[0m
[32m[I 2022-11-07 22:28:38,485][0m Trial 389 finished with value: 0.0017725854337215423 and parameters: {'nlayers': 14, 'hidden_size': 80, 'dropout': 0.19443291774192945, 'learning_rate': 0.0011671841661805033, 'batch_size': 10000, 'optimizer_name': 'Adam'}. Best is trial 318 with value: 0.001767210723471942.[0m
[32m[I 2022-11-07 22:28:59,645][0m Trial 390 finished with value: 0.0018552906343627675 and parameters: {'nlayers': 12, 'hidden_size': 90, 'dropout': 0.18416003890873828, 'learning_rate': 0.0013301870271839082, 'batch_size': 9560, 'optimizer_name': 'Adam'}. Best is trial 318 with value: 0.001767210723471942.[0m
[32m[I 2022-11-07 22:29:03,392][0m Trial 391 finished with value: 0.00631090158804478 and parameters: {'nlayers': 18, 'hidden_size': 86, 'dropout': 0.18692519385185766, 'learning_rate': 0.0014400300155543346, 'batch_size': 2814, 'optimizer_name': 'Adam'}. Best is trial 318 with value: 0.001767210723471942.[0m
[32m[I 2022-11-07 22:29:25,589][0m Trial 392 finished with value: 0.0018295737018207317 and parameters: {'nlayers': 15, 'hidden_size': 84, 'dropout': 0.1770937079115647, 'learning_rate': 0.0010153937534317797, 'batch_size': 9691, 'optimizer_name': 'Adam'}. Best is trial 318 with value: 0.001767210723471942.[0m
[32m[I 2022-11-07 22:29:57,265][0m Trial 393 finished with value: 0.00180251967801414 and parameters: {'nlayers': 43, 'hidden_size': 100, 'dropout': 0.18464991349567425, 'learning_rate': 0.0008296815212674934, 'batch_size': 9827, 'optimizer_name': 'Adam'}. Best is trial 318 with value: 0.001767210723471942.[0m
[32m[I 2022-11-07 22:30:20,682][0m Trial 394 finished with value: 0.0017758668303489685 and parameters: {'nlayers': 16, 'hidden_size': 88, 'dropout': 0.19598072816421552, 'learning_rate': 0.0016280457051325386, 'batch_size': 10000, 'optimizer_name': 'Adam'}. Best is trial 318 with value: 0.001767210723471942.[0m
[32m[I 2022-11-07 22:30:51,547][0m Trial 395 finished with value: 0.0018710155648789786 and parameters: {'nlayers': 52, 'hidden_size': 71, 'dropout': 0.20540397274881958, 'learning_rate': 0.0012049455889520777, 'batch_size': 9479, 'optimizer_name': 'Adam'}. Best is trial 318 with value: 0.001767210723471942.[0m
[32m[I 2022-11-07 22:31:12,890][0m Trial 396 finished with value: 0.0018354583603636032 and parameters: {'nlayers': 11, 'hidden_size': 102, 'dropout': 0.1726327688764283, 'learning_rate': 0.0009435739157969485, 'batch_size': 9673, 'optimizer_name': 'Adam'}. Best is trial 318 with value: 0.001767210723471942.[0m
[32m[I 2022-11-07 22:31:48,231][0m Trial 397 finished with value: 0.0018017487800617961 and parameters: {'nlayers': 56, 'hidden_size': 97, 'dropout': 0.1675766261069643, 'learning_rate': 0.0014958136756421322, 'batch_size': 9817, 'optimizer_name': 'RMSprop'}. Best is trial 318 with value: 0.001767210723471942.[0m
[32m[I 2022-11-07 22:32:20,751][0m Trial 398 finished with value: 0.0018100468727630607 and parameters: {'nlayers': 46, 'hidden_size': 108, 'dropout': 0.18295650075856223, 'learning_rate': 0.0007373651708975919, 'batch_size': 9809, 'optimizer_name': 'SGD'}. Best is trial 318 with value: 0.001767210723471942.[0m
[32m[I 2022-11-07 22:32:48,102][0m Trial 399 finished with value: 0.0019661481483950285 and parameters: {'nlayers': 39, 'hidden_size': 94, 'dropout': 0.16973036139057623, 'learning_rate': 0.001259328077008495, 'batch_size': 9008, 'optimizer_name': 'Adam'}. Best is trial 318 with value: 0.001767210723471942.[0m
[32m[I 2022-11-07 22:33:09,229][0m Trial 400 finished with value: 0.0018876723483937062 and parameters: {'nlayers': 13, 'hidden_size': 102, 'dropout': 0.17965136319685984, 'learning_rate': 0.0010687451066586483, 'batch_size': 9402, 'optimizer_name': 'Adam'}. Best is trial 318 with value: 0.001767210723471942.[0m
[32m[I 2022-11-07 22:33:33,814][0m Trial 401 finished with value: 0.0017748033509205337 and parameters: {'nlayers': 17, 'hidden_size': 87, 'dropout': 0.16321767046661495, 'learning_rate': 0.0017297264398897154, 'batch_size': 9999, 'optimizer_name': 'Adam'}. Best is trial 318 with value: 0.001767210723471942.[0m
[32m[I 2022-11-07 22:34:08,098][0m Trial 402 finished with value: 0.0018404252126619414 and parameters: {'nlayers': 49, 'hidden_size': 111, 'dropout': 0.21892215529181763, 'learning_rate': 0.0023894227204814085, 'batch_size': 9625, 'optimizer_name': 'Adam'}. Best is trial 318 with value: 0.001767210723471942.[0m
[32m[I 2022-11-07 22:34:58,730][0m Trial 403 finished with value: 0.001810853700223768 and parameters: {'nlayers': 43, 'hidden_size': 209, 'dropout': 0.19102640153311606, 'learning_rate': 0.0015266442078787704, 'batch_size': 9812, 'optimizer_name': 'Adam'}. Best is trial 318 with value: 0.001767210723471942.[0m
[32m[I 2022-11-07 22:35:36,597][0m Trial 404 finished with value: 0.0018495504866038555 and parameters: {'nlayers': 58, 'hidden_size': 114, 'dropout': 0.16913662997578044, 'learning_rate': 0.0008085210947845402, 'batch_size': 9605, 'optimizer_name': 'Adam'}. Best is trial 318 with value: 0.001767210723471942.[0m
[32m[I 2022-11-07 22:36:12,199][0m Trial 405 finished with value: 0.0018018839040777944 and parameters: {'nlayers': 19, 'hidden_size': 246, 'dropout': 0.1614482197196771, 'learning_rate': 0.0019315716793020157, 'batch_size': 9836, 'optimizer_name': 'Adam'}. Best is trial 318 with value: 0.001767210723471942.[0m
[32m[I 2022-11-07 22:36:31,535][0m Trial 406 finished with value: 0.0019235757109155923 and parameters: {'nlayers': 9, 'hidden_size': 105, 'dropout': 0.152102349580963, 'learning_rate': 0.0012818932439865374, 'batch_size': 9260, 'optimizer_name': 'Adam'}. Best is trial 318 with value: 0.001767210723471942.[0m
[32m[I 2022-11-07 22:37:04,648][0m Trial 407 finished with value: 0.0017717265256560674 and parameters: {'nlayers': 54, 'hidden_size': 65, 'dropout': 0.17542946817794242, 'learning_rate': 0.0025255234343359136, 'batch_size': 9999, 'optimizer_name': 'Adam'}. Best is trial 318 with value: 0.001767210723471942.[0m
[32m[I 2022-11-07 22:37:30,602][0m Trial 408 finished with value: 0.0018326272785953337 and parameters: {'nlayers': 23, 'hidden_size': 115, 'dropout': 0.16571747159443911, 'learning_rate': 0.002332860920392796, 'batch_size': 9669, 'optimizer_name': 'Adam'}. Best is trial 318 with value: 0.001767210723471942.[0m
[32m[I 2022-11-07 22:38:02,181][0m Trial 409 finished with value: 0.0018109973484402686 and parameters: {'nlayers': 40, 'hidden_size': 93, 'dropout': 0.1820537756094739, 'learning_rate': 0.001039008662992289, 'batch_size': 9826, 'optimizer_name': 'Adam'}. Best is trial 318 with value: 0.001767210723471942.[0m
[32m[I 2022-11-07 22:38:34,934][0m Trial 410 finished with value: 0.0019062478454024703 and parameters: {'nlayers': 17, 'hidden_size': 265, 'dropout': 0.10482105202476935, 'learning_rate': 0.0027461990542605153, 'batch_size': 9450, 'optimizer_name': 'RMSprop'}. Best is trial 318 with value: 0.001767210723471942.[0m
[32m[I 2022-11-07 22:39:00,521][0m Trial 411 finished with value: 0.0017676741111323842 and parameters: {'nlayers': 21, 'hidden_size': 100, 'dropout': 0.15668098243667422, 'learning_rate': 0.001899603166230794, 'batch_size': 9998, 'optimizer_name': 'Adam'}. Best is trial 318 with value: 0.001767210723471942.[0m
[32m[I 2022-11-07 22:39:25,654][0m Trial 412 finished with value: 0.001807116826205252 and parameters: {'nlayers': 21, 'hidden_size': 99, 'dropout': 0.1536809490647014, 'learning_rate': 0.0019668884282906156, 'batch_size': 9813, 'optimizer_name': 'Adam'}. Best is trial 318 with value: 0.001767210723471942.[0m
[32m[I 2022-11-07 22:39:49,473][0m Trial 413 finished with value: 0.0018419412214619258 and parameters: {'nlayers': 19, 'hidden_size': 87, 'dropout': 0.1475769453337697, 'learning_rate': 0.00171171144301982, 'batch_size': 9641, 'optimizer_name': 'Adam'}. Best is trial 318 with value: 0.001767210723471942.[0m
