[32m[I 2022-11-07 22:40:14,750][0m Trial 414 finished with value: 0.001801734990187258 and parameters: {'nlayers': 22, 'hidden_size': 79, 'dropout': 0.15721178647579923, 'learning_rate': 0.0021909632034413226, 'batch_size': 9845, 'optimizer_name': 'Adam'}. Best is trial 318 with value: 0.001767210723471942.[0m
[32m[I 2022-11-07 22:40:42,666][0m Trial 415 finished with value: 0.0017769507826532554 and parameters: {'nlayers': 26, 'hidden_size': 93, 'dropout': 0.1476451131225507, 'learning_rate': 0.0017852016095542033, 'batch_size': 9986, 'optimizer_name': 'Adam'}. Best is trial 318 with value: 0.001767210723471942.[0m
[32m[I 2022-11-07 22:41:06,357][0m Trial 416 finished with value: 0.0018675676275089752 and parameters: {'nlayers': 20, 'hidden_size': 98, 'dropout': 0.16187449773238208, 'learning_rate': 0.0020155815249487787, 'batch_size': 9505, 'optimizer_name': 'Adam'}. Best is trial 318 with value: 0.001767210723471942.[0m
[32m[I 2022-11-07 22:41:32,443][0m Trial 417 finished with value: 0.001833397892788191 and parameters: {'nlayers': 24, 'hidden_size': 107, 'dropout': 0.17113641690379236, 'learning_rate': 0.0015243358149110854, 'batch_size': 9678, 'optimizer_name': 'Adam'}. Best is trial 318 with value: 0.001767210723471942.[0m
[32m[I 2022-11-07 22:41:55,559][0m Trial 418 finished with value: 0.0018059041926038267 and parameters: {'nlayers': 14, 'hidden_size': 102, 'dropout': 0.15546373671457264, 'learning_rate': 0.002258067341837267, 'batch_size': 9829, 'optimizer_name': 'Adam'}. Best is trial 318 with value: 0.001767210723471942.[0m
[32m[I 2022-11-07 22:42:21,648][0m Trial 419 finished with value: 0.0018048204145045459 and parameters: {'nlayers': 16, 'hidden_size': 153, 'dropout': 0.12198172228761232, 'learning_rate': 0.0024975634880505544, 'batch_size': 9807, 'optimizer_name': 'Adam'}. Best is trial 318 with value: 0.001767210723471942.[0m
[32m[I 2022-11-07 22:42:49,976][0m Trial 420 finished with value: 0.001795629897856202 and parameters: {'nlayers': 22, 'hidden_size': 160, 'dropout': 0.1467216112276317, 'learning_rate': 0.001990046946272927, 'batch_size': 9994, 'optimizer_name': 'SGD'}. Best is trial 318 with value: 0.001767210723471942.[0m
[32m[I 2022-11-07 22:43:43,897][0m Trial 421 finished with value: 0.0018509416673129482 and parameters: {'nlayers': 52, 'hidden_size': 198, 'dropout': 0.13007155271732807, 'learning_rate': 0.0028546173626801665, 'batch_size': 9544, 'optimizer_name': 'Adam'}. Best is trial 318 with value: 0.001767210723471942.[0m
[32m[I 2022-11-07 22:44:07,618][0m Trial 422 finished with value: 0.0019062397544427714 and parameters: {'nlayers': 27, 'hidden_size': 96, 'dropout': 0.1720309255754606, 'learning_rate': 0.0018041669917474865, 'batch_size': 9327, 'optimizer_name': 'Adam'}. Best is trial 318 with value: 0.001767210723471942.[0m
[32m[I 2022-11-07 22:44:15,218][0m Trial 423 finished with value: 0.0034362586651183915 and parameters: {'nlayers': 20, 'hidden_size': 81, 'dropout': 0.11598230026293263, 'learning_rate': 0.0023543549891291964, 'batch_size': 5173, 'optimizer_name': 'RMSprop'}. Best is trial 318 with value: 0.001767210723471942.[0m
[32m[I 2022-11-07 22:44:53,279][0m Trial 424 finished with value: 0.0017738393333082574 and parameters: {'nlayers': 60, 'hidden_size': 90, 'dropout': 0.19112794885859402, 'learning_rate': 0.0013680370582557432, 'batch_size': 9989, 'optimizer_name': 'Adam'}. Best is trial 318 with value: 0.001767210723471942.[0m
[32m[I 2022-11-07 22:45:08,560][0m Trial 425 finished with value: 0.002638019642384696 and parameters: {'nlayers': 18, 'hidden_size': 167, 'dropout': 0.19931893303377612, 'learning_rate': 0.002611996212430187, 'batch_size': 6737, 'optimizer_name': 'Adam'}. Best is trial 318 with value: 0.001767210723471942.[0m
[32m[I 2022-11-07 22:45:34,237][0m Trial 426 finished with value: 0.001834703872519958 and parameters: {'nlayers': 24, 'hidden_size': 105, 'dropout': 0.1558845954538115, 'learning_rate': 0.001619005032977707, 'batch_size': 9661, 'optimizer_name': 'Adam'}. Best is trial 318 with value: 0.001767210723471942.[0m
[32m[I 2022-11-07 22:46:00,843][0m Trial 427 finished with value: 0.0017741399869892116 and parameters: {'nlayers': 15, 'hidden_size': 155, 'dropout': 0.1797838486652166, 'learning_rate': 0.0021230552299244553, 'batch_size': 9998, 'optimizer_name': 'Adam'}. Best is trial 318 with value: 0.001767210723471942.[0m
[32m[I 2022-11-07 22:46:36,457][0m Trial 428 finished with value: 0.0018082280517172679 and parameters: {'nlayers': 55, 'hidden_size': 97, 'dropout': 0.16272818542492007, 'learning_rate': 0.0018780514155792034, 'batch_size': 9785, 'optimizer_name': 'Adam'}. Best is trial 318 with value: 0.001767210723471942.[0m
[32m[I 2022-11-07 22:47:01,150][0m Trial 429 finished with value: 0.0018330539499812842 and parameters: {'nlayers': 22, 'hidden_size': 86, 'dropout': 0.14466106927254588, 'learning_rate': 0.0022808665029140974, 'batch_size': 9677, 'optimizer_name': 'Adam'}. Best is trial 318 with value: 0.001767210723471942.[0m
[32m[I 2022-11-07 22:47:13,713][0m Trial 430 finished with value: 0.002819387658588831 and parameters: {'nlayers': 13, 'hidden_size': 204, 'dropout': 0.13582797590259357, 'learning_rate': 0.0024753089280275422, 'batch_size': 6285, 'optimizer_name': 'Adam'}. Best is trial 318 with value: 0.001767210723471942.[0m
[32m[I 2022-11-07 22:47:41,629][0m Trial 431 finished with value: 0.0018100419929951968 and parameters: {'nlayers': 18, 'hidden_size': 161, 'dropout': 0.10956003098251663, 'learning_rate': 0.00204927573858808, 'batch_size': 9793, 'optimizer_name': 'Adam'}. Best is trial 318 with value: 0.001767210723471942.[0m
[32m[I 2022-11-07 22:48:03,935][0m Trial 432 finished with value: 0.001880736950161073 and parameters: {'nlayers': 12, 'hidden_size': 149, 'dropout': 0.1666673063755752, 'learning_rate': 0.0030934185519696728, 'batch_size': 9417, 'optimizer_name': 'Adam'}. Best is trial 318 with value: 0.001767210723471942.[0m
[32m[I 2022-11-07 22:48:38,472][0m Trial 433 finished with value: 0.001807871717559204 and parameters: {'nlayers': 48, 'hidden_size': 107, 'dropout': 0.1519515958185428, 'learning_rate': 0.0014492489698289673, 'batch_size': 9824, 'optimizer_name': 'Adam'}. Best is trial 318 with value: 0.001767210723471942.[0m
[32m[I 2022-11-07 22:49:27,037][0m Trial 434 finished with value: 0.0017750458637221524 and parameters: {'nlayers': 94, 'hidden_size': 100, 'dropout': 0.17481840543061794, 'learning_rate': 0.0027705620719812563, 'batch_size': 9998, 'optimizer_name': 'Adam'}. Best is trial 318 with value: 0.001767210723471942.[0m
[32m[I 2022-11-07 22:50:04,078][0m Trial 435 finished with value: 0.0018529564229532575 and parameters: {'nlayers': 58, 'hidden_size': 113, 'dropout': 0.15996484254521665, 'learning_rate': 0.0016184852858059022, 'batch_size': 9558, 'optimizer_name': 'RMSprop'}. Best is trial 318 with value: 0.001767210723471942.[0m
[32m[I 2022-11-07 22:50:41,057][0m Trial 436 finished with value: 0.001835984683869471 and parameters: {'nlayers': 51, 'hidden_size': 122, 'dropout': 0.1259090847417989, 'learning_rate': 0.001257585594094034, 'batch_size': 9678, 'optimizer_name': 'Adam'}. Best is trial 318 with value: 0.001767210723471942.[0m
[32m[I 2022-11-07 22:51:16,919][0m Trial 437 finished with value: 0.001774692426291158 and parameters: {'nlayers': 24, 'hidden_size': 196, 'dropout': 0.22809940970759954, 'learning_rate': 0.0022385470163546056, 'batch_size': 9997, 'optimizer_name': 'Adam'}. Best is trial 318 with value: 0.001767210723471942.[0m
[32m[I 2022-11-07 22:51:46,030][0m Trial 438 finished with value: 0.0018088474225148596 and parameters: {'nlayers': 20, 'hidden_size': 164, 'dropout': 0.14156692687064654, 'learning_rate': 0.0006592614281657039, 'batch_size': 9825, 'optimizer_name': 'Adam'}. Best is trial 318 with value: 0.001767210723471942.[0m
[32m[I 2022-11-07 22:52:11,161][0m Trial 439 finished with value: 0.0018646842293215283 and parameters: {'nlayers': 17, 'hidden_size': 139, 'dropout': 0.24772486895969428, 'learning_rate': 0.0025880066935973773, 'batch_size': 9527, 'optimizer_name': 'Adam'}. Best is trial 318 with value: 0.001767210723471942.[0m
[32m[I 2022-11-07 22:52:34,989][0m Trial 440 finished with value: 0.0017799600547387534 and parameters: {'nlayers': 27, 'hidden_size': 26, 'dropout': 0.18627928523307688, 'learning_rate': 0.0011686271423270505, 'batch_size': 9996, 'optimizer_name': 'Adam'}. Best is trial 318 with value: 0.001767210723471942.[0m
[32m[I 2022-11-07 22:52:55,865][0m Trial 441 finished with value: 0.0019322353468022122 and parameters: {'nlayers': 9, 'hidden_size': 172, 'dropout': 0.1502149057088307, 'learning_rate': 0.0018296628385650843, 'batch_size': 9202, 'optimizer_name': 'Adam'}. Best is trial 318 with value: 0.001767210723471942.[0m
[32m[I 2022-11-07 22:53:47,048][0m Trial 442 finished with value: 0.0018083510310660563 and parameters: {'nlayers': 45, 'hidden_size': 224, 'dropout': 0.16737356741767767, 'learning_rate': 0.0021346536892181706, 'batch_size': 9812, 'optimizer_name': 'SGD'}. Best is trial 318 with value: 0.001767210723471942.[0m
[32m[I 2022-11-07 22:54:11,908][0m Trial 443 finished with value: 0.0018444393493805738 and parameters: {'nlayers': 21, 'hidden_size': 91, 'dropout': 0.4220938793281669, 'learning_rate': 0.000945041408708961, 'batch_size': 9649, 'optimizer_name': 'Adam'}. Best is trial 318 with value: 0.001767210723471942.[0m
[32m[I 2022-11-07 22:54:38,064][0m Trial 444 finished with value: 0.0018043754398276842 and parameters: {'nlayers': 16, 'hidden_size': 154, 'dropout': 0.15753691769481507, 'learning_rate': 0.0023993622454243453, 'batch_size': 9826, 'optimizer_name': 'Adam'}. Best is trial 318 with value: 0.001767210723471942.[0m
[32m[I 2022-11-07 22:56:00,693][0m Trial 445 finished with value: 0.001773441615571302 and parameters: {'nlayers': 54, 'hidden_size': 300, 'dropout': 0.1336870104655369, 'learning_rate': 0.002917410726127137, 'batch_size': 9994, 'optimizer_name': 'Adam'}. Best is trial 318 with value: 0.001767210723471942.[0m
[32m[I 2022-11-07 22:56:34,039][0m Trial 446 finished with value: 0.0018383674072033026 and parameters: {'nlayers': 56, 'hidden_size': 104, 'dropout': 0.1775276302250331, 'learning_rate': 0.002009504402491173, 'batch_size': 9627, 'optimizer_name': 'Adam'}. Best is trial 318 with value: 0.001767210723471942.[0m
[32m[I 2022-11-07 22:57:01,122][0m Trial 447 finished with value: 0.0017720933561683725 and parameters: {'nlayers': 23, 'hidden_size': 111, 'dropout': 0.14228961661877237, 'learning_rate': 0.002661168512861466, 'batch_size': 9998, 'optimizer_name': 'Adam'}. Best is trial 318 with value: 0.001767210723471942.[0m
[32m[I 2022-11-07 22:57:33,810][0m Trial 448 finished with value: 0.0021602670664682727 and parameters: {'nlayers': 26, 'hidden_size': 186, 'dropout': 0.1628513467416813, 'learning_rate': 0.0015211510586459903, 'batch_size': 9394, 'optimizer_name': 'RMSprop'}. Best is trial 318 with value: 0.001767210723471942.[0m
[32m[I 2022-11-07 22:58:21,048][0m Trial 449 finished with value: 0.001812352648028448 and parameters: {'nlayers': 62, 'hidden_size': 148, 'dropout': 0.1530412949159583, 'learning_rate': 0.008358758470183206, 'batch_size': 9804, 'optimizer_name': 'Adam'}. Best is trial 318 with value: 0.001767210723471942.[0m
[32m[I 2022-11-07 22:58:43,657][0m Trial 450 finished with value: 0.00183080387361906 and parameters: {'nlayers': 14, 'hidden_size': 95, 'dropout': 0.3780125471663285, 'learning_rate': 0.0009855363882149831, 'batch_size': 9675, 'optimizer_name': 'Adam'}. Best is trial 318 with value: 0.001767210723471942.[0m
[32m[I 2022-11-07 22:59:13,454][0m Trial 451 finished with value: 0.0018070645884399803 and parameters: {'nlayers': 20, 'hidden_size': 169, 'dropout': 0.17006868338568193, 'learning_rate': 0.0022982153014018828, 'batch_size': 9825, 'optimizer_name': 'Adam'}. Best is trial 318 with value: 0.001767210723471942.[0m
[32m[I 2022-11-07 22:59:33,278][0m Trial 452 finished with value: 0.0018595942405873825 and parameters: {'nlayers': 5, 'hidden_size': 160, 'dropout': 0.12757402386606767, 'learning_rate': 0.0018442288549343937, 'batch_size': 9518, 'optimizer_name': 'Adam'}. Best is trial 318 with value: 0.001767210723471942.[0m
[32m[I 2022-11-07 22:59:57,141][0m Trial 453 finished with value: 0.0018063465810824494 and parameters: {'nlayers': 19, 'hidden_size': 84, 'dropout': 0.1799456200246161, 'learning_rate': 0.0011631657631679209, 'batch_size': 9823, 'optimizer_name': 'Adam'}. Best is trial 318 with value: 0.001767210723471942.[0m
[32m[I 2022-11-07 23:00:38,318][0m Trial 454 finished with value: 0.0017720057466407374 and parameters: {'nlayers': 59, 'hidden_size': 117, 'dropout': 0.21185773259317076, 'learning_rate': 0.0024716955968312683, 'batch_size': 9998, 'optimizer_name': 'Adam'}. Best is trial 318 with value: 0.001767210723471942.[0m
[32m[I 2022-11-07 23:01:17,689][0m Trial 455 finished with value: 0.001772983158613737 and parameters: {'nlayers': 50, 'hidden_size': 127, 'dropout': 0.11845995979331264, 'learning_rate': 0.0016529161121470776, 'batch_size': 9997, 'optimizer_name': 'Adam'}. Best is trial 318 with value: 0.001767210723471942.[0m
[32m[I 2022-11-07 23:01:29,860][0m Trial 456 finished with value: 0.003936968905698434 and parameters: {'nlayers': 47, 'hidden_size': 101, 'dropout': 0.14634448732110442, 'learning_rate': 0.000597113300539902, 'batch_size': 4510, 'optimizer_name': 'Adam'}. Best is trial 318 with value: 0.001767210723471942.[0m
[32m[I 2022-11-07 23:02:00,739][0m Trial 457 finished with value: 0.0018381160516759587 and parameters: {'nlayers': 17, 'hidden_size': 213, 'dropout': 0.15915284512244487, 'learning_rate': 0.0021793973681541344, 'batch_size': 9677, 'optimizer_name': 'Adam'}. Best is trial 318 with value: 0.001767210723471942.[0m
[32m[I 2022-11-07 23:02:33,529][0m Trial 458 finished with value: 0.001893705736365845 and parameters: {'nlayers': 38, 'hidden_size': 135, 'dropout': 0.13617432500374627, 'learning_rate': 0.0012497034934102914, 'batch_size': 9362, 'optimizer_name': 'Adam'}. Best is trial 318 with value: 0.001767210723471942.[0m
[32m[I 2022-11-07 23:02:56,129][0m Trial 459 finished with value: 0.0018071820005438838 and parameters: {'nlayers': 12, 'hidden_size': 109, 'dropout': 0.17243942271510823, 'learning_rate': 0.0014229524669181013, 'batch_size': 9811, 'optimizer_name': 'Adam'}. Best is trial 318 with value: 0.001767210723471942.[0m
[32m[I 2022-11-07 23:02:59,712][0m Trial 460 finished with value: 0.010909148321233846 and parameters: {'nlayers': 22, 'hidden_size': 145, 'dropout': 0.1855404835143426, 'learning_rate': 0.004955800577473622, 'batch_size': 1626, 'optimizer_name': 'RMSprop'}. Best is trial 318 with value: 0.001767210723471942.[0m
[32m[I 2022-11-07 23:03:43,332][0m Trial 461 finished with value: 0.0018388961386804135 and parameters: {'nlayers': 53, 'hidden_size': 153, 'dropout': 0.15203119329292503, 'learning_rate': 0.0008462886558828046, 'batch_size': 9650, 'optimizer_name': 'Adam'}. Best is trial 318 with value: 0.001767210723471942.[0m
[32m[I 2022-11-07 23:04:04,366][0m Trial 462 finished with value: 0.001807055672151312 and parameters: {'nlayers': 11, 'hidden_size': 72, 'dropout': 0.16535780389989838, 'learning_rate': 0.0019467356071476093, 'batch_size': 9827, 'optimizer_name': 'Adam'}. Best is trial 318 with value: 0.001767210723471942.[0m
[32m[I 2022-11-07 23:04:34,851][0m Trial 463 finished with value: 0.0024261628336931912 and parameters: {'nlayers': 44, 'hidden_size': 180, 'dropout': 0.14115843775758863, 'learning_rate': 0.0027846741442916173, 'batch_size': 7299, 'optimizer_name': 'Adam'}. Best is trial 318 with value: 0.001767210723471942.[0m
[32m[I 2022-11-07 23:05:05,089][0m Trial 464 finished with value: 0.0017757461522624354 and parameters: {'nlayers': 25, 'hidden_size': 140, 'dropout': 0.1947047553733657, 'learning_rate': 0.005905774383637949, 'batch_size': 9999, 'optimizer_name': 'Adam'}. Best is trial 318 with value: 0.001767210723471942.[0m
[32m[I 2022-11-07 23:05:27,406][0m Trial 465 finished with value: 0.001851629624499007 and parameters: {'nlayers': 15, 'hidden_size': 120, 'dropout': 0.1614504872806157, 'learning_rate': 0.0024708185962099855, 'batch_size': 9555, 'optimizer_name': 'Adam'}. Best is trial 318 with value: 0.001767210723471942.[0m
[32m[I 2022-11-07 23:05:57,812][0m Trial 466 finished with value: 0.0018283866741219345 and parameters: {'nlayers': 42, 'hidden_size': 97, 'dropout': 0.15410171214502366, 'learning_rate': 0.002098960397068462, 'batch_size': 9800, 'optimizer_name': 'SGD'}. Best is trial 318 with value: 0.001767210723471942.[0m
[32m[I 2022-11-07 23:07:18,557][0m Trial 467 finished with value: 0.0017727340681067461 and parameters: {'nlayers': 89, 'hidden_size': 191, 'dropout': 0.17412667873490326, 'learning_rate': 0.0029913230760322583, 'batch_size': 9995, 'optimizer_name': 'Adam'}. Best is trial 318 with value: 0.001767210723471942.[0m
[32m[I 2022-11-07 23:07:38,169][0m Trial 468 finished with value: 0.001941374297647789 and parameters: {'nlayers': 18, 'hidden_size': 89, 'dropout': 0.13132461987242505, 'learning_rate': 0.0017959922340309332, 'batch_size': 9117, 'optimizer_name': 'Adam'}. Best is trial 318 with value: 0.001767210723471942.[0m
[32m[I 2022-11-07 23:08:02,637][0m Trial 469 finished with value: 0.0018624393948488663 and parameters: {'nlayers': 23, 'hidden_size': 103, 'dropout': 0.10030740744795534, 'learning_rate': 0.001009785145435068, 'batch_size': 9518, 'optimizer_name': 'Adam'}. Best is trial 318 with value: 0.001767210723471942.[0m
[32m[I 2022-11-07 23:08:42,074][0m Trial 470 finished with value: 0.001822027717675308 and parameters: {'nlayers': 29, 'hidden_size': 207, 'dropout': 0.14513982399703793, 'learning_rate': 0.002273655327710827, 'batch_size': 9719, 'optimizer_name': 'Adam'}. Best is trial 318 with value: 0.001767210723471942.[0m
[32m[I 2022-11-07 23:09:19,334][0m Trial 471 finished with value: 0.0017733033429767923 and parameters: {'nlayers': 40, 'hidden_size': 160, 'dropout': 0.17110702862183896, 'learning_rate': 0.0026431558082237257, 'batch_size': 9998, 'optimizer_name': 'Adam'}. Best is trial 318 with value: 0.001767210723471942.[0m
[32m[I 2022-11-07 23:09:49,449][0m Trial 472 finished with value: 0.001807686426903117 and parameters: {'nlayers': 21, 'hidden_size': 167, 'dropout': 0.18122522590046133, 'learning_rate': 0.0013899800078340909, 'batch_size': 9815, 'optimizer_name': 'Adam'}. Best is trial 318 with value: 0.001767210723471942.[0m
[32m[I 2022-11-07 23:10:23,638][0m Trial 473 finished with value: 0.0018309596914407062 and parameters: {'nlayers': 49, 'hidden_size': 107, 'dropout': 0.1595849936761769, 'learning_rate': 0.0006907362651186076, 'batch_size': 9662, 'optimizer_name': 'Adam'}. Best is trial 318 with value: 0.001767210723471942.[0m
[32m[I 2022-11-07 23:11:02,130][0m Trial 474 finished with value: 0.0018894170697049584 and parameters: {'nlayers': 56, 'hidden_size': 132, 'dropout': 0.11655079531912269, 'learning_rate': 0.0023863871679383497, 'batch_size': 9394, 'optimizer_name': 'RMSprop'}. Best is trial 318 with value: 0.001767210723471942.[0m
[32m[I 2022-11-07 23:11:49,584][0m Trial 475 finished with value: 0.00177125726062838 and parameters: {'nlayers': 46, 'hidden_size': 175, 'dropout': 0.3387549247722628, 'learning_rate': 0.0019991405827224093, 'batch_size': 9998, 'optimizer_name': 'Adam'}. Best is trial 318 with value: 0.001767210723471942.[0m
[32m[I 2022-11-07 23:12:31,937][0m Trial 476 finished with value: 0.0018037772566016342 and parameters: {'nlayers': 45, 'hidden_size': 176, 'dropout': 0.34282516433673876, 'learning_rate': 0.0017489332155152739, 'batch_size': 9817, 'optimizer_name': 'Adam'}. Best is trial 318 with value: 0.001767210723471942.[0m
[32m[I 2022-11-07 23:13:09,951][0m Trial 477 finished with value: 0.002065669298033204 and parameters: {'nlayers': 45, 'hidden_size': 174, 'dropout': 0.29832012865365404, 'learning_rate': 0.0019141536254318986, 'batch_size': 8589, 'optimizer_name': 'Adam'}. Best is trial 318 with value: 0.001767210723471942.[0m
[32m[I 2022-11-07 23:13:52,027][0m Trial 478 finished with value: 0.0020052536800082795 and parameters: {'nlayers': 46, 'hidden_size': 185, 'dropout': 0.39921269451190505, 'learning_rate': 0.0016169121059547483, 'batch_size': 8850, 'optimizer_name': 'Adam'}. Best is trial 318 with value: 0.001767210723471942.[0m
[32m[I 2022-11-07 23:14:36,388][0m Trial 479 finished with value: 0.0018406616535664249 and parameters: {'nlayers': 47, 'hidden_size': 169, 'dropout': 0.33626007349354603, 'learning_rate': 0.001961718438620341, 'batch_size': 9627, 'optimizer_name': 'Adam'}. Best is trial 318 with value: 0.001767210723471942.[0m
[32m[I 2022-11-07 23:15:22,454][0m Trial 480 finished with value: 0.001801711291217 and parameters: {'nlayers': 43, 'hidden_size': 182, 'dropout': 0.3089209638610583, 'learning_rate': 0.0011581890598345163, 'batch_size': 9847, 'optimizer_name': 'Adam'}. Best is trial 318 with value: 0.001767210723471942.[0m
[32m[I 2022-11-07 23:16:15,253][0m Trial 481 finished with value: 0.001870137541759765 and parameters: {'nlayers': 50, 'hidden_size': 199, 'dropout': 0.3289134831399391, 'learning_rate': 0.0020844108546618843, 'batch_size': 9477, 'optimizer_name': 'Adam'}. Best is trial 318 with value: 0.001767210723471942.[0m
[32m[I 2022-11-07 23:17:04,330][0m Trial 482 finished with value: 0.0018257810683800567 and parameters: {'nlayers': 53, 'hidden_size': 173, 'dropout': 0.12466363013937376, 'learning_rate': 0.0015531974004264312, 'batch_size': 9699, 'optimizer_name': 'Adam'}. Best is trial 318 with value: 0.001767210723471942.[0m
