[32m[I 2022-11-08 03:12:27,027][0m Trial 966 finished with value: 0.001778226736677734 and parameters: {'nlayers': 21, 'hidden_size': 99, 'dropout': 0.4535866698280694, 'learning_rate': 0.007266113069451121, 'batch_size': 9997, 'optimizer_name': 'Adam'}. Best is trial 899 with value: 0.0017655460917727903.[0m
[32m[I 2022-11-08 03:13:07,633][0m Trial 967 finished with value: 0.0017744578210243357 and parameters: {'nlayers': 35, 'hidden_size': 184, 'dropout': 0.43224128181584043, 'learning_rate': 0.0020310781032949993, 'batch_size': 9999, 'optimizer_name': 'Adam'}. Best is trial 899 with value: 0.0017655460917727903.[0m
[32m[I 2022-11-08 03:13:43,957][0m Trial 968 finished with value: 0.0018541906321916121 and parameters: {'nlayers': 67, 'hidden_size': 75, 'dropout': 0.10913658088664796, 'learning_rate': 0.001786698949227855, 'batch_size': 9538, 'optimizer_name': 'Adam'}. Best is trial 899 with value: 0.0017655460917727903.[0m
[32m[I 2022-11-08 03:14:08,331][0m Trial 969 finished with value: 0.001772393732264538 and parameters: {'nlayers': 18, 'hidden_size': 88, 'dropout': 0.4203126777196206, 'learning_rate': 0.0028494595468144114, 'batch_size': 9999, 'optimizer_name': 'Adam'}. Best is trial 899 with value: 0.0017655460917727903.[0m
[32m[I 2022-11-08 03:14:34,166][0m Trial 970 finished with value: 0.001828516627677656 and parameters: {'nlayers': 10, 'hidden_size': 227, 'dropout': 0.4105188159030749, 'learning_rate': 0.002285900142987186, 'batch_size': 9684, 'optimizer_name': 'Adam'}. Best is trial 899 with value: 0.0017655460917727903.[0m
[32m[I 2022-11-08 03:14:59,431][0m Trial 971 finished with value: 0.0018275777805868273 and parameters: {'nlayers': 16, 'hidden_size': 152, 'dropout': 0.4317670433727778, 'learning_rate': 0.002086128714930803, 'batch_size': 9708, 'optimizer_name': 'Adam'}. Best is trial 899 with value: 0.0017655460917727903.[0m
[32m[I 2022-11-08 03:15:21,377][0m Trial 972 finished with value: 0.0018987346743853752 and parameters: {'nlayers': 20, 'hidden_size': 54, 'dropout': 0.400671285391171, 'learning_rate': 0.0025194514150165075, 'batch_size': 9347, 'optimizer_name': 'Adam'}. Best is trial 899 with value: 0.0017655460917727903.[0m
[32m[I 2022-11-08 03:15:44,511][0m Trial 973 finished with value: 0.00177552567501837 and parameters: {'nlayers': 13, 'hidden_size': 82, 'dropout': 0.14776542324544317, 'learning_rate': 0.006413996053254302, 'batch_size': 9997, 'optimizer_name': 'Adam'}. Best is trial 899 with value: 0.0017655460917727903.[0m
[32m[I 2022-11-08 03:16:07,685][0m Trial 974 finished with value: 0.0018040957189769398 and parameters: {'nlayers': 14, 'hidden_size': 91, 'dropout': 0.11986498689195578, 'learning_rate': 0.0018699333618807802, 'batch_size': 9798, 'optimizer_name': 'Adam'}. Best is trial 899 with value: 0.0017655460917727903.[0m
[32m[I 2022-11-08 03:16:29,193][0m Trial 975 finished with value: 0.00186225589434406 and parameters: {'nlayers': 9, 'hidden_size': 143, 'dropout': 0.4428894775878264, 'learning_rate': 0.00024439422957443324, 'batch_size': 9522, 'optimizer_name': 'RMSprop'}. Best is trial 899 with value: 0.0017655460917727903.[0m
[32m[I 2022-11-08 03:16:55,121][0m Trial 976 finished with value: 0.00180353143566666 and parameters: {'nlayers': 23, 'hidden_size': 99, 'dropout': 0.15099665211480578, 'learning_rate': 0.002734791771901497, 'batch_size': 9822, 'optimizer_name': 'Adam'}. Best is trial 899 with value: 0.0017655460917727903.[0m
[32m[I 2022-11-08 03:17:17,448][0m Trial 977 finished with value: 0.0018441750205811717 and parameters: {'nlayers': 15, 'hidden_size': 104, 'dropout': 0.4265870901550201, 'learning_rate': 0.002343318748813583, 'batch_size': 9624, 'optimizer_name': 'Adam'}. Best is trial 899 with value: 0.0017655460917727903.[0m
[32m[I 2022-11-08 03:18:09,294][0m Trial 978 finished with value: 0.0017750560373067856 and parameters: {'nlayers': 97, 'hidden_size': 94, 'dropout': 0.4345036897370434, 'learning_rate': 0.0016432086481281227, 'batch_size': 10000, 'optimizer_name': 'Adam'}. Best is trial 899 with value: 0.0017655460917727903.[0m
[32m[I 2022-11-08 03:19:02,348][0m Trial 979 finished with value: 0.0018098956439596568 and parameters: {'nlayers': 39, 'hidden_size': 248, 'dropout': 0.38916344429263544, 'learning_rate': 0.0020966595795173615, 'batch_size': 9797, 'optimizer_name': 'Adam'}. Best is trial 899 with value: 0.0017655460917727903.[0m
[32m[I 2022-11-08 03:19:22,626][0m Trial 980 finished with value: 0.0018253749864512205 and parameters: {'nlayers': 12, 'hidden_size': 64, 'dropout': 0.11449960002273347, 'learning_rate': 0.0025689364460297626, 'batch_size': 9704, 'optimizer_name': 'Adam'}. Best is trial 899 with value: 0.0017655460917727903.[0m
[32m[I 2022-11-08 03:19:47,156][0m Trial 981 finished with value: 0.0017734623747109484 and parameters: {'nlayers': 17, 'hidden_size': 85, 'dropout': 0.12987317863570724, 'learning_rate': 0.0023091227671149556, 'batch_size': 9997, 'optimizer_name': 'Adam'}. Best is trial 899 with value: 0.0017655460917727903.[0m
[32m[I 2022-11-08 03:19:56,886][0m Trial 982 finished with value: 0.0030231682361650408 and parameters: {'nlayers': 19, 'hidden_size': 105, 'dropout': 0.4133502980659145, 'learning_rate': 0.0018344105428793806, 'batch_size': 5847, 'optimizer_name': 'Adam'}. Best is trial 899 with value: 0.0017655460917727903.[0m
[32m[I 2022-11-08 03:20:20,074][0m Trial 983 finished with value: 0.0018697382715404096 and parameters: {'nlayers': 27, 'hidden_size': 72, 'dropout': 0.15672777504607943, 'learning_rate': 0.0021303623820576587, 'batch_size': 9490, 'optimizer_name': 'Adam'}. Best is trial 899 with value: 0.0017655460917727903.[0m
[32m[I 2022-11-08 03:20:41,833][0m Trial 984 finished with value: 0.0018060977591881145 and parameters: {'nlayers': 13, 'hidden_size': 80, 'dropout': 0.422786860754852, 'learning_rate': 0.0029889275144808964, 'batch_size': 9811, 'optimizer_name': 'Adam'}. Best is trial 899 with value: 0.0017655460917727903.[0m
[32m[I 2022-11-08 03:21:07,125][0m Trial 985 finished with value: 0.0017747377712599253 and parameters: {'nlayers': 10, 'hidden_size': 175, 'dropout': 0.14490037879953407, 'learning_rate': 0.0027089654514388913, 'batch_size': 9998, 'optimizer_name': 'Adam'}. Best is trial 899 with value: 0.0017655460917727903.[0m
[32m[I 2022-11-08 03:21:28,357][0m Trial 986 finished with value: 0.0018341610798184177 and parameters: {'nlayers': 16, 'hidden_size': 42, 'dropout': 0.3040727439986316, 'learning_rate': 0.0024661204717876116, 'batch_size': 9660, 'optimizer_name': 'Adam'}. Best is trial 899 with value: 0.0017655460917727903.[0m
[32m[I 2022-11-08 03:22:03,860][0m Trial 987 finished with value: 0.0019100826601635027 and parameters: {'nlayers': 64, 'hidden_size': 98, 'dropout': 0.45190643807898145, 'learning_rate': 0.0017004354900573366, 'batch_size': 9232, 'optimizer_name': 'Adam'}. Best is trial 899 with value: 0.0017655460917727903.[0m
[32m[I 2022-11-08 03:22:32,887][0m Trial 988 finished with value: 0.0018071762830110137 and parameters: {'nlayers': 22, 'hidden_size': 147, 'dropout': 0.419157546497575, 'learning_rate': 0.002019925780134208, 'batch_size': 9810, 'optimizer_name': 'Adam'}. Best is trial 899 with value: 0.0017655460917727903.[0m
[32m[I 2022-11-08 03:22:58,341][0m Trial 989 finished with value: 0.00187150911023894 and parameters: {'nlayers': 25, 'hidden_size': 91, 'dropout': 0.13674951274304478, 'learning_rate': 0.002265568455992878, 'batch_size': 9469, 'optimizer_name': 'Adam'}. Best is trial 899 with value: 0.0017655460917727903.[0m
[32m[I 2022-11-08 03:23:31,827][0m Trial 990 finished with value: 0.0018106393130322257 and parameters: {'nlayers': 61, 'hidden_size': 59, 'dropout': 0.2755193661292582, 'learning_rate': 0.00670373982757127, 'batch_size': 9812, 'optimizer_name': 'Adam'}. Best is trial 899 with value: 0.0017655460917727903.[0m
[32m[I 2022-11-08 03:23:55,834][0m Trial 991 finished with value: 0.0018405036203052454 and parameters: {'nlayers': 19, 'hidden_size': 106, 'dropout': 0.15363934253154188, 'learning_rate': 0.0019756278998006404, 'batch_size': 9613, 'optimizer_name': 'Adam'}. Best is trial 899 with value: 0.0017655460917727903.[0m
[32m[I 2022-11-08 03:24:06,262][0m Trial 992 finished with value: 0.0031747808633138187 and parameters: {'nlayers': 12, 'hidden_size': 212, 'dropout': 0.4015531947765329, 'learning_rate': 0.0028441181837343932, 'batch_size': 5572, 'optimizer_name': 'Adam'}. Best is trial 899 with value: 0.0017655460917727903.[0m
[32m[I 2022-11-08 03:24:27,172][0m Trial 993 finished with value: 0.0017752859340780314 and parameters: {'nlayers': 7, 'hidden_size': 72, 'dropout': 0.4366680862911878, 'learning_rate': 0.0024289810041942432, 'batch_size': 9995, 'optimizer_name': 'RMSprop'}. Best is trial 899 with value: 0.0017655460917727903.[0m
[32m[I 2022-11-08 03:24:55,950][0m Trial 994 finished with value: 0.0018068324159944615 and parameters: {'nlayers': 15, 'hidden_size': 201, 'dropout': 0.1601566520240176, 'learning_rate': 0.002599042238940882, 'batch_size': 9820, 'optimizer_name': 'Adam'}. Best is trial 899 with value: 0.0017655460917727903.[0m
[32m[I 2022-11-08 03:25:20,893][0m Trial 995 finished with value: 0.0018332908832789851 and parameters: {'nlayers': 11, 'hidden_size': 188, 'dropout': 0.40835978503771964, 'learning_rate': 0.0015702029579671142, 'batch_size': 9656, 'optimizer_name': 'Adam'}. Best is trial 899 with value: 0.0017655460917727903.[0m
[32m[I 2022-11-08 03:25:44,617][0m Trial 996 finished with value: 0.0018036914267551148 and parameters: {'nlayers': 17, 'hidden_size': 87, 'dropout': 0.4254201303003847, 'learning_rate': 0.002208611471165922, 'batch_size': 9819, 'optimizer_name': 'Adam'}. Best is trial 899 with value: 0.0017655460917727903.[0m
[32m[I 2022-11-08 03:26:19,358][0m Trial 997 finished with value: 0.0019024184999789516 and parameters: {'nlayers': 37, 'hidden_size': 153, 'dropout': 0.12733728189474022, 'learning_rate': 0.009726211475430263, 'batch_size': 9343, 'optimizer_name': 'Adam'}. Best is trial 899 with value: 0.0017655460917727903.[0m
[32m[I 2022-11-08 03:26:42,590][0m Trial 998 finished with value: 0.0018017173947183056 and parameters: {'nlayers': 13, 'hidden_size': 95, 'dropout': 0.14865959432969314, 'learning_rate': 0.0019371600922191857, 'batch_size': 9831, 'optimizer_name': 'Adam'}. Best is trial 899 with value: 0.0017655460917727903.[0m
[32m[I 2022-11-08 03:27:08,572][0m Trial 999 finished with value: 0.0017703348330835157 and parameters: {'nlayers': 21, 'hidden_size': 101, 'dropout': 0.11479563212528775, 'learning_rate': 0.0017438879085236209, 'batch_size': 9997, 'optimizer_name': 'Adam'}. Best is trial 899 with value: 0.0017655460917727903.[0m
[32m[I 2022-11-08 03:27:29,348][0m Trial 1000 finished with value: 0.0018525812616896561 and parameters: {'nlayers': 9, 'hidden_size': 110, 'dropout': 0.4451598464153604, 'learning_rate': 0.0032255547024553468, 'batch_size': 9549, 'optimizer_name': 'Adam'}. Best is trial 899 with value: 0.0017655460917727903.[0m
[32m[I 2022-11-08 03:27:53,846][0m Trial 1001 finished with value: 0.0018384273390094695 and parameters: {'nlayers': 15, 'hidden_size': 140, 'dropout': 0.43120453694524113, 'learning_rate': 0.0023301146536128434, 'batch_size': 9646, 'optimizer_name': 'Adam'}. Best is trial 899 with value: 0.0017655460917727903.[0m
[32m[I 2022-11-08 03:28:18,094][0m Trial 1002 finished with value: 0.0018106807237593604 and parameters: {'nlayers': 19, 'hidden_size': 82, 'dropout': 0.10671225251204049, 'learning_rate': 0.007790455573128999, 'batch_size': 9804, 'optimizer_name': 'Adam'}. Best is trial 899 with value: 0.0017655460917727903.[0m
[32m[I 2022-11-08 03:28:44,642][0m Trial 1003 finished with value: 0.0018119984010052212 and parameters: {'nlayers': 14, 'hidden_size': 171, 'dropout': 0.1372944356026015, 'learning_rate': 0.0003976035498338803, 'batch_size': 9821, 'optimizer_name': 'Adam'}. Best is trial 899 with value: 0.0017655460917727903.[0m
[32m[I 2022-11-08 03:29:07,979][0m Trial 1004 finished with value: 0.0018527512902012666 and parameters: {'nlayers': 18, 'hidden_size': 98, 'dropout': 0.2934209719295666, 'learning_rate': 0.0026354366378766717, 'batch_size': 9546, 'optimizer_name': 'Adam'}. Best is trial 899 with value: 0.0017655460917727903.[0m
[32m[I 2022-11-08 03:29:30,049][0m Trial 1005 finished with value: 0.0018087054765245092 and parameters: {'nlayers': 11, 'hidden_size': 91, 'dropout': 0.41648084498294274, 'learning_rate': 0.002080410432913497, 'batch_size': 9821, 'optimizer_name': 'Adam'}. Best is trial 899 with value: 0.0017655460917727903.[0m
[32m[I 2022-11-08 03:29:52,095][0m Trial 1006 finished with value: 0.0018820805711287066 and parameters: {'nlayers': 17, 'hidden_size': 76, 'dropout': 0.25187630125512966, 'learning_rate': 0.002994727883994554, 'batch_size': 9409, 'optimizer_name': 'Adam'}. Best is trial 899 with value: 0.0017655460917727903.[0m
[32m[I 2022-11-08 03:30:24,820][0m Trial 1007 finished with value: 0.0018395397360460746 and parameters: {'nlayers': 39, 'hidden_size': 144, 'dropout': 0.15477057516775755, 'learning_rate': 0.00245910983464131, 'batch_size': 9650, 'optimizer_name': 'Adam'}. Best is trial 899 with value: 0.0017655460917727903.[0m
[32m[I 2022-11-08 03:30:46,728][0m Trial 1008 finished with value: 0.0017736351128491228 and parameters: {'nlayers': 8, 'hidden_size': 105, 'dropout': 0.16274718415565256, 'learning_rate': 0.002226725123846042, 'batch_size': 9991, 'optimizer_name': 'Adam'}. Best is trial 899 with value: 0.0017655460917727903.[0m
[32m[I 2022-11-08 03:31:39,284][0m Trial 1009 finished with value: 0.0017772510406230005 and parameters: {'nlayers': 62, 'hidden_size': 159, 'dropout': 0.39401950253080037, 'learning_rate': 0.0019022163353773081, 'batch_size': 9994, 'optimizer_name': 'Adam'}. Best is trial 899 with value: 0.0017655460917727903.[0m
[32m[I 2022-11-08 03:32:11,979][0m Trial 1010 finished with value: 0.0017756975219301945 and parameters: {'nlayers': 21, 'hidden_size': 181, 'dropout': 0.4407768705168197, 'learning_rate': 0.0017265508944411345, 'batch_size': 9999, 'optimizer_name': 'Adam'}. Best is trial 899 with value: 0.0017655460917727903.[0m
[32m[I 2022-11-08 03:32:35,063][0m Trial 1011 finished with value: 0.001771576902270317 and parameters: {'nlayers': 14, 'hidden_size': 68, 'dropout': 0.14214858317174223, 'learning_rate': 0.002778626998341094, 'batch_size': 10000, 'optimizer_name': 'Adam'}. Best is trial 899 with value: 0.0017655460917727903.[0m
[32m[I 2022-11-08 03:32:56,568][0m Trial 1012 finished with value: 0.001829719936677845 and parameters: {'nlayers': 11, 'hidden_size': 101, 'dropout': 0.4547073268941032, 'learning_rate': 0.0021147367984687515, 'batch_size': 9686, 'optimizer_name': 'Adam'}. Best is trial 899 with value: 0.0017655460917727903.[0m
[32m[I 2022-11-08 03:33:19,977][0m Trial 1013 finished with value: 0.001946234626706323 and parameters: {'nlayers': 23, 'hidden_size': 110, 'dropout': 0.42714921225915636, 'learning_rate': 0.002517833081191672, 'batch_size': 9133, 'optimizer_name': 'Adam'}. Best is trial 899 with value: 0.0017655460917727903.[0m
[32m[I 2022-11-08 03:33:43,272][0m Trial 1014 finished with value: 0.0018252419903357208 and parameters: {'nlayers': 16, 'hidden_size': 86, 'dropout': 0.14828542369164713, 'learning_rate': 0.0015384870032744587, 'batch_size': 9796, 'optimizer_name': 'RMSprop'}. Best is trial 899 with value: 0.0017655460917727903.[0m
[32m[I 2022-11-08 03:34:04,939][0m Trial 1015 finished with value: 0.0018573276643122068 and parameters: {'nlayers': 12, 'hidden_size': 93, 'dropout': 0.15892403939199196, 'learning_rate': 0.00235813926806423, 'batch_size': 9537, 'optimizer_name': 'Adam'}. Best is trial 899 with value: 0.0017655460917727903.[0m
[32m[I 2022-11-08 03:34:10,067][0m Trial 1016 finished with value: 0.004738013788013701 and parameters: {'nlayers': 20, 'hidden_size': 78, 'dropout': 0.12289649554007454, 'learning_rate': 0.0018845325367924817, 'batch_size': 3768, 'optimizer_name': 'Adam'}. Best is trial 899 with value: 0.0017655460917727903.[0m
[32m[I 2022-11-08 03:34:31,572][0m Trial 1017 finished with value: 0.001805263111426854 and parameters: {'nlayers': 6, 'hidden_size': 151, 'dropout': 0.4092595586950401, 'learning_rate': 0.002698766143022859, 'batch_size': 9813, 'optimizer_name': 'Adam'}. Best is trial 899 with value: 0.0017655460917727903.[0m
[32m[I 2022-11-08 03:34:51,394][0m Trial 1018 finished with value: 0.0018315352868630214 and parameters: {'nlayers': 9, 'hidden_size': 50, 'dropout': 0.4352682000977614, 'learning_rate': 0.0020954353915605497, 'batch_size': 9688, 'optimizer_name': 'Adam'}. Best is trial 899 with value: 0.0017655460917727903.[0m
[32m[I 2022-11-08 03:35:20,870][0m Trial 1019 finished with value: 0.0019009243375679103 and parameters: {'nlayers': 41, 'hidden_size': 99, 'dropout': 0.13295406273146446, 'learning_rate': 0.0033419021209281268, 'batch_size': 9335, 'optimizer_name': 'Adam'}. Best is trial 899 with value: 0.0017655460917727903.[0m
[32m[I 2022-11-08 03:35:24,732][0m Trial 1020 finished with value: 0.008790963787143514 and parameters: {'nlayers': 14, 'hidden_size': 195, 'dropout': 0.41632034685888997, 'learning_rate': 0.0022252933619893154, 'batch_size': 2006, 'optimizer_name': 'Adam'}. Best is trial 899 with value: 0.0017655460917727903.[0m
[32m[I 2022-11-08 03:35:49,658][0m Trial 1021 finished with value: 0.0017692111551761626 and parameters: {'nlayers': 17, 'hidden_size': 89, 'dropout': 0.15201740477254017, 'learning_rate': 0.0024586443105586277, 'batch_size': 10000, 'optimizer_name': 'Adam'}. Best is trial 899 with value: 0.0017655460917727903.[0m
[32m[I 2022-11-08 03:36:18,769][0m Trial 1022 finished with value: 0.0017767893642187118 and parameters: {'nlayers': 33, 'hidden_size': 84, 'dropout': 0.15206021732136857, 'learning_rate': 0.0030885669454176878, 'batch_size': 10000, 'optimizer_name': 'Adam'}. Best is trial 899 with value: 0.0017655460917727903.[0m
[32m[I 2022-11-08 03:36:25,952][0m Trial 1023 finished with value: 0.010213992032300374 and parameters: {'nlayers': 60, 'hidden_size': 74, 'dropout': 0.1488661987403616, 'learning_rate': 0.002741318059276491, 'batch_size': 1733, 'optimizer_name': 'Adam'}. Best is trial 899 with value: 0.0017655460917727903.[0m
[32m[I 2022-11-08 03:36:27,623][0m Trial 1024 finished with value: 0.013626154754068944 and parameters: {'nlayers': 13, 'hidden_size': 88, 'dropout': 0.14020738623537446, 'learning_rate': 0.0029690568688269196, 'batch_size': 1309, 'optimizer_name': 'Adam'}. Best is trial 899 with value: 0.0017655460917727903.[0m
[32m[I 2022-11-08 03:37:05,259][0m Trial 1025 finished with value: 0.0018042419559793894 and parameters: {'nlayers': 65, 'hidden_size': 81, 'dropout': 0.16317955811555618, 'learning_rate': 0.0025953474174420536, 'batch_size': 9805, 'optimizer_name': 'Adam'}. Best is trial 899 with value: 0.0017655460917727903.[0m
[32m[I 2022-11-08 03:37:28,382][0m Trial 1026 finished with value: 0.0018373464707569823 and parameters: {'nlayers': 16, 'hidden_size': 90, 'dropout': 0.15814823037593786, 'learning_rate': 0.002837869451406753, 'batch_size': 9632, 'optimizer_name': 'Adam'}. Best is trial 899 with value: 0.0017655460917727903.[0m
[32m[I 2022-11-08 03:37:49,173][0m Trial 1027 finished with value: 0.0018051055786699247 and parameters: {'nlayers': 10, 'hidden_size': 60, 'dropout': 0.14486923668992202, 'learning_rate': 0.005628405318915077, 'batch_size': 9819, 'optimizer_name': 'Adam'}. Best is trial 899 with value: 0.0017655460917727903.[0m
[32m[I 2022-11-08 03:38:14,676][0m Trial 1028 finished with value: 0.001857153151139795 and parameters: {'nlayers': 15, 'hidden_size': 164, 'dropout': 0.1528158217269817, 'learning_rate': 0.0024876694059328005, 'batch_size': 9538, 'optimizer_name': 'Adam'}. Best is trial 899 with value: 0.0017655460917727903.[0m
[32m[I 2022-11-08 03:38:38,450][0m Trial 1029 finished with value: 0.0018065495161705644 and parameters: {'nlayers': 12, 'hidden_size': 141, 'dropout': 0.16558724805423877, 'learning_rate': 0.002470255697770922, 'batch_size': 9817, 'optimizer_name': 'Adam'}. Best is trial 899 with value: 0.0017655460917727903.[0m
[32m[I 2022-11-08 03:39:00,724][0m Trial 1030 finished with value: 0.001878779772465908 and parameters: {'nlayers': 16, 'hidden_size': 79, 'dropout': 0.13780858200574336, 'learning_rate': 0.0026155768167016743, 'batch_size': 9443, 'optimizer_name': 'Adam'}. Best is trial 899 with value: 0.0017655460917727903.[0m
[32m[I 2022-11-08 03:39:22,634][0m Trial 1031 finished with value: 0.0018282712201400514 and parameters: {'nlayers': 14, 'hidden_size': 84, 'dropout': 0.15322658983462809, 'learning_rate': 0.0023555458556836334, 'batch_size': 9684, 'optimizer_name': 'Adam'}. Best is trial 899 with value: 0.0017655460917727903.[0m
[32m[I 2022-11-08 03:40:34,634][0m Trial 1032 finished with value: 0.0017728507876467719 and parameters: {'nlayers': 70, 'hidden_size': 207, 'dropout': 0.14625211225924334, 'learning_rate': 0.0028945716674204022, 'batch_size': 9998, 'optimizer_name': 'Adam'}. Best is trial 899 with value: 0.0017655460917727903.[0m
[32m[I 2022-11-08 03:41:24,064][0m Trial 1033 finished with value: 0.0018055434746125016 and parameters: {'nlayers': 58, 'hidden_size': 176, 'dropout': 0.16177179914461928, 'learning_rate': 0.002638716903876018, 'batch_size': 9819, 'optimizer_name': 'Adam'}. Best is trial 899 with value: 0.0017655460917727903.[0m
[32m[I 2022-11-08 03:41:48,258][0m Trial 1034 finished with value: 0.0017783644646689324 and parameters: {'nlayers': 18, 'hidden_size': 66, 'dropout': 0.1291226722169769, 'learning_rate': 0.002368507814173616, 'batch_size': 9999, 'optimizer_name': 'Adam'}. Best is trial 899 with value: 0.0017655460917727903.[0m
