[32m[I 2022-11-07 20:49:25,650][0m Trial 207 finished with value: 0.00180772466424972 and parameters: {'nlayers': 14, 'hidden_size': 107, 'dropout': 0.15075357543250625, 'learning_rate': 0.002706590968135208, 'batch_size': 9798, 'optimizer_name': 'Adam'}. Best is trial 195 with value: 0.001767993638185369.[0m
[32m[I 2022-11-07 20:49:49,380][0m Trial 208 finished with value: 0.0017728414695771797 and parameters: {'nlayers': 18, 'hidden_size': 112, 'dropout': 0.18172867020402667, 'learning_rate': 0.0014394786153308237, 'batch_size': 9998, 'optimizer_name': 'Adam'}. Best is trial 195 with value: 0.001767993638185369.[0m
[32m[I 2022-11-07 20:50:11,374][0m Trial 209 finished with value: 0.0018607876258690985 and parameters: {'nlayers': 18, 'hidden_size': 104, 'dropout': 0.49933902923484275, 'learning_rate': 0.0013334625924685936, 'batch_size': 9566, 'optimizer_name': 'Adam'}. Best is trial 195 with value: 0.001767993638185369.[0m
[32m[I 2022-11-07 20:50:34,531][0m Trial 210 finished with value: 0.0018064816176611607 and parameters: {'nlayers': 16, 'hidden_size': 110, 'dropout': 0.17874667769164515, 'learning_rate': 0.001550967664562605, 'batch_size': 9802, 'optimizer_name': 'Adam'}. Best is trial 195 with value: 0.001767993638185369.[0m
[32m[I 2022-11-07 20:50:58,750][0m Trial 211 finished with value: 0.0017771093998469325 and parameters: {'nlayers': 14, 'hidden_size': 115, 'dropout': 0.20244430644758876, 'learning_rate': 0.0012120390849244087, 'batch_size': 9982, 'optimizer_name': 'Adam'}. Best is trial 195 with value: 0.001767993638185369.[0m
[32m[I 2022-11-07 20:51:24,253][0m Trial 212 finished with value: 0.0018103503951051483 and parameters: {'nlayers': 20, 'hidden_size': 127, 'dropout': 0.18246221056175554, 'learning_rate': 0.0018038764653947404, 'batch_size': 9802, 'optimizer_name': 'Adam'}. Best is trial 195 with value: 0.001767993638185369.[0m
[32m[I 2022-11-07 20:51:58,313][0m Trial 213 finished with value: 0.0017741614333666802 and parameters: {'nlayers': 43, 'hidden_size': 119, 'dropout': 0.16564673494367288, 'learning_rate': 0.0006323340404788528, 'batch_size': 9987, 'optimizer_name': 'RMSprop'}. Best is trial 195 with value: 0.001767993638185369.[0m
[32m[I 2022-11-07 20:52:31,902][0m Trial 214 finished with value: 0.0017716801946397137 and parameters: {'nlayers': 42, 'hidden_size': 117, 'dropout': 0.16548607592719192, 'learning_rate': 0.0008960183622137511, 'batch_size': 9997, 'optimizer_name': 'Adam'}. Best is trial 195 with value: 0.001767993638185369.[0m
[32m[I 2022-11-07 20:52:54,546][0m Trial 215 finished with value: 0.0018365469214978959 and parameters: {'nlayers': 13, 'hidden_size': 123, 'dropout': 0.15956782196579694, 'learning_rate': 0.0007686343024004057, 'batch_size': 9654, 'optimizer_name': 'Adam'}. Best is trial 195 with value: 0.001767993638185369.[0m
[32m[I 2022-11-07 20:53:18,391][0m Trial 216 finished with value: 0.001851038492535889 and parameters: {'nlayers': 18, 'hidden_size': 117, 'dropout': 0.17316930528313212, 'learning_rate': 0.00021737096945272528, 'batch_size': 9596, 'optimizer_name': 'Adam'}. Best is trial 195 with value: 0.001767993638185369.[0m
[32m[I 2022-11-07 20:53:48,268][0m Trial 217 finished with value: 0.0017778330724175918 and parameters: {'nlayers': 42, 'hidden_size': 112, 'dropout': 0.1391370818985962, 'learning_rate': 0.0006032862477537337, 'batch_size': 9998, 'optimizer_name': 'RMSprop'}. Best is trial 195 with value: 0.001767993638185369.[0m
[32m[I 2022-11-07 20:54:52,389][0m Trial 218 finished with value: 0.0018145739819213648 and parameters: {'nlayers': 67, 'hidden_size': 197, 'dropout': 0.15524927462695362, 'learning_rate': 0.00041756343086914036, 'batch_size': 9795, 'optimizer_name': 'Adam'}. Best is trial 195 with value: 0.001767993638185369.[0m
[32m[I 2022-11-07 20:55:26,065][0m Trial 219 finished with value: 0.0018787005005887 and parameters: {'nlayers': 49, 'hidden_size': 119, 'dropout': 0.16608576459591542, 'learning_rate': 0.001013284872615859, 'batch_size': 9459, 'optimizer_name': 'Adam'}. Best is trial 195 with value: 0.001767993638185369.[0m
[32m[I 2022-11-07 20:56:13,712][0m Trial 220 finished with value: 0.0018048405537900362 and parameters: {'nlayers': 45, 'hidden_size': 191, 'dropout': 0.1484535244910451, 'learning_rate': 0.000916890269152345, 'batch_size': 9809, 'optimizer_name': 'Adam'}. Best is trial 195 with value: 0.001767993638185369.[0m
[32m[I 2022-11-07 20:56:45,552][0m Trial 221 finished with value: 0.001801566424349019 and parameters: {'nlayers': 43, 'hidden_size': 107, 'dropout': 0.16379682278822202, 'learning_rate': 0.000555231340418643, 'batch_size': 9861, 'optimizer_name': 'Adam'}. Best is trial 195 with value: 0.001767993638185369.[0m
[32m[I 2022-11-07 20:57:15,102][0m Trial 222 finished with value: 0.0017685758716919843 and parameters: {'nlayers': 40, 'hidden_size': 112, 'dropout': 0.17140629812194758, 'learning_rate': 0.0007813702999595575, 'batch_size': 9996, 'optimizer_name': 'Adam'}. Best is trial 195 with value: 0.001767993638185369.[0m
[32m[I 2022-11-07 20:57:45,039][0m Trial 223 finished with value: 0.0018356428861544083 and parameters: {'nlayers': 40, 'hidden_size': 95, 'dropout': 0.1758450410932421, 'learning_rate': 0.0008009314005833351, 'batch_size': 9671, 'optimizer_name': 'Adam'}. Best is trial 195 with value: 0.001767993638185369.[0m
[32m[I 2022-11-07 20:58:19,101][0m Trial 224 finished with value: 0.0017742503598918782 and parameters: {'nlayers': 41, 'hidden_size': 126, 'dropout': 0.18512529032684755, 'learning_rate': 0.0011291821230756949, 'batch_size': 9987, 'optimizer_name': 'Adam'}. Best is trial 195 with value: 0.001767993638185369.[0m
[32m[I 2022-11-07 20:58:40,560][0m Trial 225 finished with value: 0.001807398075111541 and parameters: {'nlayers': 10, 'hidden_size': 113, 'dropout': 0.16948933176218586, 'learning_rate': 0.001411043681656299, 'batch_size': 9805, 'optimizer_name': 'Adam'}. Best is trial 195 with value: 0.001767993638185369.[0m
[32m[I 2022-11-07 20:59:04,447][0m Trial 226 finished with value: 0.001839348958166698 and parameters: {'nlayers': 17, 'hidden_size': 121, 'dropout': 0.15703948035414272, 'learning_rate': 0.0006991638207787245, 'batch_size': 9653, 'optimizer_name': 'Adam'}. Best is trial 195 with value: 0.001767993638185369.[0m
[32m[I 2022-11-07 20:59:40,277][0m Trial 227 finished with value: 0.0017984847466328857 and parameters: {'nlayers': 46, 'hidden_size': 129, 'dropout': 0.14529418229257365, 'learning_rate': 0.0009870401577246897, 'batch_size': 9826, 'optimizer_name': 'RMSprop'}. Best is trial 195 with value: 0.001767993638185369.[0m
[32m[I 2022-11-07 21:00:09,757][0m Trial 228 finished with value: 0.0017727932540148338 and parameters: {'nlayers': 39, 'hidden_size': 112, 'dropout': 0.13757490404640474, 'learning_rate': 0.001210093148495378, 'batch_size': 9987, 'optimizer_name': 'Adam'}. Best is trial 195 with value: 0.001767993638185369.[0m
[32m[I 2022-11-07 21:00:48,409][0m Trial 229 finished with value: 0.0018624296094871752 and parameters: {'nlayers': 36, 'hidden_size': 181, 'dropout': 0.12779895994152204, 'learning_rate': 0.0014073009017233945, 'batch_size': 9513, 'optimizer_name': 'Adam'}. Best is trial 195 with value: 0.001767993638185369.[0m
[32m[I 2022-11-07 21:01:17,946][0m Trial 230 finished with value: 0.0018346140566952028 and parameters: {'nlayers': 39, 'hidden_size': 101, 'dropout': 0.2873556480482758, 'learning_rate': 0.0011916776139428964, 'batch_size': 9653, 'optimizer_name': 'Adam'}. Best is trial 195 with value: 0.001767993638185369.[0m
[32m[I 2022-11-07 21:01:50,741][0m Trial 231 finished with value: 0.0017778719160812199 and parameters: {'nlayers': 42, 'hidden_size': 111, 'dropout': 0.1348760445505528, 'learning_rate': 0.0008545137379460134, 'batch_size': 9979, 'optimizer_name': 'Adam'}. Best is trial 195 with value: 0.001767993638185369.[0m
[32m[I 2022-11-07 21:02:15,286][0m Trial 232 finished with value: 0.0017795519094576078 and parameters: {'nlayers': 15, 'hidden_size': 115, 'dropout': 0.14078619165348036, 'learning_rate': 0.0012018581605699901, 'batch_size': 9982, 'optimizer_name': 'Adam'}. Best is trial 195 with value: 0.001767993638185369.[0m
[32m[I 2022-11-07 21:02:48,030][0m Trial 233 finished with value: 0.001801905689888808 and parameters: {'nlayers': 40, 'hidden_size': 123, 'dropout': 0.15023302835973915, 'learning_rate': 0.007121734997606124, 'batch_size': 9826, 'optimizer_name': 'Adam'}. Best is trial 195 with value: 0.001767993638185369.[0m
[32m[I 2022-11-07 21:03:34,692][0m Trial 234 finished with value: 0.0017746786872963403 and parameters: {'nlayers': 43, 'hidden_size': 187, 'dropout': 0.17167970513346764, 'learning_rate': 0.0002631644207273156, 'batch_size': 9993, 'optimizer_name': 'Adam'}. Best is trial 195 with value: 0.001767993638185369.[0m
[32m[I 2022-11-07 21:04:10,414][0m Trial 235 finished with value: 0.0017741879451462087 and parameters: {'nlayers': 52, 'hidden_size': 109, 'dropout': 0.16020904317344453, 'learning_rate': 0.0016733473281347036, 'batch_size': 9997, 'optimizer_name': 'Adam'}. Best is trial 195 with value: 0.001767993638185369.[0m
[32m[I 2022-11-07 21:05:01,274][0m Trial 236 finished with value: 0.001821749219298669 and parameters: {'nlayers': 48, 'hidden_size': 204, 'dropout': 0.18060072990424447, 'learning_rate': 0.0005832907934022024, 'batch_size': 9733, 'optimizer_name': 'Adam'}. Best is trial 195 with value: 0.001767993638185369.[0m
[32m[I 2022-11-07 21:05:36,189][0m Trial 237 finished with value: 0.0017780412644147873 and parameters: {'nlayers': 45, 'hidden_size': 119, 'dropout': 0.42693568695074113, 'learning_rate': 0.0019852100458141297, 'batch_size': 10000, 'optimizer_name': 'Adam'}. Best is trial 195 with value: 0.001767993638185369.[0m
[32m[I 2022-11-07 21:06:00,484][0m Trial 238 finished with value: 0.0018158256915974602 and parameters: {'nlayers': 21, 'hidden_size': 101, 'dropout': 0.13554044915825486, 'learning_rate': 0.0074277273905906036, 'batch_size': 9758, 'optimizer_name': 'RMSprop'}. Best is trial 195 with value: 0.001767993638185369.[0m
[32m[I 2022-11-07 21:06:34,296][0m Trial 239 finished with value: 0.0018561551756848327 and parameters: {'nlayers': 41, 'hidden_size': 135, 'dropout': 0.14973463849874075, 'learning_rate': 0.00898804612974333, 'batch_size': 9539, 'optimizer_name': 'Adam'}. Best is trial 195 with value: 0.001767993638185369.[0m
[32m[I 2022-11-07 21:07:24,175][0m Trial 240 finished with value: 0.0018131313418477185 and parameters: {'nlayers': 55, 'hidden_size': 175, 'dropout': 0.1565603399598545, 'learning_rate': 0.0013981732827043434, 'batch_size': 9814, 'optimizer_name': 'Adam'}. Best is trial 195 with value: 0.001767993638185369.[0m
[32m[I 2022-11-07 21:07:58,080][0m Trial 241 finished with value: 0.0017967109517700085 and parameters: {'nlayers': 49, 'hidden_size': 107, 'dropout': 0.1631809982842684, 'learning_rate': 0.0017176460443719128, 'batch_size': 9861, 'optimizer_name': 'Adam'}. Best is trial 195 with value: 0.001767993638185369.[0m
[32m[I 2022-11-07 21:08:33,734][0m Trial 242 finished with value: 0.001774637322519845 and parameters: {'nlayers': 51, 'hidden_size': 111, 'dropout': 0.16135080430846221, 'learning_rate': 0.005627791230331559, 'batch_size': 9993, 'optimizer_name': 'Adam'}. Best is trial 195 with value: 0.001767993638185369.[0m
[32m[I 2022-11-07 21:09:10,285][0m Trial 243 finished with value: 0.0018130713852269338 and parameters: {'nlayers': 53, 'hidden_size': 117, 'dropout': 0.1732510219502424, 'learning_rate': 0.0015849328941802167, 'batch_size': 9788, 'optimizer_name': 'Adam'}. Best is trial 195 with value: 0.001767993638185369.[0m
[32m[I 2022-11-07 21:09:42,747][0m Trial 244 finished with value: 0.0017698311291573154 and parameters: {'nlayers': 52, 'hidden_size': 96, 'dropout': 0.15467795722186178, 'learning_rate': 0.0009767527273636934, 'batch_size': 9993, 'optimizer_name': 'Adam'}. Best is trial 195 with value: 0.001767993638185369.[0m
[32m[I 2022-11-07 21:10:06,102][0m Trial 245 finished with value: 0.001776320743560791 and parameters: {'nlayers': 14, 'hidden_size': 95, 'dropout': 0.1438760087159659, 'learning_rate': 0.0010015123575678778, 'batch_size': 10000, 'optimizer_name': 'Adam'}. Best is trial 195 with value: 0.001767993638185369.[0m
[32m[I 2022-11-07 21:10:28,739][0m Trial 246 finished with value: 0.001841054346043798 and parameters: {'nlayers': 17, 'hidden_size': 99, 'dropout': 0.12919517334642258, 'learning_rate': 0.001107352540030613, 'batch_size': 9631, 'optimizer_name': 'Adam'}. Best is trial 195 with value: 0.001767993638185369.[0m
[32m[I 2022-11-07 21:10:58,534][0m Trial 247 finished with value: 0.0018134453107633858 and parameters: {'nlayers': 38, 'hidden_size': 91, 'dropout': 0.151092831254558, 'learning_rate': 0.0008211245796017322, 'batch_size': 9775, 'optimizer_name': 'Adam'}. Best is trial 195 with value: 0.001767993638185369.[0m
[32m[I 2022-11-07 21:11:22,486][0m Trial 248 finished with value: 0.0017715545803767534 and parameters: {'nlayers': 19, 'hidden_size': 104, 'dropout': 0.1673252162980256, 'learning_rate': 0.00251617492398787, 'batch_size': 9998, 'optimizer_name': 'Adam'}. Best is trial 195 with value: 0.001767993638185369.[0m
[32m[I 2022-11-07 21:11:45,410][0m Trial 249 finished with value: 0.0018429819023276961 and parameters: {'nlayers': 19, 'hidden_size': 104, 'dropout': 0.11870593692944133, 'learning_rate': 0.0024947631862423307, 'batch_size': 9653, 'optimizer_name': 'Adam'}. Best is trial 195 with value: 0.001767993638185369.[0m
[32m[I 2022-11-07 21:12:12,676][0m Trial 250 finished with value: 0.0018035530904303217 and parameters: {'nlayers': 22, 'hidden_size': 152, 'dropout': 0.14104196845752398, 'learning_rate': 0.006282289186047031, 'batch_size': 9813, 'optimizer_name': 'Adam'}. Best is trial 195 with value: 0.001767993638185369.[0m
[32m[I 2022-11-07 21:12:40,910][0m Trial 251 finished with value: 0.0018766856466964062 and parameters: {'nlayers': 19, 'hidden_size': 185, 'dropout': 0.18954750515502722, 'learning_rate': 0.002155746753937182, 'batch_size': 9461, 'optimizer_name': 'Adam'}. Best is trial 195 with value: 0.001767993638185369.[0m
[32m[I 2022-11-07 21:13:03,663][0m Trial 252 finished with value: 0.0018099621964133192 and parameters: {'nlayers': 15, 'hidden_size': 94, 'dropout': 0.17473069909004704, 'learning_rate': 0.002579393294066558, 'batch_size': 9805, 'optimizer_name': 'Adam'}. Best is trial 195 with value: 0.001767993638185369.[0m
[32m[I 2022-11-07 21:13:37,507][0m Trial 253 finished with value: 0.001777898583940082 and parameters: {'nlayers': 56, 'hidden_size': 104, 'dropout': 0.15715660601152381, 'learning_rate': 0.00990789395127864, 'batch_size': 9999, 'optimizer_name': 'Adam'}. Best is trial 195 with value: 0.001767993638185369.[0m
[32m[I 2022-11-07 21:14:01,196][0m Trial 254 finished with value: 0.0018388936978881853 and parameters: {'nlayers': 12, 'hidden_size': 165, 'dropout': 0.13392128773283613, 'learning_rate': 0.0013091098860314536, 'batch_size': 9630, 'optimizer_name': 'Adam'}. Best is trial 195 with value: 0.001767993638185369.[0m
[32m[I 2022-11-07 21:14:21,781][0m Trial 255 finished with value: 0.0018090395472126937 and parameters: {'nlayers': 8, 'hidden_size': 79, 'dropout': 0.18153831777523402, 'learning_rate': 0.0024340745067224787, 'batch_size': 9787, 'optimizer_name': 'Adam'}. Best is trial 195 with value: 0.001767993638185369.[0m
[32m[I 2022-11-07 21:14:45,661][0m Trial 256 finished with value: 0.00177891665995121 and parameters: {'nlayers': 17, 'hidden_size': 97, 'dropout': 0.16723644515759878, 'learning_rate': 0.002206800244982286, 'batch_size': 10000, 'optimizer_name': 'Adam'}. Best is trial 195 with value: 0.001767993638185369.[0m
[32m[I 2022-11-07 21:14:57,345][0m Trial 257 finished with value: 0.003849292800261181 and parameters: {'nlayers': 34, 'hidden_size': 147, 'dropout': 0.3188545136741412, 'learning_rate': 0.001910032700791409, 'batch_size': 4601, 'optimizer_name': 'Adam'}. Best is trial 195 with value: 0.001767993638185369.[0m
[32m[I 2022-11-07 21:15:34,129][0m Trial 258 finished with value: 0.0019063217282883473 and parameters: {'nlayers': 46, 'hidden_size': 156, 'dropout': 0.15026741096254673, 'learning_rate': 0.0029654106077786914, 'batch_size': 9322, 'optimizer_name': 'Adam'}. Best is trial 195 with value: 0.001767993638185369.[0m
[32m[I 2022-11-07 21:16:06,412][0m Trial 259 finished with value: 0.0018470798321902162 and parameters: {'nlayers': 23, 'hidden_size': 193, 'dropout': 0.1229141554645112, 'learning_rate': 0.001017303599140222, 'batch_size': 9605, 'optimizer_name': 'Adam'}. Best is trial 195 with value: 0.001767993638185369.[0m
[32m[I 2022-11-07 21:16:37,818][0m Trial 260 finished with value: 0.0018097116284886748 and parameters: {'nlayers': 50, 'hidden_size': 112, 'dropout': 0.19622930471687772, 'learning_rate': 0.00515462830553523, 'batch_size': 9817, 'optimizer_name': 'Adam'}. Best is trial 195 with value: 0.001767993638185369.[0m
[32m[I 2022-11-07 21:17:09,589][0m Trial 261 finished with value: 0.0018364477457995733 and parameters: {'nlayers': 26, 'hidden_size': 170, 'dropout': 0.14192775257941748, 'learning_rate': 0.002723475224210689, 'batch_size': 9643, 'optimizer_name': 'Adam'}. Best is trial 195 with value: 0.001767993638185369.[0m
[32m[I 2022-11-07 21:17:17,037][0m Trial 262 finished with value: 0.00515086166031704 and parameters: {'nlayers': 20, 'hidden_size': 199, 'dropout': 0.15534831525400702, 'learning_rate': 0.002583821680289807, 'batch_size': 3451, 'optimizer_name': 'Adam'}. Best is trial 195 with value: 0.001767993638185369.[0m
[32m[I 2022-11-07 21:17:52,260][0m Trial 263 finished with value: 0.0018085901869938493 and parameters: {'nlayers': 54, 'hidden_size': 107, 'dropout': 0.17154419439597973, 'learning_rate': 0.00234566358418379, 'batch_size': 9790, 'optimizer_name': 'Adam'}. Best is trial 195 with value: 0.001767993638185369.[0m
[32m[I 2022-11-07 21:18:12,926][0m Trial 264 finished with value: 0.0018797771613593582 and parameters: {'nlayers': 13, 'hidden_size': 101, 'dropout': 0.1073458095953373, 'learning_rate': 0.008029131248518732, 'batch_size': 9451, 'optimizer_name': 'Adam'}. Best is trial 195 with value: 0.001767993638185369.[0m
[32m[I 2022-11-07 21:18:40,452][0m Trial 265 finished with value: 0.0018089926862964244 and parameters: {'nlayers': 16, 'hidden_size': 178, 'dropout': 0.16367168425135864, 'learning_rate': 0.0013126089618816863, 'batch_size': 9823, 'optimizer_name': 'Adam'}. Best is trial 195 with value: 0.001767993638185369.[0m
[32m[I 2022-11-07 21:19:23,086][0m Trial 266 finished with value: 0.001800715098583343 and parameters: {'nlayers': 47, 'hidden_size': 162, 'dropout': 0.14739159011110708, 'learning_rate': 0.002021735701649265, 'batch_size': 9829, 'optimizer_name': 'Adam'}. Best is trial 195 with value: 0.001767993638185369.[0m
[32m[I 2022-11-07 21:19:43,980][0m Trial 267 finished with value: 0.0018452520384615947 and parameters: {'nlayers': 11, 'hidden_size': 111, 'dropout': 0.177157526717345, 'learning_rate': 0.004435765041006508, 'batch_size': 9616, 'optimizer_name': 'Adam'}. Best is trial 195 with value: 0.001767993638185369.[0m
[32m[I 2022-11-07 21:20:19,855][0m Trial 268 finished with value: 0.001777121742952217 and parameters: {'nlayers': 40, 'hidden_size': 138, 'dropout': 0.18736617503321357, 'learning_rate': 0.0015759676475017395, 'batch_size': 9991, 'optimizer_name': 'Adam'}. Best is trial 195 with value: 0.001767993638185369.[0m
[32m[I 2022-11-07 21:21:01,286][0m Trial 269 finished with value: 0.0017707426147936152 and parameters: {'nlayers': 59, 'hidden_size': 127, 'dropout': 0.13538988795848128, 'learning_rate': 0.002848994851475681, 'batch_size': 9994, 'optimizer_name': 'Adam'}. Best is trial 195 with value: 0.001767993638185369.[0m
[32m[I 2022-11-07 21:21:20,992][0m Trial 270 finished with value: 0.002315356354292408 and parameters: {'nlayers': 30, 'hidden_size': 132, 'dropout': 0.12879171550574006, 'learning_rate': 0.003015610071249851, 'batch_size': 7656, 'optimizer_name': 'Adam'}. Best is trial 195 with value: 0.001767993638185369.[0m
[32m[I 2022-11-07 21:21:44,211][0m Trial 271 finished with value: 0.0018665781869046149 and parameters: {'nlayers': 18, 'hidden_size': 124, 'dropout': 0.135214896144522, 'learning_rate': 0.0027708920362121657, 'batch_size': 9501, 'optimizer_name': 'Adam'}. Best is trial 195 with value: 0.001767993638185369.[0m
[32m[I 2022-11-07 21:22:28,820][0m Trial 272 finished with value: 0.0017738727872826758 and parameters: {'nlayers': 63, 'hidden_size': 133, 'dropout': 0.11566218637811314, 'learning_rate': 0.0028550082135682356, 'batch_size': 9996, 'optimizer_name': 'Adam'}. Best is trial 195 with value: 0.001767993638185369.[0m
[32m[I 2022-11-07 21:23:03,951][0m Trial 273 finished with value: 0.0019089498148436126 and parameters: {'nlayers': 59, 'hidden_size': 116, 'dropout': 0.15683667963509954, 'learning_rate': 0.002603311612823709, 'batch_size': 9281, 'optimizer_name': 'Adam'}. Best is trial 195 with value: 0.001767993638185369.[0m
[32m[I 2022-11-07 21:23:44,797][0m Trial 274 finished with value: 0.0018266807175204396 and parameters: {'nlayers': 63, 'hidden_size': 126, 'dropout': 0.16454129646975732, 'learning_rate': 0.0031684568207266096, 'batch_size': 9687, 'optimizer_name': 'Adam'}. Best is trial 195 with value: 0.001767993638185369.[0m
[32m[I 2022-11-07 21:24:30,736][0m Trial 275 finished with value: 0.0018063908887679832 and parameters: {'nlayers': 66, 'hidden_size': 141, 'dropout': 0.13818984152024172, 'learning_rate': 0.0023825719468266674, 'batch_size': 9811, 'optimizer_name': 'Adam'}. Best is trial 195 with value: 0.001767993638185369.[0m
