[32m[I 2022-11-08 05:11:04,157][0m Trial 1173 finished with value: 0.0018410801062083452 and parameters: {'nlayers': 66, 'hidden_size': 134, 'dropout': 0.1124150874185143, 'learning_rate': 0.0023359464978945387, 'batch_size': 9604, 'optimizer_name': 'Adam'}. Best is trial 899 with value: 0.0017655460917727903.[0m
[32m[I 2022-11-08 05:11:28,695][0m Trial 1174 finished with value: 0.001809246057497935 and parameters: {'nlayers': 11, 'hidden_size': 164, 'dropout': 0.1479644251815234, 'learning_rate': 0.002676402208320758, 'batch_size': 9812, 'optimizer_name': 'Adam'}. Best is trial 899 with value: 0.0017655460917727903.[0m
[32m[I 2022-11-08 05:11:52,191][0m Trial 1175 finished with value: 0.0018320059398391532 and parameters: {'nlayers': 13, 'hidden_size': 142, 'dropout': 0.1650434455041323, 'learning_rate': 0.002952683004080263, 'batch_size': 9684, 'optimizer_name': 'Adam'}. Best is trial 899 with value: 0.0017655460917727903.[0m
[32m[I 2022-11-08 05:12:24,136][0m Trial 1176 finished with value: 0.0017771046181927327 and parameters: {'nlayers': 71, 'hidden_size': 56, 'dropout': 0.13336505001796217, 'learning_rate': 0.0023145065179076135, 'batch_size': 9995, 'optimizer_name': 'Adam'}. Best is trial 899 with value: 0.0017655460917727903.[0m
[32m[I 2022-11-08 05:12:55,021][0m Trial 1177 finished with value: 0.0018257755090331637 and parameters: {'nlayers': 15, 'hidden_size': 252, 'dropout': 0.1564999350416993, 'learning_rate': 0.0025371811319815298, 'batch_size': 9690, 'optimizer_name': 'Adam'}. Best is trial 899 with value: 0.0017655460917727903.[0m
[32m[I 2022-11-08 05:13:34,147][0m Trial 1178 finished with value: 0.0018782158073644747 and parameters: {'nlayers': 70, 'hidden_size': 108, 'dropout': 0.1789080592162307, 'learning_rate': 0.0022055930228610547, 'batch_size': 9404, 'optimizer_name': 'Adam'}. Best is trial 899 with value: 0.0017655460917727903.[0m
[32m[I 2022-11-08 05:13:57,135][0m Trial 1179 finished with value: 0.0018120832150596196 and parameters: {'nlayers': 18, 'hidden_size': 60, 'dropout': 0.16376079064905152, 'learning_rate': 0.0028008922094228702, 'batch_size': 9801, 'optimizer_name': 'Adam'}. Best is trial 899 with value: 0.0017655460917727903.[0m
[32m[I 2022-11-08 05:14:42,641][0m Trial 1180 finished with value: 0.001773435745077052 and parameters: {'nlayers': 40, 'hidden_size': 185, 'dropout': 0.1387036737886466, 'learning_rate': 0.0007305647529764562, 'batch_size': 9995, 'optimizer_name': 'Adam'}. Best is trial 899 with value: 0.0017655460917727903.[0m
[32m[I 2022-11-08 05:15:07,697][0m Trial 1181 finished with value: 0.0020303905174141284 and parameters: {'nlayers': 11, 'hidden_size': 283, 'dropout': 0.14817858303840659, 'learning_rate': 0.0066510615171661985, 'batch_size': 8727, 'optimizer_name': 'Adam'}. Best is trial 899 with value: 0.0017655460917727903.[0m
[32m[I 2022-11-08 05:15:33,419][0m Trial 1182 finished with value: 0.001807224939248635 and parameters: {'nlayers': 16, 'hidden_size': 145, 'dropout': 0.17041618444683454, 'learning_rate': 0.002416521026888211, 'batch_size': 9822, 'optimizer_name': 'RMSprop'}. Best is trial 899 with value: 0.0017655460917727903.[0m
[32m[I 2022-11-08 05:16:25,113][0m Trial 1183 finished with value: 0.0017734687260859416 and parameters: {'nlayers': 61, 'hidden_size': 157, 'dropout': 0.12528931656783418, 'learning_rate': 0.0030270066507466016, 'batch_size': 9999, 'optimizer_name': 'Adam'}. Best is trial 899 with value: 0.0017655460917727903.[0m
[32m[I 2022-11-08 05:16:48,030][0m Trial 1184 finished with value: 0.0018404338649950945 and parameters: {'nlayers': 9, 'hidden_size': 172, 'dropout': 0.15685630016540386, 'learning_rate': 0.007022591395618698, 'batch_size': 9689, 'optimizer_name': 'Adam'}. Best is trial 899 with value: 0.0017655460917727903.[0m
[32m[I 2022-11-08 05:17:51,024][0m Trial 1185 finished with value: 0.001854634583402182 and parameters: {'nlayers': 42, 'hidden_size': 286, 'dropout': 0.1842032970212112, 'learning_rate': 0.0026745015318142638, 'batch_size': 9547, 'optimizer_name': 'Adam'}. Best is trial 899 with value: 0.0017655460917727903.[0m
[32m[I 2022-11-08 05:18:12,952][0m Trial 1186 finished with value: 0.001806822220160829 and parameters: {'nlayers': 13, 'hidden_size': 67, 'dropout': 0.16757756561577475, 'learning_rate': 0.007927711923611335, 'batch_size': 9824, 'optimizer_name': 'Adam'}. Best is trial 899 with value: 0.0017655460917727903.[0m
[32m[I 2022-11-08 05:18:49,409][0m Trial 1187 finished with value: 0.0018082100263943517 and parameters: {'nlayers': 84, 'hidden_size': 49, 'dropout': 0.44906387250560253, 'learning_rate': 0.002138248165364729, 'batch_size': 9829, 'optimizer_name': 'Adam'}. Best is trial 899 with value: 0.0017655460917727903.[0m
[32m[I 2022-11-08 05:19:20,974][0m Trial 1188 finished with value: 0.001869655829790606 and parameters: {'nlayers': 17, 'hidden_size': 229, 'dropout': 0.1463037676237568, 'learning_rate': 0.00247459945607756, 'batch_size': 9532, 'optimizer_name': 'Adam'}. Best is trial 899 with value: 0.0017655460917727903.[0m
[32m[I 2022-11-08 05:20:26,206][0m Trial 1189 finished with value: 0.0018051380241895444 and parameters: {'nlayers': 86, 'hidden_size': 162, 'dropout': 0.1555079363320318, 'learning_rate': 0.00043287745190824056, 'batch_size': 9822, 'optimizer_name': 'Adam'}. Best is trial 899 with value: 0.0017655460917727903.[0m
[32m[I 2022-11-08 05:21:54,428][0m Trial 1190 finished with value: 0.0019313804436518398 and parameters: {'nlayers': 73, 'hidden_size': 274, 'dropout': 0.1079475598731388, 'learning_rate': 0.008287563143230231, 'batch_size': 9193, 'optimizer_name': 'Adam'}. Best is trial 899 with value: 0.0017655460917727903.[0m
[32m[I 2022-11-08 05:22:16,748][0m Trial 1191 finished with value: 0.001835884364955551 and parameters: {'nlayers': 14, 'hidden_size': 139, 'dropout': 0.1722685175812958, 'learning_rate': 0.0022430922196406975, 'batch_size': 9670, 'optimizer_name': 'Adam'}. Best is trial 899 with value: 0.0017655460917727903.[0m
[32m[I 2022-11-08 05:22:38,826][0m Trial 1192 finished with value: 0.001884133026064038 and parameters: {'nlayers': 11, 'hidden_size': 148, 'dropout': 0.1930500822952149, 'learning_rate': 0.0016262837718995394, 'batch_size': 9406, 'optimizer_name': 'Adam'}. Best is trial 899 with value: 0.0017655460917727903.[0m
[32m[I 2022-11-08 05:23:04,703][0m Trial 1193 finished with value: 0.001772714164853096 and parameters: {'nlayers': 18, 'hidden_size': 113, 'dropout': 0.15799948201333383, 'learning_rate': 0.0026960301764282994, 'batch_size': 10000, 'optimizer_name': 'Adam'}. Best is trial 899 with value: 0.0017655460917727903.[0m
[32m[I 2022-11-08 05:23:34,344][0m Trial 1194 finished with value: 0.001802689681698297 and parameters: {'nlayers': 34, 'hidden_size': 103, 'dropout': 0.46047311482877046, 'learning_rate': 0.001888598300993652, 'batch_size': 9823, 'optimizer_name': 'Adam'}. Best is trial 899 with value: 0.0017655460917727903.[0m
[32m[I 2022-11-08 05:24:24,569][0m Trial 1195 finished with value: 0.0018317054974496272 and parameters: {'nlayers': 79, 'hidden_size': 132, 'dropout': 0.11800528293378694, 'learning_rate': 0.002361947289491605, 'batch_size': 9665, 'optimizer_name': 'Adam'}. Best is trial 899 with value: 0.0017655460917727903.[0m
[32m[I 2022-11-08 05:24:48,123][0m Trial 1196 finished with value: 0.0018145354360451548 and parameters: {'nlayers': 15, 'hidden_size': 107, 'dropout': 0.13843174261310143, 'learning_rate': 0.0019940631513087653, 'batch_size': 9796, 'optimizer_name': 'Adam'}. Best is trial 899 with value: 0.0017655460917727903.[0m
[32m[I 2022-11-08 05:25:58,376][0m Trial 1197 finished with value: 0.0017703220598574816 and parameters: {'nlayers': 81, 'hidden_size': 177, 'dropout': 0.16450786657087926, 'learning_rate': 0.0025524868802047555, 'batch_size': 9995, 'optimizer_name': 'Adam'}. Best is trial 899 with value: 0.0017655460917727903.[0m
[32m[I 2022-11-08 05:25:59,310][0m Trial 1198 finished with value: 0.036209947399554715 and parameters: {'nlayers': 7, 'hidden_size': 168, 'dropout': 0.178777329030442, 'learning_rate': 0.0022473058887344964, 'batch_size': 496, 'optimizer_name': 'Adam'}. Best is trial 899 with value: 0.0017655460917727903.[0m
[32m[I 2022-11-08 05:26:46,614][0m Trial 1199 finished with value: 0.001853829203738783 and parameters: {'nlayers': 62, 'hidden_size': 153, 'dropout': 0.15015497466850236, 'learning_rate': 0.005774721859337538, 'batch_size': 9556, 'optimizer_name': 'Adam'}. Best is trial 899 with value: 0.0017655460917727903.[0m
[32m[I 2022-11-08 05:27:08,854][0m Trial 1200 finished with value: 0.0017729707837104798 and parameters: {'nlayers': 12, 'hidden_size': 71, 'dropout': 0.12963998637873111, 'learning_rate': 0.002088791875967422, 'batch_size': 10000, 'optimizer_name': 'Adam'}. Best is trial 899 with value: 0.0017655460917727903.[0m
[32m[I 2022-11-08 05:27:37,902][0m Trial 1201 finished with value: 0.0017755629718720996 and parameters: {'nlayers': 30, 'hidden_size': 111, 'dropout': 0.14326545077077507, 'learning_rate': 0.0029417788319572795, 'batch_size': 9998, 'optimizer_name': 'Adam'}. Best is trial 899 with value: 0.0017655460917727903.[0m
[32m[I 2022-11-08 05:28:05,521][0m Trial 1202 finished with value: 0.001823633635555768 and parameters: {'nlayers': 37, 'hidden_size': 96, 'dropout': 0.1632188107731181, 'learning_rate': 0.002783535934017669, 'batch_size': 9692, 'optimizer_name': 'Adam'}. Best is trial 899 with value: 0.0017655460917727903.[0m
[32m[I 2022-11-08 05:28:34,137][0m Trial 1203 finished with value: 0.0018958142447599116 and parameters: {'nlayers': 43, 'hidden_size': 78, 'dropout': 0.15078072754677946, 'learning_rate': 0.00018671431567933655, 'batch_size': 9350, 'optimizer_name': 'RMSprop'}. Best is trial 899 with value: 0.0017655460917727903.[0m
[32m[I 2022-11-08 05:29:01,117][0m Trial 1204 finished with value: 0.0017731065273284912 and parameters: {'nlayers': 19, 'hidden_size': 136, 'dropout': 0.17449477418669396, 'learning_rate': 0.006229180258977005, 'batch_size': 10000, 'optimizer_name': 'Adam'}. Best is trial 899 with value: 0.0017655460917727903.[0m
[32m[I 2022-11-08 05:29:27,838][0m Trial 1205 finished with value: 0.0018116166513162603 and parameters: {'nlayers': 16, 'hidden_size': 159, 'dropout': 0.38711230005316555, 'learning_rate': 0.0024364797697855123, 'batch_size': 9782, 'optimizer_name': 'Adam'}. Best is trial 899 with value: 0.0017655460917727903.[0m
[32m[I 2022-11-08 05:29:49,923][0m Trial 1206 finished with value: 0.0018544156750896481 and parameters: {'nlayers': 13, 'hidden_size': 99, 'dropout': 0.16343683970660464, 'learning_rate': 0.0017684618123974985, 'batch_size': 9547, 'optimizer_name': 'Adam'}. Best is trial 899 with value: 0.0017655460917727903.[0m
[32m[I 2022-11-08 05:30:10,265][0m Trial 1207 finished with value: 0.0018016451560222359 and parameters: {'nlayers': 9, 'hidden_size': 64, 'dropout': 0.11985070728390072, 'learning_rate': 0.007041140251379521, 'batch_size': 9829, 'optimizer_name': 'Adam'}. Best is trial 899 with value: 0.0017655460917727903.[0m
[32m[I 2022-11-08 05:30:30,195][0m Trial 1208 finished with value: 0.0017754368209066313 and parameters: {'nlayers': 1, 'hidden_size': 194, 'dropout': 0.13564034317349896, 'learning_rate': 0.0031247451427872833, 'batch_size': 9999, 'optimizer_name': 'Adam'}. Best is trial 899 with value: 0.0017655460917727903.[0m
[32m[I 2022-11-08 05:30:54,837][0m Trial 1209 finished with value: 0.00183887691223037 and parameters: {'nlayers': 15, 'hidden_size': 145, 'dropout': 0.15802423056808124, 'learning_rate': 0.0007576627725461704, 'batch_size': 9649, 'optimizer_name': 'Adam'}. Best is trial 899 with value: 0.0017655460917727903.[0m
[32m[I 2022-11-08 05:31:35,673][0m Trial 1210 finished with value: 0.0018150082686834927 and parameters: {'nlayers': 72, 'hidden_size': 102, 'dropout': 0.45325182125613617, 'learning_rate': 0.0021457530647934204, 'batch_size': 9765, 'optimizer_name': 'Adam'}. Best is trial 899 with value: 0.0017655460917727903.[0m
[32m[I 2022-11-08 05:31:58,635][0m Trial 1211 finished with value: 0.0018697151937588216 and parameters: {'nlayers': 18, 'hidden_size': 91, 'dropout': 0.4652159711080592, 'learning_rate': 0.0025846633335687825, 'batch_size': 9493, 'optimizer_name': 'Adam'}. Best is trial 899 with value: 0.0017655460917727903.[0m
[32m[I 2022-11-08 05:32:22,465][0m Trial 1212 finished with value: 0.001802465995693478 and parameters: {'nlayers': 11, 'hidden_size': 154, 'dropout': 0.10747898570979432, 'learning_rate': 0.002332366516272287, 'batch_size': 9848, 'optimizer_name': 'Adam'}. Best is trial 899 with value: 0.0017655460917727903.[0m
[32m[I 2022-11-08 05:32:48,213][0m Trial 1213 finished with value: 0.0018018462977483498 and parameters: {'nlayers': 20, 'hidden_size': 109, 'dropout': 0.16967590086944553, 'learning_rate': 0.001541321621364594, 'batch_size': 9841, 'optimizer_name': 'Adam'}. Best is trial 899 with value: 0.0017655460917727903.[0m
[32m[I 2022-11-08 05:33:34,671][0m Trial 1214 finished with value: 0.0017684864186835085 and parameters: {'nlayers': 66, 'hidden_size': 129, 'dropout': 0.1440186434314234, 'learning_rate': 0.0019349913743065231, 'batch_size': 9995, 'optimizer_name': 'Adam'}. Best is trial 899 with value: 0.0017655460917727903.[0m
[32m[I 2022-11-08 05:34:18,990][0m Trial 1215 finished with value: 0.0018409711609698818 and parameters: {'nlayers': 64, 'hidden_size': 129, 'dropout': 0.13529986148609655, 'learning_rate': 0.0015370235918119649, 'batch_size': 9653, 'optimizer_name': 'Adam'}. Best is trial 899 with value: 0.0017655460917727903.[0m
[32m[I 2022-11-08 05:35:00,448][0m Trial 1216 finished with value: 0.0017720944818000834 and parameters: {'nlayers': 64, 'hidden_size': 128, 'dropout': 0.1436369004009386, 'learning_rate': 0.0018592910340482053, 'batch_size': 9997, 'optimizer_name': 'Adam'}. Best is trial 899 with value: 0.0017655460917727903.[0m
[32m[I 2022-11-08 05:35:43,365][0m Trial 1217 finished with value: 0.0019249754667565843 and parameters: {'nlayers': 67, 'hidden_size': 130, 'dropout': 0.13169330445126776, 'learning_rate': 0.0018329572484237508, 'batch_size': 9243, 'optimizer_name': 'Adam'}. Best is trial 899 with value: 0.0017655460917727903.[0m
[32m[I 2022-11-08 05:36:15,097][0m Trial 1218 finished with value: 0.002378732792419311 and parameters: {'nlayers': 61, 'hidden_size': 135, 'dropout': 0.1459156468729105, 'learning_rate': 0.0017226391892827544, 'batch_size': 7465, 'optimizer_name': 'Adam'}. Best is trial 899 with value: 0.0017655460917727903.[0m
[32m[I 2022-11-08 05:36:59,377][0m Trial 1219 finished with value: 0.00187265234917836 and parameters: {'nlayers': 68, 'hidden_size': 129, 'dropout': 0.13910437403829376, 'learning_rate': 0.001621993617302873, 'batch_size': 9482, 'optimizer_name': 'Adam'}. Best is trial 899 with value: 0.0017655460917727903.[0m
[32m[I 2022-11-08 05:37:42,874][0m Trial 1220 finished with value: 0.001804613631138603 and parameters: {'nlayers': 57, 'hidden_size': 140, 'dropout': 0.12759772482627646, 'learning_rate': 0.0018959380146696344, 'batch_size': 9817, 'optimizer_name': 'Adam'}. Best is trial 899 with value: 0.0017655460917727903.[0m
[32m[I 2022-11-08 05:38:25,902][0m Trial 1221 finished with value: 0.0018300752458549736 and parameters: {'nlayers': 65, 'hidden_size': 125, 'dropout': 0.14061650828809438, 'learning_rate': 0.001994226249108998, 'batch_size': 9683, 'optimizer_name': 'Adam'}. Best is trial 899 with value: 0.0017655460917727903.[0m
[32m[I 2022-11-08 05:38:50,253][0m Trial 1222 finished with value: 0.0018047793523021387 and parameters: {'nlayers': 13, 'hidden_size': 135, 'dropout': 0.14763678111654946, 'learning_rate': 0.001700946180733662, 'batch_size': 9802, 'optimizer_name': 'Adam'}. Best is trial 899 with value: 0.0017655460917727903.[0m
[32m[I 2022-11-08 05:39:34,401][0m Trial 1223 finished with value: 0.0018471734944248736 and parameters: {'nlayers': 70, 'hidden_size': 122, 'dropout': 0.137166279328553, 'learning_rate': 0.0020482340964634153, 'batch_size': 9594, 'optimizer_name': 'Adam'}. Best is trial 899 with value: 0.0017655460917727903.[0m
[32m[I 2022-11-08 05:40:24,527][0m Trial 1224 finished with value: 0.001775929586716805 and parameters: {'nlayers': 70, 'hidden_size': 138, 'dropout': 0.12688843607552844, 'learning_rate': 0.001416484500359452, 'batch_size': 9995, 'optimizer_name': 'RMSprop'}. Best is trial 899 with value: 0.0017655460917727903.[0m
[32m[I 2022-11-08 05:41:08,828][0m Trial 1225 finished with value: 0.001888610493251662 and parameters: {'nlayers': 67, 'hidden_size': 133, 'dropout': 0.1504348335217501, 'learning_rate': 0.0019082781336086435, 'batch_size': 9387, 'optimizer_name': 'Adam'}. Best is trial 899 with value: 0.0017655460917727903.[0m
[32m[I 2022-11-08 05:41:51,723][0m Trial 1226 finished with value: 0.0018007690708348473 and parameters: {'nlayers': 66, 'hidden_size': 124, 'dropout': 0.1434910348170311, 'learning_rate': 0.0021213791292867207, 'batch_size': 9817, 'optimizer_name': 'Adam'}. Best is trial 899 with value: 0.0017655460917727903.[0m
[32m[I 2022-11-08 05:42:39,024][0m Trial 1227 finished with value: 0.0018279497065867675 and parameters: {'nlayers': 66, 'hidden_size': 141, 'dropout': 0.14862226895526232, 'learning_rate': 0.003508034391642682, 'batch_size': 9668, 'optimizer_name': 'Adam'}. Best is trial 899 with value: 0.0017655460917727903.[0m
[32m[I 2022-11-08 05:43:22,924][0m Trial 1228 finished with value: 0.0018047218248521016 and parameters: {'nlayers': 60, 'hidden_size': 131, 'dropout': 0.15377461745114007, 'learning_rate': 0.0016305878811370602, 'batch_size': 9828, 'optimizer_name': 'Adam'}. Best is trial 899 with value: 0.0017655460917727903.[0m
[32m[I 2022-11-08 05:44:06,724][0m Trial 1229 finished with value: 0.0018547983800435589 and parameters: {'nlayers': 60, 'hidden_size': 142, 'dropout': 0.13368907556834572, 'learning_rate': 0.001911545030673212, 'batch_size': 9531, 'optimizer_name': 'Adam'}. Best is trial 899 with value: 0.0017655460917727903.[0m
[32m[I 2022-11-08 05:44:53,267][0m Trial 1230 finished with value: 0.0017753377467393874 and parameters: {'nlayers': 63, 'hidden_size': 133, 'dropout': 0.1407780129716476, 'learning_rate': 0.0022044853121645194, 'batch_size': 10000, 'optimizer_name': 'Adam'}. Best is trial 899 with value: 0.0017655460917727903.[0m
[32m[I 2022-11-08 05:45:36,064][0m Trial 1231 finished with value: 0.0018436788397204096 and parameters: {'nlayers': 69, 'hidden_size': 124, 'dropout': 0.15216700501678387, 'learning_rate': 0.00682085434921894, 'batch_size': 9672, 'optimizer_name': 'SGD'}. Best is trial 899 with value: 0.0017655460917727903.[0m
[32m[I 2022-11-08 05:46:17,982][0m Trial 1232 finished with value: 0.001806622864877462 and parameters: {'nlayers': 63, 'hidden_size': 118, 'dropout': 0.14243885308906026, 'learning_rate': 0.0060306936536051224, 'batch_size': 9830, 'optimizer_name': 'Adam'}. Best is trial 899 with value: 0.0017655460917727903.[0m
[32m[I 2022-11-08 05:47:09,718][0m Trial 1233 finished with value: 0.0017795429987798603 and parameters: {'nlayers': 72, 'hidden_size': 141, 'dropout': 0.12711200384148316, 'learning_rate': 0.0020631631216757487, 'batch_size': 9992, 'optimizer_name': 'Adam'}. Best is trial 899 with value: 0.0017655460917727903.[0m
[32m[I 2022-11-08 05:47:58,064][0m Trial 1234 finished with value: 0.0017739073078525272 and parameters: {'nlayers': 62, 'hidden_size': 146, 'dropout': 0.11846459232631242, 'learning_rate': 0.0005321633629345489, 'batch_size': 9997, 'optimizer_name': 'Adam'}. Best is trial 899 with value: 0.0017655460917727903.[0m
[32m[I 2022-11-08 05:48:45,048][0m Trial 1235 finished with value: 0.0018341943122465025 and parameters: {'nlayers': 66, 'hidden_size': 137, 'dropout': 0.15238114389591093, 'learning_rate': 0.0014244505540551762, 'batch_size': 9672, 'optimizer_name': 'Adam'}. Best is trial 899 with value: 0.0017655460917727903.[0m
[32m[I 2022-11-08 05:49:31,623][0m Trial 1236 finished with value: 0.0018937736956587512 and parameters: {'nlayers': 64, 'hidden_size': 149, 'dropout': 0.13182108049545171, 'learning_rate': 0.0016499044978217346, 'batch_size': 9361, 'optimizer_name': 'Adam'}. Best is trial 899 with value: 0.0017655460917727903.[0m
[32m[I 2022-11-08 05:50:08,396][0m Trial 1237 finished with value: 0.0019477775795049732 and parameters: {'nlayers': 60, 'hidden_size': 119, 'dropout': 0.4472410632795292, 'learning_rate': 0.006520949618593373, 'batch_size': 9077, 'optimizer_name': 'Adam'}. Best is trial 899 with value: 0.0017655460917727903.[0m
[32m[I 2022-11-08 05:50:41,225][0m Trial 1238 finished with value: 0.0018067087806912356 and parameters: {'nlayers': 62, 'hidden_size': 54, 'dropout': 0.15773692101506884, 'learning_rate': 0.001801551650411654, 'batch_size': 9813, 'optimizer_name': 'Adam'}. Best is trial 899 with value: 0.0017655460917727903.[0m
[32m[I 2022-11-08 05:51:33,910][0m Trial 1239 finished with value: 0.0018034129713277558 and parameters: {'nlayers': 71, 'hidden_size': 147, 'dropout': 0.14489905901830505, 'learning_rate': 0.0075880085116365225, 'batch_size': 9829, 'optimizer_name': 'Adam'}. Best is trial 899 with value: 0.0017655460917727903.[0m
[32m[I 2022-11-08 05:51:52,783][0m Trial 1240 finished with value: 0.0018596495347439723 and parameters: {'nlayers': 8, 'hidden_size': 32, 'dropout': 0.15434548471227427, 'learning_rate': 0.0022026421627850353, 'batch_size': 9509, 'optimizer_name': 'Adam'}. Best is trial 899 with value: 0.0017655460917727903.[0m
[32m[I 2022-11-08 05:52:51,328][0m Trial 1241 finished with value: 0.0018058744500913302 and parameters: {'nlayers': 40, 'hidden_size': 265, 'dropout': 0.1408789593581259, 'learning_rate': 0.001873780627841821, 'batch_size': 9832, 'optimizer_name': 'Adam'}. Best is trial 899 with value: 0.0017655460917727903.[0m
