[32m[I 2022-11-08 11:08:19,291][0m Trial 1863 finished with value: 0.0018068581457980997 and parameters: {'nlayers': 100, 'hidden_size': 69, 'dropout': 0.10883798445026957, 'learning_rate': 0.006888737417007909, 'batch_size': 9809, 'optimizer_name': 'Adam'}. Best is trial 1569 with value: 0.001761963053552708.[0m
[32m[I 2022-11-08 11:09:02,805][0m Trial 1864 finished with value: 0.0019227942992082407 and parameters: {'nlayers': 58, 'hidden_size': 155, 'dropout': 0.1461290537554037, 'learning_rate': 0.007189569793824369, 'batch_size': 9240, 'optimizer_name': 'RMSprop'}. Best is trial 1569 with value: 0.001761963053552708.[0m
[32m[I 2022-11-08 11:09:47,455][0m Trial 1865 finished with value: 0.0018042589955157896 and parameters: {'nlayers': 57, 'hidden_size': 148, 'dropout': 0.15061529207704966, 'learning_rate': 0.001968059781787082, 'batch_size': 9814, 'optimizer_name': 'Adam'}. Best is trial 1569 with value: 0.001761963053552708.[0m
[32m[I 2022-11-08 11:10:16,322][0m Trial 1866 finished with value: 0.0017714663624763488 and parameters: {'nlayers': 51, 'hidden_size': 29, 'dropout': 0.16032234396705988, 'learning_rate': 0.00648953647707989, 'batch_size': 10000, 'optimizer_name': 'Adam'}. Best is trial 1569 with value: 0.001761963053552708.[0m
[32m[I 2022-11-08 11:10:55,223][0m Trial 1867 finished with value: 0.0018635728845469183 and parameters: {'nlayers': 78, 'hidden_size': 84, 'dropout': 0.13003792011309134, 'learning_rate': 0.005193925892246229, 'batch_size': 9527, 'optimizer_name': 'Adam'}. Best is trial 1569 with value: 0.001761963053552708.[0m
[32m[I 2022-11-08 11:11:13,811][0m Trial 1868 finished with value: 0.0018351312619286882 and parameters: {'nlayers': 1, 'hidden_size': 164, 'dropout': 0.15467436271592697, 'learning_rate': 0.005405464693285716, 'batch_size': 9673, 'optimizer_name': 'Adam'}. Best is trial 1569 with value: 0.001761963053552708.[0m
[32m[I 2022-11-08 11:11:35,212][0m Trial 1869 finished with value: 0.0018233428442263333 and parameters: {'nlayers': 17, 'hidden_size': 43, 'dropout': 0.47383358160271694, 'learning_rate': 0.005082370481563611, 'batch_size': 9821, 'optimizer_name': 'SGD'}. Best is trial 1569 with value: 0.001761963053552708.[0m
[32m[I 2022-11-08 11:11:58,938][0m Trial 1870 finished with value: 0.0017799982244652002 and parameters: {'nlayers': 13, 'hidden_size': 93, 'dropout': 0.14056860424688575, 'learning_rate': 0.006308527442222336, 'batch_size': 9999, 'optimizer_name': 'Adam'}. Best is trial 1569 with value: 0.001761963053552708.[0m
[32m[I 2022-11-08 11:12:21,962][0m Trial 1871 finished with value: 0.0018707063368388584 and parameters: {'nlayers': 70, 'hidden_size': 16, 'dropout': 0.12105533751473946, 'learning_rate': 0.0022095071880111404, 'batch_size': 9450, 'optimizer_name': 'Adam'}. Best is trial 1569 with value: 0.001761963053552708.[0m
[32m[I 2022-11-08 11:12:33,086][0m Trial 1872 finished with value: 0.0023303969534430487 and parameters: {'nlayers': 8, 'hidden_size': 6, 'dropout': 0.16240424089900837, 'learning_rate': 0.0027373610463610715, 'batch_size': 7604, 'optimizer_name': 'Adam'}. Best is trial 1569 with value: 0.001761963053552708.[0m
[32m[I 2022-11-08 11:12:52,002][0m Trial 1873 finished with value: 0.001827239043933829 and parameters: {'nlayers': 4, 'hidden_size': 60, 'dropout': 0.1478532414455844, 'learning_rate': 0.007025100838062829, 'batch_size': 9700, 'optimizer_name': 'Adam'}. Best is trial 1569 with value: 0.001761963053552708.[0m
[32m[I 2022-11-08 11:13:18,540][0m Trial 1874 finished with value: 0.0018077266797994148 and parameters: {'nlayers': 11, 'hidden_size': 210, 'dropout': 0.13398949127389131, 'learning_rate': 0.002472138777907707, 'batch_size': 9816, 'optimizer_name': 'Adam'}. Best is trial 1569 with value: 0.001761963053552708.[0m
[32m[I 2022-11-08 11:14:17,504][0m Trial 1875 finished with value: 0.0018048513229054295 and parameters: {'nlayers': 56, 'hidden_size': 199, 'dropout': 0.11462537913562135, 'learning_rate': 0.007437574580187116, 'batch_size': 9832, 'optimizer_name': 'Adam'}. Best is trial 1569 with value: 0.001761963053552708.[0m
[32m[I 2022-11-08 11:14:51,252][0m Trial 1876 finished with value: 0.0018406455806820542 and parameters: {'nlayers': 53, 'hidden_size': 87, 'dropout': 0.15652162255685376, 'learning_rate': 0.0022864637878010447, 'batch_size': 9627, 'optimizer_name': 'Adam'}. Best is trial 1569 with value: 0.001761963053552708.[0m
[32m[I 2022-11-08 11:15:19,317][0m Trial 1877 finished with value: 0.0019013734460899393 and parameters: {'nlayers': 49, 'hidden_size': 66, 'dropout': 0.16292386424018312, 'learning_rate': 0.0017295570590611308, 'batch_size': 9328, 'optimizer_name': 'RMSprop'}. Best is trial 1569 with value: 0.001761963053552708.[0m
[32m[I 2022-11-08 11:15:45,821][0m Trial 1878 finished with value: 0.0017785229195112465 and parameters: {'nlayers': 14, 'hidden_size': 159, 'dropout': 0.14876485458380462, 'learning_rate': 0.0058659729392000395, 'batch_size': 9995, 'optimizer_name': 'Adam'}. Best is trial 1569 with value: 0.001761963053552708.[0m
[32m[I 2022-11-08 11:16:09,808][0m Trial 1879 finished with value: 0.0018057483025810282 and parameters: {'nlayers': 19, 'hidden_size': 81, 'dropout': 0.12634569830455064, 'learning_rate': 0.007902626079367843, 'batch_size': 9811, 'optimizer_name': 'Adam'}. Best is trial 1569 with value: 0.001761963053552708.[0m
[32m[I 2022-11-08 11:17:33,315][0m Trial 1880 finished with value: 0.0017732282330532845 and parameters: {'nlayers': 73, 'hidden_size': 241, 'dropout': 0.13639686000397927, 'learning_rate': 0.007364967531802881, 'batch_size': 9996, 'optimizer_name': 'Adam'}. Best is trial 1569 with value: 0.001761963053552708.[0m
[32m[I 2022-11-08 11:17:54,891][0m Trial 1881 finished with value: 0.0018620543026431646 and parameters: {'nlayers': 16, 'hidden_size': 94, 'dropout': 0.27455451655624846, 'learning_rate': 0.006817811870091651, 'batch_size': 9537, 'optimizer_name': 'Adam'}. Best is trial 1569 with value: 0.001761963053552708.[0m
[32m[I 2022-11-08 11:18:17,857][0m Trial 1882 finished with value: 0.00183516917432754 and parameters: {'nlayers': 12, 'hidden_size': 145, 'dropout': 0.15320748562831313, 'learning_rate': 0.0020029954995149208, 'batch_size': 9651, 'optimizer_name': 'Adam'}. Best is trial 1569 with value: 0.001761963053552708.[0m
[32m[I 2022-11-08 11:18:48,070][0m Trial 1883 finished with value: 0.0020466608940626387 and parameters: {'nlayers': 65, 'hidden_size': 71, 'dropout': 0.14120253414831346, 'learning_rate': 0.002482383979783032, 'batch_size': 8665, 'optimizer_name': 'Adam'}. Best is trial 1569 with value: 0.001761963053552708.[0m
[32m[I 2022-11-08 11:19:13,260][0m Trial 1884 finished with value: 0.0018012831891419808 and parameters: {'nlayers': 22, 'hidden_size': 98, 'dropout': 0.37946055560528985, 'learning_rate': 0.001898764815922885, 'batch_size': 9830, 'optimizer_name': 'Adam'}. Best is trial 1569 with value: 0.001761963053552708.[0m
[32m[I 2022-11-08 11:19:34,351][0m Trial 1885 finished with value: 0.0017781040186022024 and parameters: {'nlayers': 6, 'hidden_size': 89, 'dropout': 0.46440570673321124, 'learning_rate': 0.00815807932068981, 'batch_size': 9997, 'optimizer_name': 'Adam'}. Best is trial 1569 with value: 0.001761963053552708.[0m
[32m[I 2022-11-08 11:19:56,305][0m Trial 1886 finished with value: 0.0018278271910893847 and parameters: {'nlayers': 18, 'hidden_size': 54, 'dropout': 0.16238719911207594, 'learning_rate': 0.006571600096339548, 'batch_size': 9683, 'optimizer_name': 'Adam'}. Best is trial 1569 with value: 0.001761963053552708.[0m
[32m[I 2022-11-08 11:20:05,361][0m Trial 1887 finished with value: 0.0029534401394083368 and parameters: {'nlayers': 15, 'hidden_size': 76, 'dropout': 0.15579781005282195, 'learning_rate': 0.002649526833843117, 'batch_size': 6009, 'optimizer_name': 'Adam'}. Best is trial 1569 with value: 0.001761963053552708.[0m
[32m[I 2022-11-08 11:20:21,772][0m Trial 1888 finished with value: 0.006968320433230155 and parameters: {'nlayers': 71, 'hidden_size': 170, 'dropout': 0.11104095173253396, 'learning_rate': 0.0022189272477059307, 'batch_size': 2549, 'optimizer_name': 'RMSprop'}. Best is trial 1569 with value: 0.001761963053552708.[0m
[32m[I 2022-11-08 11:20:44,453][0m Trial 1889 finished with value: 0.0018055437751068847 and parameters: {'nlayers': 9, 'hidden_size': 153, 'dropout': 0.14767416538341632, 'learning_rate': 0.0029147575998203284, 'batch_size': 9820, 'optimizer_name': 'Adam'}. Best is trial 1569 with value: 0.001761963053552708.[0m
[32m[I 2022-11-08 11:21:07,847][0m Trial 1890 finished with value: 0.0017726504320953803 and parameters: {'nlayers': 13, 'hidden_size': 99, 'dropout': 0.3886965570581329, 'learning_rate': 0.007657949315137093, 'batch_size': 9997, 'optimizer_name': 'Adam'}. Best is trial 1569 with value: 0.001761963053552708.[0m
[32m[I 2022-11-08 11:21:37,056][0m Trial 1891 finished with value: 0.0018620376644246683 and parameters: {'nlayers': 63, 'hidden_size': 39, 'dropout': 0.1260844871887499, 'learning_rate': 0.00230012872193732, 'batch_size': 9523, 'optimizer_name': 'SGD'}. Best is trial 1569 with value: 0.001761963053552708.[0m
[32m[I 2022-11-08 11:22:11,568][0m Trial 1892 finished with value: 0.0017716212056376765 and parameters: {'nlayers': 48, 'hidden_size': 92, 'dropout': 0.1622681774305997, 'learning_rate': 0.0017075917506910558, 'batch_size': 9999, 'optimizer_name': 'Adam'}. Best is trial 1569 with value: 0.001761963053552708.[0m
[32m[I 2022-11-08 11:22:16,587][0m Trial 1893 finished with value: 0.12510330183752652 and parameters: {'nlayers': 68, 'hidden_size': 133, 'dropout': 0.10006311843819436, 'learning_rate': 0.0020110403085154063, 'batch_size': 145, 'optimizer_name': 'Adam'}. Best is trial 1569 with value: 0.001761963053552708.[0m
[32m[I 2022-11-08 11:22:37,656][0m Trial 1894 finished with value: 0.0018145623162130575 and parameters: {'nlayers': 10, 'hidden_size': 65, 'dropout': 0.22368022204938057, 'learning_rate': 0.0026071122604332917, 'batch_size': 9810, 'optimizer_name': 'Adam'}. Best is trial 1569 with value: 0.001761963053552708.[0m
[32m[I 2022-11-08 11:23:38,535][0m Trial 1895 finished with value: 0.0018990627101808388 and parameters: {'nlayers': 52, 'hidden_size': 248, 'dropout': 0.4790707783568326, 'learning_rate': 0.0020549025042601167, 'batch_size': 9345, 'optimizer_name': 'Adam'}. Best is trial 1569 with value: 0.001761963053552708.[0m
[32m[I 2022-11-08 11:24:07,754][0m Trial 1896 finished with value: 0.0018324764582335143 and parameters: {'nlayers': 24, 'hidden_size': 147, 'dropout': 0.37036181289036507, 'learning_rate': 0.0024032596073654366, 'batch_size': 9673, 'optimizer_name': 'Adam'}. Best is trial 1569 with value: 0.001761963053552708.[0m
[32m[I 2022-11-08 11:24:33,937][0m Trial 1897 finished with value: 0.0018037835835852051 and parameters: {'nlayers': 28, 'hidden_size': 82, 'dropout': 0.13831808069089205, 'learning_rate': 0.005000823700791857, 'batch_size': 9819, 'optimizer_name': 'Adam'}. Best is trial 1569 with value: 0.001761963053552708.[0m
[32m[I 2022-11-08 11:24:56,302][0m Trial 1898 finished with value: 0.0018728775493702349 and parameters: {'nlayers': 20, 'hidden_size': 96, 'dropout': 0.14743556554770545, 'learning_rate': 0.0018342630690600774, 'batch_size': 9475, 'optimizer_name': 'Adam'}. Best is trial 1569 with value: 0.001761963053552708.[0m
[32m[I 2022-11-08 11:25:30,848][0m Trial 1899 finished with value: 0.0018271435749374506 and parameters: {'nlayers': 77, 'hidden_size': 51, 'dropout': 0.1678921191911037, 'learning_rate': 0.004292500278254083, 'batch_size': 9687, 'optimizer_name': 'Adam'}. Best is trial 1569 with value: 0.001761963053552708.[0m
[32m[I 2022-11-08 11:25:46,013][0m Trial 1900 finished with value: 0.002226365988588315 and parameters: {'nlayers': 14, 'hidden_size': 71, 'dropout': 0.11915933378793772, 'learning_rate': 0.0021637009684133046, 'batch_size': 7979, 'optimizer_name': 'Adam'}. Best is trial 1569 with value: 0.001761963053552708.[0m
[32m[I 2022-11-08 11:26:10,446][0m Trial 1901 finished with value: 0.0017651856184005736 and parameters: {'nlayers': 16, 'hidden_size': 101, 'dropout': 0.48684475561142826, 'learning_rate': 0.0015903922918317416, 'batch_size': 10000, 'optimizer_name': 'RMSprop'}. Best is trial 1569 with value: 0.001761963053552708.[0m
[32m[I 2022-11-08 11:26:34,108][0m Trial 1902 finished with value: 0.0018138001887464104 and parameters: {'nlayers': 17, 'hidden_size': 87, 'dropout': 0.31701217414706573, 'learning_rate': 0.0014135569014754293, 'batch_size': 9802, 'optimizer_name': 'RMSprop'}. Best is trial 1569 with value: 0.001761963053552708.[0m
[32m[I 2022-11-08 11:26:58,013][0m Trial 1903 finished with value: 0.0018034668819656016 and parameters: {'nlayers': 18, 'hidden_size': 91, 'dropout': 0.49981480643812803, 'learning_rate': 0.0015363907522595273, 'batch_size': 9832, 'optimizer_name': 'RMSprop'}. Best is trial 1569 with value: 0.001761963053552708.[0m
[32m[I 2022-11-08 11:27:22,266][0m Trial 1904 finished with value: 0.0017766240914869433 and parameters: {'nlayers': 16, 'hidden_size': 95, 'dropout': 0.48875156288694277, 'learning_rate': 0.0014396254268484456, 'batch_size': 9994, 'optimizer_name': 'RMSprop'}. Best is trial 1569 with value: 0.001761963053552708.[0m
[32m[I 2022-11-08 11:27:45,186][0m Trial 1905 finished with value: 0.0018364159736657115 and parameters: {'nlayers': 18, 'hidden_size': 85, 'dropout': 0.49492396858458293, 'learning_rate': 0.0014152742081348997, 'batch_size': 9611, 'optimizer_name': 'RMSprop'}. Best is trial 1569 with value: 0.001761963053552708.[0m
[32m[I 2022-11-08 11:28:06,009][0m Trial 1906 finished with value: 0.0018078762028276058 and parameters: {'nlayers': 15, 'hidden_size': 11, 'dropout': 0.49832248132108226, 'learning_rate': 0.0015871361237825218, 'batch_size': 9822, 'optimizer_name': 'RMSprop'}. Best is trial 1569 with value: 0.001761963053552708.[0m
[32m[I 2022-11-08 11:28:36,691][0m Trial 1907 finished with value: 0.0019232974086735887 and parameters: {'nlayers': 17, 'hidden_size': 260, 'dropout': 0.4818000828387933, 'learning_rate': 0.0015904852402380707, 'batch_size': 9243, 'optimizer_name': 'SGD'}. Best is trial 1569 with value: 0.001761963053552708.[0m
[32m[I 2022-11-08 11:28:59,967][0m Trial 1908 finished with value: 0.001774202177044486 and parameters: {'nlayers': 15, 'hidden_size': 78, 'dropout': 0.48092608066665127, 'learning_rate': 0.0015941513068546945, 'batch_size': 9997, 'optimizer_name': 'RMSprop'}. Best is trial 1569 with value: 0.001761963053552708.[0m
[32m[I 2022-11-08 11:29:23,269][0m Trial 1909 finished with value: 0.0018576823358202974 and parameters: {'nlayers': 19, 'hidden_size': 99, 'dropout': 0.4962379320112123, 'learning_rate': 0.0017021932616003738, 'batch_size': 9514, 'optimizer_name': 'RMSprop'}. Best is trial 1569 with value: 0.001761963053552708.[0m
[32m[I 2022-11-08 11:29:46,008][0m Trial 1910 finished with value: 0.0018374688595268435 and parameters: {'nlayers': 16, 'hidden_size': 92, 'dropout': 0.4692792484245165, 'learning_rate': 0.0017694142685482804, 'batch_size': 9674, 'optimizer_name': 'RMSprop'}. Best is trial 1569 with value: 0.001761963053552708.[0m
[32m[I 2022-11-08 11:30:10,330][0m Trial 1911 finished with value: 0.0018053361814149745 and parameters: {'nlayers': 20, 'hidden_size': 100, 'dropout': 0.4824966497210719, 'learning_rate': 0.001641762868516283, 'batch_size': 9822, 'optimizer_name': 'RMSprop'}. Best is trial 1569 with value: 0.001761963053552708.[0m
[32m[I 2022-11-08 11:30:35,906][0m Trial 1912 finished with value: 0.0018028675447656279 and parameters: {'nlayers': 14, 'hidden_size': 161, 'dropout': 0.4656497928817787, 'learning_rate': 0.0013352360785971848, 'batch_size': 9820, 'optimizer_name': 'RMSprop'}. Best is trial 1569 with value: 0.001761963053552708.[0m
[32m[I 2022-11-08 11:31:00,622][0m Trial 1913 finished with value: 0.0018637469442780471 and parameters: {'nlayers': 17, 'hidden_size': 142, 'dropout': 0.47605502867638094, 'learning_rate': 0.0017607859399030334, 'batch_size': 9534, 'optimizer_name': 'RMSprop'}. Best is trial 1569 with value: 0.001761963053552708.[0m
[32m[I 2022-11-08 11:31:20,202][0m Trial 1914 finished with value: 0.001854379928683919 and parameters: {'nlayers': 13, 'hidden_size': 2, 'dropout': 0.4758371652240923, 'learning_rate': 0.0014031210445697557, 'batch_size': 9672, 'optimizer_name': 'RMSprop'}. Best is trial 1569 with value: 0.001761963053552708.[0m
[32m[I 2022-11-08 11:32:01,018][0m Trial 1915 finished with value: 0.001778434583241697 and parameters: {'nlayers': 19, 'hidden_size': 300, 'dropout': 0.48698008788016556, 'learning_rate': 0.0018215661663801056, 'batch_size': 9992, 'optimizer_name': 'RMSprop'}. Best is trial 1569 with value: 0.001761963053552708.[0m
[32m[I 2022-11-08 11:32:29,523][0m Trial 1916 finished with value: 0.0017749627797101573 and parameters: {'nlayers': 21, 'hidden_size': 152, 'dropout': 0.4912138177951923, 'learning_rate': 0.0015302573071680498, 'batch_size': 9992, 'optimizer_name': 'RMSprop'}. Best is trial 1569 with value: 0.001761963053552708.[0m
[32m[I 2022-11-08 11:32:50,120][0m Trial 1917 finished with value: 0.0018870470650412452 and parameters: {'nlayers': 15, 'hidden_size': 59, 'dropout': 0.48873784597283065, 'learning_rate': 0.0017735928331958021, 'batch_size': 9399, 'optimizer_name': 'RMSprop'}. Best is trial 1569 with value: 0.001761963053552708.[0m
[32m[I 2022-11-08 11:33:11,942][0m Trial 1918 finished with value: 0.0018279696819529397 and parameters: {'nlayers': 12, 'hidden_size': 85, 'dropout': 0.48253085333570656, 'learning_rate': 0.001499975454815058, 'batch_size': 9674, 'optimizer_name': 'RMSprop'}. Best is trial 1569 with value: 0.001761963053552708.[0m
[32m[I 2022-11-08 11:33:35,457][0m Trial 1919 finished with value: 0.0018152889846182558 and parameters: {'nlayers': 17, 'hidden_size': 92, 'dropout': 0.49259328088435717, 'learning_rate': 0.0018696198751421333, 'batch_size': 9777, 'optimizer_name': 'RMSprop'}. Best is trial 1569 with value: 0.001761963053552708.[0m
[32m[I 2022-11-08 11:33:58,517][0m Trial 1920 finished with value: 0.0018044125855369545 and parameters: {'nlayers': 15, 'hidden_size': 97, 'dropout': 0.48802400131445867, 'learning_rate': 0.0016407490713627499, 'batch_size': 9822, 'optimizer_name': 'RMSprop'}. Best is trial 1569 with value: 0.001761963053552708.[0m
[32m[I 2022-11-08 11:34:22,359][0m Trial 1921 finished with value: 0.0018076471864582684 and parameters: {'nlayers': 18, 'hidden_size': 78, 'dropout': 0.4897248340446769, 'learning_rate': 0.0012617995359594724, 'batch_size': 9826, 'optimizer_name': 'RMSprop'}. Best is trial 1569 with value: 0.001761963053552708.[0m
[32m[I 2022-11-08 11:34:41,188][0m Trial 1922 finished with value: 0.0019552606620535946 and parameters: {'nlayers': 12, 'hidden_size': 100, 'dropout': 0.488662679282558, 'learning_rate': 0.0018987233119887642, 'batch_size': 9060, 'optimizer_name': 'RMSprop'}. Best is trial 1569 with value: 0.001761963053552708.[0m
[32m[I 2022-11-08 11:35:06,722][0m Trial 1923 finished with value: 0.0018643651748006934 and parameters: {'nlayers': 14, 'hidden_size': 175, 'dropout': 0.4772969552391797, 'learning_rate': 0.007003131503430201, 'batch_size': 9509, 'optimizer_name': 'RMSprop'}. Best is trial 1569 with value: 0.001761963053552708.[0m
[32m[I 2022-11-08 11:35:41,912][0m Trial 1924 finished with value: 0.001778622868657112 and parameters: {'nlayers': 20, 'hidden_size': 222, 'dropout': 0.49001916125091133, 'learning_rate': 0.001626228553932472, 'batch_size': 10000, 'optimizer_name': 'RMSprop'}. Best is trial 1569 with value: 0.001761963053552708.[0m
[32m[I 2022-11-08 11:35:46,150][0m Trial 1925 finished with value: 0.004976594865489073 and parameters: {'nlayers': 16, 'hidden_size': 63, 'dropout': 0.4695260095238491, 'learning_rate': 0.0019518881670053702, 'batch_size': 3570, 'optimizer_name': 'RMSprop'}. Best is trial 1569 with value: 0.001761963053552708.[0m
[32m[I 2022-11-08 11:36:08,409][0m Trial 1926 finished with value: 0.0017739775301278263 and parameters: {'nlayers': 11, 'hidden_size': 71, 'dropout': 0.481299789946586, 'learning_rate': 0.0072952932750396824, 'batch_size': 9995, 'optimizer_name': 'RMSprop'}. Best is trial 1569 with value: 0.001761963053552708.[0m
[32m[I 2022-11-08 11:36:40,790][0m Trial 1927 finished with value: 0.001771281074466503 and parameters: {'nlayers': 13, 'hidden_size': 270, 'dropout': 0.4704294632350358, 'learning_rate': 0.00595329435769647, 'batch_size': 9998, 'optimizer_name': 'RMSprop'}. Best is trial 1569 with value: 0.001761963053552708.[0m
[32m[I 2022-11-08 11:37:02,195][0m Trial 1928 finished with value: 0.001840295189772277 and parameters: {'nlayers': 18, 'hidden_size': 46, 'dropout': 0.4905106076539523, 'learning_rate': 0.0018131056058233311, 'batch_size': 9648, 'optimizer_name': 'RMSprop'}. Best is trial 1569 with value: 0.001761963053552708.[0m
[32m[I 2022-11-08 11:37:29,259][0m Trial 1929 finished with value: 0.0018036053311571059 and parameters: {'nlayers': 22, 'hidden_size': 136, 'dropout': 0.49979945068314224, 'learning_rate': 0.002022621770870221, 'batch_size': 9819, 'optimizer_name': 'RMSprop'}. Best is trial 1569 with value: 0.001761963053552708.[0m
[32m[I 2022-11-08 11:37:48,561][0m Trial 1930 finished with value: 0.0018942194963407237 and parameters: {'nlayers': 15, 'hidden_size': 3, 'dropout': 0.4727229592076716, 'learning_rate': 0.004599969371777439, 'batch_size': 9345, 'optimizer_name': 'RMSprop'}. Best is trial 1569 with value: 0.001761963053552708.[0m
[32m[I 2022-11-08 11:38:17,675][0m Trial 1931 finished with value: 0.0017737213826582471 and parameters: {'nlayers': 17, 'hidden_size': 166, 'dropout': 0.46780636090364924, 'learning_rate': 0.006385438284819402, 'batch_size': 9999, 'optimizer_name': 'RMSprop'}. Best is trial 1569 with value: 0.001761963053552708.[0m
