[32m[I 2022-11-07 20:12:59,755][0m Trial 138 finished with value: 0.0018529759488836693 and parameters: {'nlayers': 42, 'hidden_size': 210, 'dropout': 0.2369363050377371, 'learning_rate': 0.0018565606030098724, 'batch_size': 9590, 'optimizer_name': 'Adam'}. Best is trial 56 with value: 0.0017683455690155395.[0m
[32m[I 2022-11-07 20:13:31,792][0m Trial 139 finished with value: 0.0018175112861311758 and parameters: {'nlayers': 24, 'hidden_size': 178, 'dropout': 0.39416975930238196, 'learning_rate': 0.0013982197239361092, 'batch_size': 9752, 'optimizer_name': 'RMSprop'}. Best is trial 56 with value: 0.0017683455690155395.[0m
[32m[I 2022-11-07 20:13:37,356][0m Trial 140 finished with value: 0.004156361418054965 and parameters: {'nlayers': 28, 'hidden_size': 64, 'dropout': 0.13560790171234716, 'learning_rate': 0.0017185612473255753, 'batch_size': 4256, 'optimizer_name': 'Adam'}. Best is trial 56 with value: 0.0017683455690155395.[0m
[32m[I 2022-11-07 20:14:21,850][0m Trial 141 finished with value: 0.00177881309354852 and parameters: {'nlayers': 39, 'hidden_size': 191, 'dropout': 0.1504921364934665, 'learning_rate': 0.002099890220804132, 'batch_size': 9986, 'optimizer_name': 'Adam'}. Best is trial 56 with value: 0.0017683455690155395.[0m
[32m[I 2022-11-07 20:15:00,072][0m Trial 142 finished with value: 0.001888821349968076 and parameters: {'nlayers': 34, 'hidden_size': 196, 'dropout': 0.17203820372101142, 'learning_rate': 0.002307713309755715, 'batch_size': 9391, 'optimizer_name': 'Adam'}. Best is trial 56 with value: 0.0017683455690155395.[0m
[32m[I 2022-11-07 20:15:40,199][0m Trial 143 finished with value: 0.0018097696523056163 and parameters: {'nlayers': 36, 'hidden_size': 185, 'dropout': 0.1283183952521244, 'learning_rate': 0.002602886314680616, 'batch_size': 9799, 'optimizer_name': 'Adam'}. Best is trial 56 with value: 0.0017683455690155395.[0m
[32m[I 2022-11-07 20:16:22,558][0m Trial 144 finished with value: 0.0017699252248215918 and parameters: {'nlayers': 46, 'hidden_size': 161, 'dropout': 0.14176452120730385, 'learning_rate': 0.001200285808544174, 'batch_size': 9994, 'optimizer_name': 'Adam'}. Best is trial 56 with value: 0.0017683455690155395.[0m
[32m[I 2022-11-07 20:16:59,647][0m Trial 145 finished with value: 0.0018379593930658506 and parameters: {'nlayers': 46, 'hidden_size': 160, 'dropout': 0.11416810470689474, 'learning_rate': 0.0012097155966905992, 'batch_size': 9639, 'optimizer_name': 'Adam'}. Best is trial 56 with value: 0.0017683455690155395.[0m
[32m[I 2022-11-07 20:17:25,205][0m Trial 146 finished with value: 0.0018823164313830235 and parameters: {'nlayers': 20, 'hidden_size': 150, 'dropout': 0.16355576624434823, 'learning_rate': 0.000685013841250504, 'batch_size': 9472, 'optimizer_name': 'SGD'}. Best is trial 56 with value: 0.0017683455690155395.[0m
[32m[I 2022-11-07 20:17:50,772][0m Trial 147 finished with value: 0.0018094399463743501 and parameters: {'nlayers': 30, 'hidden_size': 76, 'dropout': 0.13912489989392854, 'learning_rate': 0.0010463017730505072, 'batch_size': 9798, 'optimizer_name': 'Adam'}. Best is trial 56 with value: 0.0017683455690155395.[0m
[32m[I 2022-11-07 20:18:28,242][0m Trial 148 finished with value: 0.0017737424309240816 and parameters: {'nlayers': 50, 'hidden_size': 136, 'dropout': 0.1849462510949232, 'learning_rate': 0.0035603186120959666, 'batch_size': 9998, 'optimizer_name': 'Adam'}. Best is trial 56 with value: 0.0017683455690155395.[0m
[32m[I 2022-11-07 20:19:03,641][0m Trial 149 finished with value: 0.0019087761290537593 and parameters: {'nlayers': 50, 'hidden_size': 134, 'dropout': 0.19657938617778617, 'learning_rate': 0.0015201913777561555, 'batch_size': 9281, 'optimizer_name': 'Adam'}. Best is trial 56 with value: 0.0017683455690155395.[0m
[32m[I 2022-11-07 20:19:47,253][0m Trial 150 finished with value: 0.0018513292158013792 and parameters: {'nlayers': 47, 'hidden_size': 173, 'dropout': 0.18426013743677752, 'learning_rate': 0.0033656099344188, 'batch_size': 9601, 'optimizer_name': 'Adam'}. Best is trial 56 with value: 0.0017683455690155395.[0m
[32m[I 2022-11-07 20:20:21,099][0m Trial 151 finished with value: 0.001791594079961451 and parameters: {'nlayers': 42, 'hidden_size': 144, 'dropout': 0.2107768487020882, 'learning_rate': 0.003527839626349769, 'batch_size': 9863, 'optimizer_name': 'Adam'}. Best is trial 56 with value: 0.0017683455690155395.[0m
[32m[I 2022-11-07 20:21:04,821][0m Trial 152 finished with value: 0.001769943864527482 and parameters: {'nlayers': 51, 'hidden_size': 156, 'dropout': 0.17655235097301689, 'learning_rate': 0.0031122542768614743, 'batch_size': 9999, 'optimizer_name': 'Adam'}. Best is trial 56 with value: 0.0017683455690155395.[0m
[32m[I 2022-11-07 20:21:51,797][0m Trial 153 finished with value: 0.0017812042380997855 and parameters: {'nlayers': 56, 'hidden_size': 157, 'dropout': 0.177086561851454, 'learning_rate': 0.0030645554236709022, 'batch_size': 9987, 'optimizer_name': 'Adam'}. Best is trial 56 with value: 0.0017683455690155395.[0m
[32m[I 2022-11-07 20:22:31,666][0m Trial 154 finished with value: 0.001834824352409664 and parameters: {'nlayers': 45, 'hidden_size': 168, 'dropout': 0.16221199707845196, 'learning_rate': 0.0028526269869173842, 'batch_size': 9651, 'optimizer_name': 'Adam'}. Best is trial 56 with value: 0.0017683455690155395.[0m
[32m[I 2022-11-07 20:23:15,710][0m Trial 155 finished with value: 0.0018043851035099837 and parameters: {'nlayers': 51, 'hidden_size': 162, 'dropout': 0.17126236767716663, 'learning_rate': 0.0018986159937741413, 'batch_size': 9816, 'optimizer_name': 'Adam'}. Best is trial 56 with value: 0.0017683455690155395.[0m
[32m[I 2022-11-07 20:23:57,064][0m Trial 156 finished with value: 0.0017723009708667426 and parameters: {'nlayers': 53, 'hidden_size': 138, 'dropout': 0.19013494828475794, 'learning_rate': 0.0037519837855110516, 'batch_size': 9998, 'optimizer_name': 'Adam'}. Best is trial 56 with value: 0.0017683455690155395.[0m
[32m[I 2022-11-07 20:24:40,300][0m Trial 157 finished with value: 0.0018625743769337016 and parameters: {'nlayers': 57, 'hidden_size': 153, 'dropout': 0.1986186958943853, 'learning_rate': 0.0032129895771119696, 'batch_size': 9519, 'optimizer_name': 'Adam'}. Best is trial 56 with value: 0.0017683455690155395.[0m
[32m[I 2022-11-07 20:25:26,692][0m Trial 158 finished with value: 0.0019229713338151122 and parameters: {'nlayers': 53, 'hidden_size': 182, 'dropout': 0.18842786389451865, 'learning_rate': 0.0035332318613499223, 'batch_size': 9191, 'optimizer_name': 'Adam'}. Best is trial 56 with value: 0.0017683455690155395.[0m
[32m[I 2022-11-07 20:25:36,246][0m Trial 159 finished with value: 0.009425190078531712 and parameters: {'nlayers': 62, 'hidden_size': 148, 'dropout': 0.12390664179036465, 'learning_rate': 0.0029995081251310827, 'batch_size': 1892, 'optimizer_name': 'RMSprop'}. Best is trial 56 with value: 0.0017683455690155395.[0m
[32m[I 2022-11-07 20:26:10,001][0m Trial 160 finished with value: 0.0018083257287591498 and parameters: {'nlayers': 58, 'hidden_size': 112, 'dropout': 0.18043825672123665, 'learning_rate': 0.0027137283455101143, 'batch_size': 9787, 'optimizer_name': 'Adam'}. Best is trial 56 with value: 0.0017683455690155395.[0m
[32m[I 2022-11-07 20:26:49,179][0m Trial 161 finished with value: 0.0017774346317533001 and parameters: {'nlayers': 49, 'hidden_size': 135, 'dropout': 0.15597568430074926, 'learning_rate': 0.003731343978742778, 'batch_size': 9973, 'optimizer_name': 'Adam'}. Best is trial 56 with value: 0.0017683455690155395.[0m
[32m[I 2022-11-07 20:27:25,278][0m Trial 162 finished with value: 0.0017753775641329592 and parameters: {'nlayers': 53, 'hidden_size': 128, 'dropout': 0.205697357202097, 'learning_rate': 0.0015910360804765747, 'batch_size': 9993, 'optimizer_name': 'Adam'}. Best is trial 56 with value: 0.0017683455690155395.[0m
[32m[I 2022-11-07 20:28:01,824][0m Trial 163 finished with value: 0.0018258990421776175 and parameters: {'nlayers': 43, 'hidden_size': 139, 'dropout': 0.14564728817592323, 'learning_rate': 0.003263970271632338, 'batch_size': 9715, 'optimizer_name': 'Adam'}. Best is trial 56 with value: 0.0017683455690155395.[0m
[32m[I 2022-11-07 20:28:35,901][0m Trial 164 finished with value: 0.0018617436485258501 and parameters: {'nlayers': 48, 'hidden_size': 121, 'dropout': 0.16953617079848182, 'learning_rate': 0.0025209278618269363, 'batch_size': 9529, 'optimizer_name': 'Adam'}. Best is trial 56 with value: 0.0017683455690155395.[0m
[32m[I 2022-11-07 20:29:00,584][0m Trial 165 finished with value: 0.0018148075455531269 and parameters: {'nlayers': 18, 'hidden_size': 144, 'dropout': 0.18539282168185037, 'learning_rate': 0.0013809898955716912, 'batch_size': 9791, 'optimizer_name': 'Adam'}. Best is trial 56 with value: 0.0017683455690155395.[0m
[32m[I 2022-11-07 20:29:44,423][0m Trial 166 finished with value: 0.0017784876734018326 and parameters: {'nlayers': 51, 'hidden_size': 155, 'dropout': 0.1773498547447685, 'learning_rate': 0.001956798553476409, 'batch_size': 10000, 'optimizer_name': 'Adam'}. Best is trial 56 with value: 0.0017683455690155395.[0m
[32m[I 2022-11-07 20:30:13,286][0m Trial 167 finished with value: 0.0018417855398627971 and parameters: {'nlayers': 22, 'hidden_size': 166, 'dropout': 0.19524479148211799, 'learning_rate': 0.00291219317758264, 'batch_size': 9637, 'optimizer_name': 'Adam'}. Best is trial 56 with value: 0.0017683455690155395.[0m
[32m[I 2022-11-07 20:30:38,125][0m Trial 168 finished with value: 0.0018837611997223791 and parameters: {'nlayers': 15, 'hidden_size': 174, 'dropout': 0.1608008416488129, 'learning_rate': 0.0011157326010533476, 'batch_size': 9412, 'optimizer_name': 'RMSprop'}. Best is trial 56 with value: 0.0017683455690155395.[0m
[32m[I 2022-11-07 20:31:14,123][0m Trial 169 finished with value: 0.0018035388819061884 and parameters: {'nlayers': 40, 'hidden_size': 150, 'dropout': 0.1342054408180279, 'learning_rate': 0.003677679781061178, 'batch_size': 9797, 'optimizer_name': 'Adam'}. Best is trial 56 with value: 0.0017683455690155395.[0m
[32m[I 2022-11-07 20:31:50,022][0m Trial 170 finished with value: 0.0017747737975520215 and parameters: {'nlayers': 45, 'hidden_size': 132, 'dropout': 0.15421634060994865, 'learning_rate': 0.0024527342352906067, 'batch_size': 9998, 'optimizer_name': 'SGD'}. Best is trial 56 with value: 0.0017683455690155395.[0m
[32m[I 2022-11-07 20:32:24,906][0m Trial 171 finished with value: 0.00185793714191887 and parameters: {'nlayers': 44, 'hidden_size': 133, 'dropout': 0.14627924884184, 'learning_rate': 0.0024099553088450113, 'batch_size': 9769, 'optimizer_name': 'SGD'}. Best is trial 56 with value: 0.0017683455690155395.[0m
[32m[I 2022-11-07 20:32:56,005][0m Trial 172 finished with value: 0.001914465180600142 and parameters: {'nlayers': 46, 'hidden_size': 128, 'dropout': 0.1558159144253836, 'learning_rate': 0.0027804302518381445, 'batch_size': 9588, 'optimizer_name': 'SGD'}. Best is trial 56 with value: 0.0017683455690155395.[0m
[32m[I 2022-11-07 20:33:35,977][0m Trial 173 finished with value: 0.0018026857858754368 and parameters: {'nlayers': 50, 'hidden_size': 139, 'dropout': 0.1669253098799972, 'learning_rate': 0.0022378174193122225, 'batch_size': 9998, 'optimizer_name': 'SGD'}. Best is trial 56 with value: 0.0017683455690155395.[0m
[32m[I 2022-11-07 20:34:12,749][0m Trial 174 finished with value: 0.0018929302127410307 and parameters: {'nlayers': 42, 'hidden_size': 161, 'dropout': 0.11952105734783422, 'learning_rate': 0.0016528483270033469, 'batch_size': 9389, 'optimizer_name': 'SGD'}. Best is trial 56 with value: 0.0017683455690155395.[0m
[32m[I 2022-11-07 20:34:52,043][0m Trial 175 finished with value: 0.0018555919945240022 and parameters: {'nlayers': 48, 'hidden_size': 145, 'dropout': 0.14202922183052863, 'learning_rate': 0.003103532456601055, 'batch_size': 10000, 'optimizer_name': 'SGD'}. Best is trial 56 with value: 0.0017683455690155395.[0m
[32m[I 2022-11-07 20:35:37,894][0m Trial 176 finished with value: 0.001816575497672439 and parameters: {'nlayers': 46, 'hidden_size': 179, 'dropout': 0.13247512558833527, 'learning_rate': 0.0009259904571427644, 'batch_size': 9773, 'optimizer_name': 'Adam'}. Best is trial 56 with value: 0.0017683455690155395.[0m
[32m[I 2022-11-07 20:36:08,920][0m Trial 177 finished with value: 0.0018446049782612733 and parameters: {'nlayers': 40, 'hidden_size': 115, 'dropout': 0.15097283059623487, 'learning_rate': 0.002037149275413385, 'batch_size': 9628, 'optimizer_name': 'Adam'}. Best is trial 56 with value: 0.0017683455690155395.[0m
[32m[I 2022-11-07 20:36:37,060][0m Trial 178 finished with value: 0.001802931439277588 and parameters: {'nlayers': 25, 'hidden_size': 140, 'dropout': 0.17842906989953028, 'learning_rate': 0.0025823311071574593, 'batch_size': 9792, 'optimizer_name': 'RMSprop'}. Best is trial 56 with value: 0.0017683455690155395.[0m
[32m[I 2022-11-07 20:37:00,067][0m Trial 179 finished with value: 0.0025314029984226305 and parameters: {'nlayers': 54, 'hidden_size': 123, 'dropout': 0.16877222967384103, 'learning_rate': 0.004124751747276506, 'batch_size': 6983, 'optimizer_name': 'Adam'}. Best is trial 56 with value: 0.0017683455690155395.[0m
[32m[I 2022-11-07 20:37:32,265][0m Trial 180 finished with value: 0.0017749333169439076 and parameters: {'nlayers': 44, 'hidden_size': 89, 'dropout': 0.1535368047603725, 'learning_rate': 0.003397044830057112, 'batch_size': 9999, 'optimizer_name': 'Adam'}. Best is trial 56 with value: 0.0017683455690155395.[0m
[32m[I 2022-11-07 20:38:03,316][0m Trial 181 finished with value: 0.0018057142801702138 and parameters: {'nlayers': 44, 'hidden_size': 90, 'dropout': 0.1582892431622152, 'learning_rate': 0.0034294214845810066, 'batch_size': 9803, 'optimizer_name': 'Adam'}. Best is trial 56 with value: 0.0017683455690155395.[0m
[32m[I 2022-11-07 20:38:30,428][0m Trial 182 finished with value: 0.0018511403387419625 and parameters: {'nlayers': 37, 'hidden_size': 73, 'dropout': 0.12530465225522638, 'learning_rate': 0.0031495422922545075, 'batch_size': 9577, 'optimizer_name': 'Adam'}. Best is trial 56 with value: 0.0017683455690155395.[0m
[32m[I 2022-11-07 20:39:00,940][0m Trial 183 finished with value: 0.00179790375727171 and parameters: {'nlayers': 41, 'hidden_size': 102, 'dropout': 0.18918074773149116, 'learning_rate': 0.0038700293309865616, 'batch_size': 9841, 'optimizer_name': 'Adam'}. Best is trial 56 with value: 0.0017683455690155395.[0m
[32m[I 2022-11-07 20:39:32,230][0m Trial 184 finished with value: 0.001774038695195246 and parameters: {'nlayers': 44, 'hidden_size': 84, 'dropout': 0.14454635648755343, 'learning_rate': 0.0068258178749167646, 'batch_size': 9983, 'optimizer_name': 'Adam'}. Best is trial 56 with value: 0.0017683455690155395.[0m
[32m[I 2022-11-07 20:39:35,003][0m Trial 185 finished with value: 0.07295119959460802 and parameters: {'nlayers': 47, 'hidden_size': 82, 'dropout': 0.14337169479070502, 'learning_rate': 0.00610679927801425, 'batch_size': 242, 'optimizer_name': 'Adam'}. Best is trial 56 with value: 0.0017683455690155395.[0m
[32m[I 2022-11-07 20:40:06,163][0m Trial 186 finished with value: 0.0018891916839405497 and parameters: {'nlayers': 52, 'hidden_size': 86, 'dropout': 0.13594050068846453, 'learning_rate': 0.007910171803703847, 'batch_size': 9374, 'optimizer_name': 'Adam'}. Best is trial 56 with value: 0.0017683455690155395.[0m
[32m[I 2022-11-07 20:40:34,621][0m Trial 187 finished with value: 0.0018393644354015824 and parameters: {'nlayers': 44, 'hidden_size': 96, 'dropout': 0.12883623325856838, 'learning_rate': 0.002891234938394023, 'batch_size': 9636, 'optimizer_name': 'Adam'}. Best is trial 56 with value: 0.0017683455690155395.[0m
[32m[I 2022-11-07 20:40:59,346][0m Trial 188 finished with value: 0.00177783984541893 and parameters: {'nlayers': 20, 'hidden_size': 89, 'dropout': 0.11559578939906724, 'learning_rate': 0.0034187774748195014, 'batch_size': 10000, 'optimizer_name': 'RMSprop'}. Best is trial 56 with value: 0.0017683455690155395.[0m
[32m[I 2022-11-07 20:41:45,290][0m Trial 189 finished with value: 0.0018074893705211053 and parameters: {'nlayers': 50, 'hidden_size': 170, 'dropout': 0.15183609696011102, 'learning_rate': 0.007132901085409487, 'batch_size': 9829, 'optimizer_name': 'Adam'}. Best is trial 56 with value: 0.0017683455690155395.[0m
[32m[I 2022-11-07 20:42:06,267][0m Trial 190 finished with value: 0.0018775892081861788 and parameters: {'nlayers': 16, 'hidden_size': 82, 'dropout': 0.13946461959416542, 'learning_rate': 0.002633750247357287, 'batch_size': 9424, 'optimizer_name': 'Adam'}. Best is trial 56 with value: 0.0017683455690155395.[0m
[32m[I 2022-11-07 20:42:38,831][0m Trial 191 finished with value: 0.0017743887026023216 and parameters: {'nlayers': 43, 'hidden_size': 107, 'dropout': 0.16553944105323415, 'learning_rate': 0.0023289933215963044, 'batch_size': 9994, 'optimizer_name': 'Adam'}. Best is trial 56 with value: 0.0017683455690155395.[0m
[32m[I 2022-11-07 20:43:11,446][0m Trial 192 finished with value: 0.0017685352622329054 and parameters: {'nlayers': 43, 'hidden_size': 107, 'dropout': 0.15805072082872373, 'learning_rate': 0.0024125911620828636, 'batch_size': 9990, 'optimizer_name': 'Adam'}. Best is trial 56 with value: 0.0017683455690155395.[0m
[32m[I 2022-11-07 20:43:41,298][0m Trial 193 finished with value: 0.001823589559433015 and parameters: {'nlayers': 38, 'hidden_size': 109, 'dropout': 0.16431669350381425, 'learning_rate': 0.002309309254860465, 'batch_size': 9690, 'optimizer_name': 'Adam'}. Best is trial 56 with value: 0.0017683455690155395.[0m
[32m[I 2022-11-07 20:44:14,128][0m Trial 194 finished with value: 0.0018061335935751857 and parameters: {'nlayers': 47, 'hidden_size': 95, 'dropout': 0.17321483336309268, 'learning_rate': 0.0022029443465600776, 'batch_size': 9824, 'optimizer_name': 'Adam'}. Best is trial 56 with value: 0.0017683455690155395.[0m
[32m[I 2022-11-07 20:44:37,015][0m Trial 195 finished with value: 0.001767993638185369 and parameters: {'nlayers': 13, 'hidden_size': 106, 'dropout': 0.15800444179021572, 'learning_rate': 0.00247071909050744, 'batch_size': 9996, 'optimizer_name': 'Adam'}. Best is trial 195 with value: 0.001767993638185369.[0m
[32m[I 2022-11-07 20:45:17,541][0m Trial 196 finished with value: 0.0018472448488490794 and parameters: {'nlayers': 23, 'hidden_size': 288, 'dropout': 0.18209711886877109, 'learning_rate': 0.0020671078116676787, 'batch_size': 9592, 'optimizer_name': 'Adam'}. Best is trial 195 with value: 0.001767993638185369.[0m
[32m[I 2022-11-07 20:45:39,651][0m Trial 197 finished with value: 0.0018044945859773454 and parameters: {'nlayers': 12, 'hidden_size': 100, 'dropout': 0.16215270886433003, 'learning_rate': 0.002670305347682147, 'batch_size': 9846, 'optimizer_name': 'Adam'}. Best is trial 195 with value: 0.001767993638185369.[0m
[32m[I 2022-11-07 20:46:01,328][0m Trial 198 finished with value: 0.0018323357416802507 and parameters: {'nlayers': 18, 'hidden_size': 50, 'dropout': 0.14692346727466984, 'learning_rate': 0.0024642721670367317, 'batch_size': 9696, 'optimizer_name': 'Adam'}. Best is trial 195 with value: 0.001767993638185369.[0m
[32m[I 2022-11-07 20:46:20,605][0m Trial 199 finished with value: 0.0018727802306016455 and parameters: {'nlayers': 9, 'hidden_size': 104, 'dropout': 0.19095223027213917, 'learning_rate': 0.0027883619530735602, 'batch_size': 9454, 'optimizer_name': 'Adam'}. Best is trial 195 with value: 0.001767993638185369.[0m
[32m[I 2022-11-07 20:46:43,179][0m Trial 200 finished with value: 0.0018070937870477732 and parameters: {'nlayers': 13, 'hidden_size': 107, 'dropout': 0.1750018720446076, 'learning_rate': 0.0018098703743595936, 'batch_size': 9830, 'optimizer_name': 'Adam'}. Best is trial 195 with value: 0.001767993638185369.[0m
[32m[I 2022-11-07 20:47:06,751][0m Trial 201 finished with value: 0.001773587181693127 and parameters: {'nlayers': 15, 'hidden_size': 120, 'dropout': 0.15738608537565105, 'learning_rate': 0.0024573583133769158, 'batch_size': 9996, 'optimizer_name': 'Adam'}. Best is trial 195 with value: 0.001767993638185369.[0m
[32m[I 2022-11-07 20:47:30,743][0m Trial 202 finished with value: 0.0017703708254917822 and parameters: {'nlayers': 15, 'hidden_size': 114, 'dropout': 0.1581997292158288, 'learning_rate': 0.0022616199663230384, 'batch_size': 9999, 'optimizer_name': 'Adam'}. Best is trial 195 with value: 0.001767993638185369.[0m
[32m[I 2022-11-07 20:47:55,165][0m Trial 203 finished with value: 0.0017783355138402414 and parameters: {'nlayers': 15, 'hidden_size': 114, 'dropout': 0.1615955225326152, 'learning_rate': 0.0023136541214839037, 'batch_size': 9981, 'optimizer_name': 'Adam'}. Best is trial 195 with value: 0.001767993638185369.[0m
[32m[I 2022-11-07 20:48:19,598][0m Trial 204 finished with value: 0.0017783386945724488 and parameters: {'nlayers': 16, 'hidden_size': 117, 'dropout': 0.1575036089104706, 'learning_rate': 0.0020617183367570508, 'batch_size': 10000, 'optimizer_name': 'Adam'}. Best is trial 195 with value: 0.001767993638185369.[0m
[32m[I 2022-11-07 20:48:41,284][0m Trial 205 finished with value: 0.0018445939459041834 and parameters: {'nlayers': 11, 'hidden_size': 121, 'dropout': 0.16906283767838362, 'learning_rate': 0.0024493089518728656, 'batch_size': 9645, 'optimizer_name': 'Adam'}. Best is trial 195 with value: 0.001767993638185369.[0m
[32m[I 2022-11-07 20:49:03,228][0m Trial 206 finished with value: 0.0018114364445666361 and parameters: {'nlayers': 12, 'hidden_size': 101, 'dropout': 0.1448908736700623, 'learning_rate': 0.0022578314369970055, 'batch_size': 9785, 'optimizer_name': 'Adam'}. Best is trial 195 with value: 0.001767993638185369.[0m
