[32m[I 2022-11-08 09:26:26,133][0m Trial 1656 finished with value: 0.001801450620878994 and parameters: {'nlayers': 74, 'hidden_size': 13, 'dropout': 0.19921192609292515, 'learning_rate': 0.007306713792829034, 'batch_size': 9832, 'optimizer_name': 'Adam'}. Best is trial 1569 with value: 0.001761963053552708.[0m
[32m[I 2022-11-08 09:27:01,854][0m Trial 1657 finished with value: 0.0017711416032998018 and parameters: {'nlayers': 76, 'hidden_size': 45, 'dropout': 0.18038904136875927, 'learning_rate': 0.00799597808598647, 'batch_size': 9994, 'optimizer_name': 'Adam'}. Best is trial 1569 with value: 0.001761963053552708.[0m
[32m[I 2022-11-08 09:27:43,338][0m Trial 1658 finished with value: 0.0017740161633772907 and parameters: {'nlayers': 72, 'hidden_size': 92, 'dropout': 0.3074125512342031, 'learning_rate': 0.007842216314415161, 'batch_size': 9998, 'optimizer_name': 'Adam'}. Best is trial 1569 with value: 0.001761963053552708.[0m
[32m[I 2022-11-08 09:28:16,213][0m Trial 1659 finished with value: 0.001842039229220872 and parameters: {'nlayers': 75, 'hidden_size': 35, 'dropout': 0.19073911669550356, 'learning_rate': 0.007814674852876962, 'batch_size': 9618, 'optimizer_name': 'Adam'}. Best is trial 1569 with value: 0.001761963053552708.[0m
[32m[I 2022-11-08 09:28:45,199][0m Trial 1660 finished with value: 0.0019182392006717728 and parameters: {'nlayers': 69, 'hidden_size': 34, 'dropout': 0.3918704792943279, 'learning_rate': 0.007665902729532652, 'batch_size': 9210, 'optimizer_name': 'Adam'}. Best is trial 1569 with value: 0.001761963053552708.[0m
[32m[I 2022-11-08 09:29:17,353][0m Trial 1661 finished with value: 0.001775337317200226 and parameters: {'nlayers': 74, 'hidden_size': 22, 'dropout': 0.1870791738501139, 'learning_rate': 0.007793297302124788, 'batch_size': 9998, 'optimizer_name': 'Adam'}. Best is trial 1569 with value: 0.001761963053552708.[0m
[32m[I 2022-11-08 09:29:51,279][0m Trial 1662 finished with value: 0.0018293104636425371 and parameters: {'nlayers': 78, 'hidden_size': 35, 'dropout': 0.18216606941875907, 'learning_rate': 0.008012528737133044, 'batch_size': 9682, 'optimizer_name': 'Adam'}. Best is trial 1569 with value: 0.001761963053552708.[0m
[32m[I 2022-11-08 09:31:31,591][0m Trial 1663 finished with value: 0.0018673079624454427 and parameters: {'nlayers': 79, 'hidden_size': 283, 'dropout': 0.18248373769689782, 'learning_rate': 0.00835200004563784, 'batch_size': 9523, 'optimizer_name': 'Adam'}. Best is trial 1569 with value: 0.001761963053552708.[0m
[32m[I 2022-11-08 09:32:03,048][0m Trial 1664 finished with value: 0.0018048136638436154 and parameters: {'nlayers': 73, 'hidden_size': 80, 'dropout': 0.4115920686197132, 'learning_rate': 0.007384450928774346, 'batch_size': 9834, 'optimizer_name': 'RMSprop'}. Best is trial 1569 with value: 0.001761963053552708.[0m
[32m[I 2022-11-08 09:32:43,040][0m Trial 1665 finished with value: 0.0017757955599508421 and parameters: {'nlayers': 76, 'hidden_size': 98, 'dropout': 0.20385949614265364, 'learning_rate': 0.0074301104548904, 'batch_size': 9998, 'optimizer_name': 'Adam'}. Best is trial 1569 with value: 0.001761963053552708.[0m
[32m[I 2022-11-08 09:33:16,225][0m Trial 1666 finished with value: 0.0018299808308072612 and parameters: {'nlayers': 72, 'hidden_size': 43, 'dropout': 0.17839746979841803, 'learning_rate': 0.007128717444905092, 'batch_size': 9678, 'optimizer_name': 'Adam'}. Best is trial 1569 with value: 0.001761963053552708.[0m
[32m[I 2022-11-08 09:33:47,141][0m Trial 1667 finished with value: 0.0017752614521365042 and parameters: {'nlayers': 79, 'hidden_size': 40, 'dropout': 0.13099458584828588, 'learning_rate': 0.007609450408243205, 'batch_size': 9998, 'optimizer_name': 'Adam'}. Best is trial 1569 with value: 0.001761963053552708.[0m
[32m[I 2022-11-08 09:34:17,261][0m Trial 1668 finished with value: 0.0018066314519709018 and parameters: {'nlayers': 75, 'hidden_size': 40, 'dropout': 0.4037427180533609, 'learning_rate': 0.007278952063059672, 'batch_size': 9813, 'optimizer_name': 'Adam'}. Best is trial 1569 with value: 0.001761963053552708.[0m
[32m[I 2022-11-08 09:34:48,844][0m Trial 1669 finished with value: 0.0018763587086787683 and parameters: {'nlayers': 72, 'hidden_size': 37, 'dropout': 0.17672619902295744, 'learning_rate': 0.008958123423403925, 'batch_size': 9456, 'optimizer_name': 'Adam'}. Best is trial 1569 with value: 0.001761963053552708.[0m
[32m[I 2022-11-08 09:35:21,457][0m Trial 1670 finished with value: 0.001840102695989934 and parameters: {'nlayers': 70, 'hidden_size': 47, 'dropout': 0.46198947824590364, 'learning_rate': 0.001382843313165043, 'batch_size': 9674, 'optimizer_name': 'Adam'}. Best is trial 1569 with value: 0.001761963053552708.[0m
[32m[I 2022-11-08 09:35:55,037][0m Trial 1671 finished with value: 0.0017909817859376018 and parameters: {'nlayers': 76, 'hidden_size': 34, 'dropout': 0.4716928713239509, 'learning_rate': 0.007990647237114122, 'batch_size': 9842, 'optimizer_name': 'Adam'}. Best is trial 1569 with value: 0.001761963053552708.[0m
[32m[I 2022-11-08 09:36:26,924][0m Trial 1672 finished with value: 0.0019073778346571065 and parameters: {'nlayers': 73, 'hidden_size': 52, 'dropout': 0.17303546999316358, 'learning_rate': 0.006955148748927807, 'batch_size': 9281, 'optimizer_name': 'Adam'}. Best is trial 1569 with value: 0.001761963053552708.[0m
[32m[I 2022-11-08 09:37:05,837][0m Trial 1673 finished with value: 0.0018010287004587204 and parameters: {'nlayers': 76, 'hidden_size': 73, 'dropout': 0.4875473511847996, 'learning_rate': 0.007640125089877929, 'batch_size': 9817, 'optimizer_name': 'Adam'}. Best is trial 1569 with value: 0.001761963053552708.[0m
[32m[I 2022-11-08 09:37:35,222][0m Trial 1674 finished with value: 0.0018359079936973706 and parameters: {'nlayers': 70, 'hidden_size': 26, 'dropout': 0.13834596373295366, 'learning_rate': 0.007340596953196971, 'batch_size': 9669, 'optimizer_name': 'SGD'}. Best is trial 1569 with value: 0.001761963053552708.[0m
[32m[I 2022-11-08 09:38:05,121][0m Trial 1675 finished with value: 0.0018043089633346101 and parameters: {'nlayers': 73, 'hidden_size': 40, 'dropout': 0.37552466963770437, 'learning_rate': 0.0069581619611086085, 'batch_size': 9813, 'optimizer_name': 'Adam'}. Best is trial 1569 with value: 0.001761963053552708.[0m
[32m[I 2022-11-08 09:38:38,956][0m Trial 1676 finished with value: 0.0017733067122056173 and parameters: {'nlayers': 71, 'hidden_size': 43, 'dropout': 0.39769886721749137, 'learning_rate': 0.007692642042455179, 'batch_size': 9997, 'optimizer_name': 'RMSprop'}. Best is trial 1569 with value: 0.001761963053552708.[0m
[32m[I 2022-11-08 09:38:59,908][0m Trial 1677 finished with value: 0.001845873315111231 and parameters: {'nlayers': 20, 'hidden_size': 10, 'dropout': 0.1739137130326144, 'learning_rate': 0.006590364343970152, 'batch_size': 9565, 'optimizer_name': 'Adam'}. Best is trial 1569 with value: 0.001761963053552708.[0m
[32m[I 2022-11-08 09:39:42,161][0m Trial 1678 finished with value: 0.0017984302197655009 and parameters: {'nlayers': 74, 'hidden_size': 103, 'dropout': 0.41134988913086956, 'learning_rate': 0.007159172649711467, 'batch_size': 9832, 'optimizer_name': 'Adam'}. Best is trial 1569 with value: 0.001761963053552708.[0m
[32m[I 2022-11-08 09:40:23,247][0m Trial 1679 finished with value: 0.0017760463430061652 and parameters: {'nlayers': 73, 'hidden_size': 86, 'dropout': 0.4191631859126519, 'learning_rate': 0.007834696578628704, 'batch_size': 9998, 'optimizer_name': 'Adam'}. Best is trial 1569 with value: 0.001761963053552708.[0m
[32m[I 2022-11-08 09:41:05,930][0m Trial 1680 finished with value: 0.001870275494464791 and parameters: {'nlayers': 78, 'hidden_size': 110, 'dropout': 0.19025370484365825, 'learning_rate': 0.007302436175480294, 'batch_size': 9467, 'optimizer_name': 'Adam'}. Best is trial 1569 with value: 0.001761963053552708.[0m
[32m[I 2022-11-08 09:41:30,945][0m Trial 1681 finished with value: 0.0018385521891985416 and parameters: {'nlayers': 9, 'hidden_size': 232, 'dropout': 0.1867988408915734, 'learning_rate': 0.007524563463271104, 'batch_size': 9676, 'optimizer_name': 'Adam'}. Best is trial 1569 with value: 0.001761963053552708.[0m
[32m[I 2022-11-08 09:41:54,401][0m Trial 1682 finished with value: 0.0018036864803362364 and parameters: {'nlayers': 26, 'hidden_size': 25, 'dropout': 0.12896876908451166, 'learning_rate': 0.008126280439685331, 'batch_size': 9823, 'optimizer_name': 'Adam'}. Best is trial 1569 with value: 0.001761963053552708.[0m
[32m[I 2022-11-08 09:42:42,699][0m Trial 1683 finished with value: 0.001827136364402081 and parameters: {'nlayers': 38, 'hidden_size': 221, 'dropout': 0.48043723535672095, 'learning_rate': 0.007326792780592689, 'batch_size': 9675, 'optimizer_name': 'Adam'}. Best is trial 1569 with value: 0.001761963053552708.[0m
[32m[I 2022-11-08 09:43:04,069][0m Trial 1684 finished with value: 0.0018942161862907745 and parameters: {'nlayers': 18, 'hidden_size': 96, 'dropout': 0.4165182354764168, 'learning_rate': 0.0017991301894208468, 'batch_size': 9362, 'optimizer_name': 'Adam'}. Best is trial 1569 with value: 0.001761963053552708.[0m
[32m[I 2022-11-08 09:43:25,468][0m Trial 1685 finished with value: 0.0018031917635253606 and parameters: {'nlayers': 15, 'hidden_size': 25, 'dropout': 0.20378702815168526, 'learning_rate': 0.0077974363386483555, 'batch_size': 9826, 'optimizer_name': 'Adam'}. Best is trial 1569 with value: 0.001761963053552708.[0m
[32m[I 2022-11-08 09:44:03,218][0m Trial 1686 finished with value: 0.0017786920070648193 and parameters: {'nlayers': 77, 'hidden_size': 55, 'dropout': 0.1711738389311218, 'learning_rate': 0.0019444273815029545, 'batch_size': 9993, 'optimizer_name': 'Adam'}. Best is trial 1569 with value: 0.001761963053552708.[0m
[32m[I 2022-11-08 09:44:40,876][0m Trial 1687 finished with value: 0.0018556134292806148 and parameters: {'nlayers': 72, 'hidden_size': 104, 'dropout': 0.13913488699750393, 'learning_rate': 0.007657275907139604, 'batch_size': 9555, 'optimizer_name': 'Adam'}. Best is trial 1569 with value: 0.001761963053552708.[0m
[32m[I 2022-11-08 09:45:01,930][0m Trial 1688 finished with value: 0.0017711069836215377 and parameters: {'nlayers': 11, 'hidden_size': 18, 'dropout': 0.1499242723050028, 'learning_rate': 0.0061783448302129874, 'batch_size': 9997, 'optimizer_name': 'RMSprop'}. Best is trial 1569 with value: 0.001761963053552708.[0m
[32m[I 2022-11-08 09:45:36,072][0m Trial 1689 finished with value: 0.0018376977477198816 and parameters: {'nlayers': 84, 'hidden_size': 31, 'dropout': 0.16278772581187922, 'learning_rate': 0.0016826668114288477, 'batch_size': 9678, 'optimizer_name': 'Adam'}. Best is trial 1569 with value: 0.001761963053552708.[0m
[32m[I 2022-11-08 09:46:09,172][0m Trial 1690 finished with value: 0.001772377372825457 and parameters: {'nlayers': 45, 'hidden_size': 90, 'dropout': 0.4060490867054668, 'learning_rate': 0.0021084730429438954, 'batch_size': 9997, 'optimizer_name': 'Adam'}. Best is trial 1569 with value: 0.001761963053552708.[0m
[32m[I 2022-11-08 09:46:29,547][0m Trial 1691 finished with value: 0.0018024005789985687 and parameters: {'nlayers': 6, 'hidden_size': 97, 'dropout': 0.14347735371831616, 'learning_rate': 0.007060240478414134, 'batch_size': 9832, 'optimizer_name': 'Adam'}. Best is trial 1569 with value: 0.001761963053552708.[0m
[32m[I 2022-11-08 09:46:51,414][0m Trial 1692 finished with value: 0.001849221800674432 and parameters: {'nlayers': 15, 'hidden_size': 112, 'dropout': 0.1542689905572659, 'learning_rate': 0.0012210774604325214, 'batch_size': 9551, 'optimizer_name': 'Adam'}. Best is trial 1569 with value: 0.001761963053552708.[0m
[32m[I 2022-11-08 09:47:14,486][0m Trial 1693 finished with value: 0.0018059635582778593 and parameters: {'nlayers': 18, 'hidden_size': 80, 'dropout': 0.12362944198242494, 'learning_rate': 0.0009567361097336982, 'batch_size': 9839, 'optimizer_name': 'Adam'}. Best is trial 1569 with value: 0.001761963053552708.[0m
[32m[I 2022-11-08 09:47:34,629][0m Trial 1694 finished with value: 0.0018560425474141839 and parameters: {'nlayers': 12, 'hidden_size': 31, 'dropout': 0.16799641376634789, 'learning_rate': 0.00671064151752524, 'batch_size': 9677, 'optimizer_name': 'SGD'}. Best is trial 1569 with value: 0.001761963053552708.[0m
[32m[I 2022-11-08 09:47:56,997][0m Trial 1695 finished with value: 0.0018048410535891081 and parameters: {'nlayers': 22, 'hidden_size': 29, 'dropout': 0.3900182240162568, 'learning_rate': 0.0019025239922538973, 'batch_size': 9815, 'optimizer_name': 'Adam'}. Best is trial 1569 with value: 0.001761963053552708.[0m
[32m[I 2022-11-08 09:48:16,895][0m Trial 1696 finished with value: 0.0019055317762685748 and parameters: {'nlayers': 36, 'hidden_size': 16, 'dropout': 0.18287831655318113, 'learning_rate': 0.0003856607676824265, 'batch_size': 9283, 'optimizer_name': 'Adam'}. Best is trial 1569 with value: 0.001761963053552708.[0m
[32m[I 2022-11-08 09:48:48,670][0m Trial 1697 finished with value: 0.0018002206007057349 and parameters: {'nlayers': 40, 'hidden_size': 107, 'dropout': 0.4995558304728919, 'learning_rate': 0.008253506882898547, 'batch_size': 9828, 'optimizer_name': 'Adam'}. Best is trial 1569 with value: 0.001761963053552708.[0m
[32m[I 2022-11-08 09:49:11,055][0m Trial 1698 finished with value: 0.0017766761422157288 and parameters: {'nlayers': 10, 'hidden_size': 101, 'dropout': 0.4016680474608271, 'learning_rate': 0.0021246118447130575, 'batch_size': 10000, 'optimizer_name': 'Adam'}. Best is trial 1569 with value: 0.001761963053552708.[0m
[32m[I 2022-11-08 09:49:46,831][0m Trial 1699 finished with value: 0.001842374638465634 and parameters: {'nlayers': 68, 'hidden_size': 73, 'dropout': 0.3655515034944208, 'learning_rate': 0.00799277017165201, 'batch_size': 9651, 'optimizer_name': 'Adam'}. Best is trial 1569 with value: 0.001761963053552708.[0m
[32m[I 2022-11-08 09:50:14,676][0m Trial 1700 finished with value: 0.0018788594795986836 and parameters: {'nlayers': 43, 'hidden_size': 62, 'dropout': 0.16039060587115747, 'learning_rate': 0.0016315715392730859, 'batch_size': 9434, 'optimizer_name': 'Adam'}. Best is trial 1569 with value: 0.001761963053552708.[0m
[32m[I 2022-11-08 09:50:41,658][0m Trial 1701 finished with value: 0.0018022137340669836 and parameters: {'nlayers': 24, 'hidden_size': 116, 'dropout': 0.4191726777902959, 'learning_rate': 0.0020108492781787087, 'batch_size': 9830, 'optimizer_name': 'RMSprop'}. Best is trial 1569 with value: 0.001761963053552708.[0m
[32m[I 2022-11-08 09:51:03,707][0m Trial 1702 finished with value: 0.0018292540004598357 and parameters: {'nlayers': 13, 'hidden_size': 91, 'dropout': 0.1296201887190776, 'learning_rate': 0.007478720460610582, 'batch_size': 9662, 'optimizer_name': 'Adam'}. Best is trial 1569 with value: 0.001761963053552708.[0m
[32m[I 2022-11-08 09:52:25,044][0m Trial 1703 finished with value: 0.0018072055048790187 and parameters: {'nlayers': 71, 'hidden_size': 244, 'dropout': 0.3819574997433115, 'learning_rate': 0.002212954410687099, 'batch_size': 9826, 'optimizer_name': 'Adam'}. Best is trial 1569 with value: 0.001761963053552708.[0m
[32m[I 2022-11-08 09:52:46,238][0m Trial 1704 finished with value: 0.001853316557344966 and parameters: {'nlayers': 17, 'hidden_size': 52, 'dropout': 0.17608835234749368, 'learning_rate': 0.0015448212844763648, 'batch_size': 9550, 'optimizer_name': 'Adam'}. Best is trial 1569 with value: 0.001761963053552708.[0m
[32m[I 2022-11-08 09:53:04,199][0m Trial 1705 finished with value: 0.0019612089753414095 and parameters: {'nlayers': 3, 'hidden_size': 251, 'dropout': 0.15159078205233908, 'learning_rate': 0.0018106835949094672, 'batch_size': 9060, 'optimizer_name': 'Adam'}. Best is trial 1569 with value: 0.001761963053552708.[0m
[32m[I 2022-11-08 09:53:26,100][0m Trial 1706 finished with value: 0.0017698222037969438 and parameters: {'nlayers': 8, 'hidden_size': 99, 'dropout': 0.16853570723005046, 'learning_rate': 0.002242678586657741, 'batch_size': 9995, 'optimizer_name': 'Adam'}. Best is trial 1569 with value: 0.001761963053552708.[0m
[32m[I 2022-11-08 09:53:51,454][0m Trial 1707 finished with value: 0.0018036149536123504 and parameters: {'nlayers': 20, 'hidden_size': 108, 'dropout': 0.4251744790552447, 'learning_rate': 0.006886630312934172, 'batch_size': 9836, 'optimizer_name': 'Adam'}. Best is trial 1569 with value: 0.001761963053552708.[0m
[32m[I 2022-11-08 09:54:23,045][0m Trial 1708 finished with value: 0.001837718425719348 and parameters: {'nlayers': 47, 'hidden_size': 85, 'dropout': 0.14396093411694452, 'learning_rate': 0.002018216603206125, 'batch_size': 9663, 'optimizer_name': 'Adam'}. Best is trial 1569 with value: 0.001761963053552708.[0m
[32m[I 2022-11-08 09:54:42,972][0m Trial 1709 finished with value: 0.0018743024490311358 and parameters: {'nlayers': 14, 'hidden_size': 19, 'dropout': 0.13620366165646636, 'learning_rate': 0.0064076491411462775, 'batch_size': 9476, 'optimizer_name': 'Adam'}. Best is trial 1569 with value: 0.001761963053552708.[0m
[32m[I 2022-11-08 09:55:04,725][0m Trial 1710 finished with value: 0.0018024632861024174 and parameters: {'nlayers': 10, 'hidden_size': 68, 'dropout': 0.46188441241770767, 'learning_rate': 0.00233871614784652, 'batch_size': 9847, 'optimizer_name': 'Adam'}. Best is trial 1569 with value: 0.001761963053552708.[0m
[32m[I 2022-11-08 09:55:13,624][0m Trial 1711 finished with value: 0.003169619442733577 and parameters: {'nlayers': 16, 'hidden_size': 116, 'dropout': 0.15949106957141562, 'learning_rate': 0.0018238206085233188, 'batch_size': 5606, 'optimizer_name': 'Adam'}. Best is trial 1569 with value: 0.001761963053552708.[0m
[32m[I 2022-11-08 09:55:22,034][0m Trial 1712 finished with value: 0.004340304069484195 and parameters: {'nlayers': 12, 'hidden_size': 262, 'dropout': 0.12503227714534978, 'learning_rate': 0.0020388312214566075, 'batch_size': 4105, 'optimizer_name': 'Adam'}. Best is trial 1569 with value: 0.001761963053552708.[0m
[32m[I 2022-11-08 09:55:46,361][0m Trial 1713 finished with value: 0.0018041058602021771 and parameters: {'nlayers': 18, 'hidden_size': 94, 'dropout': 0.41070452892313375, 'learning_rate': 0.0012926166255872585, 'batch_size': 9834, 'optimizer_name': 'RMSprop'}. Best is trial 1569 with value: 0.001761963053552708.[0m
[32m[I 2022-11-08 09:56:16,587][0m Trial 1714 finished with value: 0.0018350562782758401 and parameters: {'nlayers': 45, 'hidden_size': 78, 'dropout': 0.1767677170754573, 'learning_rate': 0.0005671028898811505, 'batch_size': 9642, 'optimizer_name': 'Adam'}. Best is trial 1569 with value: 0.001761963053552708.[0m
[32m[I 2022-11-08 09:56:46,878][0m Trial 1715 finished with value: 0.0018338782027218163 and parameters: {'nlayers': 39, 'hidden_size': 103, 'dropout': 0.4736188600172221, 'learning_rate': 0.0071949202192555396, 'batch_size': 9824, 'optimizer_name': 'SGD'}. Best is trial 1569 with value: 0.001761963053552708.[0m
[32m[I 2022-11-08 09:57:25,712][0m Trial 1716 finished with value: 0.0018886488628957903 and parameters: {'nlayers': 80, 'hidden_size': 112, 'dropout': 0.16548975059473187, 'learning_rate': 0.0021415003513078307, 'batch_size': 9362, 'optimizer_name': 'Adam'}. Best is trial 1569 with value: 0.001761963053552708.[0m
[32m[I 2022-11-08 09:58:03,142][0m Trial 1717 finished with value: 0.001828497115064185 and parameters: {'nlayers': 75, 'hidden_size': 88, 'dropout': 0.397513019566594, 'learning_rate': 0.0024166681071406096, 'batch_size': 9670, 'optimizer_name': 'Adam'}. Best is trial 1569 with value: 0.001761963053552708.[0m
[32m[I 2022-11-08 09:58:44,281][0m Trial 1718 finished with value: 0.0017770642184047466 and parameters: {'nlayers': 67, 'hidden_size': 106, 'dropout': 0.15044506973627583, 'learning_rate': 0.0007517560399720569, 'batch_size': 9998, 'optimizer_name': 'Adam'}. Best is trial 1569 with value: 0.001761963053552708.[0m
[32m[I 2022-11-08 09:59:09,749][0m Trial 1719 finished with value: 0.0018053042664518202 and parameters: {'nlayers': 21, 'hidden_size': 98, 'dropout': 0.35691769458021066, 'learning_rate': 0.0048530294123709525, 'batch_size': 9840, 'optimizer_name': 'Adam'}. Best is trial 1569 with value: 0.001761963053552708.[0m
[32m[I 2022-11-08 09:59:16,909][0m Trial 1720 finished with value: 0.0035920697992057778 and parameters: {'nlayers': 15, 'hidden_size': 121, 'dropout': 0.41605225466976087, 'learning_rate': 0.0017330907114879105, 'batch_size': 4921, 'optimizer_name': 'Adam'}. Best is trial 1569 with value: 0.001761963053552708.[0m
[32m[I 2022-11-08 09:59:38,841][0m Trial 1721 finished with value: 0.0017776061405052055 and parameters: {'nlayers': 11, 'hidden_size': 47, 'dropout': 0.1576047442463237, 'learning_rate': 0.007850046053294065, 'batch_size': 9990, 'optimizer_name': 'Adam'}. Best is trial 1569 with value: 0.001761963053552708.[0m
[32m[I 2022-11-08 09:59:57,427][0m Trial 1722 finished with value: 0.0018714856394011566 and parameters: {'nlayers': 5, 'hidden_size': 61, 'dropout': 0.18746718796008605, 'learning_rate': 0.0019186212581975795, 'batch_size': 9504, 'optimizer_name': 'Adam'}. Best is trial 1569 with value: 0.001761963053552708.[0m
[32m[I 2022-11-08 10:00:13,003][0m Trial 1723 finished with value: 0.002525180556999037 and parameters: {'nlayers': 41, 'hidden_size': 39, 'dropout': 0.1986994305099277, 'learning_rate': 0.0014139276688179899, 'batch_size': 7018, 'optimizer_name': 'Adam'}. Best is trial 1569 with value: 0.001761963053552708.[0m
[32m[I 2022-11-08 10:00:51,447][0m Trial 1724 finished with value: 0.0018252898604030603 and parameters: {'nlayers': 70, 'hidden_size': 82, 'dropout': 0.1691118194697455, 'learning_rate': 0.0023064742688074535, 'batch_size': 9713, 'optimizer_name': 'Adam'}. Best is trial 1569 with value: 0.001761963053552708.[0m
