[32m[I 2022-11-08 05:53:13,384][0m Trial 1242 finished with value: 0.0018407446303761062 and parameters: {'nlayers': 10, 'hidden_size': 131, 'dropout': 0.39654765574227624, 'learning_rate': 0.002024502556941186, 'batch_size': 9635, 'optimizer_name': 'Adam'}. Best is trial 899 with value: 0.0017655460917727903.[0m
[32m[I 2022-11-08 05:54:03,210][0m Trial 1243 finished with value: 0.0018051915564345693 and parameters: {'nlayers': 58, 'hidden_size': 162, 'dropout': 0.23740062391340566, 'learning_rate': 0.007371878399545795, 'batch_size': 9818, 'optimizer_name': 'Adam'}. Best is trial 899 with value: 0.0017655460917727903.[0m
[32m[I 2022-11-08 05:55:06,795][0m Trial 1244 finished with value: 0.0017722620338201523 and parameters: {'nlayers': 68, 'hidden_size': 181, 'dropout': 0.11975069745598715, 'learning_rate': 0.0022614711714363145, 'batch_size': 10000, 'optimizer_name': 'Adam'}. Best is trial 899 with value: 0.0017655460917727903.[0m
[32m[I 2022-11-08 05:55:37,139][0m Trial 1245 finished with value: 0.0018346559037679521 and parameters: {'nlayers': 14, 'hidden_size': 250, 'dropout': 0.2235914359580456, 'learning_rate': 0.0020543467842260308, 'batch_size': 9661, 'optimizer_name': 'Adam'}. Best is trial 899 with value: 0.0017655460917727903.[0m
[32m[I 2022-11-08 05:56:10,116][0m Trial 1246 finished with value: 0.0025209585145475047 and parameters: {'nlayers': 89, 'hidden_size': 114, 'dropout': 0.1571453222919673, 'learning_rate': 0.009991573550339016, 'batch_size': 7011, 'optimizer_name': 'RMSprop'}. Best is trial 899 with value: 0.0017655460917727903.[0m
[32m[I 2022-11-08 05:56:45,202][0m Trial 1247 finished with value: 0.00187082146923687 and parameters: {'nlayers': 75, 'hidden_size': 62, 'dropout': 0.1342363014386123, 'learning_rate': 0.000816613975116829, 'batch_size': 9472, 'optimizer_name': 'Adam'}. Best is trial 899 with value: 0.0017655460917727903.[0m
[32m[I 2022-11-08 05:57:10,678][0m Trial 1248 finished with value: 0.0018164158824079486 and parameters: {'nlayers': 16, 'hidden_size': 137, 'dropout': 0.14725138329741352, 'learning_rate': 0.009097987356004499, 'batch_size': 9782, 'optimizer_name': 'Adam'}. Best is trial 899 with value: 0.0017655460917727903.[0m
[32m[I 2022-11-08 05:58:01,538][0m Trial 1249 finished with value: 0.0018059098353603177 and parameters: {'nlayers': 65, 'hidden_size': 151, 'dropout': 0.1533594909323646, 'learning_rate': 0.0023731837500029418, 'batch_size': 9811, 'optimizer_name': 'Adam'}. Best is trial 899 with value: 0.0017655460917727903.[0m
[32m[I 2022-11-08 05:58:28,314][0m Trial 1250 finished with value: 0.001775066034981106 and parameters: {'nlayers': 13, 'hidden_size': 171, 'dropout': 0.12611124568049356, 'learning_rate': 0.001376523316656894, 'batch_size': 9995, 'optimizer_name': 'Adam'}. Best is trial 899 with value: 0.0017655460917727903.[0m
[32m[I 2022-11-08 05:58:46,963][0m Trial 1251 finished with value: 0.0019077377583932103 and parameters: {'nlayers': 5, 'hidden_size': 129, 'dropout': 0.1599678140898327, 'learning_rate': 0.0017563256846804228, 'batch_size': 9299, 'optimizer_name': 'Adam'}. Best is trial 899 with value: 0.0017655460917727903.[0m
[32m[I 2022-11-08 05:59:07,530][0m Trial 1252 finished with value: 0.0018359459639213566 and parameters: {'nlayers': 11, 'hidden_size': 72, 'dropout': 0.16200607382660695, 'learning_rate': 0.008635725591443964, 'batch_size': 9645, 'optimizer_name': 'Adam'}. Best is trial 899 with value: 0.0017655460917727903.[0m
[32m[I 2022-11-08 06:00:06,963][0m Trial 1253 finished with value: 0.0018682634255241185 and parameters: {'nlayers': 59, 'hidden_size': 201, 'dropout': 0.13680311625377628, 'learning_rate': 0.00225347640399472, 'batch_size': 9823, 'optimizer_name': 'SGD'}. Best is trial 899 with value: 0.0017655460917727903.[0m
[32m[I 2022-11-08 06:00:49,737][0m Trial 1254 finished with value: 0.00185736869460858 and parameters: {'nlayers': 69, 'hidden_size': 124, 'dropout': 0.1494492237533373, 'learning_rate': 0.0019345076744485617, 'batch_size': 9538, 'optimizer_name': 'Adam'}. Best is trial 899 with value: 0.0017655460917727903.[0m
[32m[I 2022-11-08 06:01:24,267][0m Trial 1255 finished with value: 0.0017676690463149936 and parameters: {'nlayers': 43, 'hidden_size': 114, 'dropout': 0.1613291065720737, 'learning_rate': 0.0025819472660545528, 'batch_size': 9999, 'optimizer_name': 'Adam'}. Best is trial 899 with value: 0.0017655460917727903.[0m
[32m[I 2022-11-08 06:01:59,007][0m Trial 1256 finished with value: 0.0018081905173973965 and parameters: {'nlayers': 44, 'hidden_size': 117, 'dropout': 0.14634127628239155, 'learning_rate': 0.0027740192112401672, 'batch_size': 9828, 'optimizer_name': 'Adam'}. Best is trial 899 with value: 0.0017655460917727903.[0m
[32m[I 2022-11-08 06:02:33,483][0m Trial 1257 finished with value: 0.0017719509364247858 and parameters: {'nlayers': 43, 'hidden_size': 114, 'dropout': 0.3744694634033783, 'learning_rate': 0.0032275277649270436, 'batch_size': 9995, 'optimizer_name': 'Adam'}. Best is trial 899 with value: 0.0017655460917727903.[0m
[32m[I 2022-11-08 06:03:08,833][0m Trial 1258 finished with value: 0.0017739419430494309 and parameters: {'nlayers': 42, 'hidden_size': 122, 'dropout': 0.15780973979170196, 'learning_rate': 0.002971460470239403, 'batch_size': 10000, 'optimizer_name': 'Adam'}. Best is trial 899 with value: 0.0017655460917727903.[0m
[32m[I 2022-11-08 06:03:42,597][0m Trial 1259 finished with value: 0.001834211013729874 and parameters: {'nlayers': 45, 'hidden_size': 114, 'dropout': 0.13287591967259027, 'learning_rate': 0.0026649909441903777, 'batch_size': 9675, 'optimizer_name': 'Adam'}. Best is trial 899 with value: 0.0017655460917727903.[0m
[32m[I 2022-11-08 06:04:13,228][0m Trial 1260 finished with value: 0.001858743405981731 and parameters: {'nlayers': 39, 'hidden_size': 111, 'dropout': 0.14268586469541333, 'learning_rate': 0.0025605183085839547, 'batch_size': 9505, 'optimizer_name': 'Adam'}. Best is trial 899 with value: 0.0017655460917727903.[0m
[32m[I 2022-11-08 06:04:45,457][0m Trial 1261 finished with value: 0.0018070747322317365 and parameters: {'nlayers': 39, 'hidden_size': 116, 'dropout': 0.11176227431923759, 'learning_rate': 0.0028320286026103326, 'batch_size': 9811, 'optimizer_name': 'Adam'}. Best is trial 899 with value: 0.0017655460917727903.[0m
[32m[I 2022-11-08 06:05:21,865][0m Trial 1262 finished with value: 0.001772443280600109 and parameters: {'nlayers': 42, 'hidden_size': 127, 'dropout': 0.4405286173830463, 'learning_rate': 0.0024752524993656333, 'batch_size': 9999, 'optimizer_name': 'Adam'}. Best is trial 899 with value: 0.0017655460917727903.[0m
[32m[I 2022-11-08 06:05:54,368][0m Trial 1263 finished with value: 0.001828451633108442 and parameters: {'nlayers': 43, 'hidden_size': 109, 'dropout': 0.15015561731889496, 'learning_rate': 0.0026585450974406025, 'batch_size': 9677, 'optimizer_name': 'Adam'}. Best is trial 899 with value: 0.0017655460917727903.[0m
[32m[I 2022-11-08 06:06:28,367][0m Trial 1264 finished with value: 0.001772144776190284 and parameters: {'nlayers': 42, 'hidden_size': 116, 'dropout': 0.46867036412200536, 'learning_rate': 0.0024058688641192087, 'batch_size': 9994, 'optimizer_name': 'Adam'}. Best is trial 899 with value: 0.0017655460917727903.[0m
[32m[I 2022-11-08 06:06:59,368][0m Trial 1265 finished with value: 0.0019120278601440352 and parameters: {'nlayers': 44, 'hidden_size': 111, 'dropout': 0.16166319842059326, 'learning_rate': 0.0030719007065710463, 'batch_size': 9302, 'optimizer_name': 'Adam'}. Best is trial 899 with value: 0.0017655460917727903.[0m
[32m[I 2022-11-08 06:07:33,338][0m Trial 1266 finished with value: 0.0018047107071522738 and parameters: {'nlayers': 41, 'hidden_size': 119, 'dropout': 0.3994557730064487, 'learning_rate': 0.005325863314488574, 'batch_size': 9812, 'optimizer_name': 'Adam'}. Best is trial 899 with value: 0.0017655460917727903.[0m
[32m[I 2022-11-08 06:07:47,330][0m Trial 1267 finished with value: 0.0035089933563476026 and parameters: {'nlayers': 44, 'hidden_size': 119, 'dropout': 0.1526789292289167, 'learning_rate': 0.0028385014980679734, 'batch_size': 5058, 'optimizer_name': 'Adam'}. Best is trial 899 with value: 0.0017655460917727903.[0m
[32m[I 2022-11-08 06:08:21,203][0m Trial 1268 finished with value: 0.0018339775104370545 and parameters: {'nlayers': 42, 'hidden_size': 123, 'dropout': 0.13861145389796722, 'learning_rate': 0.002312585601338847, 'batch_size': 9652, 'optimizer_name': 'Adam'}. Best is trial 899 with value: 0.0017655460917727903.[0m
[32m[I 2022-11-08 06:08:54,363][0m Trial 1269 finished with value: 0.0018070211864999542 and parameters: {'nlayers': 45, 'hidden_size': 106, 'dropout': 0.1223596489146638, 'learning_rate': 0.0026085094718927386, 'batch_size': 9831, 'optimizer_name': 'RMSprop'}. Best is trial 899 with value: 0.0017655460917727903.[0m
[32m[I 2022-11-08 06:09:26,633][0m Trial 1270 finished with value: 0.0018709048536194772 and parameters: {'nlayers': 37, 'hidden_size': 131, 'dropout': 0.16473209622472892, 'learning_rate': 0.0024169274699093633, 'batch_size': 9493, 'optimizer_name': 'Adam'}. Best is trial 899 with value: 0.0017655460917727903.[0m
[32m[I 2022-11-08 06:09:58,931][0m Trial 1271 finished with value: 0.0018025548671003443 and parameters: {'nlayers': 41, 'hidden_size': 110, 'dropout': 0.3897207686499312, 'learning_rate': 0.0021841039462865215, 'batch_size': 9821, 'optimizer_name': 'Adam'}. Best is trial 899 with value: 0.0017655460917727903.[0m
[32m[I 2022-11-08 06:10:30,887][0m Trial 1272 finished with value: 0.001771835561439899 and parameters: {'nlayers': 39, 'hidden_size': 105, 'dropout': 0.4470935561188262, 'learning_rate': 0.0026695313682088286, 'batch_size': 9994, 'optimizer_name': 'Adam'}. Best is trial 899 with value: 0.0017655460917727903.[0m
[32m[I 2022-11-08 06:10:41,078][0m Trial 1273 finished with value: 0.008257072889782682 and parameters: {'nlayers': 61, 'hidden_size': 125, 'dropout': 0.4571331796613313, 'learning_rate': 0.0032940254790148776, 'batch_size': 2152, 'optimizer_name': 'Adam'}. Best is trial 899 with value: 0.0017655460917727903.[0m
[32m[I 2022-11-08 06:11:03,979][0m Trial 1274 finished with value: 0.001774596228317653 and parameters: {'nlayers': 8, 'hidden_size': 139, 'dropout': 0.15350752265994574, 'learning_rate': 0.0028585133409618772, 'batch_size': 9997, 'optimizer_name': 'Adam'}. Best is trial 899 with value: 0.0017655460917727903.[0m
[32m[I 2022-11-08 06:11:43,787][0m Trial 1275 finished with value: 0.0018313129979564617 and parameters: {'nlayers': 64, 'hidden_size': 111, 'dropout': 0.14349108486535517, 'learning_rate': 0.0024533468270097197, 'batch_size': 9656, 'optimizer_name': 'Adam'}. Best is trial 899 with value: 0.0017655460917727903.[0m
[32m[I 2022-11-08 06:12:05,792][0m Trial 1276 finished with value: 0.001866197684630559 and parameters: {'nlayers': 10, 'hidden_size': 133, 'dropout': 0.15982940613224744, 'learning_rate': 0.002118991207975507, 'batch_size': 9675, 'optimizer_name': 'SGD'}. Best is trial 899 with value: 0.0017655460917727903.[0m
[32m[I 2022-11-08 06:12:38,314][0m Trial 1277 finished with value: 0.001774344346970931 and parameters: {'nlayers': 40, 'hidden_size': 120, 'dropout': 0.11540041982014794, 'learning_rate': 0.002284697053443773, 'batch_size': 9997, 'optimizer_name': 'Adam'}. Best is trial 899 with value: 0.0017655460917727903.[0m
[32m[I 2022-11-08 06:13:01,759][0m Trial 1278 finished with value: 0.0017721245665349463 and parameters: {'nlayers': 12, 'hidden_size': 103, 'dropout': 0.12355037652104942, 'learning_rate': 0.002558914889172145, 'batch_size': 9999, 'optimizer_name': 'Adam'}. Best is trial 899 with value: 0.0017655460917727903.[0m
[32m[I 2022-11-08 06:13:40,842][0m Trial 1279 finished with value: 0.0018777976342066233 and parameters: {'nlayers': 66, 'hidden_size': 128, 'dropout': 0.40411419787039776, 'learning_rate': 0.002968537434132929, 'batch_size': 9459, 'optimizer_name': 'Adam'}. Best is trial 899 with value: 0.0017655460917727903.[0m
[32m[I 2022-11-08 06:14:28,574][0m Trial 1280 finished with value: 0.0017999879622597617 and parameters: {'nlayers': 73, 'hidden_size': 144, 'dropout': 0.16525905029722956, 'learning_rate': 0.002075831778073109, 'batch_size': 9833, 'optimizer_name': 'Adam'}. Best is trial 899 with value: 0.0017655460917727903.[0m
[32m[I 2022-11-08 06:15:02,041][0m Trial 1281 finished with value: 0.001826896557318038 and parameters: {'nlayers': 45, 'hidden_size': 114, 'dropout': 0.1331878931630618, 'learning_rate': 0.0023522470790419926, 'batch_size': 9685, 'optimizer_name': 'Adam'}. Best is trial 899 with value: 0.0017655460917727903.[0m
[32m[I 2022-11-08 06:15:20,115][0m Trial 1282 finished with value: 0.002806130662930459 and parameters: {'nlayers': 36, 'hidden_size': 137, 'dropout': 0.1476233226462799, 'learning_rate': 0.0027287202988313494, 'batch_size': 6323, 'optimizer_name': 'Adam'}. Best is trial 899 with value: 0.0017655460917727903.[0m
[32m[I 2022-11-08 06:15:25,382][0m Trial 1283 finished with value: 0.012623220895780884 and parameters: {'nlayers': 40, 'hidden_size': 106, 'dropout': 0.15559757598062504, 'learning_rate': 0.0025566359645294565, 'batch_size': 1395, 'optimizer_name': 'Adam'}. Best is trial 899 with value: 0.0017655460917727903.[0m
[32m[I 2022-11-08 06:15:59,927][0m Trial 1284 finished with value: 0.0019581643002918397 and parameters: {'nlayers': 75, 'hidden_size': 66, 'dropout': 0.1414879069250492, 'learning_rate': 0.00704869745003793, 'batch_size': 9069, 'optimizer_name': 'Adam'}. Best is trial 899 with value: 0.0017655460917727903.[0m
[32m[I 2022-11-08 06:16:24,018][0m Trial 1285 finished with value: 0.001809991059886047 and parameters: {'nlayers': 14, 'hidden_size': 125, 'dropout': 0.10565039224485911, 'learning_rate': 0.002007139133543115, 'batch_size': 9827, 'optimizer_name': 'Adam'}. Best is trial 899 with value: 0.0017655460917727903.[0m
[32m[I 2022-11-08 06:16:45,653][0m Trial 1286 finished with value: 0.0017716881125816669 and parameters: {'nlayers': 6, 'hidden_size': 109, 'dropout': 0.16440926183039986, 'learning_rate': 0.0022404007774403877, 'batch_size': 9999, 'optimizer_name': 'Adam'}. Best is trial 899 with value: 0.0017655460917727903.[0m
[32m[I 2022-11-08 06:17:04,748][0m Trial 1287 finished with value: 0.0019042851587409897 and parameters: {'nlayers': 9, 'hidden_size': 56, 'dropout': 0.15760099954669068, 'learning_rate': 4.797757402260998e-05, 'batch_size': 9523, 'optimizer_name': 'Adam'}. Best is trial 899 with value: 0.0017655460917727903.[0m
[32m[I 2022-11-08 06:17:26,921][0m Trial 1288 finished with value: 0.0018056248414175296 and parameters: {'nlayers': 12, 'hidden_size': 100, 'dropout': 0.4662193242549151, 'learning_rate': 0.0030891877528464737, 'batch_size': 9819, 'optimizer_name': 'Adam'}. Best is trial 899 with value: 0.0017655460917727903.[0m
[32m[I 2022-11-08 06:18:05,530][0m Trial 1289 finished with value: 0.0019118586598254046 and parameters: {'nlayers': 62, 'hidden_size': 118, 'dropout': 0.1520529343684819, 'learning_rate': 0.002518679210631441, 'batch_size': 9285, 'optimizer_name': 'Adam'}. Best is trial 899 with value: 0.0017655460917727903.[0m
[32m[I 2022-11-08 06:18:49,022][0m Trial 1290 finished with value: 0.0018259918880906675 and parameters: {'nlayers': 59, 'hidden_size': 142, 'dropout': 0.4393652440360603, 'learning_rate': 0.0027848994092505987, 'batch_size': 9665, 'optimizer_name': 'Adam'}. Best is trial 899 with value: 0.0017655460917727903.[0m
[32m[I 2022-11-08 06:19:18,265][0m Trial 1291 finished with value: 0.0018057529289123905 and parameters: {'nlayers': 38, 'hidden_size': 77, 'dropout': 0.13023487137304077, 'learning_rate': 0.00218342042232949, 'batch_size': 9811, 'optimizer_name': 'RMSprop'}. Best is trial 899 with value: 0.0017655460917727903.[0m
[32m[I 2022-11-08 06:19:53,858][0m Trial 1292 finished with value: 0.0018522095474596118 and parameters: {'nlayers': 44, 'hidden_size': 133, 'dropout': 0.14561795404199718, 'learning_rate': 0.0018661920692864908, 'batch_size': 9565, 'optimizer_name': 'Adam'}. Best is trial 899 with value: 0.0017655460917727903.[0m
[32m[I 2022-11-08 06:19:58,539][0m Trial 1293 finished with value: 0.005986085225795877 and parameters: {'nlayers': 15, 'hidden_size': 151, 'dropout': 0.16541610799087608, 'learning_rate': 0.002063425147022545, 'batch_size': 2958, 'optimizer_name': 'Adam'}. Best is trial 899 with value: 0.0017655460917727903.[0m
[32m[I 2022-11-08 06:20:20,529][0m Trial 1294 finished with value: 0.001802384562253661 and parameters: {'nlayers': 10, 'hidden_size': 105, 'dropout': 0.4499913087870014, 'learning_rate': 0.002410737992543711, 'batch_size': 9828, 'optimizer_name': 'Adam'}. Best is trial 899 with value: 0.0017655460917727903.[0m
[32m[I 2022-11-08 06:20:41,789][0m Trial 1295 finished with value: 0.0018347127151627429 and parameters: {'nlayers': 12, 'hidden_size': 112, 'dropout': 0.1353715004136833, 'learning_rate': 0.0067615680058736366, 'batch_size': 9663, 'optimizer_name': 'Adam'}. Best is trial 899 with value: 0.0017655460917727903.[0m
[32m[I 2022-11-08 06:21:06,936][0m Trial 1296 finished with value: 0.0029216270058124013 and parameters: {'nlayers': 70, 'hidden_size': 127, 'dropout': 0.1131962553787489, 'learning_rate': 0.006338932081648475, 'batch_size': 6067, 'optimizer_name': 'Adam'}. Best is trial 899 with value: 0.0017655460917727903.[0m
[32m[I 2022-11-08 06:21:38,656][0m Trial 1297 finished with value: 0.0018815555458014254 and parameters: {'nlayers': 34, 'hidden_size': 145, 'dropout': 0.15540354801526832, 'learning_rate': 0.0023488199900717063, 'batch_size': 9433, 'optimizer_name': 'SGD'}. Best is trial 899 with value: 0.0017655460917727903.[0m
[32m[I 2022-11-08 06:22:02,838][0m Trial 1298 finished with value: 0.0017712104976177216 and parameters: {'nlayers': 15, 'hidden_size': 100, 'dropout': 0.12457193090645721, 'learning_rate': 0.002700064264521522, 'batch_size': 10000, 'optimizer_name': 'Adam'}. Best is trial 899 with value: 0.0017655460917727903.[0m
[32m[I 2022-11-08 06:22:32,403][0m Trial 1299 finished with value: 0.0018129488211737523 and parameters: {'nlayers': 42, 'hidden_size': 70, 'dropout': 0.16828504475107056, 'learning_rate': 0.003602387329567051, 'batch_size': 9794, 'optimizer_name': 'Adam'}. Best is trial 899 with value: 0.0017655460917727903.[0m
[32m[I 2022-11-08 06:22:53,869][0m Trial 1300 finished with value: 0.0018058399466638726 and parameters: {'nlayers': 12, 'hidden_size': 61, 'dropout': 0.14738944898052042, 'learning_rate': 0.004569446903724192, 'batch_size': 9818, 'optimizer_name': 'Adam'}. Best is trial 899 with value: 0.0017655460917727903.[0m
[32m[I 2022-11-08 06:23:15,184][0m Trial 1301 finished with value: 0.0018369676524976294 and parameters: {'nlayers': 8, 'hidden_size': 139, 'dropout': 0.14031017434197665, 'learning_rate': 0.0018031249146398967, 'batch_size': 9641, 'optimizer_name': 'Adam'}. Best is trial 899 with value: 0.0017655460917727903.[0m
[32m[I 2022-11-08 06:23:48,675][0m Trial 1302 finished with value: 0.0018016022670148844 and parameters: {'nlayers': 57, 'hidden_size': 88, 'dropout': 0.15983610193104666, 'learning_rate': 0.0022124625041970163, 'batch_size': 9821, 'optimizer_name': 'Adam'}. Best is trial 899 with value: 0.0017655460917727903.[0m
[32m[I 2022-11-08 06:24:17,216][0m Trial 1303 finished with value: 0.001775207928381674 and parameters: {'nlayers': 63, 'hidden_size': 48, 'dropout': 0.38049447972550043, 'learning_rate': 0.0029951137600290932, 'batch_size': 9998, 'optimizer_name': 'Adam'}. Best is trial 899 with value: 0.0017655460917727903.[0m
[32m[I 2022-11-08 06:24:41,279][0m Trial 1304 finished with value: 0.0018821544236979836 and parameters: {'nlayers': 14, 'hidden_size': 155, 'dropout': 0.16938369306715503, 'learning_rate': 0.002539046872081041, 'batch_size': 9415, 'optimizer_name': 'Adam'}. Best is trial 899 with value: 0.0017655460917727903.[0m
[32m[I 2022-11-08 06:25:24,193][0m Trial 1305 finished with value: 0.0018405375877398936 and parameters: {'nlayers': 67, 'hidden_size': 119, 'dropout': 0.4335991239034539, 'learning_rate': 0.0019930043794346122, 'batch_size': 9657, 'optimizer_name': 'Adam'}. Best is trial 899 with value: 0.0017655460917727903.[0m
[32m[I 2022-11-08 06:25:48,998][0m Trial 1306 finished with value: 0.001774158544222641 and parameters: {'nlayers': 17, 'hidden_size': 103, 'dropout': 0.4098242956485229, 'learning_rate': 0.0016939582539025014, 'batch_size': 9994, 'optimizer_name': 'Adam'}. Best is trial 899 with value: 0.0017655460917727903.[0m
[32m[I 2022-11-08 06:26:10,510][0m Trial 1307 finished with value: 0.00180510395080082 and parameters: {'nlayers': 10, 'hidden_size': 96, 'dropout': 0.1504334339277173, 'learning_rate': 0.002349535735650183, 'batch_size': 9812, 'optimizer_name': 'Adam'}. Best is trial 899 with value: 0.0017655460917727903.[0m
[32m[I 2022-11-08 06:26:39,976][0m Trial 1308 finished with value: 0.0018520867275605335 and parameters: {'nlayers': 41, 'hidden_size': 83, 'dropout': 0.15895529527687974, 'learning_rate': 0.004143845097763877, 'batch_size': 9555, 'optimizer_name': 'Adam'}. Best is trial 899 with value: 0.0017655460917727903.[0m
[32m[I 2022-11-08 06:27:04,552][0m Trial 1309 finished with value: 0.0018016127094489997 and parameters: {'nlayers': 13, 'hidden_size': 148, 'dropout': 0.170719209607782, 'learning_rate': 0.0028708416300224173, 'batch_size': 9830, 'optimizer_name': 'Adam'}. Best is trial 899 with value: 0.0017655460917727903.[0m
[32m[I 2022-11-08 06:27:43,248][0m Trial 1310 finished with value: 0.0017700304817182921 and parameters: {'nlayers': 44, 'hidden_size': 135, 'dropout': 0.4568342194020253, 'learning_rate': 0.0026881125321601574, 'batch_size': 9999, 'optimizer_name': 'Adam'}. Best is trial 899 with value: 0.0017655460917727903.[0m
