[32m[I 2022-11-08 12:09:54,919][0m Trial 1999 finished with value: 0.0024457808523141145 and parameters: {'nlayers': 23, 'hidden_size': 100, 'dropout': 0.3075041929787388, 'learning_rate': 0.002262424881471806, 'batch_size': 7226, 'optimizer_name': 'Adam'}. Best is trial 1569 with value: 0.001761963053552708.[0m
USING NEW DATASET
TRAINING FEATURES
    genDatapT  genDataeta  genDataphi  genDatam       tau
0    29.4452    0.828187    2.902130   2.85348  0.361310
1    24.3193   -1.163510    0.636469   5.83685  0.126899
2    24.3193   -1.163510    0.636469   5.83685  0.962307
3    24.3193   -1.163510    0.636469   5.83685  0.457282
4    20.1703    1.844410   -0.186685   5.69090  0.840862
train set shape: (1000000, 10)
test set shape:   (1000000, 10)
TARGETS ARE [-1.10392428 -0.07368856 -0.07368856 ... -0.68454015  0.18510706
 -0.67448984]

(1000000,) (1000000, 5)
Getting best hyperparameters for m

0 	 0.0019320242003119902 	 0.001854395212722072
0 	 0.005460158311870728 	 0.005321113335793428
0 	 0.002112393913957076 	 0.002088484762410006
0 	 0.0037197491948007685 	 0.00362457019094301
0 	 0.0033635492484594127 	 0.0031807567941477153
0 	 0.0037872564525414224 	 0.003677975839477894
0 	 0.0038022616223424414 	 0.003580026973889569
0 	 0.0033157811121515084 	 0.003241223811534149
0 	 0.005397558698091693 	 0.0052764437204998625
0 	 0.0028545728149875324 	 0.0027893337247958732
0 	 0.13105328648518294 	 0.12463178122654939
0 	 0.001861535285473363 	 0.001832221841368335
0 	 0.0018976104420917646 	 0.0018389684856492477
0 	 0.0023192857363538008 	 0.002250028957996354
0 	 0.0018681472007845796 	 0.001783821074225407
0 	 0.002544875657486876 	 0.0023435259180547693
0 	 0.0018844609729065116 	 0.0017888845988265098
0 	 0.0022268948815840303 	 0.002074847603850247
0 	 0.002644058240206849 	 0.0025416481417000064
0 	 0.029359701240660518 	 0.027470853476397758
0 	 0.01029009791367516 	 0.009770167835712176
0 	 0.0019433827614244695 	 0.0019180197061940607
0 	 0.0019198059045595188 	 0.0018650769023248151
0 	 0.0021431509031765703 	 0.0020795934960462044
0 	 0.0023880198427541116 	 0.0023538637663639153
0 	 0.0020755139146930953 	 0.0019977164509360386
0 	 0.0028558811579892074 	 0.002738165197225151
0 	 0.0021911448806243845 	 0.0021731463283369595
0 	 0.002093358034573241 	 0.001880952914876032
0 	 0.0019106515450551616 	 0.001883328084537077
0 	 0.002517829423414651 	 0.0024775159627257494
0 	 0.0019943909808380965 	 0.0019378213457865259
0 	 0.001813429981878359 	 0.0017853565213903125
0 	 0.0019576550281705375 	 0.0019404091833976162
0 	 0.001805985440676358 	 0.0017853002350216455
0 	 0.002106628651838315 	 0.002074185455764999
0 	 0.004622723422982675 	 0.004534698168660382
0 	 0.0017990518457693067 	 0.0017784287313050537
0 	 0.0020333500938294687 	 0.002004507764295588
0 	 0.0022194341103196845 	 0.002178123422069493
0 	 0.0019081367238646914 	 0.0018884041946967112
0 	 0.0017937236261859777 	 0.0017745443793775132
0 	 0.0018084459044241507 	 0.0017793763667890395
0 	 0.002017571513587771 	 0.0019952399098574747
0 	 0.0019125195111295739 	 0.0019031161896401342
0 	 0.0022039008406024513 	 0.002173878776681448
0 	 0.0018031384528053324 	 0.0017793052049192187
0 	 0.0018930138783078247 	 0.0018679798274628954
0 	 0.004240946772242357 	 0.004188084411351441
0 	 0.006774551898375086 	 0.006678438481541052
0 	 0.002390852525467782 	 0.002325907194794674
0 	 0.0018922744997577144 	 0.0018429181998759856
0 	 0.0018032283203344894 	 0.001775381983372203
0 	 0.002141015539665593 	 0.0021075407204722953
0 	 0.0020277550102635014 	 0.0019549758251726423
0 	 0.0018699553986547786 	 0.0018481589658104315
0 	 0.001800888914589934 	 0.0017683455690155395
0 	 0.003147485039925805 	 0.0031147141502574282
0 	 0.002036261270341884 	 0.002023199451525735
0 	 0.0019408016182592492 	 0.0019047710834438137
0 	 0.0018587183834241647 	 0.0018255384962768601
0 	 0.001793691881549436 	 0.0017690636482487097
0 	 0.001813940672444445 	 0.0017819130341674841
0 	 0.0018724585533588752 	 0.0018421966802766182
0 	 0.00198459653012285 	 0.00192427917071825
0 	 0.0021714341374322755 	 0.002131224383313091
0 	 0.0020568360185112193 	 0.002023484688668397
0 	 0.0018598705059457911 	 0.0018350416979972357
0 	 0.00184313766863793 	 0.001793819030468663
0 	 0.0020021727520253096 	 0.001964263947867947
0 	 0.001864827769536144 	 0.0018223146783764102
0 	 0.001810451223809751 	 0.0017841870352926896
0 	 0.001791173477820526 	 0.001772213143738634
0 	 0.0019213007510027146 	 0.001894400639330002
0 	 0.0018760712721234748 	 0.0018450965618283896
0 	 0.001964557640578436 	 0.001928455324276634
0 	 0.0020659242185854143 	 0.0020445143709534323
0 	 0.0020257158609908016 	 0.001970703685850819
0 	 0.0018427062622344411 	 0.0018237638163146252
0 	 0.015342696642471572 	 0.01511906451087887
0 	 0.002288207739201704 	 0.002245771571488479
0 	 0.001818813517123838 	 0.001795574127873288
0 	 0.0018996108667690213 	 0.0018602347298830497
0 	 0.0019168517118016573 	 0.001890399962511209
0 	 0.0018175617542965804 	 0.0017827050024368822
0 	 0.0018030979581397117 	 0.0017787544208222952
0 	 0.0019110776112353414 	 0.0018809067547587016
0 	 0.0020208525300172667 	 0.0019830107602201294
0 	 0.0018473203064764427 	 0.00181862441561392
0 	 0.0019517864702002182 	 0.001930038330146905
0 	 0.002178318330784653 	 0.0021152306869678997
0 	 0.0018059963959376527 	 0.001780538354255932
0 	 0.0017947519591697428 	 0.001771168774915942
0 	 0.0018932656375646969 	 0.0018700917362221203
0 	 0.001849587608858482 	 0.0018291125315980812
0 	 0.0034666421379648707 	 0.0034076350628416898
0 	 0.0027537769564446673 	 0.0026915685555480087
0 	 0.001942986460474844 	 0.0019104095151515324
0 	 0.001976895705935502 	 0.0018300979620225614
0 	 0.0017999147893955085 	 0.0017692221558114308
0 	 0.0019121994325547087 	 0.0018565848127052862
0 	 0.0017924549485627045 	 0.0017722716313828366
0 	 0.0018522105591951823 	 0.0018107781858473528
0 	 0.0019015233557132846 	 0.0018643690339884976
0 	 0.0017938028962531797 	 0.0017711981610901797
0 	 0.001980902883957315 	 0.0019224135902883176
0 	 0.0018401066087326914 	 0.0018103979091021797
0 	 0.002026757506807051 	 0.0019775883404172657
0 	 0.0018912802275345229 	 0.0018610810054678645
0 	 0.0017930486525078598 	 0.001770751686502782
0 	 0.0020556326443743234 	 0.002018274665965282
0 	 0.0017998866013459137 	 0.0017752079753665714
0 	 0.0018499455017210666 	 0.0018118924357061164
0 	 0.005726478841645812 	 0.005648202794493387
0 	 0.0019344333172101262 	 0.0019105057916656643
0 	 0.0018800760014888458 	 0.0018573033743586856
0 	 0.0017953034167267315 	 0.0017711442417414937
0 	 0.0019486170351103614 	 0.0018685554116751337
0 	 0.0019125507145779546 	 0.0018822253980073594
0 	 0.0019870794106456703 	 0.0019526637782844086
0 	 0.001788042813539505 	 0.0017743974417448044
0 	 0.0017922852670199264 	 0.0017774812194152319
0 	 0.0018403089587339756 	 0.0018101821102992476
0 	 0.0018632766581200934 	 0.0018389595328987419
0 	 0.0018076040866428504 	 0.0017825263464986178
0 	 0.0019343532446214583 	 0.001896662746970867
0 	 0.0018369289564149477 	 0.0018168152860818317
0 	 0.001878086054942026 	 0.001851671516614875
0 	 0.0019671706764543455 	 0.0019382928571074426
0 	 0.0018347001366706844 	 0.0018077728831592727
0 	 0.003048257275591843 	 0.0029450465120290773
0 	 0.0018086276079043013 	 0.0017822124999219285
0 	 0.001805747750522567 	 0.0017736129118295486
0 	 0.001816919045305572 	 0.0017799136934367275
0 	 0.001877559716647497 	 0.0018546296841093438
0 	 0.001913306214525713 	 0.0018923586075509384
0 	 0.00185616825181447 	 0.0018203406257116697
0 	 0.001802420623311053 	 0.0017766812185931787
0 	 0.0018859410901263557 	 0.0018529759488836693
0 	 0.0018523077345266022 	 0.0018175112861311758
0 	 0.004240827361836021 	 0.004156361418054965
0 	 0.0018025481334411617 	 0.00177881309354852
0 	 0.001925421908645378 	 0.001888821349968076
0 	 0.00183422002321312 	 0.0018097696523056163
0 	 0.0018056267669302524 	 0.0017699252248215918
0 	 0.0018720000391741587 	 0.0018379593930658506
0 	 0.0020319014359768983 	 0.0018823164313830235
0 	 0.001852717055157998 	 0.0018094399463743501
0 	 0.0018015148508999438 	 0.0017737424309240816
0 	 0.001939467078279722 	 0.0019087761290537593
0 	 0.0018797164788507891 	 0.0018513292158013792
0 	 0.0018248742514856565 	 0.001791594079961451
0 	 0.0017938363556862355 	 0.001769943864527482
0 	 0.0018010758011981127 	 0.0017812042380997855
0 	 0.001859951761643166 	 0.001834824352409664
0 	 0.0018363923544842922 	 0.0018043851035099837
0 	 0.0018031608583832246 	 0.0017723009708667426
0 	 0.0019009564745412402 	 0.0018625743769337016
0 	 0.0019656904678118526 	 0.0019229713338151122
0 	 0.009587719626960997 	 0.009425190078531712
0 	 0.0018311559459680043 	 0.0018083257287591498
0 	 0.0018049222582933071 	 0.0017774346317533001
0 	 0.0018042099883841952 	 0.0017753775641329592
0 	 0.0018423811069052671 	 0.0018258990421776175
0 	 0.0018897020988192135 	 0.0018617436485258501
0 	 0.0018466427692438265 	 0.0018148075455531269
0 	 0.0018081604808568954 	 0.0017784876734018326
0 	 0.001875822612380071 	 0.0018417855398627971
0 	 0.001912745592115891 	 0.0018837611997223791
0 	 0.0018325627787059407 	 0.0018035388819061884
0 	 0.0018638222873103598 	 0.0017747737975520215
0 	 0.0019305403156428904 	 0.00185793714191887
0 	 0.002035941355144873 	 0.001914465180600142
0 	 0.001852640600818757 	 0.0018026857858754368
0 	 0.0019820114461387077 	 0.0018929302127410307
0 	 0.0019254398822784423 	 0.0018555919945240022
0 	 0.0018385316367331346 	 0.001816575497672439
0 	 0.0018559122387680415 	 0.0018446049782612733
0 	 0.001841485871647308 	 0.001802931439277588
0 	 0.0025571413049038237 	 0.0025314029984226305
0 	 0.0017890151601658425 	 0.0017749333169439076
0 	 0.0018255248867977787 	 0.0018057142801702138
0 	 0.0018700181292730744 	 0.0018511403387419625
0 	 0.0018286371894900772 	 0.00179790375727171
0 	 0.00178419003849169 	 0.001774038695195246
0 	 0.07312465834716135 	 0.07295119959460802
0 	 0.001915324165390223 	 0.0018891916839405497
0 	 0.0018583565498843338 	 0.0018393644354015824
0 	 0.00179579861164093 	 0.00177783984541893
0 	 0.0018313014018522273 	 0.0018074893705211053
0 	 0.0019054245077238018 	 0.0018775892081861788
0 	 0.001795738195929261 	 0.0017743887026023216
0 	 0.001798482706119587 	 0.0017685352622329054
0 	 0.0018692339629211663 	 0.001823589559433015
0 	 0.0018194828649636978 	 0.0018061335935751857
0 	 0.001792781621444316 	 0.001767993638185369
0 	 0.0018920759741120582 	 0.0018472448488490794
0 	 0.001837393834584616 	 0.0018044945859773454
0 	 0.0018508473577180712 	 0.0018323357416802507
0 	 0.0019006488790768309 	 0.0018727802306016455
0 	 0.001832661569300406 	 0.0018070937870477732
0 	 0.001802333832240286 	 0.001773587181693127
0 	 0.001809697980844494 	 0.0017703708254917822
0 	 0.0017994843328564048 	 0.0017783355138402414
0 	 0.0017962046086788177 	 0.0017783386945724488
0 	 0.0018664407693023445 	 0.0018445939459041834
0 	 0.0018307941478920276 	 0.0018114364445666361
0 	 0.001834999677915431 	 0.00180772466424972
0 	 0.0017996934186842327 	 0.0017728414695771797
0 	 0.0019116705272229128 	 0.0018607876258690985
0 	 0.001834483730187345 	 0.0018064816176611607
0 	 0.001816768352217723 	 0.0017771093998469325
0 	 0.0018372314058014677 	 0.0018103503951051483
0 	 0.001795646487693714 	 0.0017741614333666802
0 	 0.00180464072252281 	 0.0017716801946397137
0 	 0.0018853480978389444 	 0.0018365469214978959
0 	 0.0019044303531296901 	 0.001851038492535889
0 	 0.0017924353787364376 	 0.0017778330724175918
0 	 0.001860443042090135 	 0.0018145739819213648
0 	 0.0019034103657103124 	 0.0018787005005887
0 	 0.0018338430139289038 	 0.0018048405537900362
0 	 0.0018403104861263039 	 0.001801566424349019
0 	 0.0017991218568325616 	 0.0017685758716919843
0 	 0.0019192764491825856 	 0.0018356428861544083
0 	 0.0017964599087656804 	 0.0017742503598918782
0 	 0.0018390823419698339 	 0.001807398075111541
0 	 0.0018754540070911449 	 0.001839348958166698
0 	 0.0018285972060726296 	 0.0017984847466328857
0 	 0.001792575353447878 	 0.0017727932540148338
0 	 0.0018878181744082974 	 0.0018624296094871752
0 	 0.001865651435732508 	 0.0018346140566952028
0 	 0.0018044360499425503 	 0.0017778719160812199
0 	 0.0018053556092873146 	 0.0017795519094576078
0 	 0.001831007775987648 	 0.001801905689888808
0 	 0.00181298072567385 	 0.0017746786872963403
0 	 0.0018049439537748165 	 0.0017741879451462087
0 	 0.0018494817913711518 	 0.001821749219298669
0 	 0.0018018497318029404 	 0.0017780412644147873
0 	 0.0018514157667050574 	 0.0018158256915974602
0 	 0.0018938596499317383 	 0.0018561551756848327
0 	 0.0018381319738148623 	 0.0018131313418477185
0 	 0.0018217089620810132 	 0.0017967109517700085
0 	 0.0017975832438261363 	 0.001774637322519845
0 	 0.001836823071929743 	 0.0018130713852269338
0 	 0.0018037878231137146 	 0.0017698311291573154
0 	 0.0018023147135972977 	 0.001776320743560791
0 	 0.0018783402633548167 	 0.001841054346043798
0 	 0.0018546771728779044 	 0.0018134453107633858
0 	 0.0017932803094518211 	 0.0017715545803767534
0 	 0.0018629617429478582 	 0.0018429819023276961
0 	 0.0018381139869586925 	 0.0018035530904303217
0 	 0.0019016587013498242 	 0.0018766856466964062
0 	 0.001828270810164705 	 0.0018099621964133192
0 	 0.001793630350374057 	 0.001777898583940082
0 	 0.0018731553761263378 	 0.0018388936978881853
0 	 0.0018383131653779956 	 0.0018090395472126937
0 	 0.001798633173108101 	 0.00177891665995121
0 	 0.00392419621882763 	 0.003849292800261181
0 	 0.0019209562734686953 	 0.0019063217282883473
0 	 0.001874058051757177 	 0.0018470798321902162
0 	 0.0018325033590533017 	 0.0018097116284886748
0 	 0.0018617492004955481 	 0.0018364477457995733
0 	 0.005241049999293988 	 0.00515086166031704
0 	 0.0018213297939641483 	 0.0018085901869938493
0 	 0.0019067717745069246 	 0.0018797771613593582
0 	 0.0018317655743740004 	 0.0018089926862964244
0 	 0.0018330040516767465 	 0.001800715098583343
0 	 0.001878709149563967 	 0.0018452520384615947
0 	 0.0018043511175868294 	 0.001777121742952217
0 	 0.0017940759784058377 	 0.0017707426147936152
0 	 0.0023589370890969145 	 0.002315356354292408
0 	 0.0018919606721221791 	 0.0018665781869046149
0 	 0.0017907658085769631 	 0.0017738727872826758
0 	 0.0019343648089402811 	 0.0019089498148436126
0 	 0.0018564712106597008 	 0.0018266807175204396
0 	 0.0018369712003107744 	 0.0018063908887679832
0 	 0.001806484346259104 	 0.0017698206970937038
0 	 0.001868900446468609 	 0.0018342361439837864
0 	 0.001831886185669792 	 0.001808172410262064
0 	 0.0018976195763495622 	 0.0018721760526233472
0 	 0.009744548168853045 	 0.009433841603705397
0 	 0.0017890819032298898 	 0.0017756756696003285
0 	 0.00776553719939988 	 0.007624107185087175
0 	 0.0018329983188053098 	 0.0018165382993714447
0 	 0.0018690968820182434 	 0.0018398262085719682
0 	 0.0017933572592860711 	 0.0017723131476670387
0 	 0.0018487922965726997 	 0.0018065401056422247
0 	 0.0018812564712277387 	 0.0018635751549733175
0 	 0.001810719896716176 	 0.0017719122875153284
0 	 0.0019422358370254167 	 0.00190279697821552
0 	 0.0018015370226087642 	 0.0017779529267618684
0 	 0.0018651903766182944 	 0.0018297099601342606
0 	 0.0018411468723974077 	 0.0018093098097465162
0 	 0.0024559619530133063 	 0.002420506139823926
0 	 0.0018311477856361377 	 0.0017987570863572735
0 	 0.0030882377190208565 	 0.0030354744285569155
0 	 0.0018924446274657723 	 0.0018716754949031269
0 	 0.0018133373649192868 	 0.001771923315653904
0 	 0.0018714438350462934 	 0.0018275477750129795
0 	 0.001868811277704953 	 0.001807479560679257
0 	 0.0018386815434047654 	 0.0018078651201111125
0 	 0.0019003559135675108 	 0.0018367743594882421
0 	 0.0018060706059535424 	 0.0017758354702623494
0 	 0.0028595062790123063 	 0.0028204341559020687
0 	 0.0019210924097004122 	 0.0018875695193360635
0 	 0.0018376384155737167 	 0.0018052222243978787
0 	 0.0017942008659796915 	 0.001776146293342704
0 	 0.001801975691318512 	 0.0017719731867313385
0 	 0.0018877718927895815 	 0.0018405154464703113
0 	 0.001989390222610228 	 0.001918085239983588
0 	 0.001977171492255435 	 0.0019374502709133578
0 	 0.0019093995059009839 	 0.0018457907720236364
0 	 0.0018581778709303733 	 0.0018315263535492092
0 	 0.00185399608516263 	 0.0018125466388383329
0 	 0.0033097104552994518 	 0.003249619892159201
0 	 0.0018506925554979243 	 0.0017992505165760147
0 	 0.001911300641542482 	 0.0018820305983748462
0 	 0.0018390742422060202 	 0.0018130040745092107
0 	 0.0018038985359117876 	 0.001767210723471942
0 	 0.0018691044744981687 	 0.0018410983146797042
0 	 0.00183578306298318 	 0.0018032755736076705
0 	 0.001872699366537149 	 0.0018497725348559746
0 	 0.0018389050106431722 	 0.0017986054571709571
0 	 0.001932532557623319 	 0.0018927964506952858
0 	 0.0017938250237637694 	 0.0017755023352018706
0 	 0.0018685047903921601 	 0.0018351599411968863
0 	 0.0022446557001817597 	 0.0022077744189093647
0 	 0.0161887497865369 	 0.015929948407535192
0 	 0.001832640269967306 	 0.0018034436429161037
0 	 0.0018709450005721434 	 0.001811395584940433
0 	 0.0017978029959652797 	 0.0017718543609977066
0 	 0.0018498367417991767 	 0.0018401835418483145
0 	 0.0018922666445639043 	 0.0018609192506870511
0 	 0.0018462739457846807 	 0.0018105577071929207
0 	 0.001802260985970497 	 0.0017700912982225418
0 	 0.0018369710174031334 	 0.0018061811903779873
0 	 0.0019325443538980068 	 0.001913973783766254
0 	 0.0018918166891996933 	 0.0018395402211940665
0 	 0.0018087691836971775 	 0.0017683964171965089
0 	 0.0018244609327800116 	 0.0018051645271449721
0 	 0.0026195627852335607 	 0.00256274407709275
0 	 0.0017975155720061325 	 0.0017753815932470937
0 	 0.0019063707743864763 	 0.0018661065596881888
0 	 0.0018621054829650895 	 0.0018309873571287051
0 	 0.0018138249719146494 	 0.0017717143828512587
0 	 0.0018401948840042306 	 0.0018042231742677807
0 	 0.0018008778572082519 	 0.0017706569701433181
0 	 0.001875672411553588 	 0.0018358816246845302
0 	 0.0018859748437105668 	 0.0018657382408861617
0 	 0.0018304242745470023 	 0.001809846572631096
0 	 0.001834628554788992 	 0.001806365870243789
0 	 0.001794889886836042 	 0.0017788126207459504
0 	 0.0018701668232679366 	 0.0017947596818208694
0 	 0.002062293449576831 	 0.0018355067989845458
0 	 0.0019313059891052687 	 0.0018992091915424369
0 	 0.0018416603375890812 	 0.00181085994727264
0 	 0.001911704525912656 	 0.0018585879028342259
0 	 0.0018053237064068867 	 0.0017749566812904514
0 	 0.0018643565525893024 	 0.0018318408294213438
0 	 0.0018470210374503515 	 0.0018139185378018444
0 	 0.001899576085083985 	 0.001875953643701465
0 	 0.003690433832315298 	 0.0036363521906045766
0 	 0.0019615570112424914 	 0.0019415194933690913
0 	 0.0018290557513163624 	 0.0018128802788970693
0 	 0.0018695093594588244 	 0.001845557742304616
0 	 0.001832095148632365 	 0.0018041714989468637
0 	 0.004664963884773107 	 0.00456329264122641
0 	 0.0018041735380887986 	 0.0017731476217508317
0 	 0.0018333759326785363 	 0.0018021496009205564
0 	 0.0018904857988194148 	 0.0018519871263786981
0 	 0.0018473755248955318 	 0.0018134162194874822
0 	 0.0019248228560690434 	 0.0018907709431490564
0 	 0.0018594513336817424 	 0.0018351944491236353
0 	 0.0017997943297894542 	 0.0017783105044900057
0 	 0.001821774691130824 	 0.0018077556701803139
0 	 0.0018795926361974984 	 0.001793850642198847
0 	 0.0019021698729096903 	 0.0018636573752394234
0 	 0.0017993851424432151 	 0.0017730034451800918
0 	 0.001861954552596511 	 0.0018302994601027127
0 	 0.0017963604969518478 	 0.0017712455617041052
0 	 0.0018308584415023697 	 0.0018077146991179887
0 	 0.0018633350390578403 	 0.0018288827059678655
0 	 0.0018238939217574428 	 0.0018045171652750042
0 	 0.0019011885365324665 	 0.0018655204232748677
0 	 0.0018133641058360368 	 0.0017707516554952454
0 	 0.0019399561882019042 	 0.0019194028699720228
0 	 0.0018503277282155303 	 0.0018234692095973966
0 	 0.0018088788595875807 	 0.0017696224948098294
0 	 0.0018751405440604872 	 0.0018030058018735685
0 	 0.0018040393859148026 	 0.0017725854337215423
0 	 0.0018993790709573354 	 0.0018552906343627675
0 	 0.006373261454347693 	 0.00631090158804478
0 	 0.0018565928298811243 	 0.0018295737018207317
0 	 0.0018332446502185953 	 0.00180251967801414
0 	 0.0017944843143224715 	 0.0017758668303489685
0 	 0.0019219583009463697 	 0.0018710155648789786
0 	 0.0018849624795528204 	 0.0018354583603636032
0 	 0.001833109587531135 	 0.0018017487800617961
0 	 0.0019019693090641264 	 0.0018100468727630607
0 	 0.001999085640028569 	 0.0019661481483950285
0 	 0.0019164740773014149 	 0.0018876723483937062
0 	 0.0017965083563848787 	 0.0017748033509205337
0 	 0.0018717759274817132 	 0.0018404252126619414
0 	 0.0018363463279669303 	 0.001810853700223768
0 	 0.0018752667756207222 	 0.0018495504866038555
0 	 0.00183394841846774 	 0.0018018839040777944
0 	 0.0019575649152306705 	 0.0019235757109155923
0 	 0.001789965934426275 	 0.0017717265256560674
0 	 0.0018500296248930024 	 0.0018326272785953337
0 	 0.0018353460369104283 	 0.0018109973484402686
0 	 0.0019310297064049533 	 0.0019062478454024703
0 	 0.00180592533826208 	 0.0017676741111323842
0 	 0.0018338220607586912 	 0.001807116826205252
0 	 0.0018539816008206658 	 0.0018419412214619258
0 	 0.0018244720007817474 	 0.001801734990187258
0 	 0.0017992695675998324 	 0.0017769507826532554
0 	 0.0018890802230664392 	 0.0018675676275089752
0 	 0.0018540670505164205 	 0.001833397892788191
0 	 0.0018228021700392664 	 0.0018059041926038267
0 	 0.0018269989551772908 	 0.0018048204145045459
0 	 0.0020116216597949265 	 0.001795629897856202
0 	 0.0018856036543146663 	 0.0018509416673129482
0 	 0.0019181532575806275 	 0.0019062397544427714
0 	 0.0034673104554892925 	 0.0034362586651183915
0 	 0.001809950648324126 	 0.0017738393333082574
0 	 0.0026729825706603674 	 0.002638019642384696
0 	 0.0018601483895706841 	 0.001834703872519958
0 	 0.0017940387514310