[32m[I 2022-11-08 10:35:10,690][0m Trial 1794 finished with value: 0.0017702307432889937 and parameters: {'nlayers': 76, 'hidden_size': 226, 'dropout': 0.38887799881118573, 'learning_rate': 0.002208206690061917, 'batch_size': 10000, 'optimizer_name': 'Adam'}. Best is trial 1569 with value: 0.001761963053552708.[0m
[32m[I 2022-11-08 10:35:33,427][0m Trial 1795 finished with value: 0.001860818316523514 and parameters: {'nlayers': 17, 'hidden_size': 108, 'dropout': 0.14586091248833774, 'learning_rate': 0.002004432138344682, 'batch_size': 9543, 'optimizer_name': 'Adam'}. Best is trial 1569 with value: 0.001761963053552708.[0m
[32m[I 2022-11-08 10:36:05,934][0m Trial 1796 finished with value: 0.0018109644537192475 and parameters: {'nlayers': 47, 'hidden_size': 97, 'dropout': 0.161000366243876, 'learning_rate': 0.006799023279235886, 'batch_size': 9821, 'optimizer_name': 'Adam'}. Best is trial 1569 with value: 0.001761963053552708.[0m
[32m[I 2022-11-08 10:36:27,465][0m Trial 1797 finished with value: 0.0018376075285525362 and parameters: {'nlayers': 14, 'hidden_size': 74, 'dropout': 0.4395607801201779, 'learning_rate': 0.00654942292230121, 'batch_size': 9680, 'optimizer_name': 'Adam'}. Best is trial 1569 with value: 0.001761963053552708.[0m
[32m[I 2022-11-08 10:36:54,896][0m Trial 1798 finished with value: 0.0018047598727143907 and parameters: {'nlayers': 44, 'hidden_size': 37, 'dropout': 0.48289276879852955, 'learning_rate': 0.0010741951121267129, 'batch_size': 9809, 'optimizer_name': 'Adam'}. Best is trial 1569 with value: 0.001761963053552708.[0m
[32m[I 2022-11-08 10:38:09,230][0m Trial 1799 finished with value: 0.0018913499541827175 and parameters: {'nlayers': 66, 'hidden_size': 256, 'dropout': 0.3283560362204956, 'learning_rate': 0.0015883032195870696, 'batch_size': 9370, 'optimizer_name': 'Adam'}. Best is trial 1569 with value: 0.001761963053552708.[0m
[32m[I 2022-11-08 10:38:16,119][0m Trial 1800 finished with value: 0.02763742670930665 and parameters: {'nlayers': 97, 'hidden_size': 62, 'dropout': 0.20990202111436745, 'learning_rate': 0.0024932392456489746, 'batch_size': 638, 'optimizer_name': 'RMSprop'}. Best is trial 1569 with value: 0.001761963053552708.[0m
[32m[I 2022-11-08 10:38:55,958][0m Trial 1801 finished with value: 0.0017762592001980236 and parameters: {'nlayers': 69, 'hidden_size': 86, 'dropout': 0.18845840200155353, 'learning_rate': 0.007627064784250408, 'batch_size': 9996, 'optimizer_name': 'Adam'}. Best is trial 1569 with value: 0.001761963053552708.[0m
[32m[I 2022-11-08 10:39:43,439][0m Trial 1802 finished with value: 0.001773108184337616 and parameters: {'nlayers': 74, 'hidden_size': 119, 'dropout': 0.12453803489011255, 'learning_rate': 0.0023243722631950446, 'batch_size': 10000, 'optimizer_name': 'Adam'}. Best is trial 1569 with value: 0.001761963053552708.[0m
[32m[I 2022-11-08 10:40:04,105][0m Trial 1803 finished with value: 0.0018334328010831786 and parameters: {'nlayers': 9, 'hidden_size': 104, 'dropout': 0.4205252227138486, 'learning_rate': 0.0018531120767843478, 'batch_size': 9708, 'optimizer_name': 'Adam'}. Best is trial 1569 with value: 0.001761963053552708.[0m
[32m[I 2022-11-08 10:40:30,402][0m Trial 1804 finished with value: 0.0018564084240831591 and parameters: {'nlayers': 19, 'hidden_size': 157, 'dropout': 0.15111828611403272, 'learning_rate': 0.0026301872101972385, 'batch_size': 9560, 'optimizer_name': 'SGD'}. Best is trial 1569 with value: 0.001761963053552708.[0m
[32m[I 2022-11-08 10:41:08,302][0m Trial 1805 finished with value: 0.0018272619543559948 and parameters: {'nlayers': 42, 'hidden_size': 150, 'dropout': 0.24769934068692515, 'learning_rate': 0.002157331686002775, 'batch_size': 9726, 'optimizer_name': 'Adam'}. Best is trial 1569 with value: 0.001761963053552708.[0m
[32m[I 2022-11-08 10:41:29,666][0m Trial 1806 finished with value: 0.001804367243880179 and parameters: {'nlayers': 5, 'hidden_size': 170, 'dropout': 0.16616685984240764, 'learning_rate': 0.007270167844473511, 'batch_size': 9840, 'optimizer_name': 'Adam'}. Best is trial 1569 with value: 0.001761963053552708.[0m
[32m[I 2022-11-08 10:41:56,144][0m Trial 1807 finished with value: 0.001996937928572692 and parameters: {'nlayers': 23, 'hidden_size': 163, 'dropout': 0.40760439597470566, 'learning_rate': 0.0012460681015796556, 'batch_size': 8861, 'optimizer_name': 'Adam'}. Best is trial 1569 with value: 0.001761963053552708.[0m
[32m[I 2022-11-08 10:42:18,305][0m Trial 1808 finished with value: 0.0018029465699387645 and parameters: {'nlayers': 15, 'hidden_size': 70, 'dropout': 0.42725388154009963, 'learning_rate': 0.0017256233943018862, 'batch_size': 9821, 'optimizer_name': 'Adam'}. Best is trial 1569 with value: 0.001761963053552708.[0m
[32m[I 2022-11-08 10:42:42,081][0m Trial 1809 finished with value: 0.0018637570623686892 and parameters: {'nlayers': 32, 'hidden_size': 44, 'dropout': 0.45716294248443584, 'learning_rate': 0.0019799129866553654, 'batch_size': 9528, 'optimizer_name': 'Adam'}. Best is trial 1569 with value: 0.001761963053552708.[0m
[32m[I 2022-11-08 10:43:14,826][0m Trial 1810 finished with value: 0.001808338424043339 and parameters: {'nlayers': 51, 'hidden_size': 112, 'dropout': 0.1764248026698917, 'learning_rate': 0.0027767481611093202, 'batch_size': 9822, 'optimizer_name': 'Adam'}. Best is trial 1569 with value: 0.001761963053552708.[0m
[32m[I 2022-11-08 10:43:52,851][0m Trial 1811 finished with value: 0.0019050701432382633 and parameters: {'nlayers': 72, 'hidden_size': 97, 'dropout': 0.15834066093544594, 'learning_rate': 0.002402858766185241, 'batch_size': 9318, 'optimizer_name': 'Adam'}. Best is trial 1569 with value: 0.001761963053552708.[0m
[32m[I 2022-11-08 10:44:26,428][0m Trial 1812 finished with value: 0.0017670435471166023 and parameters: {'nlayers': 37, 'hidden_size': 123, 'dropout': 0.13760423574142286, 'learning_rate': 0.0022339911030251377, 'batch_size': 9997, 'optimizer_name': 'Adam'}. Best is trial 1569 with value: 0.001761963053552708.[0m
[32m[I 2022-11-08 10:44:57,768][0m Trial 1813 finished with value: 0.0018306028883578154 and parameters: {'nlayers': 39, 'hidden_size': 114, 'dropout': 0.13413654653792725, 'learning_rate': 0.0023957894776087453, 'batch_size': 9677, 'optimizer_name': 'RMSprop'}. Best is trial 1569 with value: 0.001761963053552708.[0m
[32m[I 2022-11-08 10:45:20,282][0m Trial 1814 finished with value: 0.0018124557107832848 and parameters: {'nlayers': 11, 'hidden_size': 115, 'dropout': 0.1370313753429192, 'learning_rate': 0.0026950184264839293, 'batch_size': 9808, 'optimizer_name': 'Adam'}. Best is trial 1569 with value: 0.001761963053552708.[0m
[32m[I 2022-11-08 10:45:39,886][0m Trial 1815 finished with value: 0.0018732573787140804 and parameters: {'nlayers': 7, 'hidden_size': 122, 'dropout': 0.12793115490922116, 'learning_rate': 0.0025303467035855134, 'batch_size': 9481, 'optimizer_name': 'Adam'}. Best is trial 1569 with value: 0.001761963053552708.[0m
[32m[I 2022-11-08 10:46:02,860][0m Trial 1816 finished with value: 0.00180745281047325 and parameters: {'nlayers': 13, 'hidden_size': 106, 'dropout': 0.13095481042932633, 'learning_rate': 0.007024788697652134, 'batch_size': 9805, 'optimizer_name': 'Adam'}. Best is trial 1569 with value: 0.001761963053552708.[0m
[32m[I 2022-11-08 10:46:26,665][0m Trial 1817 finished with value: 0.001839138698755842 and parameters: {'nlayers': 17, 'hidden_size': 119, 'dropout': 0.14206603016260688, 'learning_rate': 0.0007385577059240062, 'batch_size': 9646, 'optimizer_name': 'Adam'}. Best is trial 1569 with value: 0.001761963053552708.[0m
[32m[I 2022-11-08 10:46:58,243][0m Trial 1818 finished with value: 0.0018005109792328658 and parameters: {'nlayers': 41, 'hidden_size': 105, 'dropout': 0.14013712757896266, 'learning_rate': 0.0022413337607334665, 'batch_size': 9820, 'optimizer_name': 'Adam'}. Best is trial 1569 with value: 0.001761963053552708.[0m
[32m[I 2022-11-08 10:47:29,614][0m Trial 1819 finished with value: 0.001839278581913234 and parameters: {'nlayers': 49, 'hidden_size': 112, 'dropout': 0.12187726996071506, 'learning_rate': 0.0028828921563582586, 'batch_size': 9635, 'optimizer_name': 'Adam'}. Best is trial 1569 with value: 0.001761963053552708.[0m
[32m[I 2022-11-08 10:48:07,088][0m Trial 1820 finished with value: 0.00180372119579986 and parameters: {'nlayers': 66, 'hidden_size': 82, 'dropout': 0.13699848836643305, 'learning_rate': 0.0020425924233381946, 'batch_size': 9838, 'optimizer_name': 'Adam'}. Best is trial 1569 with value: 0.001761963053552708.[0m
[32m[I 2022-11-08 10:48:28,468][0m Trial 1821 finished with value: 0.0019018809162008633 and parameters: {'nlayers': 21, 'hidden_size': 57, 'dropout': 0.12976241603823196, 'learning_rate': 0.0003921539211773733, 'batch_size': 9358, 'optimizer_name': 'Adam'}. Best is trial 1569 with value: 0.001761963053552708.[0m
[32m[I 2022-11-08 10:48:49,583][0m Trial 1822 finished with value: 0.001774982249863173 and parameters: {'nlayers': 10, 'hidden_size': 64, 'dropout': 0.14230703700967792, 'learning_rate': 0.007390587317361153, 'batch_size': 9998, 'optimizer_name': 'Adam'}. Best is trial 1569 with value: 0.001761963053552708.[0m
[32m[I 2022-11-08 10:49:27,751][0m Trial 1823 finished with value: 0.0018098731064750313 and parameters: {'nlayers': 64, 'hidden_size': 90, 'dropout': 0.11691816051334965, 'learning_rate': 0.002602450261875647, 'batch_size': 9819, 'optimizer_name': 'Adam'}. Best is trial 1569 with value: 0.001761963053552708.[0m
[32m[I 2022-11-08 10:49:51,528][0m Trial 1824 finished with value: 0.0018470648765563965 and parameters: {'nlayers': 15, 'hidden_size': 105, 'dropout': 0.13398469041840458, 'learning_rate': 0.001534956665315908, 'batch_size': 10000, 'optimizer_name': 'SGD'}. Best is trial 1569 with value: 0.001761963053552708.[0m
[32m[I 2022-11-08 10:50:13,625][0m Trial 1825 finished with value: 0.0018594886561141045 and parameters: {'nlayers': 13, 'hidden_size': 110, 'dropout': 0.14428189980869932, 'learning_rate': 0.002302164148775476, 'batch_size': 9537, 'optimizer_name': 'Adam'}. Best is trial 1569 with value: 0.001761963053552708.[0m
[32m[I 2022-11-08 10:50:35,104][0m Trial 1826 finished with value: 0.0017745046451009472 and parameters: {'nlayers': 8, 'hidden_size': 97, 'dropout': 0.14766962533373604, 'learning_rate': 0.001828439634918942, 'batch_size': 9995, 'optimizer_name': 'RMSprop'}. Best is trial 1569 with value: 0.001761963053552708.[0m
[32m[I 2022-11-08 10:51:17,859][0m Trial 1827 finished with value: 0.0018385252652324711 and parameters: {'nlayers': 68, 'hidden_size': 119, 'dropout': 0.13750459433701234, 'learning_rate': 0.002111325598631584, 'batch_size': 9632, 'optimizer_name': 'Adam'}. Best is trial 1569 with value: 0.001761963053552708.[0m
[32m[I 2022-11-08 10:51:41,486][0m Trial 1828 finished with value: 0.001803382053637456 and parameters: {'nlayers': 19, 'hidden_size': 77, 'dropout': 0.12678829775890382, 'learning_rate': 0.002441313367825742, 'batch_size': 9820, 'optimizer_name': 'Adam'}. Best is trial 1569 with value: 0.001761963053552708.[0m
[32m[I 2022-11-08 10:51:50,746][0m Trial 1829 finished with value: 0.0045878463954204295 and parameters: {'nlayers': 38, 'hidden_size': 103, 'dropout': 0.12468157736423371, 'learning_rate': 0.007733982383728161, 'batch_size': 3861, 'optimizer_name': 'Adam'}. Best is trial 1569 with value: 0.001761963053552708.[0m
[32m[I 2022-11-08 10:52:18,319][0m Trial 1830 finished with value: 0.001768312338879043 and parameters: {'nlayers': 53, 'hidden_size': 2, 'dropout': 0.15191278726659635, 'learning_rate': 0.005803671931982916, 'batch_size': 9994, 'optimizer_name': 'Adam'}. Best is trial 1569 with value: 0.001761963053552708.[0m
[32m[I 2022-11-08 10:52:47,789][0m Trial 1831 finished with value: 0.0017718652007889541 and parameters: {'nlayers': 49, 'hidden_size': 37, 'dropout': 0.14666334273948747, 'learning_rate': 0.0055942855910514535, 'batch_size': 9999, 'optimizer_name': 'Adam'}. Best is trial 1569 with value: 0.001761963053552708.[0m
[32m[I 2022-11-08 10:53:14,298][0m Trial 1832 finished with value: 0.0017722994655483984 and parameters: {'nlayers': 47, 'hidden_size': 7, 'dropout': 0.14422092069298323, 'learning_rate': 0.006099173448013476, 'batch_size': 9998, 'optimizer_name': 'Adam'}. Best is trial 1569 with value: 0.001761963053552708.[0m
[32m[I 2022-11-08 10:53:33,794][0m Trial 1833 finished with value: 0.0018358353351602093 and parameters: {'nlayers': 11, 'hidden_size': 24, 'dropout': 0.13670844167758298, 'learning_rate': 0.005898121513100606, 'batch_size': 9667, 'optimizer_name': 'Adam'}. Best is trial 1569 with value: 0.001761963053552708.[0m
[32m[I 2022-11-08 10:54:02,662][0m Trial 1834 finished with value: 0.0017710655391216278 and parameters: {'nlayers': 54, 'hidden_size': 23, 'dropout': 0.15159050586717587, 'learning_rate': 0.006428894867399535, 'batch_size': 10000, 'optimizer_name': 'Adam'}. Best is trial 1569 with value: 0.001761963053552708.[0m
[32m[I 2022-11-08 10:54:26,639][0m Trial 1835 finished with value: 0.0019432733152067749 and parameters: {'nlayers': 56, 'hidden_size': 4, 'dropout': 0.14190744210903317, 'learning_rate': 0.0052996052212980396, 'batch_size': 9241, 'optimizer_name': 'Adam'}. Best is trial 1569 with value: 0.001761963053552708.[0m
[32m[I 2022-11-08 10:54:53,815][0m Trial 1836 finished with value: 0.0018681561733883303 and parameters: {'nlayers': 53, 'hidden_size': 29, 'dropout': 0.14677892678978086, 'learning_rate': 0.005579154698407607, 'batch_size': 9515, 'optimizer_name': 'Adam'}. Best is trial 1569 with value: 0.001761963053552708.[0m
[32m[I 2022-11-08 10:55:20,917][0m Trial 1837 finished with value: 0.0017724206745624543 and parameters: {'nlayers': 51, 'hidden_size': 6, 'dropout': 0.13353803573006423, 'learning_rate': 0.007527621551988029, 'batch_size': 10000, 'optimizer_name': 'Adam'}. Best is trial 1569 with value: 0.001761963053552708.[0m
[32m[I 2022-11-08 10:55:50,271][0m Trial 1838 finished with value: 0.0018258414168435535 and parameters: {'nlayers': 54, 'hidden_size': 49, 'dropout': 0.14988509496318975, 'learning_rate': 0.006151934433012019, 'batch_size': 9698, 'optimizer_name': 'Adam'}. Best is trial 1569 with value: 0.001761963053552708.[0m
[32m[I 2022-11-08 10:56:11,001][0m Trial 1839 finished with value: 0.0018049608441557494 and parameters: {'nlayers': 16, 'hidden_size': 12, 'dropout': 0.14094818060345604, 'learning_rate': 0.0064081991443067695, 'batch_size': 9814, 'optimizer_name': 'RMSprop'}. Best is trial 1569 with value: 0.001761963053552708.[0m
[32m[I 2022-11-08 10:56:41,434][0m Trial 1840 finished with value: 0.001869180953898136 and parameters: {'nlayers': 54, 'hidden_size': 67, 'dropout': 0.15161444616980296, 'learning_rate': 0.005358836342334526, 'batch_size': 9495, 'optimizer_name': 'Adam'}. Best is trial 1569 with value: 0.001761963053552708.[0m
[32m[I 2022-11-08 10:57:14,160][0m Trial 1841 finished with value: 0.0018132371470766396 and parameters: {'nlayers': 51, 'hidden_size': 84, 'dropout': 0.13238387344873837, 'learning_rate': 0.005740641229007301, 'batch_size': 9814, 'optimizer_name': 'Adam'}. Best is trial 1569 with value: 0.001761963053552708.[0m
[32m[I 2022-11-08 10:57:40,871][0m Trial 1842 finished with value: 0.0018298510131995655 and parameters: {'nlayers': 52, 'hidden_size': 13, 'dropout': 0.15320117055054253, 'learning_rate': 0.006243791264109213, 'batch_size': 9673, 'optimizer_name': 'Adam'}. Best is trial 1569 with value: 0.001761963053552708.[0m
[32m[I 2022-11-08 10:58:09,237][0m Trial 1843 finished with value: 0.0017732497047979793 and parameters: {'nlayers': 53, 'hidden_size': 15, 'dropout': 0.1202764498295135, 'learning_rate': 0.005638713150651585, 'batch_size': 9999, 'optimizer_name': 'Adam'}. Best is trial 1569 with value: 0.001761963053552708.[0m
[32m[I 2022-11-08 10:58:34,123][0m Trial 1844 finished with value: 0.001892054020879031 and parameters: {'nlayers': 52, 'hidden_size': 4, 'dropout': 0.15346753162406104, 'learning_rate': 0.00473346992198084, 'batch_size': 9821, 'optimizer_name': 'Adam'}. Best is trial 1569 with value: 0.001761963053552708.[0m
[32m[I 2022-11-08 10:59:03,835][0m Trial 1845 finished with value: 0.0018822205143966132 and parameters: {'nlayers': 56, 'hidden_size': 57, 'dropout': 0.1403641000176724, 'learning_rate': 0.006205237080682091, 'batch_size': 9409, 'optimizer_name': 'Adam'}. Best is trial 1569 with value: 0.001761963053552708.[0m
[32m[I 2022-11-08 10:59:33,164][0m Trial 1846 finished with value: 0.0018350333946097071 and parameters: {'nlayers': 52, 'hidden_size': 72, 'dropout': 0.1445996916935051, 'learning_rate': 0.00524770140452752, 'batch_size': 9671, 'optimizer_name': 'Adam'}. Best is trial 1569 with value: 0.001761963053552708.[0m
[32m[I 2022-11-08 10:59:58,055][0m Trial 1847 finished with value: 0.0018580429769560077 and parameters: {'nlayers': 50, 'hidden_size': 6, 'dropout': 0.10859969769060193, 'learning_rate': 0.004890780528476024, 'batch_size': 9821, 'optimizer_name': 'SGD'}. Best is trial 1569 with value: 0.001761963053552708.[0m
[32m[I 2022-11-08 11:00:27,789][0m Trial 1848 finished with value: 0.0018400617861532504 and parameters: {'nlayers': 75, 'hidden_size': 15, 'dropout': 0.1309919548963113, 'learning_rate': 0.0063088367689875515, 'batch_size': 9637, 'optimizer_name': 'Adam'}. Best is trial 1569 with value: 0.001761963053552708.[0m
[32m[I 2022-11-08 11:00:51,961][0m Trial 1849 finished with value: 0.0018074843588253185 and parameters: {'nlayers': 49, 'hidden_size': 24, 'dropout': 0.12796854093554685, 'learning_rate': 0.005435921908767218, 'batch_size': 9819, 'optimizer_name': 'Adam'}. Best is trial 1569 with value: 0.001761963053552708.[0m
[32m[I 2022-11-08 11:01:15,041][0m Trial 1850 finished with value: 0.0017702837377786636 and parameters: {'nlayers': 21, 'hidden_size': 21, 'dropout': 0.15180629732071366, 'learning_rate': 0.0066353192067845745, 'batch_size': 10000, 'optimizer_name': 'Adam'}. Best is trial 1569 with value: 0.001761963053552708.[0m
[32m[I 2022-11-08 11:01:38,598][0m Trial 1851 finished with value: 0.0017722625577164803 and parameters: {'nlayers': 25, 'hidden_size': 21, 'dropout': 0.11531892009519734, 'learning_rate': 0.006915829572825227, 'batch_size': 9997, 'optimizer_name': 'Adam'}. Best is trial 1569 with value: 0.001761963053552708.[0m
[32m[I 2022-11-08 11:02:07,726][0m Trial 1852 finished with value: 0.0019517298775515895 and parameters: {'nlayers': 54, 'hidden_size': 74, 'dropout': 0.15528762901546084, 'learning_rate': 0.007090595783406445, 'batch_size': 9074, 'optimizer_name': 'RMSprop'}. Best is trial 1569 with value: 0.001761963053552708.[0m
[32m[I 2022-11-08 11:02:40,210][0m Trial 1853 finished with value: 0.0018623228899137241 and parameters: {'nlayers': 51, 'hidden_size': 87, 'dropout': 0.13984501028910418, 'learning_rate': 0.00672750878633486, 'batch_size': 9525, 'optimizer_name': 'Adam'}. Best is trial 1569 with value: 0.001761963053552708.[0m
[32m[I 2022-11-08 11:03:07,336][0m Trial 1854 finished with value: 0.0018090819829777764 and parameters: {'nlayers': 54, 'hidden_size': 18, 'dropout': 0.14528818741161023, 'learning_rate': 0.0061100070588427915, 'batch_size': 9804, 'optimizer_name': 'Adam'}. Best is trial 1569 with value: 0.001761963053552708.[0m
[32m[I 2022-11-08 11:04:25,731][0m Trial 1855 finished with value: 0.0018364012334061261 and parameters: {'nlayers': 55, 'hidden_size': 296, 'dropout': 0.15447640629100887, 'learning_rate': 0.007173225434593221, 'batch_size': 9645, 'optimizer_name': 'Adam'}. Best is trial 1569 with value: 0.001761963053552708.[0m
[32m[I 2022-11-08 11:04:59,366][0m Trial 1856 finished with value: 0.001892432610126187 and parameters: {'nlayers': 55, 'hidden_size': 91, 'dropout': 0.1335758701225499, 'learning_rate': 0.005741153986977411, 'batch_size': 9391, 'optimizer_name': 'Adam'}. Best is trial 1569 with value: 0.001761963053552708.[0m
[32m[I 2022-11-08 11:05:29,176][0m Trial 1857 finished with value: 0.0018081966585234911 and parameters: {'nlayers': 49, 'hidden_size': 80, 'dropout': 0.11982345140586881, 'learning_rate': 0.006812241223268192, 'batch_size': 9813, 'optimizer_name': 'Adam'}. Best is trial 1569 with value: 0.001761963053552708.[0m
[32m[I 2022-11-08 11:05:54,717][0m Trial 1858 finished with value: 0.0017725247451816576 and parameters: {'nlayers': 52, 'hidden_size': 32, 'dropout': 0.15698967375043635, 'learning_rate': 0.006060833264656922, 'batch_size': 9995, 'optimizer_name': 'Adam'}. Best is trial 1569 with value: 0.001761963053552708.[0m
[32m[I 2022-11-08 11:06:28,520][0m Trial 1859 finished with value: 0.0018133233958600567 and parameters: {'nlayers': 55, 'hidden_size': 77, 'dropout': 0.14496951656469748, 'learning_rate': 0.006528532708394714, 'batch_size': 9814, 'optimizer_name': 'Adam'}. Best is trial 1569 with value: 0.001761963053552708.[0m
[32m[I 2022-11-08 11:06:54,226][0m Trial 1860 finished with value: 0.001855930548562897 and parameters: {'nlayers': 53, 'hidden_size': 9, 'dropout': 0.12415764370940806, 'learning_rate': 0.005963830782931426, 'batch_size': 9563, 'optimizer_name': 'Adam'}. Best is trial 1569 with value: 0.001761963053552708.[0m
[32m[I 2022-11-08 11:07:24,247][0m Trial 1861 finished with value: 0.0018294914445707655 and parameters: {'nlayers': 50, 'hidden_size': 63, 'dropout': 0.13820242220158585, 'learning_rate': 0.00583836540899783, 'batch_size': 9682, 'optimizer_name': 'Adam'}. Best is trial 1569 with value: 0.001761963053552708.[0m
[32m[I 2022-11-08 11:07:35,073][0m Trial 1862 finished with value: 0.0037782463904995588 and parameters: {'nlayers': 53, 'hidden_size': 52, 'dropout': 0.16074774970765934, 'learning_rate': 0.006695803493849887, 'batch_size': 4694, 'optimizer_name': 'Adam'}. Best is trial 1569 with value: 0.001761963053552708.[0m
