[32m[I 2022-11-07 21:25:12,607][0m Trial 276 finished with value: 0.0017698206970937038 and parameters: {'nlayers': 57, 'hidden_size': 131, 'dropout': 0.18106649122339766, 'learning_rate': 0.00120962226896561, 'batch_size': 9999, 'optimizer_name': 'Adam'}. Best is trial 195 with value: 0.001767993638185369.[0m
[32m[I 2022-11-07 21:25:53,865][0m Trial 277 finished with value: 0.0018342361439837864 and parameters: {'nlayers': 61, 'hidden_size': 129, 'dropout': 0.12415941182265221, 'learning_rate': 0.0011580266345439304, 'batch_size': 9668, 'optimizer_name': 'Adam'}. Best is trial 195 with value: 0.001767993638185369.[0m
[32m[I 2022-11-07 21:26:30,863][0m Trial 278 finished with value: 0.001808172410262064 and parameters: {'nlayers': 55, 'hidden_size': 117, 'dropout': 0.17157984280321423, 'learning_rate': 0.000919992267295339, 'batch_size': 9804, 'optimizer_name': 'Adam'}. Best is trial 195 with value: 0.001767993638185369.[0m
[32m[I 2022-11-07 21:27:23,202][0m Trial 279 finished with value: 0.0018721760526233472 and parameters: {'nlayers': 58, 'hidden_size': 186, 'dropout': 0.1525596790079256, 'learning_rate': 0.0014942988375904072, 'batch_size': 9482, 'optimizer_name': 'Adam'}. Best is trial 195 with value: 0.001767993638185369.[0m
[32m[I 2022-11-07 21:27:31,142][0m Trial 280 finished with value: 0.009433841603705397 and parameters: {'nlayers': 56, 'hidden_size': 122, 'dropout': 0.3475694102598565, 'learning_rate': 0.0011625641375275454, 'batch_size': 1877, 'optimizer_name': 'Adam'}. Best is trial 195 with value: 0.001767993638185369.[0m
[32m[I 2022-11-07 21:28:07,782][0m Trial 281 finished with value: 0.0017756756696003285 and parameters: {'nlayers': 57, 'hidden_size': 106, 'dropout': 0.17605279114342637, 'learning_rate': 0.0018322168072242022, 'batch_size': 9991, 'optimizer_name': 'Adam'}. Best is trial 195 with value: 0.001767993638185369.[0m
[32m[I 2022-11-07 21:28:12,253][0m Trial 282 finished with value: 0.007624107185087175 and parameters: {'nlayers': 21, 'hidden_size': 129, 'dropout': 0.16635187574603946, 'learning_rate': 0.0007458531174670517, 'batch_size': 2317, 'optimizer_name': 'Adam'}. Best is trial 195 with value: 0.001767993638185369.[0m
[32m[I 2022-11-07 21:28:37,571][0m Trial 283 finished with value: 0.0018165382993714447 and parameters: {'nlayers': 16, 'hidden_size': 147, 'dropout': 0.1307600038538221, 'learning_rate': 0.0021306810937340003, 'batch_size': 9814, 'optimizer_name': 'Adam'}. Best is trial 195 with value: 0.001767993638185369.[0m
[32m[I 2022-11-07 21:29:03,101][0m Trial 284 finished with value: 0.0018398262085719682 and parameters: {'nlayers': 14, 'hidden_size': 180, 'dropout': 0.15821309256795604, 'learning_rate': 0.001374960020637446, 'batch_size': 9638, 'optimizer_name': 'Adam'}. Best is trial 195 with value: 0.001767993638185369.[0m
[32m[I 2022-11-07 21:29:42,231][0m Trial 285 finished with value: 0.0017723131476670387 and parameters: {'nlayers': 36, 'hidden_size': 172, 'dropout': 0.1466070219095979, 'learning_rate': 0.0024535931141236567, 'batch_size': 9999, 'optimizer_name': 'Adam'}. Best is trial 195 with value: 0.001767993638185369.[0m
[32m[I 2022-11-07 21:31:16,051][0m Trial 286 finished with value: 0.0018065401056422247 and parameters: {'nlayers': 74, 'hidden_size': 275, 'dropout': 0.14217747535550748, 'learning_rate': 0.002455516683690785, 'batch_size': 9812, 'optimizer_name': 'Adam'}. Best is trial 195 with value: 0.001767993638185369.[0m
[32m[I 2022-11-07 21:31:51,579][0m Trial 287 finished with value: 0.0018635751549733175 and parameters: {'nlayers': 35, 'hidden_size': 170, 'dropout': 0.14879540568309071, 'learning_rate': 0.0022449469341681845, 'batch_size': 9528, 'optimizer_name': 'Adam'}. Best is trial 195 with value: 0.001767993638185369.[0m
[32m[I 2022-11-07 21:32:26,890][0m Trial 288 finished with value: 0.0017719122875153284 and parameters: {'nlayers': 32, 'hidden_size': 176, 'dropout': 0.1423070655251505, 'learning_rate': 0.002652062716586852, 'batch_size': 9989, 'optimizer_name': 'Adam'}. Best is trial 195 with value: 0.001767993638185369.[0m
[32m[I 2022-11-07 21:33:01,572][0m Trial 289 finished with value: 0.00190279697821552 and parameters: {'nlayers': 39, 'hidden_size': 176, 'dropout': 0.1377071145339438, 'learning_rate': 0.0026941345265621545, 'batch_size': 9271, 'optimizer_name': 'Adam'}. Best is trial 195 with value: 0.001767993638185369.[0m
[32m[I 2022-11-07 21:33:36,369][0m Trial 290 finished with value: 0.0017779529267618684 and parameters: {'nlayers': 32, 'hidden_size': 159, 'dropout': 0.1299756506646526, 'learning_rate': 0.002005614682585744, 'batch_size': 9996, 'optimizer_name': 'Adam'}. Best is trial 195 with value: 0.001767993638185369.[0m
[32m[I 2022-11-07 21:34:14,870][0m Trial 291 finished with value: 0.0018297099601342606 and parameters: {'nlayers': 37, 'hidden_size': 173, 'dropout': 0.14605162897858484, 'learning_rate': 0.0009722249958223191, 'batch_size': 9674, 'optimizer_name': 'Adam'}. Best is trial 195 with value: 0.001767993638185369.[0m
[32m[I 2022-11-07 21:34:51,818][0m Trial 292 finished with value: 0.0018093098097465162 and parameters: {'nlayers': 29, 'hidden_size': 191, 'dropout': 0.1216954980119954, 'learning_rate': 0.0026489236830483176, 'batch_size': 9805, 'optimizer_name': 'Adam'}. Best is trial 195 with value: 0.001767993638185369.[0m
[32m[I 2022-11-07 21:35:15,107][0m Trial 293 finished with value: 0.002420506139823926 and parameters: {'nlayers': 33, 'hidden_size': 167, 'dropout': 0.1391014111086722, 'learning_rate': 0.0017441283991659223, 'batch_size': 7332, 'optimizer_name': 'Adam'}. Best is trial 195 with value: 0.001767993638185369.[0m
[32m[I 2022-11-07 21:35:55,256][0m Trial 294 finished with value: 0.0017987570863572735 and parameters: {'nlayers': 36, 'hidden_size': 182, 'dropout': 0.11262185829432085, 'learning_rate': 0.0015433912336051108, 'batch_size': 9826, 'optimizer_name': 'Adam'}. Best is trial 195 with value: 0.001767993638185369.[0m
[32m[I 2022-11-07 21:36:10,162][0m Trial 295 finished with value: 0.0030354744285569155 and parameters: {'nlayers': 27, 'hidden_size': 174, 'dropout': 0.15343481685444704, 'learning_rate': 0.0012916163501175953, 'batch_size': 5852, 'optimizer_name': 'Adam'}. Best is trial 195 with value: 0.001767993638185369.[0m
[32m[I 2022-11-07 21:36:45,815][0m Trial 296 finished with value: 0.0018716754949031269 and parameters: {'nlayers': 38, 'hidden_size': 162, 'dropout': 0.13481976753868388, 'learning_rate': 0.0022858265905761847, 'batch_size': 9483, 'optimizer_name': 'Adam'}. Best is trial 195 with value: 0.001767993638185369.[0m
[32m[I 2022-11-07 21:37:43,736][0m Trial 297 finished with value: 0.001771923315653904 and parameters: {'nlayers': 60, 'hidden_size': 189, 'dropout': 0.14714922998275004, 'learning_rate': 0.0008092088256419838, 'batch_size': 9992, 'optimizer_name': 'Adam'}. Best is trial 195 with value: 0.001767993638185369.[0m
[32m[I 2022-11-07 21:38:39,064][0m Trial 298 finished with value: 0.0018275477750129795 and parameters: {'nlayers': 59, 'hidden_size': 190, 'dropout': 0.14454025030576542, 'learning_rate': 0.0007095974503729607, 'batch_size': 9672, 'optimizer_name': 'Adam'}. Best is trial 195 with value: 0.001767993638185369.[0m
[32m[I 2022-11-07 21:39:34,678][0m Trial 299 finished with value: 0.001807479560679257 and parameters: {'nlayers': 65, 'hidden_size': 184, 'dropout': 0.3782265499833813, 'learning_rate': 0.0008673014912523637, 'batch_size': 9802, 'optimizer_name': 'Adam'}. Best is trial 195 with value: 0.001767993638185369.[0m
[32m[I 2022-11-07 21:40:27,528][0m Trial 300 finished with value: 0.0018078651201111125 and parameters: {'nlayers': 58, 'hidden_size': 180, 'dropout': 0.14803274595073576, 'learning_rate': 0.00035082043894626535, 'batch_size': 9826, 'optimizer_name': 'Adam'}. Best is trial 195 with value: 0.001767993638185369.[0m
[32m[I 2022-11-07 21:41:25,928][0m Trial 301 finished with value: 0.0018367743594882421 and parameters: {'nlayers': 61, 'hidden_size': 195, 'dropout': 0.13194175793538201, 'learning_rate': 0.000502172880666495, 'batch_size': 9629, 'optimizer_name': 'Adam'}. Best is trial 195 with value: 0.001767993638185369.[0m
[32m[I 2022-11-07 21:42:11,883][0m Trial 302 finished with value: 0.0017758354702623494 and parameters: {'nlayers': 38, 'hidden_size': 206, 'dropout': 0.1590862475658745, 'learning_rate': 0.002884640862614939, 'batch_size': 9998, 'optimizer_name': 'Adam'}. Best is trial 195 with value: 0.001767993638185369.[0m
[32m[I 2022-11-07 21:42:26,175][0m Trial 303 finished with value: 0.0028204341559020687 and parameters: {'nlayers': 24, 'hidden_size': 153, 'dropout': 0.12410351102800228, 'learning_rate': 0.002425468244847795, 'batch_size': 6294, 'optimizer_name': 'Adam'}. Best is trial 195 with value: 0.001767993638185369.[0m
[32m[I 2022-11-07 21:43:23,241][0m Trial 304 finished with value: 0.0018875695193360635 and parameters: {'nlayers': 60, 'hidden_size': 199, 'dropout': 0.15160291062612932, 'learning_rate': 0.00112024667545097, 'batch_size': 9397, 'optimizer_name': 'Adam'}. Best is trial 195 with value: 0.001767993638185369.[0m
[32m[I 2022-11-07 21:44:07,066][0m Trial 305 finished with value: 0.0018052222243978787 and parameters: {'nlayers': 41, 'hidden_size': 187, 'dropout': 0.14044850658760005, 'learning_rate': 0.0025915889471195925, 'batch_size': 9822, 'optimizer_name': 'Adam'}. Best is trial 195 with value: 0.001767993638185369.[0m
[32m[I 2022-11-07 21:44:44,311][0m Trial 306 finished with value: 0.001776146293342704 and parameters: {'nlayers': 31, 'hidden_size': 177, 'dropout': 0.16438602437630714, 'learning_rate': 0.002165518092484411, 'batch_size': 9991, 'optimizer_name': 'Adam'}. Best is trial 195 with value: 0.001767993638185369.[0m
[32m[I 2022-11-07 21:45:18,658][0m Trial 307 finished with value: 0.0017719731867313385 and parameters: {'nlayers': 28, 'hidden_size': 169, 'dropout': 0.14625385275481068, 'learning_rate': 0.0008484545491442636, 'batch_size': 10000, 'optimizer_name': 'Adam'}. Best is trial 195 with value: 0.001767993638185369.[0m
[32m[I 2022-11-07 21:45:50,019][0m Trial 308 finished with value: 0.0018405154464703113 and parameters: {'nlayers': 26, 'hidden_size': 165, 'dropout': 0.15409698429920396, 'learning_rate': 0.0006744491636006414, 'batch_size': 9656, 'optimizer_name': 'Adam'}. Best is trial 195 with value: 0.001767993638185369.[0m
[32m[I 2022-11-07 21:46:21,863][0m Trial 309 finished with value: 0.001918085239983588 and parameters: {'nlayers': 28, 'hidden_size': 170, 'dropout': 0.1681323852676215, 'learning_rate': 4.482224644410332e-05, 'batch_size': 9507, 'optimizer_name': 'Adam'}. Best is trial 195 with value: 0.001767993638185369.[0m
[32m[I 2022-11-07 21:46:52,123][0m Trial 310 finished with value: 0.0019374502709133578 and parameters: {'nlayers': 31, 'hidden_size': 159, 'dropout': 0.15923106059933786, 'learning_rate': 0.0027300820127916054, 'batch_size': 9131, 'optimizer_name': 'Adam'}. Best is trial 195 with value: 0.001767993638185369.[0m
[32m[I 2022-11-07 21:47:26,233][0m Trial 311 finished with value: 0.0018457907720236364 and parameters: {'nlayers': 29, 'hidden_size': 169, 'dropout': 0.1475468624040162, 'learning_rate': 0.0004592898733582846, 'batch_size': 9999, 'optimizer_name': 'SGD'}. Best is trial 195 with value: 0.001767993638185369.[0m
[32m[I 2022-11-07 21:48:17,258][0m Trial 312 finished with value: 0.0018315263535492092 and parameters: {'nlayers': 54, 'hidden_size': 185, 'dropout': 0.1452290411858413, 'learning_rate': 0.0008920890079309766, 'batch_size': 9688, 'optimizer_name': 'Adam'}. Best is trial 195 with value: 0.001767993638185369.[0m
[32m[I 2022-11-07 21:48:54,000][0m Trial 313 finished with value: 0.0018125466388383329 and parameters: {'nlayers': 33, 'hidden_size': 175, 'dropout': 0.1686716698207395, 'learning_rate': 0.0007760395579027729, 'batch_size': 9756, 'optimizer_name': 'Adam'}. Best is trial 195 with value: 0.001767993638185369.[0m
[32m[I 2022-11-07 21:49:05,170][0m Trial 314 finished with value: 0.003249619892159201 and parameters: {'nlayers': 25, 'hidden_size': 152, 'dropout': 0.1536532856456485, 'learning_rate': 0.002515576886696635, 'batch_size': 5451, 'optimizer_name': 'Adam'}. Best is trial 195 with value: 0.001767993638185369.[0m
[32m[I 2022-11-07 21:49:45,332][0m Trial 315 finished with value: 0.0017992505165760147 and parameters: {'nlayers': 52, 'hidden_size': 142, 'dropout': 0.46827377415137517, 'learning_rate': 0.0010673791064165904, 'batch_size': 9825, 'optimizer_name': 'Adam'}. Best is trial 195 with value: 0.001767993638185369.[0m
[32m[I 2022-11-07 21:50:17,727][0m Trial 316 finished with value: 0.0018820305983748462 and parameters: {'nlayers': 27, 'hidden_size': 181, 'dropout': 0.10181445665554684, 'learning_rate': 0.001957519360846864, 'batch_size': 9422, 'optimizer_name': 'Adam'}. Best is trial 195 with value: 0.001767993638185369.[0m
[32m[I 2022-11-07 21:50:59,286][0m Trial 317 finished with value: 0.0018130040745092107 and parameters: {'nlayers': 35, 'hidden_size': 193, 'dropout': 0.1586913151260122, 'learning_rate': 0.0022787703401061293, 'batch_size': 9825, 'optimizer_name': 'Adam'}. Best is trial 195 with value: 0.001767993638185369.[0m
[32m[I 2022-11-07 21:51:47,254][0m Trial 318 finished with value: 0.001767210723471942 and parameters: {'nlayers': 56, 'hidden_size': 164, 'dropout': 0.13043686043403213, 'learning_rate': 0.0009770737210494616, 'batch_size': 9998, 'optimizer_name': 'Adam'}. Best is trial 318 with value: 0.001767210723471942.[0m
[32m[I 2022-11-07 21:52:34,381][0m Trial 319 finished with value: 0.0018410983146797042 and parameters: {'nlayers': 57, 'hidden_size': 165, 'dropout': 0.1232774151982578, 'learning_rate': 0.000935495051613018, 'batch_size': 9628, 'optimizer_name': 'Adam'}. Best is trial 318 with value: 0.001767210723471942.[0m
[32m[I 2022-11-07 21:53:01,582][0m Trial 320 finished with value: 0.0018032755736076705 and parameters: {'nlayers': 56, 'hidden_size': 13, 'dropout': 0.11459671925560296, 'learning_rate': 0.0005020564288809004, 'batch_size': 9832, 'optimizer_name': 'Adam'}. Best is trial 318 with value: 0.001767210723471942.[0m
[32m[I 2022-11-07 21:53:44,934][0m Trial 321 finished with value: 0.0018497725348559746 and parameters: {'nlayers': 54, 'hidden_size': 158, 'dropout': 0.12977961682838096, 'learning_rate': 0.001020190919161023, 'batch_size': 9575, 'optimizer_name': 'Adam'}. Best is trial 318 with value: 0.001767210723471942.[0m
[32m[I 2022-11-07 21:54:28,698][0m Trial 322 finished with value: 0.0017986054571709571 and parameters: {'nlayers': 58, 'hidden_size': 146, 'dropout': 0.262229488295586, 'learning_rate': 0.0008936982838491631, 'batch_size': 9837, 'optimizer_name': 'Adam'}. Best is trial 318 with value: 0.001767210723471942.[0m
[32m[I 2022-11-07 21:55:13,040][0m Trial 323 finished with value: 0.0018927964506952858 and parameters: {'nlayers': 60, 'hidden_size': 155, 'dropout': 0.13321870274713238, 'learning_rate': 0.0007352386313240472, 'batch_size': 9352, 'optimizer_name': 'Adam'}. Best is trial 318 with value: 0.001767210723471942.[0m
[32m[I 2022-11-07 21:55:59,468][0m Trial 324 finished with value: 0.0017755023352018706 and parameters: {'nlayers': 53, 'hidden_size': 164, 'dropout': 0.13944239702981076, 'learning_rate': 0.0012355969288302229, 'batch_size': 9990, 'optimizer_name': 'Adam'}. Best is trial 318 with value: 0.001767210723471942.[0m
[32m[I 2022-11-07 21:56:43,849][0m Trial 325 finished with value: 0.0018351599411968863 and parameters: {'nlayers': 62, 'hidden_size': 139, 'dropout': 0.17342720279188703, 'learning_rate': 0.002990387215594517, 'batch_size': 9651, 'optimizer_name': 'Adam'}. Best is trial 318 with value: 0.001767210723471942.[0m
[32m[I 2022-11-07 21:57:25,591][0m Trial 326 finished with value: 0.0022077744189093647 and parameters: {'nlayers': 51, 'hidden_size': 203, 'dropout': 0.1656650512788583, 'learning_rate': 0.0010988206976178996, 'batch_size': 8031, 'optimizer_name': 'Adam'}. Best is trial 318 with value: 0.001767210723471942.[0m
[32m[I 2022-11-07 21:57:28,630][0m Trial 327 finished with value: 0.015929948407535192 and parameters: {'nlayers': 23, 'hidden_size': 149, 'dropout': 0.12703483592606915, 'learning_rate': 0.0006786561456398645, 'batch_size': 1109, 'optimizer_name': 'Adam'}. Best is trial 318 with value: 0.001767210723471942.[0m
[32m[I 2022-11-07 21:58:21,144][0m Trial 328 finished with value: 0.0018034436429161037 and parameters: {'nlayers': 55, 'hidden_size': 188, 'dropout': 0.17701239026061127, 'learning_rate': 0.0018228097618244706, 'batch_size': 9822, 'optimizer_name': 'Adam'}. Best is trial 318 with value: 0.001767210723471942.[0m
[32m[I 2022-11-07 21:59:07,821][0m Trial 329 finished with value: 0.001811395584940433 and parameters: {'nlayers': 64, 'hidden_size': 160, 'dropout': 0.11970689154408456, 'learning_rate': 0.0027914342006820137, 'batch_size': 9992, 'optimizer_name': 'SGD'}. Best is trial 318 with value: 0.001767210723471942.[0m
[32m[I 2022-11-07 21:59:37,115][0m Trial 330 finished with value: 0.0017718543609977066 and parameters: {'nlayers': 24, 'hidden_size': 133, 'dropout': 0.1392276585194527, 'learning_rate': 0.0020992095079503214, 'batch_size': 9997, 'optimizer_name': 'Adam'}. Best is trial 318 with value: 0.001767210723471942.[0m
[32m[I 2022-11-07 22:00:05,428][0m Trial 331 finished with value: 0.0018401835418483145 and parameters: {'nlayers': 25, 'hidden_size': 131, 'dropout': 0.13949215094449946, 'learning_rate': 0.002078309587518909, 'batch_size': 9658, 'optimizer_name': 'Adam'}. Best is trial 318 with value: 0.001767210723471942.[0m
[32m[I 2022-11-07 22:00:35,325][0m Trial 332 finished with value: 0.0018609192506870511 and parameters: {'nlayers': 21, 'hidden_size': 180, 'dropout': 0.13053642557819645, 'learning_rate': 0.0016372084190039932, 'batch_size': 9519, 'optimizer_name': 'Adam'}. Best is trial 318 with value: 0.001767210723471942.[0m
[32m[I 2022-11-07 22:01:10,228][0m Trial 333 finished with value: 0.0018105577071929207 and parameters: {'nlayers': 28, 'hidden_size': 175, 'dropout': 0.15061586402928392, 'learning_rate': 0.0021782960507192553, 'batch_size': 9806, 'optimizer_name': 'Adam'}. Best is trial 318 with value: 0.001767210723471942.[0m
[32m[I 2022-11-07 22:01:42,107][0m Trial 334 finished with value: 0.0017700912982225418 and parameters: {'nlayers': 23, 'hidden_size': 166, 'dropout': 0.14140276547030392, 'learning_rate': 0.00192358529715957, 'batch_size': 10000, 'optimizer_name': 'Adam'}. Best is trial 318 with value: 0.001767210723471942.[0m
[32m[I 2022-11-07 22:02:17,229][0m Trial 335 finished with value: 0.0018061811903779873 and parameters: {'nlayers': 25, 'hidden_size': 193, 'dropout': 0.1433915024629704, 'learning_rate': 0.0019954087668385676, 'batch_size': 9796, 'optimizer_name': 'Adam'}. Best is trial 318 with value: 0.001767210723471942.[0m
[32m[I 2022-11-07 22:02:46,075][0m Trial 336 finished with value: 0.001913973783766254 and parameters: {'nlayers': 26, 'hidden_size': 156, 'dropout': 0.15859984639179633, 'learning_rate': 0.002429465830420823, 'batch_size': 9285, 'optimizer_name': 'Adam'}. Best is trial 318 with value: 0.001767210723471942.[0m
[32m[I 2022-11-07 22:03:16,346][0m Trial 337 finished with value: 0.0018395402211940665 and parameters: {'nlayers': 23, 'hidden_size': 165, 'dropout': 0.23989757585118715, 'learning_rate': 0.0005549819532030462, 'batch_size': 9665, 'optimizer_name': 'Adam'}. Best is trial 318 with value: 0.001767210723471942.[0m
[32m[I 2022-11-07 22:03:52,750][0m Trial 338 finished with value: 0.0017683964171965089 and parameters: {'nlayers': 23, 'hidden_size': 212, 'dropout': 0.15300026072697087, 'learning_rate': 0.002243534976302718, 'batch_size': 9992, 'optimizer_name': 'Adam'}. Best is trial 318 with value: 0.001767210723471942.[0m
[32m[I 2022-11-07 22:04:28,171][0m Trial 339 finished with value: 0.0018051645271449721 and parameters: {'nlayers': 23, 'hidden_size': 210, 'dropout': 0.15122111342330832, 'learning_rate': 0.001909989344527288, 'batch_size': 9816, 'optimizer_name': 'Adam'}. Best is trial 318 with value: 0.001767210723471942.[0m
[32m[I 2022-11-07 22:04:50,422][0m Trial 340 finished with value: 0.00256274407709275 and parameters: {'nlayers': 24, 'hidden_size': 219, 'dropout': 0.16098202805792072, 'learning_rate': 0.002209997150759824, 'batch_size': 6905, 'optimizer_name': 'Adam'}. Best is trial 318 with value: 0.001767210723471942.[0m
[32m[I 2022-11-07 22:05:24,932][0m Trial 341 finished with value: 0.0017753815932470937 and parameters: {'nlayers': 21, 'hidden_size': 216, 'dropout': 0.15111927261639851, 'learning_rate': 0.00230861766526412, 'batch_size': 9993, 'optimizer_name': 'Adam'}. Best is trial 318 with value: 0.001767210723471942.[0m
[32m[I 2022-11-07 22:05:46,542][0m Trial 342 finished with value: 0.0018661065596881888 and parameters: {'nlayers': 10, 'hidden_size': 134, 'dropout': 0.16480265501982144, 'learning_rate': 0.0020396278855664904, 'batch_size': 9474, 'optimizer_name': 'Adam'}. Best is trial 318 with value: 0.001767210723471942.[0m
[32m[I 2022-11-07 22:06:20,452][0m Trial 343 finished with value: 0.0018309873571287051 and parameters: {'nlayers': 42, 'hidden_size': 125, 'dropout': 0.14450669963013674, 'learning_rate': 0.0018237104108544634, 'batch_size': 9640, 'optimizer_name': 'Adam'}. Best is trial 318 with value: 0.001767210723471942.[0m
[32m[I 2022-11-07 22:06:48,698][0m Trial 344 finished with value: 0.0017717143828512587 and parameters: {'nlayers': 20, 'hidden_size': 145, 'dropout': 0.1559586885440508, 'learning_rate': 0.0003312682757078961, 'batch_size': 9991, 'optimizer_name': 'Adam'}. Best is trial 318 with value: 0.001767210723471942.[0m
