[32m[I 2022-11-08 02:13:08,870][0m Trial 828 finished with value: 0.0017748993588658079 and parameters: {'nlayers': 13, 'hidden_size': 107, 'dropout': 0.4296492451226172, 'learning_rate': 0.0020812753022757106, 'batch_size': 9994, 'optimizer_name': 'Adam'}. Best is trial 646 with value: 0.0017660508930683137.[0m
[32m[I 2022-11-08 02:13:27,549][0m Trial 829 finished with value: 0.0019511069771844997 and parameters: {'nlayers': 9, 'hidden_size': 103, 'dropout': 0.45294197116202467, 'learning_rate': 0.0029678028679202334, 'batch_size': 9082, 'optimizer_name': 'Adam'}. Best is trial 646 with value: 0.0017660508930683137.[0m
[32m[I 2022-11-08 02:13:50,317][0m Trial 830 finished with value: 0.001840338613487242 and parameters: {'nlayers': 14, 'hidden_size': 116, 'dropout': 0.11019948259475973, 'learning_rate': 0.002441886779074196, 'batch_size': 9666, 'optimizer_name': 'Adam'}. Best is trial 646 with value: 0.0017660508930683137.[0m
[32m[I 2022-11-08 02:14:17,265][0m Trial 831 finished with value: 0.001773705547100807 and parameters: {'nlayers': 17, 'hidden_size': 137, 'dropout': 0.36084875984793985, 'learning_rate': 0.001926108073203872, 'batch_size': 9999, 'optimizer_name': 'Adam'}. Best is trial 646 with value: 0.0017660508930683137.[0m
[32m[I 2022-11-08 02:14:39,788][0m Trial 832 finished with value: 0.0017748982897519182 and parameters: {'nlayers': 11, 'hidden_size': 71, 'dropout': 0.4572859050550774, 'learning_rate': 0.0016362493685143594, 'batch_size': 9999, 'optimizer_name': 'Adam'}. Best is trial 646 with value: 0.0017660508930683137.[0m
[32m[I 2022-11-08 02:15:00,926][0m Trial 833 finished with value: 0.0018352900203550307 and parameters: {'nlayers': 7, 'hidden_size': 142, 'dropout': 0.40839179338205706, 'learning_rate': 0.002683045221353845, 'batch_size': 9677, 'optimizer_name': 'Adam'}. Best is trial 646 with value: 0.0017660508930683137.[0m
[32m[I 2022-11-08 02:16:30,243][0m Trial 834 finished with value: 0.0017957252532243729 and parameters: {'nlayers': 74, 'hidden_size': 264, 'dropout': 0.4196241794766653, 'learning_rate': 0.002155111000925071, 'batch_size': 10000, 'optimizer_name': 'SGD'}. Best is trial 646 with value: 0.0017660508930683137.[0m
[32m[I 2022-11-08 02:17:18,112][0m Trial 835 finished with value: 0.0019003851784605821 and parameters: {'nlayers': 91, 'hidden_size': 123, 'dropout': 0.4736641108116657, 'learning_rate': 0.002359591697476453, 'batch_size': 9347, 'optimizer_name': 'Adam'}. Best is trial 646 with value: 0.0017660508930683137.[0m
[32m[I 2022-11-08 02:18:16,971][0m Trial 836 finished with value: 0.0018630859347389163 and parameters: {'nlayers': 38, 'hidden_size': 291, 'dropout': 0.39273984240641024, 'learning_rate': 0.002537227743422229, 'batch_size': 9533, 'optimizer_name': 'Adam'}. Best is trial 646 with value: 0.0017660508930683137.[0m
[32m[I 2022-11-08 02:18:53,694][0m Trial 837 finished with value: 0.0018237394303638552 and parameters: {'nlayers': 60, 'hidden_size': 106, 'dropout': 0.1887648146266181, 'learning_rate': 0.0015798404801726958, 'batch_size': 9717, 'optimizer_name': 'Adam'}. Best is trial 646 with value: 0.0017660508930683137.[0m
[32m[I 2022-11-08 02:19:24,672][0m Trial 838 finished with value: 0.0018016262300455815 and parameters: {'nlayers': 31, 'hidden_size': 131, 'dropout': 0.1822224778612384, 'learning_rate': 0.0017807523114074237, 'batch_size': 9827, 'optimizer_name': 'Adam'}. Best is trial 646 with value: 0.0017660508930683137.[0m
[32m[I 2022-11-08 02:19:54,937][0m Trial 839 finished with value: 0.0017736391110806026 and parameters: {'nlayers': 15, 'hidden_size': 214, 'dropout': 0.3399208893091834, 'learning_rate': 0.00279980023338972, 'batch_size': 9999, 'optimizer_name': 'Adam'}. Best is trial 646 with value: 0.0017660508930683137.[0m
[32m[I 2022-11-08 02:20:18,654][0m Trial 840 finished with value: 0.0018297881087712103 and parameters: {'nlayers': 19, 'hidden_size': 95, 'dropout': 0.48340090792292845, 'learning_rate': 0.002129648985607595, 'batch_size': 9699, 'optimizer_name': 'Adam'}. Best is trial 646 with value: 0.0017660508930683137.[0m
[32m[I 2022-11-08 02:20:49,489][0m Trial 841 finished with value: 0.0018671189011533512 and parameters: {'nlayers': 42, 'hidden_size': 111, 'dropout': 0.3720994462969711, 'learning_rate': 0.001914872289370392, 'batch_size': 9518, 'optimizer_name': 'Adam'}. Best is trial 646 with value: 0.0017660508930683137.[0m
[32m[I 2022-11-08 02:21:22,326][0m Trial 842 finished with value: 0.0017726752042770387 and parameters: {'nlayers': 63, 'hidden_size': 51, 'dropout': 0.16775934843046314, 'learning_rate': 0.0024612839887369065, 'batch_size': 10000, 'optimizer_name': 'Adam'}. Best is trial 646 with value: 0.0017660508930683137.[0m
[32m[I 2022-11-08 02:21:43,995][0m Trial 843 finished with value: 0.0018065641965322162 and parameters: {'nlayers': 9, 'hidden_size': 102, 'dropout': 0.2634065429005422, 'learning_rate': 0.0021682339462410485, 'batch_size': 9801, 'optimizer_name': 'Adam'}. Best is trial 646 with value: 0.0017660508930683137.[0m
[32m[I 2022-11-08 02:22:06,941][0m Trial 844 finished with value: 0.0018367554803492645 and parameters: {'nlayers': 13, 'hidden_size': 118, 'dropout': 0.17254077363430959, 'learning_rate': 0.002730943947140049, 'batch_size': 9799, 'optimizer_name': 'SGD'}. Best is trial 646 with value: 0.0017660508930683137.[0m
[32m[I 2022-11-08 02:22:27,580][0m Trial 845 finished with value: 0.0018946474939330446 and parameters: {'nlayers': 12, 'hidden_size': 86, 'dropout': 0.43175036141722345, 'learning_rate': 0.008509486993997332, 'batch_size': 9376, 'optimizer_name': 'Adam'}. Best is trial 646 with value: 0.0017660508930683137.[0m
[32m[I 2022-11-08 02:22:50,840][0m Trial 846 finished with value: 0.001832216549062887 and parameters: {'nlayers': 16, 'hidden_size': 94, 'dropout': 0.10233233368536976, 'learning_rate': 0.005157414977877277, 'batch_size': 9656, 'optimizer_name': 'Adam'}. Best is trial 646 with value: 0.0017660508930683137.[0m
[32m[I 2022-11-08 02:23:12,659][0m Trial 847 finished with value: 0.0018099163980501514 and parameters: {'nlayers': 10, 'hidden_size': 100, 'dropout': 0.4623286001930054, 'learning_rate': 0.0023016104801197477, 'batch_size': 9806, 'optimizer_name': 'RMSprop'}. Best is trial 646 with value: 0.0017660508930683137.[0m
[32m[I 2022-11-08 02:23:42,434][0m Trial 848 finished with value: 0.0017737908349751068 and parameters: {'nlayers': 44, 'hidden_size': 80, 'dropout': 0.47290911184395307, 'learning_rate': 0.0018697758413283704, 'batch_size': 9999, 'optimizer_name': 'Adam'}. Best is trial 646 with value: 0.0017660508930683137.[0m
[32m[I 2022-11-08 02:24:05,705][0m Trial 849 finished with value: 0.0018567973835544622 and parameters: {'nlayers': 18, 'hidden_size': 108, 'dropout': 0.1151081641611047, 'learning_rate': 0.001496845631919803, 'batch_size': 9558, 'optimizer_name': 'Adam'}. Best is trial 646 with value: 0.0017660508930683137.[0m
[32m[I 2022-11-08 02:24:48,846][0m Trial 850 finished with value: 0.0018061127621103725 and parameters: {'nlayers': 59, 'hidden_size': 129, 'dropout': 0.16387913002096582, 'learning_rate': 0.003811210037201681, 'batch_size': 9811, 'optimizer_name': 'Adam'}. Best is trial 646 with value: 0.0017660508930683137.[0m
[32m[I 2022-11-08 02:25:13,905][0m Trial 851 finished with value: 0.0017761130926966262 and parameters: {'nlayers': 13, 'hidden_size': 142, 'dropout': 0.1960009565559876, 'learning_rate': 0.00207287180597375, 'batch_size': 9998, 'optimizer_name': 'Adam'}. Best is trial 646 with value: 0.0017660508930683137.[0m
[32m[I 2022-11-08 02:25:26,163][0m Trial 852 finished with value: 0.0037407012922423227 and parameters: {'nlayers': 40, 'hidden_size': 114, 'dropout': 0.39529182081680564, 'learning_rate': 0.0031084423538229305, 'batch_size': 4760, 'optimizer_name': 'Adam'}. Best is trial 646 with value: 0.0017660508930683137.[0m
[32m[I 2022-11-08 02:25:55,426][0m Trial 853 finished with value: 0.0018319799471511935 and parameters: {'nlayers': 36, 'hidden_size': 102, 'dropout': 0.4131804771474287, 'learning_rate': 0.002599890828104467, 'batch_size': 9686, 'optimizer_name': 'Adam'}. Best is trial 646 with value: 0.0017660508930683137.[0m
[32m[I 2022-11-08 02:26:17,962][0m Trial 854 finished with value: 0.0019122611714368668 and parameters: {'nlayers': 8, 'hidden_size': 223, 'dropout': 0.3239206861806473, 'learning_rate': 0.0028788579828462955, 'batch_size': 9246, 'optimizer_name': 'Adam'}. Best is trial 646 with value: 0.0017660508930683137.[0m
[32m[I 2022-11-08 02:26:42,958][0m Trial 855 finished with value: 0.0018051886719970811 and parameters: {'nlayers': 15, 'hidden_size': 137, 'dropout': 0.17662612631456423, 'learning_rate': 0.001650680250861252, 'batch_size': 9821, 'optimizer_name': 'Adam'}. Best is trial 646 with value: 0.0017660508930683137.[0m
[32m[I 2022-11-08 02:27:16,059][0m Trial 856 finished with value: 0.0018589804465200426 and parameters: {'nlayers': 61, 'hidden_size': 96, 'dropout': 0.36244033147787247, 'learning_rate': 0.004681317038797378, 'batch_size': 9490, 'optimizer_name': 'Adam'}. Best is trial 646 with value: 0.0017660508930683137.[0m
[32m[I 2022-11-08 02:28:08,346][0m Trial 857 finished with value: 0.001824639623960829 and parameters: {'nlayers': 42, 'hidden_size': 240, 'dropout': 0.48977520825046184, 'learning_rate': 0.0023677199069283457, 'batch_size': 9834, 'optimizer_name': 'SGD'}. Best is trial 646 with value: 0.0017660508930683137.[0m
[32m[I 2022-11-08 02:28:27,746][0m Trial 858 finished with value: 0.0018532349234204489 and parameters: {'nlayers': 5, 'hidden_size': 123, 'dropout': 0.16608190021937522, 'learning_rate': 0.0019699171718750522, 'batch_size': 9567, 'optimizer_name': 'Adam'}. Best is trial 646 with value: 0.0017660508930683137.[0m
[32m[I 2022-11-08 02:28:55,901][0m Trial 859 finished with value: 0.0017728042393922805 and parameters: {'nlayers': 11, 'hidden_size': 232, 'dropout': 0.46514913105614497, 'learning_rate': 0.002203408067184275, 'batch_size': 10000, 'optimizer_name': 'Adam'}. Best is trial 646 with value: 0.0017660508930683137.[0m
[32m[I 2022-11-08 02:29:10,264][0m Trial 860 finished with value: 0.0022626204819693263 and parameters: {'nlayers': 14, 'hidden_size': 88, 'dropout': 0.24366144032921666, 'learning_rate': 0.002445309933322411, 'batch_size': 7833, 'optimizer_name': 'Adam'}. Best is trial 646 with value: 0.0017660508930683137.[0m
[32m[I 2022-11-08 02:29:46,642][0m Trial 861 finished with value: 0.0018330259026481616 and parameters: {'nlayers': 57, 'hidden_size': 106, 'dropout': 0.4254357482294735, 'learning_rate': 0.002656615705707588, 'batch_size': 9685, 'optimizer_name': 'Adam'}. Best is trial 646 with value: 0.0017660508930683137.[0m
[32m[I 2022-11-08 02:30:20,147][0m Trial 862 finished with value: 0.0018003676656164348 and parameters: {'nlayers': 46, 'hidden_size': 91, 'dropout': 0.38305544156355553, 'learning_rate': 0.0017801722239355199, 'batch_size': 9812, 'optimizer_name': 'Adam'}. Best is trial 646 with value: 0.0017660508930683137.[0m
[32m[I 2022-11-08 02:30:51,772][0m Trial 863 finished with value: 0.001805247913948115 and parameters: {'nlayers': 20, 'hidden_size': 208, 'dropout': 0.35193375556126155, 'learning_rate': 0.002008931098257168, 'batch_size': 9814, 'optimizer_name': 'Adam'}. Best is trial 646 with value: 0.0017660508930683137.[0m
[32m[I 2022-11-08 02:31:31,584][0m Trial 864 finished with value: 0.001840866582626292 and parameters: {'nlayers': 65, 'hidden_size': 109, 'dropout': 0.18045860927123067, 'learning_rate': 0.0022470793320755597, 'batch_size': 9623, 'optimizer_name': 'Adam'}. Best is trial 646 with value: 0.0017660508930683137.[0m
[32m[I 2022-11-08 02:31:54,480][0m Trial 865 finished with value: 0.0018896890024136857 and parameters: {'nlayers': 17, 'hidden_size': 115, 'dropout': 0.43866781826476897, 'learning_rate': 0.0014967013684546247, 'batch_size': 9394, 'optimizer_name': 'Adam'}. Best is trial 646 with value: 0.0017660508930683137.[0m
[32m[I 2022-11-08 02:32:17,333][0m Trial 866 finished with value: 0.0017981587774493614 and parameters: {'nlayers': 10, 'hidden_size': 132, 'dropout': 0.12255421357023615, 'learning_rate': 0.0029971111691555145, 'batch_size': 9841, 'optimizer_name': 'Adam'}. Best is trial 646 with value: 0.0017660508930683137.[0m
[32m[I 2022-11-08 02:32:50,384][0m Trial 867 finished with value: 0.0018054380213475259 and parameters: {'nlayers': 49, 'hidden_size': 83, 'dropout': 0.2313491769088292, 'learning_rate': 0.002497963120105336, 'batch_size': 9823, 'optimizer_name': 'Adam'}. Best is trial 646 with value: 0.0017660508930683137.[0m
[32m[I 2022-11-08 02:33:10,237][0m Trial 868 finished with value: 0.001841289624641497 and parameters: {'nlayers': 7, 'hidden_size': 96, 'dropout': 0.20826670195431127, 'learning_rate': 0.002288783755074107, 'batch_size': 9621, 'optimizer_name': 'RMSprop'}. Best is trial 646 with value: 0.0017660508930683137.[0m
[32m[I 2022-11-08 02:33:33,637][0m Trial 869 finished with value: 0.0018053745073918566 and parameters: {'nlayers': 12, 'hidden_size': 121, 'dropout': 0.10054164092951651, 'learning_rate': 0.002718806281519664, 'batch_size': 9831, 'optimizer_name': 'Adam'}. Best is trial 646 with value: 0.0017660508930683137.[0m
[32m[I 2022-11-08 02:34:04,304][0m Trial 870 finished with value: 0.0018777128290196861 and parameters: {'nlayers': 44, 'hidden_size': 103, 'dropout': 0.17092851503664708, 'learning_rate': 0.0017159715130116715, 'batch_size': 9504, 'optimizer_name': 'SGD'}. Best is trial 646 with value: 0.0017660508930683137.[0m
[32m[I 2022-11-08 02:34:28,132][0m Trial 871 finished with value: 0.0017761934787034988 and parameters: {'nlayers': 15, 'hidden_size': 112, 'dropout': 0.48283333609943296, 'learning_rate': 0.0021563445198472704, 'batch_size': 10000, 'optimizer_name': 'Adam'}. Best is trial 646 with value: 0.0017660508930683137.[0m
[32m[I 2022-11-08 02:34:53,234][0m Trial 872 finished with value: 0.001778625211327242 and parameters: {'nlayers': 18, 'hidden_size': 99, 'dropout': 0.22089006706050118, 'learning_rate': 0.001989100070204833, 'batch_size': 9992, 'optimizer_name': 'Adam'}. Best is trial 646 with value: 0.0017660508930683137.[0m
[32m[I 2022-11-08 02:35:38,302][0m Trial 873 finished with value: 0.0017737376943877468 and parameters: {'nlayers': 55, 'hidden_size': 145, 'dropout': 0.16114384250900649, 'learning_rate': 0.0025067836474222866, 'batch_size': 9998, 'optimizer_name': 'Adam'}. Best is trial 646 with value: 0.0017660508930683137.[0m
[32m[I 2022-11-08 02:36:12,933][0m Trial 874 finished with value: 0.0018258997345856468 and parameters: {'nlayers': 59, 'hidden_size': 77, 'dropout': 0.44839426851491976, 'learning_rate': 0.005830745920880634, 'batch_size': 9690, 'optimizer_name': 'Adam'}. Best is trial 646 with value: 0.0017660508930683137.[0m
[32m[I 2022-11-08 02:36:32,963][0m Trial 875 finished with value: 0.0019156302579168396 and parameters: {'nlayers': 9, 'hidden_size': 126, 'dropout': 0.1102438444345747, 'learning_rate': 0.0014586102905900329, 'batch_size': 9253, 'optimizer_name': 'Adam'}. Best is trial 646 with value: 0.0017660508930683137.[0m
[32m[I 2022-11-08 02:36:36,169][0m Trial 876 finished with value: 0.0041529863759091025 and parameters: {'nlayers': 2, 'hidden_size': 92, 'dropout': 0.18204708244041867, 'learning_rate': 0.005456344733586398, 'batch_size': 4275, 'optimizer_name': 'Adam'}. Best is trial 646 with value: 0.0017660508930683137.[0m
[32m[I 2022-11-08 02:36:58,960][0m Trial 877 finished with value: 0.0018252052144775218 and parameters: {'nlayers': 13, 'hidden_size': 118, 'dropout': 0.47097148394314226, 'learning_rate': 0.001881289233971056, 'batch_size': 9701, 'optimizer_name': 'Adam'}. Best is trial 646 with value: 0.0017660508930683137.[0m
[32m[I 2022-11-08 02:37:35,480][0m Trial 878 finished with value: 0.0017971923432956354 and parameters: {'nlayers': 41, 'hidden_size': 137, 'dropout': 0.16817090872704657, 'learning_rate': 0.0023809975545919515, 'batch_size': 9809, 'optimizer_name': 'Adam'}. Best is trial 646 with value: 0.0017660508930683137.[0m
[32m[I 2022-11-08 02:37:56,140][0m Trial 879 finished with value: 0.0018780533682725715 and parameters: {'nlayers': 11, 'hidden_size': 107, 'dropout': 0.1584144264375816, 'learning_rate': 0.002946997507161407, 'batch_size': 9403, 'optimizer_name': 'Adam'}. Best is trial 646 with value: 0.0017660508930683137.[0m
[32m[I 2022-11-08 02:38:24,361][0m Trial 880 finished with value: 0.001976719651679572 and parameters: {'nlayers': 47, 'hidden_size': 84, 'dropout': 0.119156675354485, 'learning_rate': 0.0016338622153323778, 'batch_size': 8977, 'optimizer_name': 'Adam'}. Best is trial 646 with value: 0.0017660508930683137.[0m
[32m[I 2022-11-08 02:38:54,663][0m Trial 881 finished with value: 0.001840837593202467 and parameters: {'nlayers': 38, 'hidden_size': 94, 'dropout': 0.3160315529187024, 'learning_rate': 0.002088984019553833, 'batch_size': 9625, 'optimizer_name': 'Adam'}. Best is trial 646 with value: 0.0017660508930683137.[0m
[32m[I 2022-11-08 02:39:18,302][0m Trial 882 finished with value: 0.001834390762269777 and parameters: {'nlayers': 16, 'hidden_size': 101, 'dropout': 0.4791897715222937, 'learning_rate': 0.002603859258995405, 'batch_size': 9999, 'optimizer_name': 'SGD'}. Best is trial 646 with value: 0.0017660508930683137.[0m
[32m[I 2022-11-08 02:40:02,693][0m Trial 883 finished with value: 0.0018082081075962953 and parameters: {'nlayers': 63, 'hidden_size': 129, 'dropout': 0.4905630667552175, 'learning_rate': 0.0027952719624743045, 'batch_size': 9821, 'optimizer_name': 'Adam'}. Best is trial 646 with value: 0.0017660508930683137.[0m
[32m[I 2022-11-08 02:40:35,807][0m Trial 884 finished with value: 0.0018027221037570768 and parameters: {'nlayers': 57, 'hidden_size': 68, 'dropout': 0.17486005021523923, 'learning_rate': 0.002284870471277666, 'batch_size': 9812, 'optimizer_name': 'Adam'}. Best is trial 646 with value: 0.0017660508930683137.[0m
[32m[I 2022-11-08 02:41:01,828][0m Trial 885 finished with value: 0.001835553958464138 and parameters: {'nlayers': 45, 'hidden_size': 23, 'dropout': 0.1929734499387758, 'learning_rate': 0.00132874298119123, 'batch_size': 9655, 'optimizer_name': 'Adam'}. Best is trial 646 with value: 0.0017660508930683137.[0m
[32m[I 2022-11-08 02:41:25,516][0m Trial 886 finished with value: 0.0017680632657635356 and parameters: {'nlayers': 14, 'hidden_size': 90, 'dropout': 0.4180745616868658, 'learning_rate': 0.0019123080010823522, 'batch_size': 9991, 'optimizer_name': 'Adam'}. Best is trial 646 with value: 0.0017660508930683137.[0m
[32m[I 2022-11-08 02:42:07,149][0m Trial 887 finished with value: 0.0018633832595869781 and parameters: {'nlayers': 83, 'hidden_size': 86, 'dropout': 0.4119813139204593, 'learning_rate': 0.0018379728887443466, 'batch_size': 9497, 'optimizer_name': 'Adam'}. Best is trial 646 with value: 0.0017660508930683137.[0m
[32m[I 2022-11-08 02:42:29,414][0m Trial 888 finished with value: 0.0017953924213594031 and parameters: {'nlayers': 14, 'hidden_size': 80, 'dropout': 0.41790601803596494, 'learning_rate': 0.0020187708728919883, 'batch_size': 9836, 'optimizer_name': 'Adam'}. Best is trial 646 with value: 0.0017660508930683137.[0m
[32m[I 2022-11-08 02:42:53,456][0m Trial 889 finished with value: 0.001805070826276195 and parameters: {'nlayers': 17, 'hidden_size': 92, 'dropout': 0.4270932485637346, 'learning_rate': 0.0018704084740052836, 'batch_size': 9842, 'optimizer_name': 'Adam'}. Best is trial 646 with value: 0.0017660508930683137.[0m
[32m[I 2022-11-08 02:43:15,842][0m Trial 890 finished with value: 0.0018388616952074155 and parameters: {'nlayers': 14, 'hidden_size': 86, 'dropout': 0.4184597322677799, 'learning_rate': 0.0021395522917750163, 'batch_size': 9630, 'optimizer_name': 'Adam'}. Best is trial 646 with value: 0.0017660508930683137.[0m
[32m[I 2022-11-08 02:43:38,451][0m Trial 891 finished with value: 0.001802642215020582 and parameters: {'nlayers': 12, 'hidden_size': 92, 'dropout': 0.4022787745818398, 'learning_rate': 0.004894960045029905, 'batch_size': 9836, 'optimizer_name': 'RMSprop'}. Best is trial 646 with value: 0.0017660508930683137.[0m
[32m[I 2022-11-08 02:44:00,544][0m Trial 892 finished with value: 0.0018534717311638087 and parameters: {'nlayers': 15, 'hidden_size': 100, 'dropout': 0.42470647267968187, 'learning_rate': 0.0020045221762782896, 'batch_size': 9578, 'optimizer_name': 'Adam'}. Best is trial 646 with value: 0.0017660508930683137.[0m
[32m[I 2022-11-08 02:44:44,074][0m Trial 893 finished with value: 0.0018090098723048482 and parameters: {'nlayers': 80, 'hidden_size': 90, 'dropout': 0.4351560747415062, 'learning_rate': 0.0017564964348719967, 'batch_size': 9821, 'optimizer_name': 'Adam'}. Best is trial 646 with value: 0.0017660508930683137.[0m
[32m[I 2022-11-08 02:45:09,046][0m Trial 894 finished with value: 0.0017695694380842415 and parameters: {'nlayers': 18, 'hidden_size': 97, 'dropout': 0.4239385570751804, 'learning_rate': 0.0021829559844989597, 'batch_size': 9998, 'optimizer_name': 'Adam'}. Best is trial 646 with value: 0.0017660508930683137.[0m
[32m[I 2022-11-08 02:45:34,290][0m Trial 895 finished with value: 0.0017772836148738861 and parameters: {'nlayers': 20, 'hidden_size': 77, 'dropout': 0.4250365626803551, 'learning_rate': 0.002369384557593937, 'batch_size': 10000, 'optimizer_name': 'Adam'}. Best is trial 646 with value: 0.0017660508930683137.[0m
[32m[I 2022-11-08 02:45:56,217][0m Trial 896 finished with value: 0.001916376657485962 and parameters: {'nlayers': 18, 'hidden_size': 97, 'dropout': 0.4098140146749377, 'learning_rate': 0.0025492544158271626, 'batch_size': 9375, 'optimizer_name': 'SGD'}. Best is trial 646 with value: 0.0017660508930683137.[0m
