[32m[I 2022-11-08 08:45:19,668][0m Trial 1587 finished with value: 0.0018575338393440378 and parameters: {'nlayers': 64, 'hidden_size': 54, 'dropout': 0.1752367511917244, 'learning_rate': 0.0015335787749300067, 'batch_size': 9507, 'optimizer_name': 'Adam'}. Best is trial 1569 with value: 0.001761963053552708.[0m
[32m[I 2022-11-08 08:46:02,585][0m Trial 1588 finished with value: 0.0018338111330134974 and parameters: {'nlayers': 72, 'hidden_size': 116, 'dropout': 0.15739421462262904, 'learning_rate': 0.001890244772811257, 'batch_size': 9683, 'optimizer_name': 'Adam'}. Best is trial 1569 with value: 0.001761963053552708.[0m
[32m[I 2022-11-08 08:46:49,952][0m Trial 1589 finished with value: 0.0018082287202354605 and parameters: {'nlayers': 70, 'hidden_size': 129, 'dropout': 0.15625721555573735, 'learning_rate': 0.0020717714921550745, 'batch_size': 9825, 'optimizer_name': 'RMSprop'}. Best is trial 1569 with value: 0.001761963053552708.[0m
[32m[I 2022-11-08 08:47:31,174][0m Trial 1590 finished with value: 0.0017791543395120064 and parameters: {'nlayers': 67, 'hidden_size': 103, 'dropout': 0.1710861995433448, 'learning_rate': 0.0017438430215153734, 'batch_size': 9998, 'optimizer_name': 'Adam'}. Best is trial 1569 with value: 0.001761963053552708.[0m
[32m[I 2022-11-08 08:48:16,490][0m Trial 1591 finished with value: 0.00176962770819664 and parameters: {'nlayers': 65, 'hidden_size': 144, 'dropout': 0.16096955894079143, 'learning_rate': 0.002231807524985687, 'batch_size': 10000, 'optimizer_name': 'Adam'}. Best is trial 1569 with value: 0.001761963053552708.[0m
[32m[I 2022-11-08 08:48:58,843][0m Trial 1592 finished with value: 0.0019355170054033953 and parameters: {'nlayers': 70, 'hidden_size': 136, 'dropout': 0.19877256261695103, 'learning_rate': 0.0014293478955821506, 'batch_size': 9186, 'optimizer_name': 'Adam'}. Best is trial 1569 with value: 0.001761963053552708.[0m
[32m[I 2022-11-08 08:49:36,540][0m Trial 1593 finished with value: 0.0018514276802988356 and parameters: {'nlayers': 63, 'hidden_size': 106, 'dropout': 0.17417280860946943, 'learning_rate': 0.002004497238342145, 'batch_size': 9568, 'optimizer_name': 'Adam'}. Best is trial 1569 with value: 0.001761963053552708.[0m
[32m[I 2022-11-08 08:50:16,989][0m Trial 1594 finished with value: 0.0018253817722528659 and parameters: {'nlayers': 61, 'hidden_size': 124, 'dropout': 0.1821710657805629, 'learning_rate': 0.007644126851694186, 'batch_size': 9697, 'optimizer_name': 'Adam'}. Best is trial 1569 with value: 0.001761963053552708.[0m
[32m[I 2022-11-08 08:50:55,860][0m Trial 1595 finished with value: 0.0018033543418386876 and parameters: {'nlayers': 65, 'hidden_size': 97, 'dropout': 0.16513677115158135, 'learning_rate': 0.0006306088269909436, 'batch_size': 9809, 'optimizer_name': 'Adam'}. Best is trial 1569 with value: 0.001761963053552708.[0m
[32m[I 2022-11-08 08:51:29,129][0m Trial 1596 finished with value: 0.0018917452886401205 and parameters: {'nlayers': 67, 'hidden_size': 68, 'dropout': 0.3519340207151127, 'learning_rate': 0.0018182317582525868, 'batch_size': 9356, 'optimizer_name': 'Adam'}. Best is trial 1569 with value: 0.001761963053552708.[0m
[32m[I 2022-11-08 08:53:01,949][0m Trial 1597 finished with value: 0.0018053356055981796 and parameters: {'nlayers': 64, 'hidden_size': 295, 'dropout': 0.3323198897970777, 'learning_rate': 0.0072746639773248484, 'batch_size': 9801, 'optimizer_name': 'Adam'}. Best is trial 1569 with value: 0.001761963053552708.[0m
[32m[I 2022-11-08 08:53:54,952][0m Trial 1598 finished with value: 0.0018548971421439412 and parameters: {'nlayers': 44, 'hidden_size': 227, 'dropout': 0.1550306256667183, 'learning_rate': 0.0021954316705737648, 'batch_size': 9539, 'optimizer_name': 'Adam'}. Best is trial 1569 with value: 0.001761963053552708.[0m
[32m[I 2022-11-08 08:54:39,409][0m Trial 1599 finished with value: 0.0018054026561152572 and parameters: {'nlayers': 73, 'hidden_size': 114, 'dropout': 0.15548429550566328, 'learning_rate': 0.0020392486409858157, 'batch_size': 9829, 'optimizer_name': 'Adam'}. Best is trial 1569 with value: 0.001761963053552708.[0m
[32m[I 2022-11-08 08:55:25,034][0m Trial 1600 finished with value: 0.0018043737086018707 and parameters: {'nlayers': 60, 'hidden_size': 139, 'dropout': 0.1677468369844671, 'learning_rate': 0.008201927988151185, 'batch_size': 9823, 'optimizer_name': 'RMSprop'}. Best is trial 1569 with value: 0.001761963053552708.[0m
[32m[I 2022-11-08 08:55:33,025][0m Trial 1601 finished with value: 0.006506391413977225 and parameters: {'nlayers': 58, 'hidden_size': 61, 'dropout': 0.18015345793492363, 'learning_rate': 0.005722974390381798, 'batch_size': 2710, 'optimizer_name': 'Adam'}. Best is trial 1569 with value: 0.001761963053552708.[0m
[32m[I 2022-11-08 08:55:36,861][0m Trial 1602 finished with value: 0.014514005276546199 and parameters: {'nlayers': 26, 'hidden_size': 152, 'dropout': 0.1436400156215594, 'learning_rate': 0.0016776108529760491, 'batch_size': 1226, 'optimizer_name': 'Adam'}. Best is trial 1569 with value: 0.001761963053552708.[0m
[32m[I 2022-11-08 08:56:19,240][0m Trial 1603 finished with value: 0.0017716438755981919 and parameters: {'nlayers': 68, 'hidden_size': 107, 'dropout': 0.3935983671510105, 'learning_rate': 0.0022734707427844217, 'batch_size': 9995, 'optimizer_name': 'Adam'}. Best is trial 1569 with value: 0.001761963053552708.[0m
[32m[I 2022-11-08 08:56:51,479][0m Trial 1604 finished with value: 0.0018384414033295639 and parameters: {'nlayers': 46, 'hidden_size': 99, 'dropout': 0.16276473825264012, 'learning_rate': 0.001869848222656162, 'batch_size': 9647, 'optimizer_name': 'Adam'}. Best is trial 1569 with value: 0.001761963053552708.[0m
[32m[I 2022-11-08 08:57:21,965][0m Trial 1605 finished with value: 0.0018441795636339087 and parameters: {'nlayers': 40, 'hidden_size': 120, 'dropout': 0.4805603295695598, 'learning_rate': 0.002330643015625448, 'batch_size': 9659, 'optimizer_name': 'SGD'}. Best is trial 1569 with value: 0.001761963053552708.[0m
[32m[I 2022-11-08 08:58:04,713][0m Trial 1606 finished with value: 0.0018760227888463188 and parameters: {'nlayers': 53, 'hidden_size': 156, 'dropout': 0.14996923760843456, 'learning_rate': 0.000927081202537251, 'batch_size': 9454, 'optimizer_name': 'Adam'}. Best is trial 1569 with value: 0.001761963053552708.[0m
[32m[I 2022-11-08 08:58:55,918][0m Trial 1607 finished with value: 0.0017752560755886762 and parameters: {'nlayers': 75, 'hidden_size': 129, 'dropout': 0.1610407583911459, 'learning_rate': 0.0013417942163100657, 'batch_size': 9999, 'optimizer_name': 'Adam'}. Best is trial 1569 with value: 0.001761963053552708.[0m
[32m[I 2022-11-08 08:59:35,262][0m Trial 1608 finished with value: 0.0018065936420858819 and parameters: {'nlayers': 62, 'hidden_size': 110, 'dropout': 0.3796804038686011, 'learning_rate': 0.002056361820163854, 'batch_size': 9798, 'optimizer_name': 'Adam'}. Best is trial 1569 with value: 0.001761963053552708.[0m
[32m[I 2022-11-08 09:00:09,992][0m Trial 1609 finished with value: 0.0018037350907424681 and parameters: {'nlayers': 35, 'hidden_size': 146, 'dropout': 0.269553714524079, 'learning_rate': 0.002219594010559901, 'batch_size': 9832, 'optimizer_name': 'Adam'}. Best is trial 1569 with value: 0.001761963053552708.[0m
[32m[I 2022-11-08 09:00:52,155][0m Trial 1610 finished with value: 0.0017734731243056457 and parameters: {'nlayers': 71, 'hidden_size': 94, 'dropout': 0.17281145235953835, 'learning_rate': 0.0016562593628905165, 'batch_size': 9996, 'optimizer_name': 'Adam'}. Best is trial 1569 with value: 0.001761963053552708.[0m
[32m[I 2022-11-08 09:01:28,173][0m Trial 1611 finished with value: 0.0018524976513733767 and parameters: {'nlayers': 56, 'hidden_size': 105, 'dropout': 0.18703542024632921, 'learning_rate': 0.007073914843763353, 'batch_size': 9578, 'optimizer_name': 'Adam'}. Best is trial 1569 with value: 0.001761963053552708.[0m
[32m[I 2022-11-08 09:02:02,736][0m Trial 1612 finished with value: 0.0017713425517082214 and parameters: {'nlayers': 43, 'hidden_size': 114, 'dropout': 0.15402091784623684, 'learning_rate': 0.00192534340983625, 'batch_size': 10000, 'optimizer_name': 'Adam'}. Best is trial 1569 with value: 0.001761963053552708.[0m
[32m[I 2022-11-08 09:02:47,031][0m Trial 1613 finished with value: 0.0018346000935468237 and parameters: {'nlayers': 64, 'hidden_size': 133, 'dropout': 0.13658834533280692, 'learning_rate': 0.002381933005756503, 'batch_size': 9662, 'optimizer_name': 'RMSprop'}. Best is trial 1569 with value: 0.001761963053552708.[0m
[32m[I 2022-11-08 09:03:16,533][0m Trial 1614 finished with value: 0.0018953418928992602 and parameters: {'nlayers': 41, 'hidden_size': 99, 'dropout': 0.17062212934708354, 'learning_rate': 0.0015589145793470332, 'batch_size': 9365, 'optimizer_name': 'Adam'}. Best is trial 1569 with value: 0.001761963053552708.[0m
[32m[I 2022-11-08 09:03:45,915][0m Trial 1615 finished with value: 0.0018054696685808897 and parameters: {'nlayers': 60, 'hidden_size': 56, 'dropout': 0.15518411651649242, 'learning_rate': 0.006770046968269086, 'batch_size': 9813, 'optimizer_name': 'Adam'}. Best is trial 1569 with value: 0.001761963053552708.[0m
[32m[I 2022-11-08 09:04:29,584][0m Trial 1616 finished with value: 0.0018339228697868512 and parameters: {'nlayers': 69, 'hidden_size': 119, 'dropout': 0.16259656539899628, 'learning_rate': 0.006514043132266881, 'batch_size': 9670, 'optimizer_name': 'Adam'}. Best is trial 1569 with value: 0.001761963053552708.[0m
[32m[I 2022-11-08 09:05:17,996][0m Trial 1617 finished with value: 0.0018059044214821017 and parameters: {'nlayers': 39, 'hidden_size': 211, 'dropout': 0.1444937825781634, 'learning_rate': 0.002178209874272698, 'batch_size': 9824, 'optimizer_name': 'Adam'}. Best is trial 1569 with value: 0.001761963053552708.[0m
[32m[I 2022-11-08 09:05:47,337][0m Trial 1618 finished with value: 0.0018078431054395615 and parameters: {'nlayers': 28, 'hidden_size': 125, 'dropout': 0.3994185414469748, 'learning_rate': 0.001175590698520441, 'batch_size': 9815, 'optimizer_name': 'Adam'}. Best is trial 1569 with value: 0.001761963053552708.[0m
[32m[I 2022-11-08 09:06:40,887][0m Trial 1619 finished with value: 0.0018628307786195612 and parameters: {'nlayers': 77, 'hidden_size': 149, 'dropout': 0.17524367231199267, 'learning_rate': 0.0019548560193617635, 'batch_size': 9502, 'optimizer_name': 'Adam'}. Best is trial 1569 with value: 0.001761963053552708.[0m
[32m[I 2022-11-08 09:07:10,073][0m Trial 1620 finished with value: 0.0017709440293432284 and parameters: {'nlayers': 22, 'hidden_size': 139, 'dropout': 0.1659648537878678, 'learning_rate': 0.005181032725994791, 'batch_size': 9996, 'optimizer_name': 'Adam'}. Best is trial 1569 with value: 0.001761963053552708.[0m
[32m[I 2022-11-08 09:07:20,659][0m Trial 1621 finished with value: 0.0024089019638225398 and parameters: {'nlayers': 5, 'hidden_size': 94, 'dropout': 0.14926435034303062, 'learning_rate': 0.007511476258073934, 'batch_size': 7356, 'optimizer_name': 'Adam'}. Best is trial 1569 with value: 0.001761963053552708.[0m
[32m[I 2022-11-08 09:07:32,486][0m Trial 1622 finished with value: 0.0027600771110797137 and parameters: {'nlayers': 19, 'hidden_size': 103, 'dropout': 0.22743055149859137, 'learning_rate': 0.0023990158092221793, 'batch_size': 6424, 'optimizer_name': 'Adam'}. Best is trial 1569 with value: 0.001761963053552708.[0m
[32m[I 2022-11-08 09:08:55,363][0m Trial 1623 finished with value: 0.0018306674978741204 and parameters: {'nlayers': 66, 'hidden_size': 266, 'dropout': 0.13435014208966037, 'learning_rate': 0.0021741612077780456, 'batch_size': 9663, 'optimizer_name': 'Adam'}. Best is trial 1569 with value: 0.001761963053552708.[0m
[32m[I 2022-11-08 09:09:23,259][0m Trial 1624 finished with value: 0.0018279269322276238 and parameters: {'nlayers': 47, 'hidden_size': 65, 'dropout': 0.3196312215814109, 'learning_rate': 0.007892163706948816, 'batch_size': 9690, 'optimizer_name': 'Adam'}. Best is trial 1569 with value: 0.001761963053552708.[0m
[32m[I 2022-11-08 09:10:03,330][0m Trial 1625 finished with value: 0.001800770690800931 and parameters: {'nlayers': 63, 'hidden_size': 111, 'dropout': 0.49195360651930725, 'learning_rate': 0.0018027493429213558, 'batch_size': 9827, 'optimizer_name': 'Adam'}. Best is trial 1569 with value: 0.001761963053552708.[0m
[32m[I 2022-11-08 09:10:25,733][0m Trial 1626 finished with value: 0.0019357286091460134 and parameters: {'nlayers': 20, 'hidden_size': 102, 'dropout': 0.38799583066746224, 'learning_rate': 0.0020573701366002105, 'batch_size': 9172, 'optimizer_name': 'RMSprop'}. Best is trial 1569 with value: 0.001761963053552708.[0m
[32m[I 2022-11-08 09:10:51,934][0m Trial 1627 finished with value: 0.0018745956855781571 and parameters: {'nlayers': 43, 'hidden_size': 72, 'dropout': 0.17970819936718468, 'learning_rate': 0.0036921212886573598, 'batch_size': 9479, 'optimizer_name': 'SGD'}. Best is trial 1569 with value: 0.001761963053552708.[0m
[32m[I 2022-11-08 09:11:13,009][0m Trial 1628 finished with value: 0.0019942879636730532 and parameters: {'nlayers': 24, 'hidden_size': 96, 'dropout': 0.46812434266584424, 'learning_rate': 0.000519641494932419, 'batch_size': 8921, 'optimizer_name': 'Adam'}. Best is trial 1569 with value: 0.001761963053552708.[0m
[32m[I 2022-11-08 09:11:39,187][0m Trial 1629 finished with value: 0.001772710942082177 and parameters: {'nlayers': 19, 'hidden_size': 117, 'dropout': 0.15708773120049618, 'learning_rate': 0.0024180992977406194, 'batch_size': 9998, 'optimizer_name': 'Adam'}. Best is trial 1569 with value: 0.001761963053552708.[0m
[32m[I 2022-11-08 09:12:17,973][0m Trial 1630 finished with value: 0.0017710809469223023 and parameters: {'nlayers': 45, 'hidden_size': 135, 'dropout': 0.28966656321772205, 'learning_rate': 0.0018456429015902634, 'batch_size': 10000, 'optimizer_name': 'Adam'}. Best is trial 1569 with value: 0.001761963053552708.[0m
[32m[I 2022-11-08 09:12:51,169][0m Trial 1631 finished with value: 0.0018040201693809658 and parameters: {'nlayers': 37, 'hidden_size': 144, 'dropout': 0.16707736075254673, 'learning_rate': 0.001593624788952319, 'batch_size': 9828, 'optimizer_name': 'Adam'}. Best is trial 1569 with value: 0.001761963053552708.[0m
[32m[I 2022-11-08 09:13:40,028][0m Trial 1632 finished with value: 0.0018434670424654317 and parameters: {'nlayers': 61, 'hidden_size': 157, 'dropout': 0.2424238300500751, 'learning_rate': 0.0021631120165994614, 'batch_size': 9638, 'optimizer_name': 'Adam'}. Best is trial 1569 with value: 0.001761963053552708.[0m
[32m[I 2022-11-08 09:14:17,522][0m Trial 1633 finished with value: 0.0018111514156725164 and parameters: {'nlayers': 58, 'hidden_size': 107, 'dropout': 0.1453957237164628, 'learning_rate': 0.0072545810328870615, 'batch_size': 9795, 'optimizer_name': 'Adam'}. Best is trial 1569 with value: 0.001761963053552708.[0m
[32m[I 2022-11-08 09:14:50,465][0m Trial 1634 finished with value: 0.0018683199528363049 and parameters: {'nlayers': 66, 'hidden_size': 59, 'dropout': 0.15983520905607693, 'learning_rate': 0.002498825900918184, 'batch_size': 9479, 'optimizer_name': 'Adam'}. Best is trial 1569 with value: 0.001761963053552708.[0m
[32m[I 2022-11-08 09:15:06,820][0m Trial 1635 finished with value: 0.0022639342454880583 and parameters: {'nlayers': 17, 'hidden_size': 113, 'dropout': 0.40134660643731973, 'learning_rate': 0.0020237635856816135, 'batch_size': 7836, 'optimizer_name': 'Adam'}. Best is trial 1569 with value: 0.001761963053552708.[0m
[32m[I 2022-11-08 09:15:44,480][0m Trial 1636 finished with value: 0.0018087314513542513 and parameters: {'nlayers': 49, 'hidden_size': 126, 'dropout': 0.36915360204721653, 'learning_rate': 0.002300323433275832, 'batch_size': 9814, 'optimizer_name': 'Adam'}. Best is trial 1569 with value: 0.001761963053552708.[0m
[32m[I 2022-11-08 09:16:13,241][0m Trial 1637 finished with value: 0.0017723096907138825 and parameters: {'nlayers': 30, 'hidden_size': 91, 'dropout': 0.14995956637383837, 'learning_rate': 0.0017978247906485722, 'batch_size': 10000, 'optimizer_name': 'Adam'}. Best is trial 1569 with value: 0.001761963053552708.[0m
[32m[I 2022-11-08 09:16:28,641][0m Trial 1638 finished with value: 0.0034102426440108056 and parameters: {'nlayers': 68, 'hidden_size': 68, 'dropout': 0.1755721020810976, 'learning_rate': 0.007052660187429638, 'batch_size': 5202, 'optimizer_name': 'Adam'}. Best is trial 1569 with value: 0.001761963053552708.[0m
[32m[I 2022-11-08 09:16:47,316][0m Trial 1639 finished with value: 0.001896959086450861 and parameters: {'nlayers': 7, 'hidden_size': 100, 'dropout': 0.18828818185175622, 'learning_rate': 0.0014528810886457679, 'batch_size': 9330, 'optimizer_name': 'RMSprop'}. Best is trial 1569 with value: 0.001761963053552708.[0m
[32m[I 2022-11-08 09:17:12,150][0m Trial 1640 finished with value: 0.0018401271486846126 and parameters: {'nlayers': 22, 'hidden_size': 105, 'dropout': 0.1398534850607337, 'learning_rate': 0.0023178984843177813, 'batch_size': 9642, 'optimizer_name': 'Adam'}. Best is trial 1569 with value: 0.001761963053552708.[0m
[32m[I 2022-11-08 09:17:45,675][0m Trial 1641 finished with value: 0.0018069569902706673 and parameters: {'nlayers': 33, 'hidden_size': 148, 'dropout': 0.4093714821881331, 'learning_rate': 0.00018900180036197554, 'batch_size': 9782, 'optimizer_name': 'Adam'}. Best is trial 1569 with value: 0.001761963053552708.[0m
[32m[I 2022-11-08 09:18:20,996][0m Trial 1642 finished with value: 0.001806903436939063 and parameters: {'nlayers': 41, 'hidden_size': 132, 'dropout': 0.1317945758028061, 'learning_rate': 0.002588367154597519, 'batch_size': 9835, 'optimizer_name': 'Adam'}. Best is trial 1569 with value: 0.001761963053552708.[0m
[32m[I 2022-11-08 09:18:56,913][0m Trial 1643 finished with value: 0.001839347085334095 and parameters: {'nlayers': 54, 'hidden_size': 110, 'dropout': 0.16742056412195608, 'learning_rate': 0.002064874347680232, 'batch_size': 9619, 'optimizer_name': 'Adam'}. Best is trial 1569 with value: 0.001761963053552708.[0m
[32m[I 2022-11-08 09:19:27,834][0m Trial 1644 finished with value: 0.00180828003396536 and parameters: {'nlayers': 59, 'hidden_size': 50, 'dropout': 0.47663704460288353, 'learning_rate': 0.0007715446289571514, 'batch_size': 9834, 'optimizer_name': 'Adam'}. Best is trial 1569 with value: 0.001761963053552708.[0m
[32m[I 2022-11-08 09:20:07,162][0m Trial 1645 finished with value: 0.001869004365136115 and parameters: {'nlayers': 71, 'hidden_size': 94, 'dropout': 0.15633277994457617, 'learning_rate': 0.0016346229377634633, 'batch_size': 9482, 'optimizer_name': 'Adam'}. Best is trial 1569 with value: 0.001761963053552708.[0m
[32m[I 2022-11-08 09:20:47,744][0m Trial 1646 finished with value: 0.0017798972579555613 and parameters: {'nlayers': 64, 'hidden_size': 120, 'dropout': 0.14841551549859783, 'learning_rate': 0.008684628235838026, 'batch_size': 9993, 'optimizer_name': 'Adam'}. Best is trial 1569 with value: 0.001761963053552708.[0m
[32m[I 2022-11-08 09:21:13,285][0m Trial 1647 finished with value: 0.0018045682357169476 and parameters: {'nlayers': 16, 'hidden_size': 140, 'dropout': 0.38435119857179095, 'learning_rate': 0.0010783045677035812, 'batch_size': 9811, 'optimizer_name': 'Adam'}. Best is trial 1569 with value: 0.001761963053552708.[0m
[32m[I 2022-11-08 09:21:57,658][0m Trial 1648 finished with value: 0.0018653226870644789 and parameters: {'nlayers': 56, 'hidden_size': 153, 'dropout': 0.16047423372482933, 'learning_rate': 0.0019561455996201954, 'batch_size': 9653, 'optimizer_name': 'SGD'}. Best is trial 1569 with value: 0.001761963053552708.[0m
[32m[I 2022-11-08 09:22:28,598][0m Trial 1649 finished with value: 0.001801810669236106 and parameters: {'nlayers': 42, 'hidden_size': 86, 'dropout': 0.34258202155656275, 'learning_rate': 0.002274152933423019, 'batch_size': 9819, 'optimizer_name': 'Adam'}. Best is trial 1569 with value: 0.001761963053552708.[0m
[32m[I 2022-11-08 09:23:02,804][0m Trial 1650 finished with value: 0.001767438418726361 and parameters: {'nlayers': 74, 'hidden_size': 41, 'dropout': 0.18010232898100076, 'learning_rate': 0.007577971134566442, 'batch_size': 9994, 'optimizer_name': 'Adam'}. Best is trial 1569 with value: 0.001761963053552708.[0m
[32m[I 2022-11-08 09:23:30,916][0m Trial 1651 finished with value: 0.0018602983508412324 and parameters: {'nlayers': 77, 'hidden_size': 48, 'dropout': 0.1962387899644973, 'learning_rate': 0.007474862697321726, 'batch_size': 9528, 'optimizer_name': 'RMSprop'}. Best is trial 1569 with value: 0.001761963053552708.[0m
[32m[I 2022-11-08 09:24:13,480][0m Trial 1652 finished with value: 0.0018070279313813717 and parameters: {'nlayers': 81, 'hidden_size': 85, 'dropout': 0.19429124580905788, 'learning_rate': 0.007502602313247709, 'batch_size': 9821, 'optimizer_name': 'Adam'}. Best is trial 1569 with value: 0.001761963053552708.[0m
[32m[I 2022-11-08 09:24:44,905][0m Trial 1653 finished with value: 0.0018896137912687275 and parameters: {'nlayers': 74, 'hidden_size': 42, 'dropout': 0.19317097159322527, 'learning_rate': 0.0076863001094046885, 'batch_size': 9390, 'optimizer_name': 'Adam'}. Best is trial 1569 with value: 0.001761963053552708.[0m
[32m[I 2022-11-08 09:25:24,217][0m Trial 1654 finished with value: 0.0017701490710575422 and parameters: {'nlayers': 75, 'hidden_size': 76, 'dropout': 0.18469828465079086, 'learning_rate': 0.007535078236075428, 'batch_size': 9999, 'optimizer_name': 'Adam'}. Best is trial 1569 with value: 0.001761963053552708.[0m
[32m[I 2022-11-08 09:25:55,241][0m Trial 1655 finished with value: 0.0018257442040747135 and parameters: {'nlayers': 69, 'hidden_size': 30, 'dropout': 0.21318189492861217, 'learning_rate': 0.007553031388723258, 'batch_size': 9687, 'optimizer_name': 'Adam'}. Best is trial 1569 with value: 0.001761963053552708.[0m
