[32m[I 2022-11-07 23:17:45,905][0m Trial 483 finished with value: 0.001809068541707466 and parameters: {'nlayers': 48, 'hidden_size': 156, 'dropout': 0.13825747268799088, 'learning_rate': 0.001295465566982785, 'batch_size': 9818, 'optimizer_name': 'Adam'}. Best is trial 318 with value: 0.001767210723471942.[0m
[32m[I 2022-11-07 23:18:27,522][0m Trial 484 finished with value: 0.0017672420901466133 and parameters: {'nlayers': 42, 'hidden_size': 162, 'dropout': 0.3849181441984268, 'learning_rate': 0.002170239935826337, 'batch_size': 9997, 'optimizer_name': 'Adam'}. Best is trial 318 with value: 0.001767210723471942.[0m
[32m[I 2022-11-07 23:19:06,030][0m Trial 485 finished with value: 0.0019117854587737757 and parameters: {'nlayers': 42, 'hidden_size': 164, 'dropout': 0.37745527594526207, 'learning_rate': 0.0022204811101083533, 'batch_size': 9285, 'optimizer_name': 'Adam'}. Best is trial 318 with value: 0.001767210723471942.[0m
[32m[I 2022-11-07 23:19:42,555][0m Trial 486 finished with value: 0.001807711294632617 and parameters: {'nlayers': 39, 'hidden_size': 150, 'dropout': 0.11075171575267181, 'learning_rate': 0.0008199897209303256, 'batch_size': 9840, 'optimizer_name': 'RMSprop'}. Best is trial 318 with value: 0.001767210723471942.[0m
[32m[I 2022-11-07 23:20:18,422][0m Trial 487 finished with value: 0.0018571022327840954 and parameters: {'nlayers': 37, 'hidden_size': 158, 'dropout': 0.2710123943934435, 'learning_rate': 0.0010732027482223607, 'batch_size': 9540, 'optimizer_name': 'Adam'}. Best is trial 318 with value: 0.001767210723471942.[0m
[32m[I 2022-11-07 23:20:29,731][0m Trial 488 finished with value: 0.0048874485308751485 and parameters: {'nlayers': 41, 'hidden_size': 145, 'dropout': 0.15037441597547763, 'learning_rate': 0.002141639739773364, 'batch_size': 3629, 'optimizer_name': 'SGD'}. Best is trial 318 with value: 0.001767210723471942.[0m
[32m[I 2022-11-07 23:20:51,844][0m Trial 489 finished with value: 0.0017730284834456718 and parameters: {'nlayers': 7, 'hidden_size': 152, 'dropout': 0.41401288472742137, 'learning_rate': 0.005463150772712575, 'batch_size': 9995, 'optimizer_name': 'Adam'}. Best is trial 318 with value: 0.001767210723471942.[0m
[32m[I 2022-11-07 23:21:43,976][0m Trial 490 finished with value: 0.0017704602509737014 and parameters: {'nlayers': 57, 'hidden_size': 167, 'dropout': 0.35207949184961346, 'learning_rate': 0.0017032439116301738, 'batch_size': 10000, 'optimizer_name': 'Adam'}. Best is trial 318 with value: 0.001767210723471942.[0m
[32m[I 2022-11-07 23:22:33,548][0m Trial 491 finished with value: 0.001839503718255066 and parameters: {'nlayers': 59, 'hidden_size': 164, 'dropout': 0.40548417633739137, 'learning_rate': 0.0014791521952707228, 'batch_size': 9679, 'optimizer_name': 'Adam'}. Best is trial 318 with value: 0.001767210723471942.[0m
[32m[I 2022-11-07 23:23:21,243][0m Trial 492 finished with value: 0.0018048329681288739 and parameters: {'nlayers': 55, 'hidden_size': 161, 'dropout': 0.44176273921460385, 'learning_rate': 0.0016865057222463142, 'batch_size': 9807, 'optimizer_name': 'Adam'}. Best is trial 318 with value: 0.001767210723471942.[0m
[32m[I 2022-11-07 23:24:01,492][0m Trial 493 finished with value: 0.002159359199142224 and parameters: {'nlayers': 57, 'hidden_size': 163, 'dropout': 0.34868565157272463, 'learning_rate': 0.0014323463420202222, 'batch_size': 8220, 'optimizer_name': 'Adam'}. Best is trial 318 with value: 0.001767210723471942.[0m
[32m[I 2022-11-07 23:24:40,968][0m Trial 494 finished with value: 0.0018330856170466721 and parameters: {'nlayers': 40, 'hidden_size': 165, 'dropout': 0.36993029952139617, 'learning_rate': 0.0012874648350078945, 'batch_size': 9660, 'optimizer_name': 'Adam'}. Best is trial 318 with value: 0.001767210723471942.[0m
[32m[I 2022-11-07 23:25:36,308][0m Trial 495 finished with value: 0.0017736381001981411 and parameters: {'nlayers': 62, 'hidden_size': 170, 'dropout': 0.4342161333472714, 'learning_rate': 0.0018027555085657551, 'batch_size': 9997, 'optimizer_name': 'Adam'}. Best is trial 318 with value: 0.001767210723471942.[0m
[32m[I 2022-11-07 23:26:24,909][0m Trial 496 finished with value: 0.0018129547214021488 and parameters: {'nlayers': 61, 'hidden_size': 154, 'dropout': 0.41368195386679424, 'learning_rate': 0.0010826937640460116, 'batch_size': 9800, 'optimizer_name': 'Adam'}. Best is trial 318 with value: 0.001767210723471942.[0m
[32m[I 2022-11-07 23:27:10,162][0m Trial 497 finished with value: 0.0018791032953470617 and parameters: {'nlayers': 58, 'hidden_size': 158, 'dropout': 0.3685230841377937, 'learning_rate': 0.0016999577728781183, 'batch_size': 9432, 'optimizer_name': 'Adam'}. Best is trial 318 with value: 0.001767210723471942.[0m
[32m[I 2022-11-07 23:27:59,512][0m Trial 498 finished with value: 0.0018319346189844866 and parameters: {'nlayers': 56, 'hidden_size': 169, 'dropout': 0.1316765805334417, 'learning_rate': 0.0008105363071764111, 'batch_size': 9648, 'optimizer_name': 'RMSprop'}. Best is trial 318 with value: 0.001767210723471942.[0m
[32m[I 2022-11-07 23:28:40,303][0m Trial 499 finished with value: 0.0018030910265456645 and parameters: {'nlayers': 51, 'hidden_size': 141, 'dropout': 0.3663479815254835, 'learning_rate': 0.0015057197771722304, 'batch_size': 9811, 'optimizer_name': 'Adam'}. Best is trial 318 with value: 0.001767210723471942.[0m
[32m[I 2022-11-07 23:29:27,779][0m Trial 500 finished with value: 0.0017769301124923535 and parameters: {'nlayers': 59, 'hidden_size': 150, 'dropout': 0.31988698831671625, 'learning_rate': 0.0010283673924897437, 'batch_size': 9994, 'optimizer_name': 'Adam'}. Best is trial 318 with value: 0.001767210723471942.[0m
[32m[I 2022-11-07 23:30:17,316][0m Trial 501 finished with value: 0.0017738684718281476 and parameters: {'nlayers': 43, 'hidden_size': 193, 'dropout': 0.3869558789309652, 'learning_rate': 0.0005337846508855385, 'batch_size': 9999, 'optimizer_name': 'Adam'}. Best is trial 318 with value: 0.001767210723471942.[0m
[32m[I 2022-11-07 23:30:22,252][0m Trial 502 finished with value: 0.03693459654847781 and parameters: {'nlayers': 52, 'hidden_size': 126, 'dropout': 0.35603245331116096, 'learning_rate': 0.0032446833530608665, 'batch_size': 480, 'optimizer_name': 'Adam'}. Best is trial 318 with value: 0.001767210723471942.[0m
[32m[I 2022-11-07 23:31:00,486][0m Trial 503 finished with value: 0.0018453505593601708 and parameters: {'nlayers': 54, 'hidden_size': 136, 'dropout': 0.3549693212890463, 'learning_rate': 0.0013309409121362822, 'batch_size': 9586, 'optimizer_name': 'Adam'}. Best is trial 318 with value: 0.001767210723471942.[0m
[32m[I 2022-11-07 23:32:17,779][0m Trial 504 finished with value: 0.0018180245137338724 and parameters: {'nlayers': 96, 'hidden_size': 180, 'dropout': 0.38405058184969604, 'learning_rate': 0.0018797220417746641, 'batch_size': 9801, 'optimizer_name': 'Adam'}. Best is trial 318 with value: 0.001767210723471942.[0m
[32m[I 2022-11-07 23:32:41,249][0m Trial 505 finished with value: 0.001865721100440083 and parameters: {'nlayers': 13, 'hidden_size': 158, 'dropout': 0.14142249439053925, 'learning_rate': 0.0008964759645787702, 'batch_size': 9495, 'optimizer_name': 'Adam'}. Best is trial 318 with value: 0.001767210723471942.[0m
[32m[I 2022-11-07 23:33:18,697][0m Trial 506 finished with value: 0.001810722052291584 and parameters: {'nlayers': 41, 'hidden_size': 146, 'dropout': 0.38924730121025297, 'learning_rate': 0.001141708103550143, 'batch_size': 9811, 'optimizer_name': 'Adam'}. Best is trial 318 with value: 0.001767210723471942.[0m
[32m[I 2022-11-07 23:33:42,274][0m Trial 507 finished with value: 0.0018064327533462096 and parameters: {'nlayers': 10, 'hidden_size': 168, 'dropout': 0.12333939571556143, 'learning_rate': 0.0016639615857747846, 'batch_size': 9822, 'optimizer_name': 'Adam'}. Best is trial 318 with value: 0.001767210723471942.[0m
[32m[I 2022-11-07 23:34:26,816][0m Trial 508 finished with value: 0.0019126341615859658 and parameters: {'nlayers': 37, 'hidden_size': 219, 'dropout': 0.3972334500808869, 'learning_rate': 0.0023553756818199298, 'batch_size': 9277, 'optimizer_name': 'Adam'}. Best is trial 318 with value: 0.001767210723471942.[0m
[32m[I 2022-11-07 23:35:15,954][0m Trial 509 finished with value: 0.0017843635469675064 and parameters: {'nlayers': 57, 'hidden_size': 176, 'dropout': 0.20201378444656487, 'learning_rate': 0.0025962100321107002, 'batch_size': 10000, 'optimizer_name': 'SGD'}. Best is trial 318 with value: 0.001767210723471942.[0m
[32m[I 2022-11-07 23:35:43,164][0m Trial 510 finished with value: 0.0018367229189191546 and parameters: {'nlayers': 15, 'hidden_size': 187, 'dropout': 0.1475308446243831, 'learning_rate': 0.0019747904725019717, 'batch_size': 9625, 'optimizer_name': 'Adam'}. Best is trial 318 with value: 0.001767210723471942.[0m
[32m[I 2022-11-07 23:36:22,909][0m Trial 511 finished with value: 0.0018111258480594844 and parameters: {'nlayers': 44, 'hidden_size': 157, 'dropout': 0.13250741240393193, 'learning_rate': 0.0006762818532488391, 'batch_size': 9799, 'optimizer_name': 'RMSprop'}. Best is trial 318 with value: 0.001767210723471942.[0m
[32m[I 2022-11-07 23:36:57,932][0m Trial 512 finished with value: 0.0018379097495883731 and parameters: {'nlayers': 42, 'hidden_size': 132, 'dropout': 0.15248464844866655, 'learning_rate': 0.0028337067798487508, 'batch_size': 9653, 'optimizer_name': 'Adam'}. Best is trial 318 with value: 0.001767210723471942.[0m
[32m[I 2022-11-07 23:37:33,750][0m Trial 513 finished with value: 0.0018045667822619005 and parameters: {'nlayers': 39, 'hidden_size': 140, 'dropout': 0.19137054046259797, 'learning_rate': 0.0023955518941842792, 'batch_size': 9832, 'optimizer_name': 'Adam'}. Best is trial 318 with value: 0.001767210723471942.[0m
[32m[I 2022-11-07 23:38:25,513][0m Trial 514 finished with value: 0.0018580373614559195 and parameters: {'nlayers': 64, 'hidden_size': 163, 'dropout': 0.14012151775226722, 'learning_rate': 0.001335630439734664, 'batch_size': 9503, 'optimizer_name': 'Adam'}. Best is trial 318 with value: 0.001767210723471942.[0m
[32m[I 2022-11-07 23:39:00,360][0m Trial 515 finished with value: 0.0017731018943397483 and parameters: {'nlayers': 54, 'hidden_size': 81, 'dropout': 0.15649137989166884, 'learning_rate': 0.001828594640291077, 'batch_size': 9999, 'optimizer_name': 'Adam'}. Best is trial 318 with value: 0.001767210723471942.[0m
[32m[I 2022-11-07 23:40:28,460][0m Trial 516 finished with value: 0.001837625070006876 and parameters: {'nlayers': 82, 'hidden_size': 238, 'dropout': 0.18302020995899496, 'learning_rate': 0.002126270203868796, 'batch_size': 9668, 'optimizer_name': 'Adam'}. Best is trial 318 with value: 0.001767210723471942.[0m
[32m[I 2022-11-07 23:41:30,980][0m Trial 517 finished with value: 0.0017713934603375498 and parameters: {'nlayers': 60, 'hidden_size': 202, 'dropout': 0.14515058798226188, 'learning_rate': 0.0016010241460138403, 'batch_size': 9999, 'optimizer_name': 'Adam'}. Best is trial 318 with value: 0.001767210723471942.[0m
[32m[I 2022-11-07 23:41:35,922][0m Trial 518 finished with value: 0.005726166653772183 and parameters: {'nlayers': 16, 'hidden_size': 150, 'dropout': 0.2819025637664287, 'learning_rate': 0.004656083541421611, 'batch_size': 3086, 'optimizer_name': 'Adam'}. Best is trial 318 with value: 0.001767210723471942.[0m
[32m[I 2022-11-07 23:41:59,407][0m Trial 519 finished with value: 0.0018074743741644552 and parameters: {'nlayers': 13, 'hidden_size': 123, 'dropout': 0.12061634712960832, 'learning_rate': 0.0009452345642200025, 'batch_size': 9825, 'optimizer_name': 'Adam'}. Best is trial 318 with value: 0.001767210723471942.[0m
[32m[I 2022-11-07 23:42:34,148][0m Trial 520 finished with value: 0.0019352614372389924 and parameters: {'nlayers': 35, 'hidden_size': 167, 'dropout': 0.1650087036244549, 'learning_rate': 0.0011891066621501699, 'batch_size': 9166, 'optimizer_name': 'Adam'}. Best is trial 318 with value: 0.001767210723471942.[0m
[32m[I 2022-11-07 23:43:24,085][0m Trial 521 finished with value: 0.0018737587977100062 and parameters: {'nlayers': 52, 'hidden_size': 183, 'dropout': 0.10982068740512609, 'learning_rate': 0.0042327439561529265, 'batch_size': 9472, 'optimizer_name': 'Adam'}. Best is trial 318 with value: 0.001767210723471942.[0m
[32m[I 2022-11-07 23:44:04,481][0m Trial 522 finished with value: 0.0017998954599223486 and parameters: {'nlayers': 44, 'hidden_size': 155, 'dropout': 0.1352103921883344, 'learning_rate': 0.002295957571903696, 'batch_size': 9840, 'optimizer_name': 'Adam'}. Best is trial 318 with value: 0.001767210723471942.[0m
[32m[I 2022-11-07 23:45:15,651][0m Trial 523 finished with value: 0.0017712869882583618 and parameters: {'nlayers': 55, 'hidden_size': 257, 'dropout': 0.17483122600239856, 'learning_rate': 0.002610263572365675, 'batch_size': 10000, 'optimizer_name': 'RMSprop'}. Best is trial 318 with value: 0.001767210723471942.[0m
[32m[I 2022-11-07 23:45:43,954][0m Trial 524 finished with value: 0.0018341500170895916 and parameters: {'nlayers': 18, 'hidden_size': 174, 'dropout': 0.3314645235850872, 'learning_rate': 0.001989198081593735, 'batch_size': 9683, 'optimizer_name': 'Adam'}. Best is trial 318 with value: 0.001767210723471942.[0m
[32m[I 2022-11-07 23:46:20,030][0m Trial 525 finished with value: 0.0017984038730988435 and parameters: {'nlayers': 49, 'hidden_size': 115, 'dropout': 0.4035831877253169, 'learning_rate': 0.003062096931705736, 'batch_size': 9820, 'optimizer_name': 'Adam'}. Best is trial 318 with value: 0.001767210723471942.[0m
[32m[I 2022-11-07 23:46:43,047][0m Trial 526 finished with value: 0.0018388720317230605 and parameters: {'nlayers': 11, 'hidden_size': 145, 'dropout': 0.15451753561794812, 'learning_rate': 0.0014663811347616375, 'batch_size': 9656, 'optimizer_name': 'Adam'}. Best is trial 318 with value: 0.001767210723471942.[0m
[32m[I 2022-11-07 23:47:38,689][0m Trial 527 finished with value: 0.0018857721804199658 and parameters: {'nlayers': 57, 'hidden_size': 195, 'dropout': 0.12846704996546607, 'learning_rate': 0.00047920404919000786, 'batch_size': 9378, 'optimizer_name': 'Adam'}. Best is trial 318 with value: 0.001767210723471942.[0m
[32m[I 2022-11-07 23:48:02,592][0m Trial 528 finished with value: 0.0018113797186977757 and parameters: {'nlayers': 14, 'hidden_size': 129, 'dropout': 0.1477545478361773, 'learning_rate': 0.001772053560444611, 'batch_size': 9797, 'optimizer_name': 'Adam'}. Best is trial 318 with value: 0.001767210723471942.[0m
[32m[I 2022-11-07 23:48:40,808][0m Trial 529 finished with value: 0.0017724040925878324 and parameters: {'nlayers': 42, 'hidden_size': 160, 'dropout': 0.16448983104022072, 'learning_rate': 0.0021819321395624347, 'batch_size': 9999, 'optimizer_name': 'Adam'}. Best is trial 318 with value: 0.001767210723471942.[0m
[32m[I 2022-11-07 23:49:15,199][0m Trial 530 finished with value: 0.001857962023678783 and parameters: {'nlayers': 40, 'hidden_size': 138, 'dropout': 0.18803626737889262, 'learning_rate': 0.0025004346470882156, 'batch_size': 9526, 'optimizer_name': 'Adam'}. Best is trial 318 with value: 0.001767210723471942.[0m
[32m[I 2022-11-07 23:49:39,410][0m Trial 531 finished with value: 0.001806173346184364 and parameters: {'nlayers': 19, 'hidden_size': 92, 'dropout': 0.17150514368470482, 'learning_rate': 0.0008476347087741543, 'batch_size': 9824, 'optimizer_name': 'Adam'}. Best is trial 318 with value: 0.001767210723471942.[0m
[32m[I 2022-11-07 23:50:03,651][0m Trial 532 finished with value: 0.0029730500904032297 and parameters: {'nlayers': 60, 'hidden_size': 152, 'dropout': 0.13869918405528694, 'learning_rate': 0.0011164009918382314, 'batch_size': 6064, 'optimizer_name': 'SGD'}. Best is trial 318 with value: 0.001767210723471942.[0m
[32m[I 2022-11-07 23:50:32,346][0m Trial 533 finished with value: 0.0017739577613036712 and parameters: {'nlayers': 17, 'hidden_size': 170, 'dropout': 0.15691181197799803, 'learning_rate': 0.0015725937056124976, 'batch_size': 9995, 'optimizer_name': 'Adam'}. Best is trial 318 with value: 0.001767210723471942.[0m
[32m[I 2022-11-07 23:51:14,949][0m Trial 534 finished with value: 0.0018309777464009514 and parameters: {'nlayers': 47, 'hidden_size': 162, 'dropout': 0.17849310348084677, 'learning_rate': 0.0027641712916960486, 'batch_size': 9680, 'optimizer_name': 'Adam'}. Best is trial 318 with value: 0.001767210723471942.[0m
[32m[I 2022-11-07 23:51:38,760][0m Trial 535 finished with value: 0.0018027264259045238 and parameters: {'nlayers': 8, 'hidden_size': 189, 'dropout': 0.4913532382159032, 'learning_rate': 0.002035912406263615, 'batch_size': 9838, 'optimizer_name': 'Adam'}. Best is trial 318 with value: 0.001767210723471942.[0m
[32m[I 2022-11-07 23:52:07,414][0m Trial 536 finished with value: 0.0018574661540317367 and parameters: {'nlayers': 15, 'hidden_size': 211, 'dropout': 0.14356126635773253, 'learning_rate': 0.0012817096570597495, 'batch_size': 9569, 'optimizer_name': 'Adam'}. Best is trial 318 with value: 0.001767210723471942.[0m
[32m[I 2022-11-07 23:52:46,603][0m Trial 537 finished with value: 0.0018964056234818346 and parameters: {'nlayers': 38, 'hidden_size': 179, 'dropout': 0.1687670739844779, 'learning_rate': 0.0023084203467815716, 'batch_size': 9337, 'optimizer_name': 'RMSprop'}. Best is trial 318 with value: 0.001767210723471942.[0m
[32m[I 2022-11-07 23:53:20,598][0m Trial 538 finished with value: 0.0018334978716094965 and parameters: {'nlayers': 58, 'hidden_size': 77, 'dropout': 0.15043450687928606, 'learning_rate': 0.0017387587252116843, 'batch_size': 9683, 'optimizer_name': 'Adam'}. Best is trial 318 with value: 0.001767210723471942.[0m
[32m[I 2022-11-07 23:53:50,019][0m Trial 539 finished with value: 0.0018078017157196768 and parameters: {'nlayers': 45, 'hidden_size': 57, 'dropout': 0.12839484944927998, 'learning_rate': 0.0009720888457933146, 'batch_size': 9831, 'optimizer_name': 'Adam'}. Best is trial 318 with value: 0.001767210723471942.[0m
[32m[I 2022-11-07 23:54:16,561][0m Trial 540 finished with value: 0.0018005419213819093 and parameters: {'nlayers': 21, 'hidden_size': 119, 'dropout': 0.4563729742441167, 'learning_rate': 0.0019251367079745536, 'batch_size': 9835, 'optimizer_name': 'Adam'}. Best is trial 318 with value: 0.001767210723471942.[0m
[32m[I 2022-11-07 23:54:40,007][0m Trial 541 finished with value: 0.0023080510639097995 and parameters: {'nlayers': 55, 'hidden_size': 84, 'dropout': 0.36105345339074946, 'learning_rate': 0.0006513866282142626, 'batch_size': 7656, 'optimizer_name': 'Adam'}. Best is trial 318 with value: 0.001767210723471942.[0m
[32m[I 2022-11-07 23:55:03,663][0m Trial 542 finished with value: 0.0017792773832141285 and parameters: {'nlayers': 12, 'hidden_size': 124, 'dropout': 0.16024884785192442, 'learning_rate': 0.0024661836850722574, 'batch_size': 9999, 'optimizer_name': 'Adam'}. Best is trial 318 with value: 0.001767210723471942.[0m
[32m[I 2022-11-07 23:56:06,218][0m Trial 543 finished with value: 0.0017750840112149382 and parameters: {'nlayers': 51, 'hidden_size': 229, 'dropout': 0.1197071879677015, 'learning_rate': 0.0014017033102201358, 'batch_size': 9992, 'optimizer_name': 'Adam'}. Best is trial 318 with value: 0.001767210723471942.[0m
[32m[I 2022-11-07 23:56:45,325][0m Trial 544 finished with value: 0.001775766178445466 and parameters: {'nlayers': 43, 'hidden_size': 146, 'dropout': 0.13528852833895977, 'learning_rate': 0.0021883065752041973, 'batch_size': 9999, 'optimizer_name': 'Adam'}. Best is trial 318 with value: 0.001767210723471942.[0m
[32m[I 2022-11-07 23:57:03,196][0m Trial 545 finished with value: 0.0018562157549074107 and parameters: {'nlayers': 1, 'hidden_size': 135, 'dropout': 0.29420840982164104, 'learning_rate': 0.0029307834738308888, 'batch_size': 9543, 'optimizer_name': 'Adam'}. Best is trial 318 with value: 0.001767210723471942.[0m
[32m[I 2022-11-07 23:57:36,109][0m Trial 546 finished with value: 0.0018312331288283116 and parameters: {'nlayers': 26, 'hidden_size': 171, 'dropout': 0.14918577788987802, 'learning_rate': 0.0027290148529740764, 'batch_size': 9678, 'optimizer_name': 'Adam'}. Best is trial 318 with value: 0.001767210723471942.[0m
[32m[I 2022-11-07 23:58:02,254][0m Trial 547 finished with value: 0.001804750044233896 and parameters: {'nlayers': 16, 'hidden_size': 156, 'dropout': 0.17767794892237976, 'learning_rate': 0.0011530577021341172, 'batch_size': 9817, 'optimizer_name': 'Adam'}. Best is trial 318 with value: 0.001767210723471942.[0m
[32m[I 2022-11-07 23:58:27,369][0m Trial 548 finished with value: 0.0018787663998240131 and parameters: {'nlayers': 41, 'hidden_size': 42, 'dropout': 0.15992136999542408, 'learning_rate': 0.006573593451464986, 'batch_size': 9440, 'optimizer_name': 'RMSprop'}. Best is trial 318 with value: 0.001767210723471942.[0m
[32m[I 2022-11-07 23:58:53,105][0m Trial 549 finished with value: 0.0018310365682548888 and parameters: {'nlayers': 23, 'hidden_size': 111, 'dropout': 0.18871856571916773, 'learning_rate': 0.0016533800798108093, 'batch_size': 9673, 'optimizer_name': 'Adam'}. Best is trial 318 with value: 0.001767210723471942.[0m
[32m[I 2022-11-07 23:59:40,768][0m Trial 550 finished with value: 0.0018120070482665104 and parameters: {'nlayers': 53, 'hidden_size': 166, 'dropout': 0.17156639523788855, 'learning_rate': 0.0007496954692910268, 'batch_size': 9818, 'optimizer_name': 'Adam'}. Best is trial 318 with value: 0.001767210723471942.[0m
[32m[I 2022-11-08 00:00:05,904][0m Trial 551 finished with value: 0.0017748191515795523 and parameters: {'nlayers': 19, 'hidden_size': 97, 'dropout': 0.19752397700839983, 'learning_rate': 0.0024039321994378054, 'batch_size': 9993, 'optimizer_name': 'Adam'}. Best is trial 318 with value: 0.001767210723471942.[0m
