[32m[I 2022-11-08 11:38:39,364][0m Trial 1932 finished with value: 0.0018339174097449483 and parameters: {'nlayers': 11, 'hidden_size': 89, 'dropout': 0.2547954131585192, 'learning_rate': 0.0017481788768214748, 'batch_size': 9681, 'optimizer_name': 'RMSprop'}. Best is trial 1569 with value: 0.001761963053552708.[0m
[32m[I 2022-11-08 11:39:01,984][0m Trial 1933 finished with value: 0.0017721531539037264 and parameters: {'nlayers': 9, 'hidden_size': 103, 'dropout': 0.48037507570920057, 'learning_rate': 0.007653505586800993, 'batch_size': 9995, 'optimizer_name': 'RMSprop'}. Best is trial 1569 with value: 0.001761963053552708.[0m
[32m[I 2022-11-08 11:39:13,628][0m Trial 1934 finished with value: 0.0026674215601910868 and parameters: {'nlayers': 13, 'hidden_size': 141, 'dropout': 0.48745585077954506, 'learning_rate': 0.0019896977267217734, 'batch_size': 6629, 'optimizer_name': 'RMSprop'}. Best is trial 1569 with value: 0.001761963053552708.[0m
[32m[I 2022-11-08 11:39:40,263][0m Trial 1935 finished with value: 0.0018611686405625343 and parameters: {'nlayers': 20, 'hidden_size': 148, 'dropout': 0.23511524276557647, 'learning_rate': 0.0013095087272495293, 'batch_size': 9514, 'optimizer_name': 'RMSprop'}. Best is trial 1569 with value: 0.001761963053552708.[0m
[32m[I 2022-11-08 11:40:29,138][0m Trial 1936 finished with value: 0.0017687886837089945 and parameters: {'nlayers': 56, 'hidden_size': 158, 'dropout': 0.4591590375216531, 'learning_rate': 0.007183293454614488, 'batch_size': 9997, 'optimizer_name': 'RMSprop'}. Best is trial 1569 with value: 0.001761963053552708.[0m
[32m[I 2022-11-08 11:40:52,311][0m Trial 1937 finished with value: 0.0018331773648464199 and parameters: {'nlayers': 16, 'hidden_size': 94, 'dropout': 0.4780827469277175, 'learning_rate': 0.006744198468180803, 'batch_size': 9670, 'optimizer_name': 'RMSprop'}. Best is trial 1569 with value: 0.001761963053552708.[0m
[32m[I 2022-11-08 11:40:55,422][0m Trial 1938 finished with value: 0.00611635738300759 and parameters: {'nlayers': 13, 'hidden_size': 82, 'dropout': 0.47903532050381703, 'learning_rate': 0.0014852598288537817, 'batch_size': 2899, 'optimizer_name': 'RMSprop'}. Best is trial 1569 with value: 0.001761963053552708.[0m
[32m[I 2022-11-08 11:41:21,732][0m Trial 1939 finished with value: 0.001807837888169916 and parameters: {'nlayers': 19, 'hidden_size': 131, 'dropout': 0.11155841384173626, 'learning_rate': 0.0018995920655420656, 'batch_size': 9806, 'optimizer_name': 'RMSprop'}. Best is trial 1569 with value: 0.001761963053552708.[0m
[32m[I 2022-11-08 11:41:41,085][0m Trial 1940 finished with value: 0.00181122607122799 and parameters: {'nlayers': 11, 'hidden_size': 16, 'dropout': 0.39367706078504583, 'learning_rate': 0.007468234386610445, 'batch_size': 9806, 'optimizer_name': 'SGD'}. Best is trial 1569 with value: 0.001761963053552708.[0m
[32m[I 2022-11-08 11:42:06,526][0m Trial 1941 finished with value: 0.001858906315828104 and parameters: {'nlayers': 23, 'hidden_size': 101, 'dropout': 0.4711623601447206, 'learning_rate': 0.0016730530701400922, 'batch_size': 9546, 'optimizer_name': 'Adam'}. Best is trial 1569 with value: 0.001761963053552708.[0m
[32m[I 2022-11-08 11:42:29,902][0m Trial 1942 finished with value: 0.001809112673646834 and parameters: {'nlayers': 7, 'hidden_size': 204, 'dropout': 0.49364345572249185, 'learning_rate': 0.002079823418069819, 'batch_size': 9797, 'optimizer_name': 'Adam'}. Best is trial 1569 with value: 0.001761963053552708.[0m
[32m[I 2022-11-08 11:43:07,396][0m Trial 1943 finished with value: 0.0017731679267081813 and parameters: {'nlayers': 66, 'hidden_size': 74, 'dropout': 0.4800078970288319, 'learning_rate': 0.00788614558803995, 'batch_size': 9995, 'optimizer_name': 'Adam'}. Best is trial 1569 with value: 0.001761963053552708.[0m
[32m[I 2022-11-08 11:43:37,025][0m Trial 1944 finished with value: 0.0018376189240402476 and parameters: {'nlayers': 14, 'hidden_size': 233, 'dropout': 0.463015058338187, 'learning_rate': 0.0018812752960457343, 'batch_size': 9671, 'optimizer_name': 'RMSprop'}. Best is trial 1569 with value: 0.001761963053552708.[0m
[32m[I 2022-11-08 11:43:59,232][0m Trial 1945 finished with value: 0.0018827647208406976 and parameters: {'nlayers': 17, 'hidden_size': 89, 'dropout': 0.40128402391901924, 'learning_rate': 0.0020860291355594973, 'batch_size': 9405, 'optimizer_name': 'Adam'}. Best is trial 1569 with value: 0.001761963053552708.[0m
[32m[I 2022-11-08 11:44:19,998][0m Trial 1946 finished with value: 0.0018050429307583445 and parameters: {'nlayers': 10, 'hidden_size': 56, 'dropout': 0.48380343579667695, 'learning_rate': 0.0016452853278155154, 'batch_size': 9812, 'optimizer_name': 'Adam'}. Best is trial 1569 with value: 0.001761963053552708.[0m
[32m[I 2022-11-08 11:45:01,335][0m Trial 1947 finished with value: 0.0018061974049828446 and parameters: {'nlayers': 72, 'hidden_size': 102, 'dropout': 0.12534320218724013, 'learning_rate': 0.0018428077405857825, 'batch_size': 9820, 'optimizer_name': 'Adam'}. Best is trial 1569 with value: 0.001761963053552708.[0m
[32m[I 2022-11-08 11:45:20,909][0m Trial 1948 finished with value: 0.001927909737714104 and parameters: {'nlayers': 15, 'hidden_size': 30, 'dropout': 0.36451244337836386, 'learning_rate': 0.002103401438167988, 'batch_size': 9212, 'optimizer_name': 'Adam'}. Best is trial 1569 with value: 0.001761963053552708.[0m
[32m[I 2022-11-08 11:46:41,441][0m Trial 1949 finished with value: 0.0018374380460969015 and parameters: {'nlayers': 58, 'hidden_size': 286, 'dropout': 0.45623757376758106, 'learning_rate': 0.00146292326207646, 'batch_size': 9633, 'optimizer_name': 'Adam'}. Best is trial 1569 with value: 0.001761963053552708.[0m
[32m[I 2022-11-08 11:47:02,101][0m Trial 1950 finished with value: 0.005481317155397311 and parameters: {'nlayers': 69, 'hidden_size': 190, 'dropout': 0.13004263934942029, 'learning_rate': 0.006900362821372666, 'batch_size': 3233, 'optimizer_name': 'Adam'}. Best is trial 1569 with value: 0.001761963053552708.[0m
[32m[I 2022-11-08 11:47:37,157][0m Trial 1951 finished with value: 0.0017763137602720227 and parameters: {'nlayers': 62, 'hidden_size': 66, 'dropout': 0.26346908402786545, 'learning_rate': 0.0066415396935872815, 'batch_size': 9996, 'optimizer_name': 'Adam'}. Best is trial 1569 with value: 0.001761963053552708.[0m
[32m[I 2022-11-08 11:48:00,489][0m Trial 1952 finished with value: 0.0017723243902711308 and parameters: {'nlayers': 12, 'hidden_size': 95, 'dropout': 0.11812922761787802, 'learning_rate': 0.007354713564406178, 'batch_size': 9996, 'optimizer_name': 'Adam'}. Best is trial 1569 with value: 0.001761963053552708.[0m
[32m[I 2022-11-08 11:48:27,859][0m Trial 1953 finished with value: 0.0018567255053969067 and parameters: {'nlayers': 21, 'hidden_size': 154, 'dropout': 0.37508668368099635, 'learning_rate': 0.002166744471637112, 'batch_size': 9529, 'optimizer_name': 'RMSprop'}. Best is trial 1569 with value: 0.001761963053552708.[0m
[32m[I 2022-11-08 11:49:09,923][0m Trial 1954 finished with value: 0.001782748851552941 and parameters: {'nlayers': 74, 'hidden_size': 86, 'dropout': 0.3503242909313166, 'learning_rate': 0.0019081014854914215, 'batch_size': 9999, 'optimizer_name': 'Adam'}. Best is trial 1569 with value: 0.001761963053552708.[0m
[32m[I 2022-11-08 11:49:31,382][0m Trial 1955 finished with value: 0.001835534794386043 and parameters: {'nlayers': 8, 'hidden_size': 129, 'dropout': 0.44939334446000617, 'learning_rate': 0.0016564670235957632, 'batch_size': 9675, 'optimizer_name': 'Adam'}. Best is trial 1569 with value: 0.001761963053552708.[0m
[32m[I 2022-11-08 11:49:56,961][0m Trial 1956 finished with value: 0.0017752181364185918 and parameters: {'nlayers': 18, 'hidden_size': 106, 'dropout': 0.3935059675166603, 'learning_rate': 0.00766975930638346, 'batch_size': 9999, 'optimizer_name': 'Adam'}. Best is trial 1569 with value: 0.001761963053552708.[0m
[32m[I 2022-11-08 11:50:20,312][0m Trial 1957 finished with value: 0.0018929348554432232 and parameters: {'nlayers': 15, 'hidden_size': 144, 'dropout': 0.10669061012986361, 'learning_rate': 0.0020817230552717635, 'batch_size': 9698, 'optimizer_name': 'SGD'}. Best is trial 1569 with value: 0.001761963053552708.[0m
[32m[I 2022-11-08 11:50:40,756][0m Trial 1958 finished with value: 0.0018867863181196614 and parameters: {'nlayers': 13, 'hidden_size': 76, 'dropout': 0.13461380484697238, 'learning_rate': 0.007121795664973335, 'batch_size': 9396, 'optimizer_name': 'Adam'}. Best is trial 1569 with value: 0.001761963053552708.[0m
[32m[I 2022-11-08 11:51:16,652][0m Trial 1959 finished with value: 0.0018061687274498852 and parameters: {'nlayers': 55, 'hidden_size': 98, 'dropout': 0.3822148444466892, 'learning_rate': 0.005472444223644014, 'batch_size': 9809, 'optimizer_name': 'Adam'}. Best is trial 1569 with value: 0.001761963053552708.[0m
[32m[I 2022-11-08 11:51:39,929][0m Trial 1960 finished with value: 0.00180534844574403 and parameters: {'nlayers': 10, 'hidden_size': 137, 'dropout': 0.49940943209015487, 'learning_rate': 0.0018510785051371033, 'batch_size': 9813, 'optimizer_name': 'Adam'}. Best is trial 1569 with value: 0.001761963053552708.[0m
[32m[I 2022-11-08 11:52:35,153][0m Trial 1961 finished with value: 0.0018102853425152857 and parameters: {'nlayers': 65, 'hidden_size': 166, 'dropout': 0.4031238450685358, 'learning_rate': 0.0022453700896987536, 'batch_size': 9821, 'optimizer_name': 'Adam'}. Best is trial 1569 with value: 0.001761963053552708.[0m
[32m[I 2022-11-08 11:52:59,335][0m Trial 1962 finished with value: 0.0017779923141002655 and parameters: {'nlayers': 16, 'hidden_size': 81, 'dropout': 0.47355023350751274, 'learning_rate': 0.001990577723385935, 'batch_size': 10000, 'optimizer_name': 'RMSprop'}. Best is trial 1569 with value: 0.001761963053552708.[0m
[32m[I 2022-11-08 11:53:20,292][0m Trial 1963 finished with value: 0.0018635788761762035 and parameters: {'nlayers': 18, 'hidden_size': 38, 'dropout': 0.12250311497077403, 'learning_rate': 0.0017135173352494644, 'batch_size': 9538, 'optimizer_name': 'Adam'}. Best is trial 1569 with value: 0.001761963053552708.[0m
[32m[I 2022-11-08 11:54:03,514][0m Trial 1964 finished with value: 0.0018263684365088858 and parameters: {'nlayers': 76, 'hidden_size': 93, 'dropout': 0.4621199353292498, 'learning_rate': 0.005658880651490326, 'batch_size': 9710, 'optimizer_name': 'Adam'}. Best is trial 1569 with value: 0.001761963053552708.[0m
[32m[I 2022-11-08 11:54:29,803][0m Trial 1965 finished with value: 0.0018048345368276155 and parameters: {'nlayers': 30, 'hidden_size': 61, 'dropout': 0.4850361067996791, 'learning_rate': 0.001281063137665081, 'batch_size': 9811, 'optimizer_name': 'Adam'}. Best is trial 1569 with value: 0.001761963053552708.[0m
[32m[I 2022-11-08 11:54:48,852][0m Trial 1966 finished with value: 0.0018614463283916408 and parameters: {'nlayers': 5, 'hidden_size': 100, 'dropout': 0.1307319502510872, 'learning_rate': 0.006436255529517836, 'batch_size': 9537, 'optimizer_name': 'Adam'}. Best is trial 1569 with value: 0.001761963053552708.[0m
[32m[I 2022-11-08 11:55:24,115][0m Trial 1967 finished with value: 0.001830845741918852 and parameters: {'nlayers': 67, 'hidden_size': 67, 'dropout': 0.3849196214353407, 'learning_rate': 0.007527364082689281, 'batch_size': 9683, 'optimizer_name': 'Adam'}. Best is trial 1569 with value: 0.001761963053552708.[0m
[32m[I 2022-11-08 11:55:49,945][0m Trial 1968 finished with value: 0.001806017447931839 and parameters: {'nlayers': 22, 'hidden_size': 108, 'dropout': 0.11456637227781005, 'learning_rate': 0.006187110531022147, 'batch_size': 9814, 'optimizer_name': 'Adam'}. Best is trial 1569 with value: 0.001761963053552708.[0m
[32m[I 2022-11-08 11:56:22,229][0m Trial 1969 finished with value: 0.001771251938971771 and parameters: {'nlayers': 60, 'hidden_size': 50, 'dropout': 0.39890910529130663, 'learning_rate': 0.0021463681353956743, 'batch_size': 9996, 'optimizer_name': 'Adam'}. Best is trial 1569 with value: 0.001761963053552708.[0m
[32m[I 2022-11-08 11:56:44,889][0m Trial 1970 finished with value: 0.0018999603621069792 and parameters: {'nlayers': 13, 'hidden_size': 150, 'dropout': 0.13646190316317205, 'learning_rate': 0.002318972674338964, 'batch_size': 9353, 'optimizer_name': 'Adam'}. Best is trial 1569 with value: 0.001761963053552708.[0m
[32m[I 2022-11-08 11:57:17,872][0m Trial 1971 finished with value: 0.0018070239275936979 and parameters: {'nlayers': 95, 'hidden_size': 2, 'dropout': 0.1411828135287795, 'learning_rate': 0.008121400688030656, 'batch_size': 9808, 'optimizer_name': 'RMSprop'}. Best is trial 1569 with value: 0.001761963053552708.[0m
[32m[I 2022-11-08 11:57:56,590][0m Trial 1972 finished with value: 0.0018547917868649408 and parameters: {'nlayers': 81, 'hidden_size': 88, 'dropout': 0.4928162047777509, 'learning_rate': 0.001522409724138713, 'batch_size': 9561, 'optimizer_name': 'Adam'}. Best is trial 1569 with value: 0.001761963053552708.[0m
[32m[I 2022-11-08 11:58:26,568][0m Trial 1973 finished with value: 0.001768312265615676 and parameters: {'nlayers': 26, 'hidden_size': 125, 'dropout': 0.10554574804972386, 'learning_rate': 0.0019717167177725316, 'batch_size': 9999, 'optimizer_name': 'Adam'}. Best is trial 1569 with value: 0.001761963053552708.[0m
[32m[I 2022-11-08 11:58:53,413][0m Trial 1974 finished with value: 0.001804546407193831 and parameters: {'nlayers': 25, 'hidden_size': 108, 'dropout': 0.10816512170269182, 'learning_rate': 0.002233262467561052, 'batch_size': 9828, 'optimizer_name': 'Adam'}. Best is trial 1569 with value: 0.001761963053552708.[0m
[32m[I 2022-11-08 11:59:19,325][0m Trial 1975 finished with value: 0.001833854698549705 and parameters: {'nlayers': 25, 'hidden_size': 108, 'dropout': 0.10913852985099859, 'learning_rate': 0.0019829567776990455, 'batch_size': 9657, 'optimizer_name': 'Adam'}. Best is trial 1569 with value: 0.001761963053552708.[0m
[32m[I 2022-11-08 11:59:49,458][0m Trial 1976 finished with value: 0.0017781418016280096 and parameters: {'nlayers': 21, 'hidden_size': 157, 'dropout': 0.10732080688019469, 'learning_rate': 0.007800335397897191, 'batch_size': 9995, 'optimizer_name': 'Adam'}. Best is trial 1569 with value: 0.001761963053552708.[0m
[32m[I 2022-11-08 12:00:18,724][0m Trial 1977 finished with value: 0.0019238100599087054 and parameters: {'nlayers': 24, 'hidden_size': 163, 'dropout': 0.11270841699692773, 'learning_rate': 0.003832746663017131, 'batch_size': 9202, 'optimizer_name': 'Adam'}. Best is trial 1569 with value: 0.001761963053552708.[0m
[32m[I 2022-11-08 12:00:48,163][0m Trial 1978 finished with value: 0.0017710696383461187 and parameters: {'nlayers': 30, 'hidden_size': 103, 'dropout': 0.10027210148225915, 'learning_rate': 0.007263856770379147, 'batch_size': 9998, 'optimizer_name': 'Adam'}. Best is trial 1569 with value: 0.001761963053552708.[0m
[32m[I 2022-11-08 12:01:22,943][0m Trial 1979 finished with value: 0.0017789785552470728 and parameters: {'nlayers': 26, 'hidden_size': 171, 'dropout': 0.1145887230071745, 'learning_rate': 0.002326780338364829, 'batch_size': 9999, 'optimizer_name': 'RMSprop'}. Best is trial 1569 with value: 0.001761963053552708.[0m
[32m[I 2022-11-08 12:01:48,156][0m Trial 1980 finished with value: 0.0018638563454675462 and parameters: {'nlayers': 23, 'hidden_size': 103, 'dropout': 0.11941837943246099, 'learning_rate': 0.006970089188679793, 'batch_size': 9663, 'optimizer_name': 'SGD'}. Best is trial 1569 with value: 0.001761963053552708.[0m
[32m[I 2022-11-08 12:02:15,198][0m Trial 1981 finished with value: 0.0018070293699547276 and parameters: {'nlayers': 24, 'hidden_size': 111, 'dropout': 0.112179651979678, 'learning_rate': 0.001791674565387469, 'batch_size': 9815, 'optimizer_name': 'Adam'}. Best is trial 1569 with value: 0.001761963053552708.[0m
[32m[I 2022-11-08 12:02:40,097][0m Trial 1982 finished with value: 0.002155746932218697 and parameters: {'nlayers': 27, 'hidden_size': 161, 'dropout': 0.10284248408243712, 'learning_rate': 0.002062808773702795, 'batch_size': 8226, 'optimizer_name': 'Adam'}. Best is trial 1569 with value: 0.001761963053552708.[0m
[32m[I 2022-11-08 12:03:05,863][0m Trial 1983 finished with value: 0.001882007954722938 and parameters: {'nlayers': 26, 'hidden_size': 95, 'dropout': 0.10551897873772817, 'learning_rate': 0.0059395931886608395, 'batch_size': 9433, 'optimizer_name': 'Adam'}. Best is trial 1569 with value: 0.001761963053552708.[0m
[32m[I 2022-11-08 12:03:09,038][0m Trial 1984 finished with value: 0.017175728059863497 and parameters: {'nlayers': 25, 'hidden_size': 115, 'dropout': 0.11569456983626458, 'learning_rate': 0.002415082179325402, 'batch_size': 1046, 'optimizer_name': 'Adam'}. Best is trial 1569 with value: 0.001761963053552708.[0m
[32m[I 2022-11-08 12:03:33,748][0m Trial 1985 finished with value: 0.0018118361245708433 and parameters: {'nlayers': 22, 'hidden_size': 71, 'dropout': 0.12641206604709115, 'learning_rate': 0.0022067314050013137, 'batch_size': 9823, 'optimizer_name': 'Adam'}. Best is trial 1569 with value: 0.001761963053552708.[0m
[32m[I 2022-11-08 12:04:02,717][0m Trial 1986 finished with value: 0.0017727704852819443 and parameters: {'nlayers': 29, 'hidden_size': 102, 'dropout': 0.10750887418419672, 'learning_rate': 0.0017447901061283238, 'batch_size': 10000, 'optimizer_name': 'Adam'}. Best is trial 1569 with value: 0.001761963053552708.[0m
[32m[I 2022-11-08 12:04:34,811][0m Trial 1987 finished with value: 0.0018468927415714643 and parameters: {'nlayers': 23, 'hidden_size': 182, 'dropout': 0.12365921611399715, 'learning_rate': 0.0035217742594611467, 'batch_size': 9613, 'optimizer_name': 'Adam'}. Best is trial 1569 with value: 0.001761963053552708.[0m
[32m[I 2022-11-08 12:05:01,105][0m Trial 1988 finished with value: 0.001805878738286881 and parameters: {'nlayers': 28, 'hidden_size': 96, 'dropout': 0.10976388771638798, 'learning_rate': 0.001996783854142985, 'batch_size': 9812, 'optimizer_name': 'Adam'}. Best is trial 1569 with value: 0.001761963053552708.[0m
[32m[I 2022-11-08 12:05:24,199][0m Trial 1989 finished with value: 0.0018653122783835853 and parameters: {'nlayers': 24, 'hidden_size': 80, 'dropout': 0.4503772938940462, 'learning_rate': 0.0024479601837646726, 'batch_size': 9506, 'optimizer_name': 'RMSprop'}. Best is trial 1569 with value: 0.001761963053552708.[0m
[32m[I 2022-11-08 12:05:51,461][0m Trial 1990 finished with value: 0.0017770081192141748 and parameters: {'nlayers': 23, 'hidden_size': 107, 'dropout': 0.10412890756204525, 'learning_rate': 0.007516610009442199, 'batch_size': 9998, 'optimizer_name': 'Adam'}. Best is trial 1569 with value: 0.001761963053552708.[0m
[32m[I 2022-11-08 12:06:15,021][0m Trial 1991 finished with value: 0.001831306883727832 and parameters: {'nlayers': 19, 'hidden_size': 83, 'dropout': 0.11478731317689973, 'learning_rate': 0.0013458887633320425, 'batch_size': 9682, 'optimizer_name': 'Adam'}. Best is trial 1569 with value: 0.001761963053552708.[0m
[32m[I 2022-11-08 12:06:40,832][0m Trial 1992 finished with value: 0.0018086016839595803 and parameters: {'nlayers': 27, 'hidden_size': 88, 'dropout': 0.11508209165620906, 'learning_rate': 0.002182842598501166, 'batch_size': 9822, 'optimizer_name': 'Adam'}. Best is trial 1569 with value: 0.001761963053552708.[0m
[32m[I 2022-11-08 12:07:14,977][0m Trial 1993 finished with value: 0.0018032051565934977 and parameters: {'nlayers': 20, 'hidden_size': 217, 'dropout': 0.11309158453280438, 'learning_rate': 0.0015528127646175643, 'batch_size': 9815, 'optimizer_name': 'Adam'}. Best is trial 1569 with value: 0.001761963053552708.[0m
[32m[I 2022-11-08 12:07:39,623][0m Trial 1994 finished with value: 0.0018396709877752425 and parameters: {'nlayers': 21, 'hidden_size': 95, 'dropout': 0.11389983266036595, 'learning_rate': 0.0026809666977817307, 'batch_size': 9647, 'optimizer_name': 'Adam'}. Best is trial 1569 with value: 0.001761963053552708.[0m
[32m[I 2022-11-08 12:08:03,005][0m Trial 1995 finished with value: 0.0017742189973592758 and parameters: {'nlayers': 21, 'hidden_size': 56, 'dropout': 0.1201749275703204, 'learning_rate': 0.0018437366820737125, 'batch_size': 10000, 'optimizer_name': 'Adam'}. Best is trial 1569 with value: 0.001761963053552708.[0m
[32m[I 2022-11-08 12:08:27,351][0m Trial 1996 finished with value: 0.0018859291331375446 and parameters: {'nlayers': 21, 'hidden_size': 113, 'dropout': 0.11090499492736287, 'learning_rate': 0.0023609178518451688, 'batch_size': 9407, 'optimizer_name': 'Adam'}. Best is trial 1569 with value: 0.001761963053552708.[0m
[32m[I 2022-11-08 12:09:12,592][0m Trial 1997 finished with value: 0.001802015562925001 and parameters: {'nlayers': 26, 'hidden_size': 276, 'dropout': 0.1008348651003735, 'learning_rate': 0.006604926275297954, 'batch_size': 9828, 'optimizer_name': 'RMSprop'}. Best is trial 1569 with value: 0.001761963053552708.[0m
[32m[I 2022-11-08 12:09:39,980][0m Trial 1998 finished with value: 0.0018352887197737742 and parameters: {'nlayers': 19, 'hidden_size': 156, 'dropout': 0.1125745723591965, 'learning_rate': 0.002069647580857672, 'batch_size': 9653, 'optimizer_name': 'Adam'}. Best is trial 1569 with value: 0.001761963053552708.[0m
