[32m[I 2022-11-08 01:42:43,744][0m Trial 759 finished with value: 0.001891913492948856 and parameters: {'nlayers': 12, 'hidden_size': 114, 'dropout': 0.3643535771943706, 'learning_rate': 0.001100909127049295, 'batch_size': 9377, 'optimizer_name': 'Adam'}. Best is trial 646 with value: 0.0017660508930683137.[0m
[32m[I 2022-11-08 01:43:07,456][0m Trial 760 finished with value: 0.0017760811840371192 and parameters: {'nlayers': 14, 'hidden_size': 128, 'dropout': 0.29900636230839994, 'learning_rate': 0.0019755877474658986, 'batch_size': 9992, 'optimizer_name': 'Adam'}. Best is trial 646 with value: 0.0017660508930683137.[0m
[32m[I 2022-11-08 01:43:45,104][0m Trial 761 finished with value: 0.0018435384958021103 and parameters: {'nlayers': 63, 'hidden_size': 103, 'dropout': 0.46181392794127796, 'learning_rate': 0.0018004495628109898, 'batch_size': 9610, 'optimizer_name': 'Adam'}. Best is trial 646 with value: 0.0017660508930683137.[0m
[32m[I 2022-11-08 01:44:11,219][0m Trial 762 finished with value: 0.0017743838608264924 and parameters: {'nlayers': 18, 'hidden_size': 121, 'dropout': 0.4912788781383252, 'learning_rate': 0.0013751087915828835, 'batch_size': 10000, 'optimizer_name': 'Adam'}. Best is trial 646 with value: 0.0017660508930683137.[0m
[32m[I 2022-11-08 01:44:27,586][0m Trial 763 finished with value: 0.0029379240650068933 and parameters: {'nlayers': 42, 'hidden_size': 116, 'dropout': 0.15728955072834855, 'learning_rate': 0.0009332317880717034, 'batch_size': 6036, 'optimizer_name': 'Adam'}. Best is trial 646 with value: 0.0017660508930683137.[0m
[32m[I 2022-11-08 01:44:59,944][0m Trial 764 finished with value: 0.0018211623307186231 and parameters: {'nlayers': 46, 'hidden_size': 98, 'dropout': 0.14397371247465415, 'learning_rate': 0.002460142429207208, 'batch_size': 9706, 'optimizer_name': 'Adam'}. Best is trial 646 with value: 0.0017660508930683137.[0m
[32m[I 2022-11-08 01:45:18,018][0m Trial 765 finished with value: 0.0018731721397254324 and parameters: {'nlayers': 2, 'hidden_size': 91, 'dropout': 0.46906752236632193, 'learning_rate': 0.002104207125935659, 'batch_size': 9512, 'optimizer_name': 'Adam'}. Best is trial 646 with value: 0.0017660508930683137.[0m
[32m[I 2022-11-08 01:45:56,256][0m Trial 766 finished with value: 0.0018140814491710313 and parameters: {'nlayers': 49, 'hidden_size': 132, 'dropout': 0.11070325495605589, 'learning_rate': 0.0023331869117707575, 'batch_size': 9773, 'optimizer_name': 'Adam'}. Best is trial 646 with value: 0.0017660508930683137.[0m
[32m[I 2022-11-08 01:46:17,493][0m Trial 767 finished with value: 0.0018132896591141064 and parameters: {'nlayers': 10, 'hidden_size': 104, 'dropout': 0.15199132311115005, 'learning_rate': 0.0011212738400728252, 'batch_size': 9818, 'optimizer_name': 'Adam'}. Best is trial 646 with value: 0.0017660508930683137.[0m
[32m[I 2022-11-08 01:46:36,457][0m Trial 768 finished with value: 0.0018923290528668959 and parameters: {'nlayers': 6, 'hidden_size': 109, 'dropout': 0.16147576258324997, 'learning_rate': 0.0026725050338912136, 'batch_size': 9387, 'optimizer_name': 'Adam'}. Best is trial 646 with value: 0.0017660508930683137.[0m
[32m[I 2022-11-08 01:47:06,769][0m Trial 769 finished with value: 0.0017996975077962977 and parameters: {'nlayers': 39, 'hidden_size': 97, 'dropout': 0.45020479484308784, 'learning_rate': 0.000717365989505024, 'batch_size': 9817, 'optimizer_name': 'Adam'}. Best is trial 646 with value: 0.0017660508930683137.[0m
[32m[I 2022-11-08 01:47:39,092][0m Trial 770 finished with value: 0.0018423379158914435 and parameters: {'nlayers': 51, 'hidden_size': 112, 'dropout': 0.2373396447577621, 'learning_rate': 0.0017085420211960336, 'batch_size': 9656, 'optimizer_name': 'Adam'}. Best is trial 646 with value: 0.0017660508930683137.[0m
[32m[I 2022-11-08 01:48:00,925][0m Trial 771 finished with value: 0.0019821527165450234 and parameters: {'nlayers': 12, 'hidden_size': 91, 'dropout': 0.16692724158444633, 'learning_rate': 0.0014976566850418687, 'batch_size': 9835, 'optimizer_name': 'SGD'}. Best is trial 646 with value: 0.0017660508930683137.[0m
[32m[I 2022-11-08 01:48:25,321][0m Trial 772 finished with value: 0.001854084062990848 and parameters: {'nlayers': 15, 'hidden_size': 139, 'dropout': 0.34263467252371466, 'learning_rate': 0.002115286087445028, 'batch_size': 9547, 'optimizer_name': 'Adam'}. Best is trial 646 with value: 0.0017660508930683137.[0m
[32m[I 2022-11-08 01:48:56,590][0m Trial 773 finished with value: 0.0017759920043718088 and parameters: {'nlayers': 45, 'hidden_size': 74, 'dropout': 0.43645923080136767, 'learning_rate': 0.002525732246964833, 'batch_size': 9989, 'optimizer_name': 'Adam'}. Best is trial 646 with value: 0.0017660508930683137.[0m
[32m[I 2022-11-08 01:49:17,869][0m Trial 774 finished with value: 0.00180372520008157 and parameters: {'nlayers': 8, 'hidden_size': 100, 'dropout': 0.14937550021755003, 'learning_rate': 0.0018703444241812462, 'batch_size': 9832, 'optimizer_name': 'Adam'}. Best is trial 646 with value: 0.0017660508930683137.[0m
[32m[I 2022-11-08 01:49:30,787][0m Trial 775 finished with value: 0.0025175069100581682 and parameters: {'nlayers': 14, 'hidden_size': 127, 'dropout': 0.480216581254988, 'learning_rate': 0.0013575998991072423, 'batch_size': 7072, 'optimizer_name': 'Adam'}. Best is trial 646 with value: 0.0017660508930683137.[0m
[32m[I 2022-11-08 01:50:22,121][0m Trial 776 finished with value: 0.001905232395066726 and parameters: {'nlayers': 48, 'hidden_size': 216, 'dropout': 0.1408372169813908, 'learning_rate': 0.002228018925199952, 'batch_size': 9284, 'optimizer_name': 'Adam'}. Best is trial 646 with value: 0.0017660508930683137.[0m
[32m[I 2022-11-08 01:50:46,941][0m Trial 777 finished with value: 0.0017740435333437003 and parameters: {'nlayers': 17, 'hidden_size': 105, 'dropout': 0.159993674531816, 'learning_rate': 0.0008740457435896786, 'batch_size': 9998, 'optimizer_name': 'Adam'}. Best is trial 646 with value: 0.0017660508930683137.[0m
[32m[I 2022-11-08 01:51:44,701][0m Trial 778 finished with value: 0.0018273001375805203 and parameters: {'nlayers': 43, 'hidden_size': 255, 'dropout': 0.15521913604156248, 'learning_rate': 0.0024228481460611302, 'batch_size': 9665, 'optimizer_name': 'Adam'}. Best is trial 646 with value: 0.0017660508930683137.[0m
[32m[I 2022-11-08 01:52:20,089][0m Trial 779 finished with value: 0.001849683920292955 and parameters: {'nlayers': 62, 'hidden_size': 83, 'dropout': 0.1165498690317294, 'learning_rate': 0.002707593062955065, 'batch_size': 9558, 'optimizer_name': 'Adam'}. Best is trial 646 with value: 0.0017660508930683137.[0m
[32m[I 2022-11-08 01:52:55,850][0m Trial 780 finished with value: 0.0017885386508442007 and parameters: {'nlayers': 52, 'hidden_size': 94, 'dropout': 0.398493380304405, 'learning_rate': 2.186147135702695e-05, 'batch_size': 9994, 'optimizer_name': 'Adam'}. Best is trial 646 with value: 0.0017660508930683137.[0m
[32m[I 2022-11-08 01:53:51,782][0m Trial 781 finished with value: 0.0018084338829513962 and parameters: {'nlayers': 100, 'hidden_size': 121, 'dropout': 0.1465125901034442, 'learning_rate': 0.001996928127810744, 'batch_size': 9806, 'optimizer_name': 'Adam'}. Best is trial 646 with value: 0.0017660508930683137.[0m
[32m[I 2022-11-08 01:54:13,407][0m Trial 782 finished with value: 0.0018872149749594447 and parameters: {'nlayers': 11, 'hidden_size': 134, 'dropout': 0.16772107702836916, 'learning_rate': 0.0011479781955607653, 'batch_size': 9666, 'optimizer_name': 'SGD'}. Best is trial 646 with value: 0.0017660508930683137.[0m
[32m[I 2022-11-08 01:54:32,796][0m Trial 783 finished with value: 0.0019528525075743581 and parameters: {'nlayers': 13, 'hidden_size': 104, 'dropout': 0.47086328108395964, 'learning_rate': 0.000577993168705598, 'batch_size': 9091, 'optimizer_name': 'Adam'}. Best is trial 646 with value: 0.0017660508930683137.[0m
[32m[I 2022-11-08 01:54:58,367][0m Trial 784 finished with value: 0.0017767773264223553 and parameters: {'nlayers': 18, 'hidden_size': 115, 'dropout': 0.13106917667040097, 'learning_rate': 0.0023135898810574805, 'batch_size': 9991, 'optimizer_name': 'Adam'}. Best is trial 646 with value: 0.0017660508930683137.[0m
[32m[I 2022-11-08 01:55:34,298][0m Trial 785 finished with value: 0.0018109720651481038 and parameters: {'nlayers': 65, 'hidden_size': 88, 'dropout': 0.46116104845032124, 'learning_rate': 0.0015579695948267024, 'batch_size': 9776, 'optimizer_name': 'Adam'}. Best is trial 646 with value: 0.0017660508930683137.[0m
[32m[I 2022-11-08 01:56:02,393][0m Trial 786 finished with value: 0.0018587105795678524 and parameters: {'nlayers': 34, 'hidden_size': 99, 'dropout': 0.49051219654981454, 'learning_rate': 0.0026077598726270182, 'batch_size': 9528, 'optimizer_name': 'Adam'}. Best is trial 646 with value: 0.0017660508930683137.[0m
[32m[I 2022-11-08 01:56:34,384][0m Trial 787 finished with value: 0.0017712330393451418 and parameters: {'nlayers': 40, 'hidden_size': 94, 'dropout': 0.1562228393495694, 'learning_rate': 0.0017923701084691954, 'batch_size': 9992, 'optimizer_name': 'Adam'}. Best is trial 646 with value: 0.0017660508930683137.[0m
[32m[I 2022-11-08 01:57:06,330][0m Trial 788 finished with value: 0.001803072884833524 and parameters: {'nlayers': 47, 'hidden_size': 112, 'dropout': 0.17712594381927702, 'learning_rate': 0.006053984847275965, 'batch_size': 9826, 'optimizer_name': 'Adam'}. Best is trial 646 with value: 0.0017660508930683137.[0m
[32m[I 2022-11-08 01:57:50,779][0m Trial 789 finished with value: 0.0018320331683381623 and parameters: {'nlayers': 68, 'hidden_size': 123, 'dropout': 0.13896826425081654, 'learning_rate': 0.001263654354809254, 'batch_size': 9676, 'optimizer_name': 'Adam'}. Best is trial 646 with value: 0.0017660508930683137.[0m
[32m[I 2022-11-08 01:58:09,752][0m Trial 790 finished with value: 0.0018950780241225405 and parameters: {'nlayers': 8, 'hidden_size': 68, 'dropout': 0.3081441194467753, 'learning_rate': 0.0021074362042886497, 'batch_size': 9374, 'optimizer_name': 'Adam'}. Best is trial 646 with value: 0.0017660508930683137.[0m
[32m[I 2022-11-08 01:58:30,517][0m Trial 791 finished with value: 0.001788023014316683 and parameters: {'nlayers': 4, 'hidden_size': 140, 'dropout': 0.4999702655577655, 'learning_rate': 0.0009150874945659066, 'batch_size': 9995, 'optimizer_name': 'Adam'}. Best is trial 646 with value: 0.0017660508930683137.[0m
[32m[I 2022-11-08 01:58:54,107][0m Trial 792 finished with value: 0.001808042581959468 and parameters: {'nlayers': 16, 'hidden_size': 106, 'dropout': 0.48255624723803864, 'learning_rate': 0.0022884254327184333, 'batch_size': 9821, 'optimizer_name': 'Adam'}. Best is trial 646 with value: 0.0017660508930683137.[0m
[32m[I 2022-11-08 01:59:15,525][0m Trial 793 finished with value: 0.0018821062624960415 and parameters: {'nlayers': 10, 'hidden_size': 134, 'dropout': 0.10554173580450085, 'learning_rate': 0.0028481115582959828, 'batch_size': 9543, 'optimizer_name': 'SGD'}. Best is trial 646 with value: 0.0017660508930683137.[0m
[32m[I 2022-11-08 01:59:49,675][0m Trial 794 finished with value: 0.0017694989225831724 and parameters: {'nlayers': 50, 'hidden_size': 86, 'dropout': 0.3241180755719665, 'learning_rate': 0.0019847460773740415, 'batch_size': 9993, 'optimizer_name': 'Adam'}. Best is trial 646 with value: 0.0017660508930683137.[0m
[32m[I 2022-11-08 02:00:24,669][0m Trial 795 finished with value: 0.001773607737423957 and parameters: {'nlayers': 53, 'hidden_size': 83, 'dropout': 0.35673589118142573, 'learning_rate': 0.0019854681072183416, 'batch_size': 9997, 'optimizer_name': 'Adam'}. Best is trial 646 with value: 0.0017660508930683137.[0m
[32m[I 2022-11-08 02:00:59,006][0m Trial 796 finished with value: 0.001772552227973938 and parameters: {'nlayers': 50, 'hidden_size': 83, 'dropout': 0.32157612787874473, 'learning_rate': 0.0019235983387025431, 'batch_size': 10000, 'optimizer_name': 'Adam'}. Best is trial 646 with value: 0.0017660508930683137.[0m
[32m[I 2022-11-08 02:01:07,658][0m Trial 797 finished with value: 0.005356390667523672 and parameters: {'nlayers': 51, 'hidden_size': 74, 'dropout': 0.31341598017831246, 'learning_rate': 0.002091763488632926, 'batch_size': 3309, 'optimizer_name': 'Adam'}. Best is trial 646 with value: 0.0017660508930683137.[0m
[32m[I 2022-11-08 02:01:38,313][0m Trial 798 finished with value: 0.0018289336002882722 and parameters: {'nlayers': 54, 'hidden_size': 80, 'dropout': 0.32999579816673763, 'learning_rate': 0.002444276653097362, 'batch_size': 9693, 'optimizer_name': 'Adam'}. Best is trial 646 with value: 0.0017660508930683137.[0m
[32m[I 2022-11-08 02:02:12,272][0m Trial 799 finished with value: 0.0018250373617906442 and parameters: {'nlayers': 52, 'hidden_size': 89, 'dropout': 0.2865770925027296, 'learning_rate': 0.002197532486706371, 'batch_size': 9690, 'optimizer_name': 'Adam'}. Best is trial 646 with value: 0.0017660508930683137.[0m
[32m[I 2022-11-08 02:02:44,611][0m Trial 800 finished with value: 0.0018023852752514994 and parameters: {'nlayers': 50, 'hidden_size': 77, 'dropout': 0.3706522938701865, 'learning_rate': 0.0018019817796639669, 'batch_size': 9819, 'optimizer_name': 'Adam'}. Best is trial 646 with value: 0.0017660508930683137.[0m
[32m[I 2022-11-08 02:03:03,742][0m Trial 801 finished with value: 0.001896594257813909 and parameters: {'nlayers': 19, 'hidden_size': 32, 'dropout': 0.3008612829725035, 'learning_rate': 0.0022653634208504034, 'batch_size': 9367, 'optimizer_name': 'Adam'}. Best is trial 646 with value: 0.0017660508930683137.[0m
[32m[I 2022-11-08 02:03:25,772][0m Trial 802 finished with value: 0.00180421356819627 and parameters: {'nlayers': 14, 'hidden_size': 88, 'dropout': 0.3884802266577055, 'learning_rate': 0.0019996835154024468, 'batch_size': 9815, 'optimizer_name': 'RMSprop'}. Best is trial 646 with value: 0.0017660508930683137.[0m
[32m[I 2022-11-08 02:04:01,954][0m Trial 803 finished with value: 0.0018564898248563935 and parameters: {'nlayers': 61, 'hidden_size': 92, 'dropout': 0.38385013577108207, 'learning_rate': 0.002543176157815126, 'batch_size': 9541, 'optimizer_name': 'Adam'}. Best is trial 646 with value: 0.0017660508930683137.[0m
[32m[I 2022-11-08 02:04:24,794][0m Trial 804 finished with value: 0.0018077946597254509 and parameters: {'nlayers': 16, 'hidden_size': 96, 'dropout': 0.4048442747293386, 'learning_rate': 0.0018218024684126199, 'batch_size': 9813, 'optimizer_name': 'Adam'}. Best is trial 646 with value: 0.0017660508930683137.[0m
[32m[I 2022-11-08 02:04:59,409][0m Trial 805 finished with value: 0.001799548829331591 and parameters: {'nlayers': 52, 'hidden_size': 86, 'dropout': 0.25571336700910063, 'learning_rate': 0.0023391683846990087, 'batch_size': 9834, 'optimizer_name': 'Adam'}. Best is trial 646 with value: 0.0017660508930683137.[0m
[32m[I 2022-11-08 02:05:21,202][0m Trial 806 finished with value: 0.0018341696688107083 and parameters: {'nlayers': 12, 'hidden_size': 99, 'dropout': 0.41491777743205166, 'learning_rate': 0.002178067460163822, 'batch_size': 9660, 'optimizer_name': 'Adam'}. Best is trial 646 with value: 0.0017660508930683137.[0m
[32m[I 2022-11-08 02:05:41,717][0m Trial 807 finished with value: 0.0018743360803642707 and parameters: {'nlayers': 13, 'hidden_size': 79, 'dropout': 0.1741745632100215, 'learning_rate': 0.0026786873261222385, 'batch_size': 9492, 'optimizer_name': 'SGD'}. Best is trial 646 with value: 0.0017660508930683137.[0m
[32m[I 2022-11-08 02:06:03,775][0m Trial 808 finished with value: 0.0017775919765233993 and parameters: {'nlayers': 8, 'hidden_size': 101, 'dropout': 0.2899216139023004, 'learning_rate': 0.001660396724060497, 'batch_size': 10000, 'optimizer_name': 'Adam'}. Best is trial 646 with value: 0.0017660508930683137.[0m
[32m[I 2022-11-08 02:06:37,315][0m Trial 809 finished with value: 0.0017958353640065406 and parameters: {'nlayers': 48, 'hidden_size': 89, 'dropout': 0.347484786410419, 'learning_rate': 0.002474861032483689, 'batch_size': 9847, 'optimizer_name': 'Adam'}. Best is trial 646 with value: 0.0017660508930683137.[0m
[32m[I 2022-11-08 02:07:00,087][0m Trial 810 finished with value: 0.0017695582169422572 and parameters: {'nlayers': 10, 'hidden_size': 116, 'dropout': 0.4230094210138192, 'learning_rate': 0.0020069552705836847, 'batch_size': 9995, 'optimizer_name': 'Adam'}. Best is trial 646 with value: 0.0017660508930683137.[0m
[32m[I 2022-11-08 02:07:20,400][0m Trial 811 finished with value: 0.0018314471374822762 and parameters: {'nlayers': 6, 'hidden_size': 118, 'dropout': 0.43599348920966347, 'learning_rate': 0.0019276474805196384, 'batch_size': 9701, 'optimizer_name': 'Adam'}. Best is trial 646 with value: 0.0017660508930683137.[0m
[32m[I 2022-11-08 02:07:39,888][0m Trial 812 finished with value: 0.0019088421513315623 and parameters: {'nlayers': 9, 'hidden_size': 128, 'dropout': 0.4297009179183112, 'learning_rate': 0.00203177931097433, 'batch_size': 9276, 'optimizer_name': 'Adam'}. Best is trial 646 with value: 0.0017660508930683137.[0m
[32m[I 2022-11-08 02:08:01,866][0m Trial 813 finished with value: 0.0018035951323208674 and parameters: {'nlayers': 10, 'hidden_size': 114, 'dropout': 0.27345515545206683, 'learning_rate': 0.0021048219378559576, 'batch_size': 9821, 'optimizer_name': 'Adam'}. Best is trial 646 with value: 0.0017660508930683137.[0m
[32m[I 2022-11-08 02:08:22,235][0m Trial 814 finished with value: 0.0018494306204091674 and parameters: {'nlayers': 7, 'hidden_size': 122, 'dropout': 0.4367948215645741, 'learning_rate': 0.0016625643470223315, 'batch_size': 9586, 'optimizer_name': 'Adam'}. Best is trial 646 with value: 0.0017660508930683137.[0m
[32m[I 2022-11-08 02:08:44,594][0m Trial 815 finished with value: 0.0018057791657133545 and parameters: {'nlayers': 10, 'hidden_size': 116, 'dropout': 0.4144964524177472, 'learning_rate': 0.0018551459051296148, 'batch_size': 9832, 'optimizer_name': 'Adam'}. Best is trial 646 with value: 0.0017660508930683137.[0m
[32m[I 2022-11-08 02:09:06,701][0m Trial 816 finished with value: 0.0018298014133127792 and parameters: {'nlayers': 12, 'hidden_size': 128, 'dropout': 0.4445736693912426, 'learning_rate': 0.0022289105017640016, 'batch_size': 9678, 'optimizer_name': 'Adam'}. Best is trial 646 with value: 0.0017660508930683137.[0m
[32m[I 2022-11-08 02:09:13,304][0m Trial 817 finished with value: 0.003386209802999054 and parameters: {'nlayers': 11, 'hidden_size': 109, 'dropout': 0.42445037964107174, 'learning_rate': 0.0023380978815238105, 'batch_size': 5237, 'optimizer_name': 'Adam'}. Best is trial 646 with value: 0.0017660508930683137.[0m
[32m[I 2022-11-08 02:09:37,796][0m Trial 818 finished with value: 0.0017701703624412254 and parameters: {'nlayers': 14, 'hidden_size': 119, 'dropout': 0.4200901098856737, 'learning_rate': 0.0019813550115463513, 'batch_size': 9991, 'optimizer_name': 'Adam'}. Best is trial 646 with value: 0.0017660508930683137.[0m
[32m[I 2022-11-08 02:09:56,979][0m Trial 819 finished with value: 0.001859933476058293 and parameters: {'nlayers': 5, 'hidden_size': 113, 'dropout': 0.4472701146521525, 'learning_rate': 0.0017980803053950136, 'batch_size': 9518, 'optimizer_name': 'Adam'}. Best is trial 646 with value: 0.0017660508930683137.[0m
[32m[I 2022-11-08 02:10:19,408][0m Trial 820 finished with value: 0.0018106363111360384 and parameters: {'nlayers': 12, 'hidden_size': 128, 'dropout': 0.4200073318156248, 'learning_rate': 0.0021382746448999814, 'batch_size': 9833, 'optimizer_name': 'SGD'}. Best is trial 646 with value: 0.0017660508930683137.[0m
[32m[I 2022-11-08 02:10:41,826][0m Trial 821 finished with value: 0.0017699281334877014 and parameters: {'nlayers': 9, 'hidden_size': 108, 'dropout': 0.3773344308266859, 'learning_rate': 0.002489186047147758, 'batch_size': 10000, 'optimizer_name': 'Adam'}. Best is trial 646 with value: 0.0017660508930683137.[0m
[32m[I 2022-11-08 02:10:47,416][0m Trial 822 finished with value: 0.004444971856124656 and parameters: {'nlayers': 15, 'hidden_size': 124, 'dropout': 0.4020472614280648, 'learning_rate': 0.0028194036102246103, 'batch_size': 3991, 'optimizer_name': 'Adam'}. Best is trial 646 with value: 0.0017660508930683137.[0m
[32m[I 2022-11-08 02:11:07,159][0m Trial 823 finished with value: 0.0018363584950296316 and parameters: {'nlayers': 7, 'hidden_size': 60, 'dropout': 0.43403804415503183, 'learning_rate': 0.0022629858967692087, 'batch_size': 9659, 'optimizer_name': 'Adam'}. Best is trial 646 with value: 0.0017660508930683137.[0m
[32m[I 2022-11-08 02:11:38,886][0m Trial 824 finished with value: 0.0018024027693327445 and parameters: {'nlayers': 19, 'hidden_size': 204, 'dropout': 0.4300334254864594, 'learning_rate': 0.001996663898125013, 'batch_size': 9826, 'optimizer_name': 'Adam'}. Best is trial 646 with value: 0.0017660508930683137.[0m
[32m[I 2022-11-08 02:12:01,018][0m Trial 825 finished with value: 0.0018878382435543915 and parameters: {'nlayers': 11, 'hidden_size': 134, 'dropout': 0.4232296712419567, 'learning_rate': 0.0026010305517975875, 'batch_size': 9442, 'optimizer_name': 'Adam'}. Best is trial 646 with value: 0.0017660508930683137.[0m
[32m[I 2022-11-08 02:12:24,642][0m Trial 826 finished with value: 0.0018106788472668207 and parameters: {'nlayers': 16, 'hidden_size': 120, 'dropout': 0.40861265882099407, 'learning_rate': 0.001761518822106282, 'batch_size': 9825, 'optimizer_name': 'RMSprop'}. Best is trial 646 with value: 0.0017660508930683137.[0m
[32m[I 2022-11-08 02:12:45,235][0m Trial 827 finished with value: 0.0017705693150158698 and parameters: {'nlayers': 4, 'hidden_size': 112, 'dropout': 0.4412868092494723, 'learning_rate': 0.0023247397203816807, 'batch_size': 9987, 'optimizer_name': 'Adam'}. Best is trial 646 with value: 0.0017660508930683137.[0m
