[32m[I 2022-11-08 00:00:30,067][0m Trial 552 finished with value: 0.0018320728344714818 and parameters: {'nlayers': 14, 'hidden_size': 141, 'dropout': 0.1426163746599813, 'learning_rate': 0.0020060963165618394, 'batch_size': 9679, 'optimizer_name': 'Adam'}. Best is trial 318 with value: 0.001767210723471942.[0m
[32m[I 2022-11-08 00:01:12,529][0m Trial 553 finished with value: 0.0019363784807011144 and parameters: {'nlayers': 62, 'hidden_size': 148, 'dropout': 0.16466618099333602, 'learning_rate': 0.00135524391874198, 'batch_size': 9131, 'optimizer_name': 'Adam'}. Best is trial 318 with value: 0.001767210723471942.[0m
[32m[I 2022-11-08 00:01:37,752][0m Trial 554 finished with value: 0.0017722500319575795 and parameters: {'nlayers': 21, 'hidden_size': 89, 'dropout': 0.15403203933905524, 'learning_rate': 0.0022583717790702435, 'batch_size': 9999, 'optimizer_name': 'SGD'}. Best is trial 318 with value: 0.001767210723471942.[0m
[32m[I 2022-11-08 00:02:25,131][0m Trial 555 finished with value: 0.0018642511266983432 and parameters: {'nlayers': 49, 'hidden_size': 179, 'dropout': 0.11341602382161814, 'learning_rate': 0.009411091081688822, 'batch_size': 9507, 'optimizer_name': 'Adam'}. Best is trial 318 with value: 0.001767210723471942.[0m
[32m[I 2022-11-08 00:02:55,421][0m Trial 556 finished with value: 0.001807094922785654 and parameters: {'nlayers': 17, 'hidden_size': 197, 'dropout': 0.18215070153603757, 'learning_rate': 0.0010432995169654565, 'batch_size': 9816, 'optimizer_name': 'Adam'}. Best is trial 318 with value: 0.001767210723471942.[0m
[32m[I 2022-11-08 00:03:33,899][0m Trial 557 finished with value: 0.0018348182602810573 and parameters: {'nlayers': 57, 'hidden_size': 118, 'dropout': 0.13538202848533662, 'learning_rate': 0.0026199391960335557, 'batch_size': 9668, 'optimizer_name': 'Adam'}. Best is trial 318 with value: 0.001767210723471942.[0m
[32m[I 2022-11-08 00:03:39,233][0m Trial 558 finished with value: 0.01739281436533236 and parameters: {'nlayers': 38, 'hidden_size': 154, 'dropout': 0.14689771221947934, 'learning_rate': 0.0018662549459003207, 'batch_size': 1013, 'optimizer_name': 'Adam'}. Best is trial 318 with value: 0.001767210723471942.[0m
[32m[I 2022-11-08 00:04:13,873][0m Trial 559 finished with value: 0.0018950098614389716 and parameters: {'nlayers': 46, 'hidden_size': 130, 'dropout': 0.1275377512880415, 'learning_rate': 0.002111204706286887, 'batch_size': 9333, 'optimizer_name': 'Adam'}. Best is trial 318 with value: 0.001767210723471942.[0m
[32m[I 2022-11-08 00:04:40,197][0m Trial 560 finished with value: 0.0018100905804705526 and parameters: {'nlayers': 11, 'hidden_size': 207, 'dropout': 0.1691531614415657, 'learning_rate': 0.0015534889495162066, 'batch_size': 9813, 'optimizer_name': 'Adam'}. Best is trial 318 with value: 0.001767210723471942.[0m
[32m[I 2022-11-08 00:05:22,570][0m Trial 561 finished with value: 0.0017751638836611698 and parameters: {'nlayers': 44, 'hidden_size': 162, 'dropout': 0.15674267239460976, 'learning_rate': 0.000832590987283387, 'batch_size': 9998, 'optimizer_name': 'RMSprop'}. Best is trial 318 with value: 0.001767210723471942.[0m
[32m[I 2022-11-08 00:06:05,856][0m Trial 562 finished with value: 0.0018622643126672877 and parameters: {'nlayers': 40, 'hidden_size': 190, 'dropout': 0.2542494848144211, 'learning_rate': 0.0024567293554563162, 'batch_size': 9555, 'optimizer_name': 'Adam'}. Best is trial 318 with value: 0.001767210723471942.[0m
[32m[I 2022-11-08 00:06:36,035][0m Trial 563 finished with value: 0.0018119913749112427 and parameters: {'nlayers': 20, 'hidden_size': 173, 'dropout': 0.31263833762742577, 'learning_rate': 0.0012602184163554408, 'batch_size': 9825, 'optimizer_name': 'Adam'}. Best is trial 318 with value: 0.001767210723471942.[0m
[32m[I 2022-11-08 00:07:09,604][0m Trial 564 finished with value: 0.001802604205011775 and parameters: {'nlayers': 24, 'hidden_size': 183, 'dropout': 0.16436428650527138, 'learning_rate': 0.007346997992051262, 'batch_size': 9819, 'optimizer_name': 'Adam'}. Best is trial 318 with value: 0.001767210723471942.[0m
[32m[I 2022-11-08 00:07:47,166][0m Trial 565 finished with value: 0.0018355245475488173 and parameters: {'nlayers': 36, 'hidden_size': 165, 'dropout': 0.14068261585076067, 'learning_rate': 0.0017521534049097448, 'batch_size': 9643, 'optimizer_name': 'Adam'}. Best is trial 318 with value: 0.001767210723471942.[0m
[32m[I 2022-11-08 00:07:52,346][0m Trial 566 finished with value: 0.00736822254934244 and parameters: {'nlayers': 28, 'hidden_size': 110, 'dropout': 0.1504453377540492, 'learning_rate': 0.0021009982090516546, 'batch_size': 2423, 'optimizer_name': 'Adam'}. Best is trial 318 with value: 0.001767210723471942.[0m
[32m[I 2022-11-08 00:08:27,614][0m Trial 567 finished with value: 0.0017975489546931032 and parameters: {'nlayers': 53, 'hidden_size': 98, 'dropout': 0.17807390261590517, 'learning_rate': 0.0031385505289953384, 'batch_size': 9837, 'optimizer_name': 'Adam'}. Best is trial 318 with value: 0.001767210723471942.[0m
[32m[I 2022-11-08 00:08:52,719][0m Trial 568 finished with value: 0.0018839620569815394 and parameters: {'nlayers': 21, 'hidden_size': 144, 'dropout': 0.1602696567399989, 'learning_rate': 0.0014833327061227043, 'batch_size': 9399, 'optimizer_name': 'Adam'}. Best is trial 318 with value: 0.001767210723471942.[0m
[32m[I 2022-11-08 00:09:28,971][0m Trial 569 finished with value: 0.0018377574110603253 and parameters: {'nlayers': 48, 'hidden_size': 126, 'dropout': 0.17240756745776042, 'learning_rate': 0.0009770995254847195, 'batch_size': 9668, 'optimizer_name': 'Adam'}. Best is trial 318 with value: 0.001767210723471942.[0m
[32m[I 2022-11-08 00:09:54,773][0m Trial 570 finished with value: 0.001779131883499669 and parameters: {'nlayers': 14, 'hidden_size': 151, 'dropout': 0.2067356803001229, 'learning_rate': 0.000448159870348584, 'batch_size': 9996, 'optimizer_name': 'Adam'}. Best is trial 318 with value: 0.001767210723471942.[0m
[32m[I 2022-11-08 00:10:41,911][0m Trial 571 finished with value: 0.001770533184445045 and parameters: {'nlayers': 55, 'hidden_size': 158, 'dropout': 0.1271155486325201, 'learning_rate': 0.0026362215520275333, 'batch_size': 9994, 'optimizer_name': 'Adam'}. Best is trial 318 with value: 0.001767210723471942.[0m
[32m[I 2022-11-08 00:11:29,839][0m Trial 572 finished with value: 0.001777509200378598 and parameters: {'nlayers': 55, 'hidden_size': 159, 'dropout': 0.12197927683586242, 'learning_rate': 0.002749426896394654, 'batch_size': 9997, 'optimizer_name': 'Adam'}. Best is trial 318 with value: 0.001767210723471942.[0m
[32m[I 2022-11-08 00:12:15,454][0m Trial 573 finished with value: 0.0018111497673525196 and parameters: {'nlayers': 56, 'hidden_size': 156, 'dropout': 0.1552362757045112, 'learning_rate': 0.0028800165412367026, 'batch_size': 9822, 'optimizer_name': 'Adam'}. Best is trial 318 with value: 0.001767210723471942.[0m
[32m[I 2022-11-08 00:13:06,097][0m Trial 574 finished with value: 0.001773500858628528 and parameters: {'nlayers': 59, 'hidden_size': 164, 'dropout': 0.10669469232303616, 'learning_rate': 0.0026275156522483035, 'batch_size': 9998, 'optimizer_name': 'RMSprop'}. Best is trial 318 with value: 0.001767210723471942.[0m
[32m[I 2022-11-08 00:13:48,757][0m Trial 575 finished with value: 0.001866577462028821 and parameters: {'nlayers': 53, 'hidden_size': 151, 'dropout': 0.13481971690078634, 'learning_rate': 0.002533220081364171, 'batch_size': 9518, 'optimizer_name': 'Adam'}. Best is trial 318 with value: 0.001767210723471942.[0m
[32m[I 2022-11-08 00:14:41,572][0m Trial 576 finished with value: 0.001774097314476967 and parameters: {'nlayers': 57, 'hidden_size': 170, 'dropout': 0.14401018279502567, 'learning_rate': 0.0023928860073454948, 'batch_size': 10000, 'optimizer_name': 'Adam'}. Best is trial 318 with value: 0.001767210723471942.[0m
[32m[I 2022-11-08 00:15:25,232][0m Trial 577 finished with value: 0.0018291130558943283 and parameters: {'nlayers': 52, 'hidden_size': 157, 'dropout': 0.18316470858565045, 'learning_rate': 0.0029738730043535225, 'batch_size': 9691, 'optimizer_name': 'Adam'}. Best is trial 318 with value: 0.001767210723471942.[0m
[32m[I 2022-11-08 00:16:05,704][0m Trial 578 finished with value: 0.0018631813695696759 and parameters: {'nlayers': 54, 'hidden_size': 141, 'dropout': 0.1665555975170122, 'learning_rate': 0.002749833102754801, 'batch_size': 9689, 'optimizer_name': 'SGD'}. Best is trial 318 with value: 0.001767210723471942.[0m
[32m[I 2022-11-08 00:16:56,246][0m Trial 579 finished with value: 0.001810290343689904 and parameters: {'nlayers': 60, 'hidden_size': 162, 'dropout': 0.14924610424636695, 'learning_rate': 0.0022395582480655646, 'batch_size': 9798, 'optimizer_name': 'Adam'}. Best is trial 318 with value: 0.001767210723471942.[0m
[32m[I 2022-11-08 00:17:40,124][0m Trial 580 finished with value: 0.001775010706412934 and parameters: {'nlayers': 51, 'hidden_size': 150, 'dropout': 0.15925318069617858, 'learning_rate': 0.0023310993458930253, 'batch_size': 9999, 'optimizer_name': 'Adam'}. Best is trial 318 with value: 0.001767210723471942.[0m
[32m[I 2022-11-08 00:18:25,691][0m Trial 581 finished with value: 0.0019168703444563606 and parameters: {'nlayers': 55, 'hidden_size': 167, 'dropout': 0.11510034842724341, 'learning_rate': 0.0018981688442814945, 'batch_size': 9259, 'optimizer_name': 'Adam'}. Best is trial 318 with value: 0.001767210723471942.[0m
[32m[I 2022-11-08 00:19:08,414][0m Trial 582 finished with value: 0.001855286613941942 and parameters: {'nlayers': 58, 'hidden_size': 137, 'dropout': 0.19225421322686573, 'learning_rate': 0.0025801292166284643, 'batch_size': 9545, 'optimizer_name': 'Adam'}. Best is trial 318 with value: 0.001767210723471942.[0m
[32m[I 2022-11-08 00:19:44,281][0m Trial 583 finished with value: 0.0018062204818021968 and parameters: {'nlayers': 50, 'hidden_size': 114, 'dropout': 0.17563889555743653, 'learning_rate': 0.002053793959018515, 'batch_size': 9813, 'optimizer_name': 'Adam'}. Best is trial 318 with value: 0.001767210723471942.[0m
[32m[I 2022-11-08 00:19:56,466][0m Trial 584 finished with value: 0.004292782383450007 and parameters: {'nlayers': 56, 'hidden_size': 92, 'dropout': 0.1291830219906308, 'learning_rate': 0.0023389583263681516, 'batch_size': 4130, 'optimizer_name': 'Adam'}. Best is trial 318 with value: 0.001767210723471942.[0m
[32m[I 2022-11-08 00:20:19,000][0m Trial 585 finished with value: 0.0018043372958166473 and parameters: {'nlayers': 9, 'hidden_size': 160, 'dropout': 0.14031735266957862, 'learning_rate': 0.003205357771527923, 'batch_size': 9811, 'optimizer_name': 'Adam'}. Best is trial 318 with value: 0.001767210723471942.[0m
[32m[I 2022-11-08 00:20:35,543][0m Trial 586 finished with value: 0.0019747199844722904 and parameters: {'nlayers': 3, 'hidden_size': 146, 'dropout': 0.16699481887183126, 'learning_rate': 0.002801284867502347, 'batch_size': 8954, 'optimizer_name': 'Adam'}. Best is trial 318 with value: 0.001767210723471942.[0m
[32m[I 2022-11-08 00:21:28,904][0m Trial 587 finished with value: 0.0018587067536755015 and parameters: {'nlayers': 64, 'hidden_size': 172, 'dropout': 0.15594246502138176, 'learning_rate': 0.0018589718402511003, 'batch_size': 9507, 'optimizer_name': 'RMSprop'}. Best is trial 318 with value: 0.001767210723471942.[0m
[32m[I 2022-11-08 00:22:06,203][0m Trial 588 finished with value: 0.0017691846698522568 and parameters: {'nlayers': 42, 'hidden_size': 133, 'dropout': 0.15120541282743888, 'learning_rate': 0.0025445132639932643, 'batch_size': 10000, 'optimizer_name': 'Adam'}. Best is trial 318 with value: 0.001767210723471942.[0m
[32m[I 2022-11-08 00:22:23,108][0m Trial 589 finished with value: 0.0032419387064023648 and parameters: {'nlayers': 45, 'hidden_size': 133, 'dropout': 0.16081914889282783, 'learning_rate': 0.002625192129842371, 'batch_size': 5475, 'optimizer_name': 'Adam'}. Best is trial 318 with value: 0.001767210723471942.[0m
[32m[I 2022-11-08 00:22:58,680][0m Trial 590 finished with value: 0.001834186950942184 and parameters: {'nlayers': 47, 'hidden_size': 126, 'dropout': 0.41746632566443587, 'learning_rate': 0.003008673620482084, 'batch_size': 9692, 'optimizer_name': 'Adam'}. Best is trial 318 with value: 0.001767210723471942.[0m
[32m[I 2022-11-08 00:23:35,881][0m Trial 591 finished with value: 0.001777952915430069 and parameters: {'nlayers': 42, 'hidden_size': 131, 'dropout': 0.3482685886543976, 'learning_rate': 0.002540442213955071, 'batch_size': 10000, 'optimizer_name': 'Adam'}. Best is trial 318 with value: 0.001767210723471942.[0m
[32m[I 2022-11-08 00:23:58,661][0m Trial 592 finished with value: 0.001805180744845925 and parameters: {'nlayers': 12, 'hidden_size': 122, 'dropout': 0.1738878181653667, 'learning_rate': 0.00270376681149003, 'batch_size': 9814, 'optimizer_name': 'Adam'}. Best is trial 318 with value: 0.001767210723471942.[0m
[32m[I 2022-11-08 00:24:46,330][0m Trial 593 finished with value: 0.0018383235408740116 and parameters: {'nlayers': 70, 'hidden_size': 135, 'dropout': 0.15321143788614747, 'learning_rate': 0.0024088602441548245, 'batch_size': 9616, 'optimizer_name': 'Adam'}. Best is trial 318 with value: 0.001767210723471942.[0m
[32m[I 2022-11-08 00:25:32,560][0m Trial 594 finished with value: 0.0017682977689936485 and parameters: {'nlayers': 61, 'hidden_size': 140, 'dropout': 0.1662082092863375, 'learning_rate': 0.0028681271243577297, 'batch_size': 9998, 'optimizer_name': 'Adam'}. Best is trial 318 with value: 0.001767210723471942.[0m
[32m[I 2022-11-08 00:26:17,791][0m Trial 595 finished with value: 0.00188693132604081 and parameters: {'nlayers': 61, 'hidden_size': 151, 'dropout': 0.18721996876886318, 'learning_rate': 0.003218567883899771, 'batch_size': 9393, 'optimizer_name': 'Adam'}. Best is trial 318 with value: 0.001767210723471942.[0m
[32m[I 2022-11-08 00:27:06,361][0m Trial 596 finished with value: 0.0017789430686017329 and parameters: {'nlayers': 66, 'hidden_size': 140, 'dropout': 0.16852736477937355, 'learning_rate': 0.003521901052446401, 'batch_size': 9997, 'optimizer_name': 'Adam'}. Best is trial 318 with value: 0.001767210723471942.[0m
[32m[I 2022-11-08 00:27:54,375][0m Trial 597 finished with value: 0.0018060055530034803 and parameters: {'nlayers': 61, 'hidden_size': 156, 'dropout': 0.14750026545617276, 'learning_rate': 0.0030608691787295944, 'batch_size': 9810, 'optimizer_name': 'Adam'}. Best is trial 318 with value: 0.001767210723471942.[0m
[32m[I 2022-11-08 00:28:34,610][0m Trial 598 finished with value: 0.0018357119064749557 and parameters: {'nlayers': 58, 'hidden_size': 144, 'dropout': 0.3232354903539624, 'learning_rate': 0.0029413120013709187, 'batch_size': 9662, 'optimizer_name': 'Adam'}. Best is trial 318 with value: 0.001767210723471942.[0m
[32m[I 2022-11-08 00:29:14,067][0m Trial 599 finished with value: 0.0018027749707978829 and parameters: {'nlayers': 62, 'hidden_size': 107, 'dropout': 0.16138594465155012, 'learning_rate': 0.0028338637471856413, 'batch_size': 9826, 'optimizer_name': 'Adam'}. Best is trial 318 with value: 0.001767210723471942.[0m
[32m[I 2022-11-08 00:29:59,707][0m Trial 600 finished with value: 0.0018635265319953394 and parameters: {'nlayers': 63, 'hidden_size': 146, 'dropout': 0.18030876217284617, 'learning_rate': 0.0029692176539238137, 'batch_size': 9509, 'optimizer_name': 'Adam'}. Best is trial 318 with value: 0.001767210723471942.[0m
[32m[I 2022-11-08 00:30:52,012][0m Trial 601 finished with value: 0.0018098101035018176 and parameters: {'nlayers': 68, 'hidden_size': 153, 'dropout': 0.15219531010581944, 'learning_rate': 0.003400735836429155, 'batch_size': 9830, 'optimizer_name': 'Adam'}. Best is trial 318 with value: 0.001767210723471942.[0m
[32m[I 2022-11-08 00:31:38,470][0m Trial 602 finished with value: 0.0017686656087636948 and parameters: {'nlayers': 60, 'hidden_size': 138, 'dropout': 0.16663548330696304, 'learning_rate': 0.0027689878874640806, 'batch_size': 10000, 'optimizer_name': 'Adam'}. Best is trial 318 with value: 0.001767210723471942.[0m
[32m[I 2022-11-08 00:32:23,783][0m Trial 603 finished with value: 0.001774846935157753 and parameters: {'nlayers': 59, 'hidden_size': 137, 'dropout': 0.14467599535702244, 'learning_rate': 0.0031924838803644748, 'batch_size': 9998, 'optimizer_name': 'Adam'}. Best is trial 318 with value: 0.001767210723471942.[0m
[32m[I 2022-11-08 00:33:04,982][0m Trial 604 finished with value: 0.0018351439346549331 and parameters: {'nlayers': 60, 'hidden_size': 125, 'dropout': 0.16266984753527858, 'learning_rate': 0.0028889464055011716, 'batch_size': 9672, 'optimizer_name': 'Adam'}. Best is trial 318 with value: 0.001767210723471942.[0m
[32m[I 2022-11-08 00:33:47,366][0m Trial 605 finished with value: 0.0019011174292874239 and parameters: {'nlayers': 64, 'hidden_size': 131, 'dropout': 0.17275816509551029, 'learning_rate': 0.003089088401842875, 'batch_size': 9326, 'optimizer_name': 'Adam'}. Best is trial 318 with value: 0.001767210723471942.[0m
[32m[I 2022-11-08 00:34:28,816][0m Trial 606 finished with value: 0.0018037863796414155 and parameters: {'nlayers': 62, 'hidden_size': 119, 'dropout': 0.13310667323795863, 'learning_rate': 0.002732599787425236, 'batch_size': 9811, 'optimizer_name': 'Adam'}. Best is trial 318 with value: 0.001767210723471942.[0m
[32m[I 2022-11-08 00:35:15,456][0m Trial 607 finished with value: 0.0018367707821989306 and parameters: {'nlayers': 66, 'hidden_size': 142, 'dropout': 0.1525619338276819, 'learning_rate': 0.002843849174625537, 'batch_size': 9650, 'optimizer_name': 'Adam'}. Best is trial 318 with value: 0.001767210723471942.[0m
[32m[I 2022-11-08 00:35:53,123][0m Trial 608 finished with value: 0.0017794238179922105 and parameters: {'nlayers': 60, 'hidden_size': 85, 'dropout': 0.3774676020340453, 'learning_rate': 0.002643120176096659, 'batch_size': 10000, 'optimizer_name': 'Adam'}. Best is trial 318 with value: 0.001767210723471942.[0m
[32m[I 2022-11-08 00:36:33,517][0m Trial 609 finished with value: 0.00180124051954764 and parameters: {'nlayers': 57, 'hidden_size': 136, 'dropout': 0.12459207919448022, 'learning_rate': 0.0026608614460922287, 'batch_size': 9807, 'optimizer_name': 'Adam'}. Best is trial 318 with value: 0.001767210723471942.[0m
[32m[I 2022-11-08 00:37:10,873][0m Trial 610 finished with value: 0.0018616808278678807 and parameters: {'nlayers': 57, 'hidden_size': 114, 'dropout': 0.24550883069878024, 'learning_rate': 0.005285919224846571, 'batch_size': 9503, 'optimizer_name': 'Adam'}. Best is trial 318 with value: 0.001767210723471942.[0m
[32m[I 2022-11-08 00:37:45,867][0m Trial 611 finished with value: 0.0018077470228489228 and parameters: {'nlayers': 61, 'hidden_size': 75, 'dropout': 0.47428909929837465, 'learning_rate': 0.003013321063312815, 'batch_size': 9808, 'optimizer_name': 'Adam'}. Best is trial 318 with value: 0.001767210723471942.[0m
[32m[I 2022-11-08 00:38:14,062][0m Trial 612 finished with value: 0.0022666655829946774 and parameters: {'nlayers': 64, 'hidden_size': 102, 'dropout': 0.166228105827731, 'learning_rate': 0.0025219626749216377, 'batch_size': 7961, 'optimizer_name': 'SGD'}. Best is trial 318 with value: 0.001767210723471942.[0m
[32m[I 2022-11-08 00:38:55,817][0m Trial 613 finished with value: 0.001808662992616211 and parameters: {'nlayers': 56, 'hidden_size': 131, 'dropout': 0.14339686665841875, 'learning_rate': 0.0027360664301018705, 'batch_size': 9812, 'optimizer_name': 'Adam'}. Best is trial 318 with value: 0.001767210723471942.[0m
[32m[I 2022-11-08 00:39:31,785][0m Trial 614 finished with value: 0.0018413230629404159 and parameters: {'nlayers': 59, 'hidden_size': 99, 'dropout': 0.15737162031468171, 'learning_rate': 0.002265970993618988, 'batch_size': 9605, 'optimizer_name': 'Adam'}. Best is trial 318 with value: 0.001767210723471942.[0m
[32m[I 2022-11-08 00:40:07,802][0m Trial 615 finished with value: 0.0018037285058552983 and parameters: {'nlayers': 54, 'hidden_size': 94, 'dropout': 0.19958221509576846, 'learning_rate': 0.006801251482385315, 'batch_size': 9825, 'optimizer_name': 'Adam'}. Best is trial 318 with value: 0.001767210723471942.[0m
[32m[I 2022-11-08 00:40:53,346][0m Trial 616 finished with value: 0.0017738225633673302 and parameters: {'nlayers': 59, 'hidden_size': 140, 'dropout': 0.18553380660403407, 'learning_rate': 0.003310890575932608, 'batch_size': 9997, 'optimizer_name': 'Adam'}. Best is trial 318 with value: 0.001767210723471942.[0m
[32m[I 2022-11-08 00:41:05,005][0m Trial 617 finished with value: 0.002721950729231268 and parameters: {'nlayers': 15, 'hidden_size': 126, 'dropout': 0.13603124145864393, 'learning_rate': 0.002505575709073018, 'batch_size': 6525, 'optimizer_name': 'Adam'}. Best is trial 318 with value: 0.001767210723471942.[0m
[32m[I 2022-11-08 00:41:29,489][0m Trial 618 finished with value: 0.0017758029292577835 and parameters: {'nlayers': 17, 'hidden_size': 105, 'dropout': 0.1759004878883347, 'learning_rate': 0.001180428901949311, 'batch_size': 9994, 'optimizer_name': 'Adam'}. Best is trial 318 with value: 0.001767210723471942.[0m
[32m[I 2022-11-08 00:42:13,454][0m Trial 619 finished with value: 0.0019349401979314972 and parameters: {'nlayers': 55, 'hidden_size': 164, 'dropout': 0.39448926695044445, 'learning_rate': 0.002790868698320976, 'batch_size': 9142, 'optimizer_name': 'Adam'}. Best is trial 318 with value: 0.001767210723471942.[0m
[32m[I 2022-11-08 00:42:52,179][0m Trial 620 finished with value: 0.001835338389935271 and parameters: {'nlayers': 58, 'hidden_size': 118, 'dropout': 0.15810804868099185, 'learning_rate': 0.0024962618972614865, 'batch_size': 9650, 'optimizer_name': 'Adam'}. Best is trial 318 with value: 0.001767210723471942.[0m
