[32m[I 2022-11-08 01:12:11,614][0m Trial 690 finished with value: 0.0019775876836300907 and parameters: {'nlayers': 8, 'hidden_size': 92, 'dropout': 0.47498862598425534, 'learning_rate': 0.0026372281878842573, 'batch_size': 8959, 'optimizer_name': 'Adam'}. Best is trial 646 with value: 0.0017660508930683137.[0m
[32m[I 2022-11-08 01:12:34,030][0m Trial 691 finished with value: 0.0017758201656072536 and parameters: {'nlayers': 10, 'hidden_size': 97, 'dropout': 0.4805864676822793, 'learning_rate': 0.0008507665143111567, 'batch_size': 9997, 'optimizer_name': 'Adam'}. Best is trial 646 with value: 0.0017660508930683137.[0m
[32m[I 2022-11-08 01:12:53,920][0m Trial 692 finished with value: 0.001828316919098922 and parameters: {'nlayers': 5, 'hidden_size': 78, 'dropout': 0.47719956194967944, 'learning_rate': 0.00228343377280274, 'batch_size': 9710, 'optimizer_name': 'Adam'}. Best is trial 646 with value: 0.0017660508930683137.[0m
[32m[I 2022-11-08 01:13:14,057][0m Trial 693 finished with value: 0.00189369648443697 and parameters: {'nlayers': 10, 'hidden_size': 105, 'dropout': 0.46544149988987527, 'learning_rate': 0.0019991736302556015, 'batch_size': 9369, 'optimizer_name': 'Adam'}. Best is trial 646 with value: 0.0017660508930683137.[0m
[32m[I 2022-11-08 01:13:34,671][0m Trial 694 finished with value: 0.0018150057013475041 and parameters: {'nlayers': 7, 'hidden_size': 99, 'dropout': 0.4966077552578928, 'learning_rate': 0.0006605583449443551, 'batch_size': 9819, 'optimizer_name': 'Adam'}. Best is trial 646 with value: 0.0017660508930683137.[0m
[32m[I 2022-11-08 01:14:09,188][0m Trial 695 finished with value: 0.0017775460706614104 and parameters: {'nlayers': 48, 'hidden_size': 92, 'dropout': 0.47215299729130433, 'learning_rate': 0.009892761924575022, 'batch_size': 9999, 'optimizer_name': 'Adam'}. Best is trial 646 with value: 0.0017660508930683137.[0m
[32m[I 2022-11-08 01:14:10,055][0m Trial 696 finished with value: 0.10794996012406177 and parameters: {'nlayers': 11, 'hidden_size': 89, 'dropout': 0.468291737137328, 'learning_rate': 0.0037502571539862932, 'batch_size': 166, 'optimizer_name': 'Adam'}. Best is trial 646 with value: 0.0017660508930683137.[0m
[32m[I 2022-11-08 01:14:30,206][0m Trial 697 finished with value: 0.001869044130466862 and parameters: {'nlayers': 9, 'hidden_size': 110, 'dropout': 0.4809752476706812, 'learning_rate': 0.0027644781385053616, 'batch_size': 9527, 'optimizer_name': 'SGD'}. Best is trial 646 with value: 0.0017660508930683137.[0m
[32m[I 2022-11-08 01:14:51,615][0m Trial 698 finished with value: 0.0018057925643737986 and parameters: {'nlayers': 12, 'hidden_size': 65, 'dropout': 0.4867117423726636, 'learning_rate': 0.002549934182069763, 'batch_size': 9802, 'optimizer_name': 'Adam'}. Best is trial 646 with value: 0.0017660508930683137.[0m
[32m[I 2022-11-08 01:15:13,667][0m Trial 699 finished with value: 0.0018319440395483722 and parameters: {'nlayers': 14, 'hidden_size': 104, 'dropout': 0.49605198770547126, 'learning_rate': 0.002126218142655885, 'batch_size': 9678, 'optimizer_name': 'Adam'}. Best is trial 646 with value: 0.0017660508930683137.[0m
[32m[I 2022-11-08 01:15:37,201][0m Trial 700 finished with value: 0.0017933383929714906 and parameters: {'nlayers': 17, 'hidden_size': 82, 'dropout': 0.2768772449711977, 'learning_rate': 0.0009990472276190541, 'batch_size': 9828, 'optimizer_name': 'Adam'}. Best is trial 646 with value: 0.0017660508930683137.[0m
[32m[I 2022-11-08 01:16:09,252][0m Trial 701 finished with value: 0.001859926235448437 and parameters: {'nlayers': 47, 'hidden_size': 97, 'dropout': 0.4532061047420671, 'learning_rate': 0.0023761048094973237, 'batch_size': 9542, 'optimizer_name': 'Adam'}. Best is trial 646 with value: 0.0017660508930683137.[0m
[32m[I 2022-11-08 01:16:31,037][0m Trial 702 finished with value: 0.0017682495691463012 and parameters: {'nlayers': 9, 'hidden_size': 86, 'dropout': 0.47313647469760495, 'learning_rate': 0.0019634874528959016, 'batch_size': 9993, 'optimizer_name': 'Adam'}. Best is trial 646 with value: 0.0017660508930683137.[0m
[32m[I 2022-11-08 01:16:40,610][0m Trial 703 finished with value: 0.002583929969699549 and parameters: {'nlayers': 7, 'hidden_size': 88, 'dropout': 0.48454278884647833, 'learning_rate': 0.0018822140870609937, 'batch_size': 6867, 'optimizer_name': 'Adam'}. Best is trial 646 with value: 0.0017660508930683137.[0m
[32m[I 2022-11-08 01:17:00,455][0m Trial 704 finished with value: 0.0018072725616338598 and parameters: {'nlayers': 6, 'hidden_size': 72, 'dropout': 0.4902601324880955, 'learning_rate': 0.001584568572517167, 'batch_size': 9825, 'optimizer_name': 'Adam'}. Best is trial 646 with value: 0.0017660508930683137.[0m
[32m[I 2022-11-08 01:17:20,802][0m Trial 705 finished with value: 0.0018410151016649194 and parameters: {'nlayers': 3, 'hidden_size': 235, 'dropout': 0.4837641414760313, 'learning_rate': 0.0012072631293906925, 'batch_size': 9651, 'optimizer_name': 'Adam'}. Best is trial 646 with value: 0.0017660508930683137.[0m
[32m[I 2022-11-08 01:17:42,686][0m Trial 706 finished with value: 0.0018875415830624362 and parameters: {'nlayers': 17, 'hidden_size': 85, 'dropout': 0.4936483851693114, 'learning_rate': 0.001755106761064354, 'batch_size': 9396, 'optimizer_name': 'Adam'}. Best is trial 646 with value: 0.0017660508930683137.[0m
[32m[I 2022-11-08 01:18:03,799][0m Trial 707 finished with value: 0.0018000567500416258 and parameters: {'nlayers': 8, 'hidden_size': 108, 'dropout': 0.4989501689668455, 'learning_rate': 0.0008484851980061188, 'batch_size': 9849, 'optimizer_name': 'Adam'}. Best is trial 646 with value: 0.0017660508930683137.[0m
[32m[I 2022-11-08 01:18:26,865][0m Trial 708 finished with value: 0.001775590255163402 and parameters: {'nlayers': 12, 'hidden_size': 101, 'dropout': 0.4666244637027039, 'learning_rate': 0.0014319992497198823, 'batch_size': 9997, 'optimizer_name': 'Adam'}. Best is trial 646 with value: 0.0017660508930683137.[0m
[32m[I 2022-11-08 01:18:56,296][0m Trial 709 finished with value: 0.0019272569283651458 and parameters: {'nlayers': 49, 'hidden_size': 112, 'dropout': 0.48434890401070885, 'learning_rate': 0.0010717858876259422, 'batch_size': 9178, 'optimizer_name': 'Adam'}. Best is trial 646 with value: 0.0017660508930683137.[0m
[32m[I 2022-11-08 01:19:20,080][0m Trial 710 finished with value: 0.0017742472286760385 and parameters: {'nlayers': 14, 'hidden_size': 97, 'dropout': 0.47868527643515496, 'learning_rate': 0.0005077151430540498, 'batch_size': 9999, 'optimizer_name': 'Adam'}. Best is trial 646 with value: 0.0017660508930683137.[0m
[32m[I 2022-11-08 01:19:50,412][0m Trial 711 finished with value: 0.0018404967163070515 and parameters: {'nlayers': 45, 'hidden_size': 78, 'dropout': 0.40475594364341483, 'learning_rate': 0.0018716366286166005, 'batch_size': 9647, 'optimizer_name': 'Adam'}. Best is trial 646 with value: 0.0017660508930683137.[0m
[32m[I 2022-11-08 01:20:12,139][0m Trial 712 finished with value: 0.001808263047153993 and parameters: {'nlayers': 11, 'hidden_size': 86, 'dropout': 0.4705505063547409, 'learning_rate': 0.002754428637762948, 'batch_size': 9814, 'optimizer_name': 'Adam'}. Best is trial 646 with value: 0.0017660508930683137.[0m
[32m[I 2022-11-08 01:20:33,811][0m Trial 713 finished with value: 0.001862792172769073 and parameters: {'nlayers': 16, 'hidden_size': 104, 'dropout': 0.4686923505961728, 'learning_rate': 0.0023234900298368002, 'batch_size': 9519, 'optimizer_name': 'Adam'}. Best is trial 646 with value: 0.0017660508930683137.[0m
[32m[I 2022-11-08 01:21:05,148][0m Trial 714 finished with value: 0.0018251930843713453 and parameters: {'nlayers': 48, 'hidden_size': 96, 'dropout': 0.4636182068427511, 'learning_rate': 0.0022135345895285693, 'batch_size': 9712, 'optimizer_name': 'Adam'}. Best is trial 646 with value: 0.0017660508930683137.[0m
[32m[I 2022-11-08 01:21:35,604][0m Trial 715 finished with value: 0.0019243096058125556 and parameters: {'nlayers': 77, 'hidden_size': 5, 'dropout': 0.4878975835202777, 'learning_rate': 0.0025120532690565537, 'batch_size': 9826, 'optimizer_name': 'Adam'}. Best is trial 646 with value: 0.0017660508930683137.[0m
[32m[I 2022-11-08 01:22:05,965][0m Trial 716 finished with value: 0.0017744374519708813 and parameters: {'nlayers': 13, 'hidden_size': 245, 'dropout': 0.48316838247574984, 'learning_rate': 0.001262502136239642, 'batch_size': 9995, 'optimizer_name': 'Adam'}. Best is trial 646 with value: 0.0017660508930683137.[0m
[32m[I 2022-11-08 01:22:30,331][0m Trial 717 finished with value: 0.0018321967022682133 and parameters: {'nlayers': 18, 'hidden_size': 115, 'dropout': 0.4990645204441644, 'learning_rate': 0.0016523155439267046, 'batch_size': 9676, 'optimizer_name': 'Adam'}. Best is trial 646 with value: 0.0017660508930683137.[0m
[32m[I 2022-11-08 01:23:01,718][0m Trial 718 finished with value: 0.0017696672555743127 and parameters: {'nlayers': 46, 'hidden_size': 104, 'dropout': 0.4744854205429345, 'learning_rate': 0.004778153774357422, 'batch_size': 9995, 'optimizer_name': 'SGD'}. Best is trial 646 with value: 0.0017660508930683137.[0m
[32m[I 2022-11-08 01:23:32,381][0m Trial 719 finished with value: 0.0019316381566813997 and parameters: {'nlayers': 46, 'hidden_size': 106, 'dropout': 0.476166985776795, 'learning_rate': 0.003993953373335083, 'batch_size': 9397, 'optimizer_name': 'SGD'}. Best is trial 646 with value: 0.0017660508930683137.[0m
[32m[I 2022-11-08 01:24:06,236][0m Trial 720 finished with value: 0.0018632100638169868 and parameters: {'nlayers': 50, 'hidden_size': 110, 'dropout': 0.48408056461140747, 'learning_rate': 0.0036160500467733074, 'batch_size': 9818, 'optimizer_name': 'SGD'}. Best is trial 646 with value: 0.0017660508930683137.[0m
[32m[I 2022-11-08 01:24:33,157][0m Trial 721 finished with value: 0.0020942660397341847 and parameters: {'nlayers': 45, 'hidden_size': 103, 'dropout': 0.47774668592887315, 'learning_rate': 0.0029960237803474885, 'batch_size': 8706, 'optimizer_name': 'SGD'}. Best is trial 646 with value: 0.0017660508930683137.[0m
[32m[I 2022-11-08 01:25:03,522][0m Trial 722 finished with value: 0.0018846014062331104 and parameters: {'nlayers': 43, 'hidden_size': 94, 'dropout': 0.46476383344589817, 'learning_rate': 0.005321591784561024, 'batch_size': 9572, 'optimizer_name': 'SGD'}. Best is trial 646 with value: 0.0017660508930683137.[0m
[32m[I 2022-11-08 01:25:35,177][0m Trial 723 finished with value: 0.001799260657569538 and parameters: {'nlayers': 44, 'hidden_size': 100, 'dropout': 0.4746031226125447, 'learning_rate': 0.004802100155395746, 'batch_size': 9995, 'optimizer_name': 'SGD'}. Best is trial 646 with value: 0.0017660508930683137.[0m
[32m[I 2022-11-08 01:26:09,359][0m Trial 724 finished with value: 0.0018592704307523133 and parameters: {'nlayers': 48, 'hidden_size': 114, 'dropout': 0.45947891203983515, 'learning_rate': 0.004259193128538057, 'batch_size': 9820, 'optimizer_name': 'SGD'}. Best is trial 646 with value: 0.0017660508930683137.[0m
[32m[I 2022-11-08 01:26:40,501][0m Trial 725 finished with value: 0.0018974141258025425 and parameters: {'nlayers': 47, 'hidden_size': 92, 'dropout': 0.49012433004908373, 'learning_rate': 0.006842408656140805, 'batch_size': 9647, 'optimizer_name': 'SGD'}. Best is trial 646 with value: 0.0017660508930683137.[0m
[32m[I 2022-11-08 01:27:02,333][0m Trial 726 finished with value: 0.0018469578880752988 and parameters: {'nlayers': 9, 'hidden_size': 107, 'dropout': 0.47937639679577826, 'learning_rate': 0.0050504887857597824, 'batch_size': 9999, 'optimizer_name': 'SGD'}. Best is trial 646 with value: 0.0017660508930683137.[0m
[32m[I 2022-11-08 01:27:36,531][0m Trial 727 finished with value: 0.0018362134437483462 and parameters: {'nlayers': 51, 'hidden_size': 99, 'dropout': 0.46631644478148965, 'learning_rate': 0.0033709061333277294, 'batch_size': 9835, 'optimizer_name': 'SGD'}. Best is trial 646 with value: 0.0017660508930683137.[0m
[32m[I 2022-11-08 01:28:05,095][0m Trial 728 finished with value: 0.001921695667792872 and parameters: {'nlayers': 46, 'hidden_size': 76, 'dropout': 0.4690017922442696, 'learning_rate': 0.0029017456411263003, 'batch_size': 9471, 'optimizer_name': 'SGD'}. Best is trial 646 with value: 0.0017660508930683137.[0m
[32m[I 2022-11-08 01:28:35,487][0m Trial 729 finished with value: 0.001828236664472921 and parameters: {'nlayers': 43, 'hidden_size': 81, 'dropout': 0.4737874217667197, 'learning_rate': 0.0009227901915035213, 'batch_size': 9683, 'optimizer_name': 'Adam'}. Best is trial 646 with value: 0.0017660508930683137.[0m
[32m[I 2022-11-08 01:29:06,681][0m Trial 730 finished with value: 0.001876760378094609 and parameters: {'nlayers': 50, 'hidden_size': 104, 'dropout': 0.3986374797299073, 'learning_rate': 0.002637872309575732, 'batch_size': 9822, 'optimizer_name': 'SGD'}. Best is trial 646 with value: 0.0017660508930683137.[0m
[32m[I 2022-11-08 01:29:27,786][0m Trial 731 finished with value: 0.001845356390189947 and parameters: {'nlayers': 11, 'hidden_size': 90, 'dropout': 0.17212608103648852, 'learning_rate': 0.0007217433345129616, 'batch_size': 9669, 'optimizer_name': 'SGD'}. Best is trial 646 with value: 0.0017660508930683137.[0m
[32m[I 2022-11-08 01:29:59,440][0m Trial 732 finished with value: 0.0019373412647296733 and parameters: {'nlayers': 48, 'hidden_size': 116, 'dropout': 0.49017035670359665, 'learning_rate': 0.008158184453177099, 'batch_size': 9263, 'optimizer_name': 'SGD'}. Best is trial 646 with value: 0.0017660508930683137.[0m
[32m[I 2022-11-08 01:31:01,395][0m Trial 733 finished with value: 0.0018197753666424393 and parameters: {'nlayers': 41, 'hidden_size': 279, 'dropout': 0.4607197669009504, 'learning_rate': 0.00743734628341001, 'batch_size': 9828, 'optimizer_name': 'SGD'}. Best is trial 646 with value: 0.0017660508930683137.[0m
[32m[I 2022-11-08 01:31:25,889][0m Trial 734 finished with value: 0.0017713617593050003 and parameters: {'nlayers': 15, 'hidden_size': 95, 'dropout': 0.16398314820292867, 'learning_rate': 0.0025125361901738113, 'batch_size': 10000, 'optimizer_name': 'Adam'}. Best is trial 646 with value: 0.0017660508930683137.[0m
[32m[I 2022-11-08 01:32:00,985][0m Trial 735 finished with value: 0.0018484959598875756 and parameters: {'nlayers': 52, 'hidden_size': 109, 'dropout': 0.47728681975376014, 'learning_rate': 0.0028358837371838734, 'batch_size': 9591, 'optimizer_name': 'Adam'}. Best is trial 646 with value: 0.0017660508930683137.[0m
[32m[I 2022-11-08 01:32:21,302][0m Trial 736 finished with value: 0.0017981044773703167 and parameters: {'nlayers': 6, 'hidden_size': 85, 'dropout': 0.4534945031170905, 'learning_rate': 0.0031431982462929377, 'batch_size': 9826, 'optimizer_name': 'Adam'}. Best is trial 646 with value: 0.0017660508930683137.[0m
[32m[I 2022-11-08 01:32:51,856][0m Trial 737 finished with value: 0.0018754702755614501 and parameters: {'nlayers': 44, 'hidden_size': 102, 'dropout': 0.4227082033660853, 'learning_rate': 0.0011457600903110295, 'batch_size': 9493, 'optimizer_name': 'Adam'}. Best is trial 646 with value: 0.0017660508930683137.[0m
[32m[I 2022-11-08 01:33:12,749][0m Trial 738 finished with value: 0.001807283811205928 and parameters: {'nlayers': 9, 'hidden_size': 96, 'dropout': 0.16859183015779144, 'learning_rate': 0.00234904731998559, 'batch_size': 9818, 'optimizer_name': 'Adam'}. Best is trial 646 with value: 0.0017660508930683137.[0m
[32m[I 2022-11-08 01:33:46,668][0m Trial 739 finished with value: 0.0018009421303087057 and parameters: {'nlayers': 46, 'hidden_size': 109, 'dropout': 0.11174920280758589, 'learning_rate': 0.0076558622731574075, 'batch_size': 9823, 'optimizer_name': 'Adam'}. Best is trial 646 with value: 0.0017660508930683137.[0m
[32m[I 2022-11-08 01:34:25,051][0m Trial 740 finished with value: 0.0018401229566381884 and parameters: {'nlayers': 66, 'hidden_size': 90, 'dropout': 0.1003104527932276, 'learning_rate': 0.0009513511891992145, 'batch_size': 9675, 'optimizer_name': 'Adam'}. Best is trial 646 with value: 0.0017660508930683137.[0m
[32m[I 2022-11-08 01:34:48,229][0m Trial 741 finished with value: 0.0017713394595599878 and parameters: {'nlayers': 13, 'hidden_size': 102, 'dropout': 0.1611912458939379, 'learning_rate': 0.0026992984410939263, 'batch_size': 9995, 'optimizer_name': 'Adam'}. Best is trial 646 with value: 0.0017660508930683137.[0m
[32m[I 2022-11-08 01:35:10,220][0m Trial 742 finished with value: 0.0018772224797855889 and parameters: {'nlayers': 15, 'hidden_size': 111, 'dropout': 0.4989783163104507, 'learning_rate': 0.004550535016046015, 'batch_size': 9437, 'optimizer_name': 'Adam'}. Best is trial 646 with value: 0.0017660508930683137.[0m
[32m[I 2022-11-08 01:35:31,559][0m Trial 743 finished with value: 0.0018324432800359133 and parameters: {'nlayers': 11, 'hidden_size': 84, 'dropout': 0.47075707253696086, 'learning_rate': 0.001255937136504385, 'batch_size': 9686, 'optimizer_name': 'Adam'}. Best is trial 646 with value: 0.0017660508930683137.[0m
[32m[I 2022-11-08 01:35:53,325][0m Trial 744 finished with value: 0.001941367101572295 and parameters: {'nlayers': 13, 'hidden_size': 98, 'dropout': 0.15245766640468864, 'learning_rate': 0.0005304759607139382, 'batch_size': 9830, 'optimizer_name': 'SGD'}. Best is trial 646 with value: 0.0017660508930683137.[0m
[32m[I 2022-11-08 01:36:29,032][0m Trial 745 finished with value: 0.0017696688897443516 and parameters: {'nlayers': 49, 'hidden_size': 120, 'dropout': 0.38188191583999576, 'learning_rate': 0.002448895639643559, 'batch_size': 9999, 'optimizer_name': 'Adam'}. Best is trial 646 with value: 0.0017660508930683137.[0m
[32m[I 2022-11-08 01:37:02,063][0m Trial 746 finished with value: 0.0017719605952501297 and parameters: {'nlayers': 41, 'hidden_size': 120, 'dropout': 0.3861299852326326, 'learning_rate': 0.002212846335486763, 'batch_size': 10000, 'optimizer_name': 'Adam'}. Best is trial 646 with value: 0.0017660508930683137.[0m
[32m[I 2022-11-08 01:37:34,739][0m Trial 747 finished with value: 0.0018355142059512004 and parameters: {'nlayers': 46, 'hidden_size': 120, 'dropout': 0.3953841572001262, 'learning_rate': 0.0063866056571084805, 'batch_size': 9648, 'optimizer_name': 'Adam'}. Best is trial 646 with value: 0.0017660508930683137.[0m
[32m[I 2022-11-08 01:38:07,713][0m Trial 748 finished with value: 0.0019353337744449047 and parameters: {'nlayers': 48, 'hidden_size': 118, 'dropout': 0.45180862491670276, 'learning_rate': 0.002425688686509494, 'batch_size': 9165, 'optimizer_name': 'Adam'}. Best is trial 646 with value: 0.0017660508930683137.[0m
[32m[I 2022-11-08 01:38:42,387][0m Trial 749 finished with value: 0.001801106695533466 and parameters: {'nlayers': 44, 'hidden_size': 122, 'dropout': 0.37508534191486176, 'learning_rate': 0.0021495871221088314, 'batch_size': 9827, 'optimizer_name': 'Adam'}. Best is trial 646 with value: 0.0017660508930683137.[0m
[32m[I 2022-11-08 01:39:18,906][0m Trial 750 finished with value: 0.0017738303437190993 and parameters: {'nlayers': 47, 'hidden_size': 117, 'dropout': 0.41102688437988977, 'learning_rate': 0.002473207807901928, 'batch_size': 9996, 'optimizer_name': 'Adam'}. Best is trial 646 with value: 0.0017660508930683137.[0m
[32m[I 2022-11-08 01:39:54,467][0m Trial 751 finished with value: 0.0017746512373002256 and parameters: {'nlayers': 49, 'hidden_size': 109, 'dropout': 0.3346352667523739, 'learning_rate': 0.002040015956643042, 'batch_size': 9996, 'optimizer_name': 'Adam'}. Best is trial 646 with value: 0.0017660508930683137.[0m
[32m[I 2022-11-08 01:39:57,303][0m Trial 752 finished with value: 0.005955522427932857 and parameters: {'nlayers': 8, 'hidden_size': 124, 'dropout': 0.42883074447118164, 'learning_rate': 0.00235449416658223, 'batch_size': 2971, 'optimizer_name': 'Adam'}. Best is trial 646 with value: 0.0017660508930683137.[0m
[32m[I 2022-11-08 01:40:02,570][0m Trial 753 finished with value: 0.0050002314800130015 and parameters: {'nlayers': 17, 'hidden_size': 114, 'dropout': 0.4868866302156706, 'learning_rate': 0.0007518984317498362, 'batch_size': 3543, 'optimizer_name': 'Adam'}. Best is trial 646 with value: 0.0017660508930683137.[0m
[32m[I 2022-11-08 01:40:54,087][0m Trial 754 finished with value: 0.0018604057184721506 and parameters: {'nlayers': 43, 'hidden_size': 225, 'dropout': 0.14923060170329824, 'learning_rate': 0.0057390454835888165, 'batch_size': 9515, 'optimizer_name': 'Adam'}. Best is trial 646 with value: 0.0017660508930683137.[0m
[32m[I 2022-11-08 01:41:29,566][0m Trial 755 finished with value: 0.0018304306393444494 and parameters: {'nlayers': 45, 'hidden_size': 127, 'dropout': 0.41932575491841906, 'learning_rate': 0.0014822360584211057, 'batch_size': 9699, 'optimizer_name': 'Adam'}. Best is trial 646 with value: 0.0017660508930683137.[0m
[32m[I 2022-11-08 01:41:51,227][0m Trial 756 finished with value: 0.0018073372741762965 and parameters: {'nlayers': 10, 'hidden_size': 106, 'dropout': 0.3833427100733716, 'learning_rate': 0.0022343763866342703, 'batch_size': 9814, 'optimizer_name': 'Adam'}. Best is trial 646 with value: 0.0017660508930683137.[0m
[32m[I 2022-11-08 01:41:59,275][0m Trial 757 finished with value: 0.025432593992044186 and parameters: {'nlayers': 72, 'hidden_size': 135, 'dropout': 0.40584242459937697, 'learning_rate': 0.0003042022801883534, 'batch_size': 696, 'optimizer_name': 'Adam'}. Best is trial 646 with value: 0.0017660508930683137.[0m
[32m[I 2022-11-08 01:42:22,524][0m Trial 758 finished with value: 0.0018243697639835235 and parameters: {'nlayers': 16, 'hidden_size': 110, 'dropout': 0.47885629669308905, 'learning_rate': 0.0026115432943473807, 'batch_size': 9828, 'optimizer_name': 'SGD'}. Best is trial 646 with value: 0.0017660508930683137.[0m
