[32m[I 2022-11-08 04:15:19,504][0m Trial 1104 finished with value: 0.001801161895186532 and parameters: {'nlayers': 19, 'hidden_size': 143, 'dropout': 0.174484422868657, 'learning_rate': 0.0022846205236049994, 'batch_size': 9813, 'optimizer_name': 'Adam'}. Best is trial 899 with value: 0.0017655460917727903.[0m
[32m[I 2022-11-08 04:16:09,600][0m Trial 1105 finished with value: 0.0018453660824646553 and parameters: {'nlayers': 72, 'hidden_size': 160, 'dropout': 0.15056370516631537, 'learning_rate': 0.002467125187161188, 'batch_size': 9600, 'optimizer_name': 'Adam'}. Best is trial 899 with value: 0.0017655460917727903.[0m
[32m[I 2022-11-08 04:16:59,969][0m Trial 1106 finished with value: 0.0018088368211258848 and parameters: {'nlayers': 68, 'hidden_size': 145, 'dropout': 0.16141067793353095, 'learning_rate': 0.00209709401343286, 'batch_size': 9827, 'optimizer_name': 'Adam'}. Best is trial 899 with value: 0.0017655460917727903.[0m
[32m[I 2022-11-08 04:17:53,392][0m Trial 1107 finished with value: 0.0019229522482033042 and parameters: {'nlayers': 70, 'hidden_size': 166, 'dropout': 0.16814691838774115, 'learning_rate': 0.002620129915619443, 'batch_size': 9212, 'optimizer_name': 'Adam'}. Best is trial 899 with value: 0.0017655460917727903.[0m
[32m[I 2022-11-08 04:18:45,467][0m Trial 1108 finished with value: 0.001804888509521298 and parameters: {'nlayers': 76, 'hidden_size': 140, 'dropout': 0.14392542185530457, 'learning_rate': 0.0022572797324759497, 'batch_size': 9817, 'optimizer_name': 'Adam'}. Best is trial 899 with value: 0.0017655460917727903.[0m
[32m[I 2022-11-08 04:19:09,691][0m Trial 1109 finished with value: 0.003686366887107445 and parameters: {'nlayers': 76, 'hidden_size': 147, 'dropout': 0.15528221234060283, 'learning_rate': 0.0031531023678147167, 'batch_size': 4815, 'optimizer_name': 'Adam'}. Best is trial 899 with value: 0.0017655460917727903.[0m
[32m[I 2022-11-08 04:20:00,973][0m Trial 1110 finished with value: 0.0018658925240804375 and parameters: {'nlayers': 65, 'hidden_size': 162, 'dropout': 0.1841106412524375, 'learning_rate': 0.006599992072689353, 'batch_size': 9480, 'optimizer_name': 'Adam'}. Best is trial 899 with value: 0.0017655460917727903.[0m
[32m[I 2022-11-08 04:20:51,129][0m Trial 1111 finished with value: 0.0018364009931776172 and parameters: {'nlayers': 68, 'hidden_size': 149, 'dropout': 0.17729846447653394, 'learning_rate': 0.002410582039639374, 'batch_size': 9652, 'optimizer_name': 'Adam'}. Best is trial 899 with value: 0.0017655460917727903.[0m
[32m[I 2022-11-08 04:21:27,792][0m Trial 1112 finished with value: 0.001805418144422716 and parameters: {'nlayers': 32, 'hidden_size': 170, 'dropout': 0.13491748827077016, 'learning_rate': 0.0018752996432132515, 'batch_size': 9816, 'optimizer_name': 'Adam'}. Best is trial 899 with value: 0.0017655460917727903.[0m
[32m[I 2022-11-08 04:22:03,770][0m Trial 1113 finished with value: 0.001773995288128777 and parameters: {'nlayers': 17, 'hidden_size': 268, 'dropout': 0.15319108940186846, 'learning_rate': 0.0005000613700215836, 'batch_size': 9991, 'optimizer_name': 'Adam'}. Best is trial 899 with value: 0.0017655460917727903.[0m
[32m[I 2022-11-08 04:22:52,646][0m Trial 1114 finished with value: 0.001772043965760621 and parameters: {'nlayers': 66, 'hidden_size': 140, 'dropout': 0.16463539565413463, 'learning_rate': 0.0028501118871091273, 'batch_size': 9993, 'optimizer_name': 'Adam'}. Best is trial 899 with value: 0.0017655460917727903.[0m
[32m[I 2022-11-08 04:23:21,529][0m Trial 1115 finished with value: 0.001825073652623694 and parameters: {'nlayers': 23, 'hidden_size': 154, 'dropout': 0.1439417591698132, 'learning_rate': 0.0021565860044276174, 'batch_size': 9691, 'optimizer_name': 'Adam'}. Best is trial 899 with value: 0.0017655460917727903.[0m
[32m[I 2022-11-08 04:23:50,685][0m Trial 1116 finished with value: 0.0018011821011762903 and parameters: {'nlayers': 20, 'hidden_size': 161, 'dropout': 0.1741342700233491, 'learning_rate': 0.002656596291000688, 'batch_size': 9822, 'optimizer_name': 'Adam'}. Best is trial 899 with value: 0.0017655460917727903.[0m
[32m[I 2022-11-08 04:24:15,925][0m Trial 1117 finished with value: 0.001878693551738914 and parameters: {'nlayers': 17, 'hidden_size': 151, 'dropout': 0.15801201694737183, 'learning_rate': 0.002382166294063478, 'batch_size': 9458, 'optimizer_name': 'Adam'}. Best is trial 899 with value: 0.0017655460917727903.[0m
[32m[I 2022-11-08 04:24:38,745][0m Trial 1118 finished with value: 0.0018327648744787424 and parameters: {'nlayers': 24, 'hidden_size': 41, 'dropout': 0.14885105847075183, 'learning_rate': 0.006958179968890391, 'batch_size': 9663, 'optimizer_name': 'Adam'}. Best is trial 899 with value: 0.0017655460917727903.[0m
[32m[I 2022-11-08 04:25:06,277][0m Trial 1119 finished with value: 0.0017791309741651024 and parameters: {'nlayers': 15, 'hidden_size': 163, 'dropout': 0.1655386103555308, 'learning_rate': 0.00180553691537485, 'batch_size': 9996, 'optimizer_name': 'Adam'}. Best is trial 899 with value: 0.0017655460917727903.[0m
[32m[I 2022-11-08 04:25:58,207][0m Trial 1120 finished with value: 0.0018081784874745114 and parameters: {'nlayers': 78, 'hidden_size': 135, 'dropout': 0.12237065300135799, 'learning_rate': 0.00205198164884035, 'batch_size': 9801, 'optimizer_name': 'RMSprop'}. Best is trial 899 with value: 0.0017655460917727903.[0m
[32m[I 2022-11-08 04:27:17,668][0m Trial 1121 finished with value: 0.0017727616638583072 and parameters: {'nlayers': 94, 'hidden_size': 179, 'dropout': 0.1906313009641752, 'learning_rate': 0.003402770239286224, 'batch_size': 9998, 'optimizer_name': 'Adam'}. Best is trial 899 with value: 0.0017655460917727903.[0m
[32m[I 2022-11-08 04:27:43,930][0m Trial 1122 finished with value: 0.001774463419797362 and parameters: {'nlayers': 16, 'hidden_size': 142, 'dropout': 0.15476633946257407, 'learning_rate': 0.0025775664077410253, 'batch_size': 9995, 'optimizer_name': 'Adam'}. Best is trial 899 with value: 0.0017655460917727903.[0m
[32m[I 2022-11-08 04:28:37,825][0m Trial 1123 finished with value: 0.0018530845399288387 and parameters: {'nlayers': 72, 'hidden_size': 157, 'dropout': 0.16956296691847228, 'learning_rate': 0.002298881001976176, 'batch_size': 9574, 'optimizer_name': 'Adam'}. Best is trial 899 with value: 0.0017655460917727903.[0m
[32m[I 2022-11-08 04:29:06,052][0m Trial 1124 finished with value: 0.0017746368408203125 and parameters: {'nlayers': 19, 'hidden_size': 148, 'dropout': 0.13748158017957346, 'learning_rate': 0.002921429515455311, 'batch_size': 10000, 'optimizer_name': 'Adam'}. Best is trial 899 with value: 0.0017655460917727903.[0m
[32m[I 2022-11-08 04:29:21,521][0m Trial 1125 finished with value: 0.0022866234811315033 and parameters: {'nlayers': 22, 'hidden_size': 50, 'dropout': 0.18054130191724257, 'learning_rate': 0.0017306538521973858, 'batch_size': 7759, 'optimizer_name': 'Adam'}. Best is trial 899 with value: 0.0017655460917727903.[0m
[32m[I 2022-11-08 04:29:46,475][0m Trial 1126 finished with value: 0.0018843515534350212 and parameters: {'nlayers': 15, 'hidden_size': 167, 'dropout': 0.1310397754259413, 'learning_rate': 0.0024979866477978356, 'batch_size': 9400, 'optimizer_name': 'Adam'}. Best is trial 899 with value: 0.0017655460917727903.[0m
[32m[I 2022-11-08 04:30:35,360][0m Trial 1127 finished with value: 0.0018350831284030683 and parameters: {'nlayers': 69, 'hidden_size': 139, 'dropout': 0.16130818016166265, 'learning_rate': 0.0019887606158004484, 'batch_size': 9666, 'optimizer_name': 'Adam'}. Best is trial 899 with value: 0.0017655460917727903.[0m
[32m[I 2022-11-08 04:31:00,375][0m Trial 1128 finished with value: 0.001801048238288583 and parameters: {'nlayers': 18, 'hidden_size': 107, 'dropout': 0.17046686516066195, 'learning_rate': 0.002194075178733304, 'batch_size': 9838, 'optimizer_name': 'Adam'}. Best is trial 899 with value: 0.0017655460917727903.[0m
[32m[I 2022-11-08 04:31:29,500][0m Trial 1129 finished with value: 0.0019858610135557405 and parameters: {'nlayers': 21, 'hidden_size': 209, 'dropout': 0.14371378494882023, 'learning_rate': 0.0027736826109108215, 'batch_size': 8920, 'optimizer_name': 'Adam'}. Best is trial 899 with value: 0.0017655460917727903.[0m
[32m[I 2022-11-08 04:31:53,103][0m Trial 1130 finished with value: 0.0018347691352653247 and parameters: {'nlayers': 25, 'hidden_size': 58, 'dropout': 0.15017366244681535, 'learning_rate': 0.0025105991153289912, 'batch_size': 9667, 'optimizer_name': 'Adam'}. Best is trial 899 with value: 0.0017655460917727903.[0m
[32m[I 2022-11-08 04:32:25,278][0m Trial 1131 finished with value: 0.0018242660360034183 and parameters: {'nlayers': 16, 'hidden_size': 241, 'dropout': 0.1598145653918781, 'learning_rate': 0.003922067180206155, 'batch_size': 9817, 'optimizer_name': 'Adam'}. Best is trial 899 with value: 0.0017655460917727903.[0m
[32m[I 2022-11-08 04:32:51,170][0m Trial 1132 finished with value: 0.0018030000915964142 and parameters: {'nlayers': 13, 'hidden_size': 170, 'dropout': 0.11472961917907125, 'learning_rate': 0.0020556643132107416, 'batch_size': 9825, 'optimizer_name': 'Adam'}. Best is trial 899 with value: 0.0017655460917727903.[0m
[32m[I 2022-11-08 04:33:20,306][0m Trial 1133 finished with value: 0.0019180652683752364 and parameters: {'nlayers': 19, 'hidden_size': 193, 'dropout': 0.15203642878870294, 'learning_rate': 0.0051231911651497515, 'batch_size': 9253, 'optimizer_name': 'Adam'}. Best is trial 899 with value: 0.0017655460917727903.[0m
[32m[I 2022-11-08 04:33:41,601][0m Trial 1134 finished with value: 0.0018628115416149556 and parameters: {'nlayers': 14, 'hidden_size': 104, 'dropout': 0.17193191829229287, 'learning_rate': 0.0023157155051386153, 'batch_size': 9513, 'optimizer_name': 'Adam'}. Best is trial 899 with value: 0.0017655460917727903.[0m
[32m[I 2022-11-08 04:34:13,451][0m Trial 1135 finished with value: 0.0018289660726872549 and parameters: {'nlayers': 22, 'hidden_size': 186, 'dropout': 0.16034673907610322, 'learning_rate': 0.0017759985992349735, 'batch_size': 9686, 'optimizer_name': 'Adam'}. Best is trial 899 with value: 0.0017655460917727903.[0m
[32m[I 2022-11-08 04:34:37,341][0m Trial 1136 finished with value: 0.0018092941287626235 and parameters: {'nlayers': 17, 'hidden_size': 100, 'dropout': 0.126835745571929, 'learning_rate': 0.003111421979442873, 'batch_size': 9823, 'optimizer_name': 'Adam'}. Best is trial 899 with value: 0.0017655460917727903.[0m
[32m[I 2022-11-08 04:34:59,410][0m Trial 1137 finished with value: 0.0018065314102328031 and parameters: {'nlayers': 20, 'hidden_size': 12, 'dropout': 0.13905550912901363, 'learning_rate': 0.002648097980663002, 'batch_size': 9833, 'optimizer_name': 'Adam'}. Best is trial 899 with value: 0.0017655460917727903.[0m
[32m[I 2022-11-08 04:36:39,523][0m Trial 1138 finished with value: 0.0017670529539368543 and parameters: {'nlayers': 74, 'hidden_size': 284, 'dropout': 0.18032892044673465, 'learning_rate': 0.007210519588777583, 'batch_size': 9996, 'optimizer_name': 'Adam'}. Best is trial 899 with value: 0.0017655460917727903.[0m
[32m[I 2022-11-08 04:38:02,421][0m Trial 1139 finished with value: 0.0018561170868277674 and parameters: {'nlayers': 74, 'hidden_size': 256, 'dropout': 0.1098264731465683, 'learning_rate': 0.00779014989425407, 'batch_size': 9554, 'optimizer_name': 'Adam'}. Best is trial 899 with value: 0.0017655460917727903.[0m
[32m[I 2022-11-08 04:38:48,337][0m Trial 1140 finished with value: 0.0018355121599478717 and parameters: {'nlayers': 77, 'hidden_size': 136, 'dropout': 0.18704569625592188, 'learning_rate': 0.007245963084915718, 'batch_size': 9668, 'optimizer_name': 'RMSprop'}. Best is trial 899 with value: 0.0017655460917727903.[0m
[32m[I 2022-11-08 04:40:27,833][0m Trial 1141 finished with value: 0.0018069603140873725 and parameters: {'nlayers': 78, 'hidden_size': 280, 'dropout': 0.17633118885035584, 'learning_rate': 0.007172268336685763, 'batch_size': 9820, 'optimizer_name': 'Adam'}. Best is trial 899 with value: 0.0017655460917727903.[0m
[32m[I 2022-11-08 04:41:49,300][0m Trial 1142 finished with value: 0.0018805677315284466 and parameters: {'nlayers': 63, 'hidden_size': 275, 'dropout': 0.1984686899399672, 'learning_rate': 0.007431861453186555, 'batch_size': 9425, 'optimizer_name': 'Adam'}. Best is trial 899 with value: 0.0017655460917727903.[0m
[32m[I 2022-11-08 04:43:34,979][0m Trial 1143 finished with value: 0.001801720819040396 and parameters: {'nlayers': 74, 'hidden_size': 299, 'dropout': 0.18257533208541246, 'learning_rate': 0.006082849466942277, 'batch_size': 9826, 'optimizer_name': 'Adam'}. Best is trial 899 with value: 0.0017655460917727903.[0m
[32m[I 2022-11-08 04:45:27,156][0m Trial 1144 finished with value: 0.0017767604736759401 and parameters: {'nlayers': 79, 'hidden_size': 298, 'dropout': 0.15360410806143637, 'learning_rate': 0.007577642435367843, 'batch_size': 9995, 'optimizer_name': 'Adam'}. Best is trial 899 with value: 0.0017655460917727903.[0m
[32m[I 2022-11-08 04:46:22,876][0m Trial 1145 finished with value: 0.001830014628745553 and parameters: {'nlayers': 73, 'hidden_size': 157, 'dropout': 0.4570218464511509, 'learning_rate': 0.007886674473492878, 'batch_size': 9653, 'optimizer_name': 'Adam'}. Best is trial 899 with value: 0.0017655460917727903.[0m
[32m[I 2022-11-08 04:47:26,570][0m Trial 1146 finished with value: 0.001801995966884229 and parameters: {'nlayers': 74, 'hidden_size': 175, 'dropout': 0.1468703542971717, 'learning_rate': 0.007466438238085421, 'batch_size': 9823, 'optimizer_name': 'Adam'}. Best is trial 899 with value: 0.0017655460917727903.[0m
[32m[I 2022-11-08 04:48:17,375][0m Trial 1147 finished with value: 0.004129086029075336 and parameters: {'nlayers': 81, 'hidden_size': 292, 'dropout': 0.10011441331670559, 'learning_rate': 0.0070327073244044235, 'batch_size': 4304, 'optimizer_name': 'Adam'}. Best is trial 899 with value: 0.0017655460917727903.[0m
[32m[I 2022-11-08 04:48:51,916][0m Trial 1148 finished with value: 0.0019015784043047398 and parameters: {'nlayers': 40, 'hidden_size': 147, 'dropout': 0.19334307829462974, 'learning_rate': 0.006515453523196789, 'batch_size': 9307, 'optimizer_name': 'Adam'}. Best is trial 899 with value: 0.0017655460917727903.[0m
[32m[I 2022-11-08 04:50:32,037][0m Trial 1149 finished with value: 0.0017734854715923043 and parameters: {'nlayers': 83, 'hidden_size': 259, 'dropout': 0.16391163481994178, 'learning_rate': 0.007257163751319473, 'batch_size': 9998, 'optimizer_name': 'Adam'}. Best is trial 899 with value: 0.0017655460917727903.[0m
[32m[I 2022-11-08 04:51:52,579][0m Trial 1150 finished with value: 0.001859653839360425 and parameters: {'nlayers': 65, 'hidden_size': 268, 'dropout': 0.11874447345512075, 'learning_rate': 0.007613408391244664, 'batch_size': 9556, 'optimizer_name': 'Adam'}. Best is trial 899 with value: 0.0017655460917727903.[0m
[32m[I 2022-11-08 04:52:41,077][0m Trial 1151 finished with value: 0.0017693680136528004 and parameters: {'nlayers': 68, 'hidden_size': 152, 'dropout': 0.12894344716638698, 'learning_rate': 0.007420803266470789, 'batch_size': 9993, 'optimizer_name': 'Adam'}. Best is trial 899 with value: 0.0017655460917727903.[0m
[32m[I 2022-11-08 04:53:38,926][0m Trial 1152 finished with value: 0.0017722171134229444 and parameters: {'nlayers': 74, 'hidden_size': 161, 'dropout': 0.17808868627258984, 'learning_rate': 0.00694781471809993, 'batch_size': 9997, 'optimizer_name': 'Adam'}. Best is trial 899 with value: 0.0017655460917727903.[0m
[32m[I 2022-11-08 04:55:18,203][0m Trial 1153 finished with value: 0.0018316595333138692 and parameters: {'nlayers': 80, 'hidden_size': 271, 'dropout': 0.13773970199735475, 'learning_rate': 0.007231863458724697, 'batch_size': 9700, 'optimizer_name': 'Adam'}. Best is trial 899 with value: 0.0017655460917727903.[0m
[32m[I 2022-11-08 04:55:47,498][0m Trial 1154 finished with value: 0.0018331033787532447 and parameters: {'nlayers': 14, 'hidden_size': 255, 'dropout': 0.15845365556005744, 'learning_rate': 0.0002919799092417797, 'batch_size': 9688, 'optimizer_name': 'Adam'}. Best is trial 899 with value: 0.0017655460917727903.[0m
[32m[I 2022-11-08 04:57:23,834][0m Trial 1155 finished with value: 0.0018124824647731705 and parameters: {'nlayers': 68, 'hidden_size': 293, 'dropout': 0.16696287562660175, 'learning_rate': 0.007228594355319144, 'batch_size': 9829, 'optimizer_name': 'Adam'}. Best is trial 899 with value: 0.0017655460917727903.[0m
[32m[I 2022-11-08 04:58:09,714][0m Trial 1156 finished with value: 0.001948541742535756 and parameters: {'nlayers': 69, 'hidden_size': 145, 'dropout': 0.1477107691103019, 'learning_rate': 0.007122644758227944, 'batch_size': 9106, 'optimizer_name': 'Adam'}. Best is trial 899 with value: 0.0017655460917727903.[0m
[32m[I 2022-11-08 04:58:33,794][0m Trial 1157 finished with value: 0.0018762937276358333 and parameters: {'nlayers': 12, 'hidden_size': 171, 'dropout': 0.16085049408976917, 'learning_rate': 0.006292349381923635, 'batch_size': 9460, 'optimizer_name': 'Adam'}. Best is trial 899 with value: 0.0017655460917727903.[0m
[32m[I 2022-11-08 05:00:12,500][0m Trial 1158 finished with value: 0.0017693749743873599 and parameters: {'nlayers': 73, 'hidden_size': 278, 'dropout': 0.21382583044019457, 'learning_rate': 0.0026476966237882088, 'batch_size': 9993, 'optimizer_name': 'Adam'}. Best is trial 899 with value: 0.0017655460917727903.[0m
[32m[I 2022-11-08 05:00:37,174][0m Trial 1159 finished with value: 0.0022069695661303323 and parameters: {'nlayers': 77, 'hidden_size': 64, 'dropout': 0.14382699981571728, 'learning_rate': 0.005509068590286379, 'batch_size': 8033, 'optimizer_name': 'Adam'}. Best is trial 899 with value: 0.0017655460917727903.[0m
[32m[I 2022-11-08 05:01:27,919][0m Trial 1160 finished with value: 0.0018108805346590986 and parameters: {'nlayers': 75, 'hidden_size': 134, 'dropout': 0.15327061281127044, 'learning_rate': 0.00674933537168112, 'batch_size': 9814, 'optimizer_name': 'Adam'}. Best is trial 899 with value: 0.0017655460917727903.[0m
[32m[I 2022-11-08 05:02:16,502][0m Trial 1161 finished with value: 0.0018340213558414981 and parameters: {'nlayers': 36, 'hidden_size': 242, 'dropout': 0.17851620851230257, 'learning_rate': 0.008462007307247811, 'batch_size': 9661, 'optimizer_name': 'RMSprop'}. Best is trial 899 with value: 0.0017655460917727903.[0m
[32m[I 2022-11-08 05:02:47,213][0m Trial 1162 finished with value: 0.001804341962530675 and parameters: {'nlayers': 14, 'hidden_size': 246, 'dropout': 0.17074789628038956, 'learning_rate': 0.00811647125855875, 'batch_size': 9824, 'optimizer_name': 'Adam'}. Best is trial 899 with value: 0.0017655460917727903.[0m
[32m[I 2022-11-08 05:03:13,623][0m Trial 1163 finished with value: 0.001859749932531668 and parameters: {'nlayers': 16, 'hidden_size': 166, 'dropout': 0.18579601051067954, 'learning_rate': 0.006881314941730351, 'batch_size': 9535, 'optimizer_name': 'Adam'}. Best is trial 899 with value: 0.0017655460917727903.[0m
[32m[I 2022-11-08 05:04:11,647][0m Trial 1164 finished with value: 0.001771943588149006 and parameters: {'nlayers': 76, 'hidden_size': 153, 'dropout': 0.131243860429368, 'learning_rate': 0.0029887890402667742, 'batch_size': 9994, 'optimizer_name': 'Adam'}. Best is trial 899 with value: 0.0017655460917727903.[0m
[32m[I 2022-11-08 05:05:38,568][0m Trial 1165 finished with value: 0.0017741219430037996 and parameters: {'nlayers': 63, 'hidden_size': 288, 'dropout': 0.20308048130152312, 'learning_rate': 0.0028029519744533723, 'batch_size': 9997, 'optimizer_name': 'Adam'}. Best is trial 899 with value: 0.0017655460917727903.[0m
[32m[I 2022-11-08 05:07:04,068][0m Trial 1166 finished with value: 0.0018291544000660677 and parameters: {'nlayers': 71, 'hidden_size': 261, 'dropout': 0.1642196554548488, 'learning_rate': 0.0006146244684016566, 'batch_size': 9682, 'optimizer_name': 'Adam'}. Best is trial 899 with value: 0.0017655460917727903.[0m
[32m[I 2022-11-08 05:07:40,974][0m Trial 1167 finished with value: 0.001797574342542076 and parameters: {'nlayers': 42, 'hidden_size': 141, 'dropout': 0.15276587299599978, 'learning_rate': 0.002460502795652899, 'batch_size': 9815, 'optimizer_name': 'Adam'}. Best is trial 899 with value: 0.0017655460917727903.[0m
[32m[I 2022-11-08 05:08:08,566][0m Trial 1168 finished with value: 0.001771796752910803 and parameters: {'nlayers': 13, 'hidden_size': 179, 'dropout': 0.12234801099378428, 'learning_rate': 0.0028233741831644723, 'batch_size': 9999, 'optimizer_name': 'Adam'}. Best is trial 899 with value: 0.0017655460917727903.[0m
[32m[I 2022-11-08 05:08:37,669][0m Trial 1169 finished with value: 0.0019092145563448814 and parameters: {'nlayers': 15, 'hidden_size': 236, 'dropout': 0.1414960200767559, 'learning_rate': 0.007394292563747144, 'batch_size': 9336, 'optimizer_name': 'Adam'}. Best is trial 899 with value: 0.0017655460917727903.[0m
[32m[I 2022-11-08 05:09:04,988][0m Trial 1170 finished with value: 0.0018596885672436127 and parameters: {'nlayers': 38, 'hidden_size': 69, 'dropout': 0.4588010448743083, 'learning_rate': 0.003278765283726335, 'batch_size': 9519, 'optimizer_name': 'Adam'}. Best is trial 899 with value: 0.0017655460917727903.[0m
[32m[I 2022-11-08 05:09:25,230][0m Trial 1171 finished with value: 0.002118354593870633 and parameters: {'nlayers': 17, 'hidden_size': 150, 'dropout': 0.1577052679288551, 'learning_rate': 0.0025217645596420993, 'batch_size': 8376, 'optimizer_name': 'Adam'}. Best is trial 899 with value: 0.0017655460917727903.[0m
[32m[I 2022-11-08 05:10:19,047][0m Trial 1172 finished with value: 0.0018064135736089663 and parameters: {'nlayers': 67, 'hidden_size': 157, 'dropout': 0.17249594568573534, 'learning_rate': 0.007703275838471021, 'batch_size': 9806, 'optimizer_name': 'Adam'}. Best is trial 899 with value: 0.0017655460917727903.[0m
