[32m[I 2022-11-08 02:46:19,930][0m Trial 897 finished with value: 0.001833667282636803 and parameters: {'nlayers': 19, 'hidden_size': 81, 'dropout': 0.4368519245817287, 'learning_rate': 0.002241192238344322, 'batch_size': 9653, 'optimizer_name': 'Adam'}. Best is trial 646 with value: 0.0017660508930683137.[0m
[32m[I 2022-11-08 02:46:46,084][0m Trial 898 finished with value: 0.0017779066327790357 and parameters: {'nlayers': 21, 'hidden_size': 91, 'dropout': 0.42126797944746525, 'learning_rate': 0.0023627157321876964, 'batch_size': 9989, 'optimizer_name': 'Adam'}. Best is trial 646 with value: 0.0017660508930683137.[0m
[32m[I 2022-11-08 02:47:09,857][0m Trial 899 finished with value: 0.0017655460917727903 and parameters: {'nlayers': 19, 'hidden_size': 72, 'dropout': 0.43059755542716827, 'learning_rate': 0.0025960116862173864, 'batch_size': 9998, 'optimizer_name': 'Adam'}. Best is trial 899 with value: 0.0017655460917727903.[0m
[32m[I 2022-11-08 02:47:34,131][0m Trial 900 finished with value: 0.0018372550864522474 and parameters: {'nlayers': 21, 'hidden_size': 81, 'dropout': 0.44063502244725505, 'learning_rate': 0.002829559800397675, 'batch_size': 9653, 'optimizer_name': 'Adam'}. Best is trial 899 with value: 0.0017655460917727903.[0m
[32m[I 2022-11-08 02:47:57,737][0m Trial 901 finished with value: 0.0017716491978319675 and parameters: {'nlayers': 18, 'hidden_size': 54, 'dropout': 0.4259268715199823, 'learning_rate': 0.002676070376180369, 'batch_size': 9998, 'optimizer_name': 'Adam'}. Best is trial 899 with value: 0.0017655460917727903.[0m
[32m[I 2022-11-08 02:48:21,644][0m Trial 902 finished with value: 0.0018119554728758338 and parameters: {'nlayers': 19, 'hidden_size': 75, 'dropout': 0.42963460567055445, 'learning_rate': 0.0034816973907681207, 'batch_size': 9817, 'optimizer_name': 'Adam'}. Best is trial 899 with value: 0.0017655460917727903.[0m
[32m[I 2022-11-08 02:48:43,863][0m Trial 903 finished with value: 0.0018746617501991763 and parameters: {'nlayers': 19, 'hidden_size': 67, 'dropout': 0.4355352689625536, 'learning_rate': 0.0032121975972122254, 'batch_size': 9452, 'optimizer_name': 'Adam'}. Best is trial 899 with value: 0.0017655460917727903.[0m
[32m[I 2022-11-08 02:49:08,110][0m Trial 904 finished with value: 0.0018320982762534551 and parameters: {'nlayers': 21, 'hidden_size': 85, 'dropout': 0.41563974096383255, 'learning_rate': 0.002600556563202322, 'batch_size': 9690, 'optimizer_name': 'Adam'}. Best is trial 899 with value: 0.0017655460917727903.[0m
[32m[I 2022-11-08 02:49:25,116][0m Trial 905 finished with value: 0.002157441704167041 and parameters: {'nlayers': 18, 'hidden_size': 70, 'dropout': 0.4203587761595764, 'learning_rate': 0.002995938379403854, 'batch_size': 8218, 'optimizer_name': 'Adam'}. Best is trial 899 with value: 0.0017655460917727903.[0m
[32m[I 2022-11-08 02:49:48,029][0m Trial 906 finished with value: 0.0018099632952428707 and parameters: {'nlayers': 16, 'hidden_size': 73, 'dropout': 0.4420406682574421, 'learning_rate': 0.0021729694120641214, 'batch_size': 9817, 'optimizer_name': 'Adam'}. Best is trial 899 with value: 0.0017655460917727903.[0m
[32m[I 2022-11-08 02:50:12,791][0m Trial 907 finished with value: 0.001776514469986977 and parameters: {'nlayers': 22, 'hidden_size': 61, 'dropout': 0.4304098150272915, 'learning_rate': 0.0018901298163055786, 'batch_size': 9997, 'optimizer_name': 'Adam'}. Best is trial 899 with value: 0.0017655460917727903.[0m
[32m[I 2022-11-08 02:50:33,596][0m Trial 908 finished with value: 0.0019200782265628492 and parameters: {'nlayers': 16, 'hidden_size': 71, 'dropout': 0.431443761853457, 'learning_rate': 0.0028311508062314385, 'batch_size': 9219, 'optimizer_name': 'Adam'}. Best is trial 899 with value: 0.0017655460917727903.[0m
[32m[I 2022-11-08 02:50:53,646][0m Trial 909 finished with value: 0.0019449256051426837 and parameters: {'nlayers': 18, 'hidden_size': 56, 'dropout': 0.41229974447207063, 'learning_rate': 0.002467787213492832, 'batch_size': 9521, 'optimizer_name': 'SGD'}. Best is trial 899 with value: 0.0017655460917727903.[0m
[32m[I 2022-11-08 02:51:16,528][0m Trial 910 finished with value: 0.0018050996687312617 and parameters: {'nlayers': 16, 'hidden_size': 67, 'dropout': 0.42077471562797025, 'learning_rate': 0.0021934245603745365, 'batch_size': 9810, 'optimizer_name': 'Adam'}. Best is trial 899 with value: 0.0017655460917727903.[0m
[32m[I 2022-11-08 02:51:39,789][0m Trial 911 finished with value: 0.0018388043754347149 and parameters: {'nlayers': 20, 'hidden_size': 76, 'dropout': 0.42775965040582503, 'learning_rate': 0.0017175234062064438, 'batch_size': 9649, 'optimizer_name': 'Adam'}. Best is trial 899 with value: 0.0017655460917727903.[0m
[32m[I 2022-11-08 02:52:05,049][0m Trial 912 finished with value: 0.0017735154122114182 and parameters: {'nlayers': 17, 'hidden_size': 95, 'dropout': 0.4493711660065628, 'learning_rate': 0.002662264784435006, 'batch_size': 10000, 'optimizer_name': 'Adam'}. Best is trial 899 with value: 0.0017655460917727903.[0m
[32m[I 2022-11-08 02:52:30,497][0m Trial 913 finished with value: 0.0018010526573893446 and parameters: {'nlayers': 22, 'hidden_size': 87, 'dropout': 0.43877929472451477, 'learning_rate': 0.0031456710491749233, 'batch_size': 9822, 'optimizer_name': 'Adam'}. Best is trial 899 with value: 0.0017655460917727903.[0m
[32m[I 2022-11-08 02:52:52,472][0m Trial 914 finished with value: 0.001768170830416045 and parameters: {'nlayers': 15, 'hidden_size': 64, 'dropout': 0.4074464465607598, 'learning_rate': 0.006705815485705627, 'batch_size': 9998, 'optimizer_name': 'Adam'}. Best is trial 899 with value: 0.0017655460917727903.[0m
[32m[I 2022-11-08 02:53:13,468][0m Trial 915 finished with value: 0.0018702219156703896 and parameters: {'nlayers': 14, 'hidden_size': 63, 'dropout': 0.4100698511381238, 'learning_rate': 0.009500183171941994, 'batch_size': 9462, 'optimizer_name': 'Adam'}. Best is trial 899 with value: 0.0017655460917727903.[0m
[32m[I 2022-11-08 02:53:39,535][0m Trial 916 finished with value: 0.0018299471481734515 and parameters: {'nlayers': 34, 'hidden_size': 55, 'dropout': 0.40417654007187725, 'learning_rate': 0.007219788091743737, 'batch_size': 9702, 'optimizer_name': 'Adam'}. Best is trial 899 with value: 0.0017655460917727903.[0m
[32m[I 2022-11-08 02:53:52,681][0m Trial 917 finished with value: 0.002350905920253363 and parameters: {'nlayers': 16, 'hidden_size': 58, 'dropout': 0.4060055158551422, 'learning_rate': 0.007022772847697211, 'batch_size': 7547, 'optimizer_name': 'Adam'}. Best is trial 899 with value: 0.0017655460917727903.[0m
[32m[I 2022-11-08 02:54:11,491][0m Trial 918 finished with value: 0.002090000490168258 and parameters: {'nlayers': 20, 'hidden_size': 77, 'dropout': 0.42340262986365385, 'learning_rate': 0.0023245163022544628, 'batch_size': 8533, 'optimizer_name': 'Adam'}. Best is trial 899 with value: 0.0017655460917727903.[0m
[32m[I 2022-11-08 02:54:35,248][0m Trial 919 finished with value: 0.0017698242972704892 and parameters: {'nlayers': 17, 'hidden_size': 66, 'dropout': 0.41653544093808453, 'learning_rate': 0.001992984862888186, 'batch_size': 9997, 'optimizer_name': 'Adam'}. Best is trial 899 with value: 0.0017655460917727903.[0m
[32m[I 2022-11-08 02:54:57,394][0m Trial 920 finished with value: 0.0018301708481550905 and parameters: {'nlayers': 15, 'hidden_size': 78, 'dropout': 0.42047673724049045, 'learning_rate': 0.0074957256375438545, 'batch_size': 9692, 'optimizer_name': 'Adam'}. Best is trial 899 with value: 0.0017655460917727903.[0m
[32m[I 2022-11-08 02:55:07,713][0m Trial 921 finished with value: 0.0028103915717193687 and parameters: {'nlayers': 18, 'hidden_size': 74, 'dropout': 0.4289939662948939, 'learning_rate': 0.008843810319983011, 'batch_size': 6298, 'optimizer_name': 'Adam'}. Best is trial 899 with value: 0.0017655460917727903.[0m
[32m[I 2022-11-08 02:55:29,815][0m Trial 922 finished with value: 0.0018125485633780484 and parameters: {'nlayers': 14, 'hidden_size': 62, 'dropout': 0.41665377527916736, 'learning_rate': 0.007963888791318003, 'batch_size': 9809, 'optimizer_name': 'Adam'}. Best is trial 899 with value: 0.0017655460917727903.[0m
[32m[I 2022-11-08 02:55:51,973][0m Trial 923 finished with value: 0.0018650073940655598 and parameters: {'nlayers': 20, 'hidden_size': 60, 'dropout': 0.4102742486540263, 'learning_rate': 0.0016455498344635604, 'batch_size': 9504, 'optimizer_name': 'Adam'}. Best is trial 899 with value: 0.0017655460917727903.[0m
[32m[I 2022-11-08 02:55:54,931][0m Trial 924 finished with value: 0.006538053949673971 and parameters: {'nlayers': 15, 'hidden_size': 47, 'dropout': 0.4135007286374289, 'learning_rate': 0.008538155245935429, 'batch_size': 2700, 'optimizer_name': 'Adam'}. Best is trial 899 with value: 0.0017655460917727903.[0m
[32m[I 2022-11-08 02:56:18,322][0m Trial 925 finished with value: 0.0017979454206672864 and parameters: {'nlayers': 17, 'hidden_size': 77, 'dropout': 0.39910302345222287, 'learning_rate': 0.006016138535417225, 'batch_size': 9824, 'optimizer_name': 'Adam'}. Best is trial 899 with value: 0.0017655460917727903.[0m
[32m[I 2022-11-08 02:56:41,288][0m Trial 926 finished with value: 0.0017750660250453103 and parameters: {'nlayers': 13, 'hidden_size': 73, 'dropout': 0.4211657765458703, 'learning_rate': 0.006623613682410901, 'batch_size': 9996, 'optimizer_name': 'Adam'}. Best is trial 899 with value: 0.0017655460917727903.[0m
[32m[I 2022-11-08 02:57:05,562][0m Trial 927 finished with value: 0.0017663455328973297 and parameters: {'nlayers': 19, 'hidden_size': 61, 'dropout': 0.4323441329269363, 'learning_rate': 0.006728706177625873, 'batch_size': 9999, 'optimizer_name': 'Adam'}. Best is trial 899 with value: 0.0017655460917727903.[0m
[32m[I 2022-11-08 02:57:27,773][0m Trial 928 finished with value: 0.0019073094192304108 and parameters: {'nlayers': 20, 'hidden_size': 67, 'dropout': 0.43719761909451277, 'learning_rate': 0.006718657669853828, 'batch_size': 9291, 'optimizer_name': 'Adam'}. Best is trial 899 with value: 0.0017655460917727903.[0m
[32m[I 2022-11-08 02:57:50,101][0m Trial 929 finished with value: 0.001843881203678806 and parameters: {'nlayers': 22, 'hidden_size': 37, 'dropout': 0.43173735920371714, 'learning_rate': 0.006430361767093977, 'batch_size': 9649, 'optimizer_name': 'Adam'}. Best is trial 899 with value: 0.0017655460917727903.[0m
[32m[I 2022-11-08 02:58:12,326][0m Trial 930 finished with value: 0.001817330736372836 and parameters: {'nlayers': 19, 'hidden_size': 46, 'dropout': 0.43522486028423035, 'learning_rate': 0.006700877320460127, 'batch_size': 9754, 'optimizer_name': 'RMSprop'}. Best is trial 899 with value: 0.0017655460917727903.[0m
[32m[I 2022-11-08 02:58:24,456][0m Trial 931 finished with value: 0.0026809456997273023 and parameters: {'nlayers': 24, 'hidden_size': 54, 'dropout': 0.4285271351007397, 'learning_rate': 0.006936019331561119, 'batch_size': 6603, 'optimizer_name': 'Adam'}. Best is trial 899 with value: 0.0017655460917727903.[0m
[32m[I 2022-11-08 02:58:48,350][0m Trial 932 finished with value: 0.0018040622788402824 and parameters: {'nlayers': 21, 'hidden_size': 62, 'dropout': 0.4221226473071102, 'learning_rate': 0.006126715547619492, 'batch_size': 9812, 'optimizer_name': 'Adam'}. Best is trial 899 with value: 0.0017655460917727903.[0m
[32m[I 2022-11-08 02:59:11,347][0m Trial 933 finished with value: 0.001861414762323808 and parameters: {'nlayers': 23, 'hidden_size': 59, 'dropout': 0.4354368804321438, 'learning_rate': 0.007102220273975751, 'batch_size': 9518, 'optimizer_name': 'Adam'}. Best is trial 899 with value: 0.0017655460917727903.[0m
[32m[I 2022-11-08 02:59:34,624][0m Trial 934 finished with value: 0.0018017242109428426 and parameters: {'nlayers': 19, 'hidden_size': 54, 'dropout': 0.4453817128492234, 'learning_rate': 0.006741576178854455, 'batch_size': 9822, 'optimizer_name': 'Adam'}. Best is trial 899 with value: 0.0017655460917727903.[0m
[32m[I 2022-11-08 02:59:56,292][0m Trial 935 finished with value: 0.0018321045890313146 and parameters: {'nlayers': 17, 'hidden_size': 44, 'dropout': 0.42602837085517364, 'learning_rate': 0.0062562702152152115, 'batch_size': 9657, 'optimizer_name': 'Adam'}. Best is trial 899 with value: 0.0017655460917727903.[0m
[32m[I 2022-11-08 03:00:22,400][0m Trial 936 finished with value: 0.0018031525129597935 and parameters: {'nlayers': 32, 'hidden_size': 54, 'dropout': 0.4406272555829221, 'learning_rate': 0.0068384301212480935, 'batch_size': 9813, 'optimizer_name': 'Adam'}. Best is trial 899 with value: 0.0017655460917727903.[0m
[32m[I 2022-11-08 03:00:24,756][0m Trial 937 finished with value: 0.007388151961964367 and parameters: {'nlayers': 13, 'hidden_size': 49, 'dropout': 0.40967740351982085, 'learning_rate': 0.007142832021195707, 'batch_size': 2403, 'optimizer_name': 'Adam'}. Best is trial 899 with value: 0.0017655460917727903.[0m
[32m[I 2022-11-08 03:00:44,589][0m Trial 938 finished with value: 0.0018874738342805398 and parameters: {'nlayers': 19, 'hidden_size': 48, 'dropout': 0.4186303223382184, 'learning_rate': 0.002531552648477249, 'batch_size': 9393, 'optimizer_name': 'Adam'}. Best is trial 899 with value: 0.0017655460917727903.[0m
[32m[I 2022-11-08 03:01:07,188][0m Trial 939 finished with value: 0.0018116525131106243 and parameters: {'nlayers': 15, 'hidden_size': 70, 'dropout': 0.44206967826875915, 'learning_rate': 0.006638023850744808, 'batch_size': 9813, 'optimizer_name': 'Adam'}. Best is trial 899 with value: 0.0017655460917727903.[0m
[32m[I 2022-11-08 03:01:31,926][0m Trial 940 finished with value: 0.0017795678637090489 and parameters: {'nlayers': 22, 'hidden_size': 61, 'dropout': 0.4314096946345665, 'learning_rate': 0.006905584031883091, 'batch_size': 9993, 'optimizer_name': 'Adam'}. Best is trial 899 with value: 0.0017655460917727903.[0m
[32m[I 2022-11-08 03:01:52,462][0m Trial 941 finished with value: 0.001855006321968828 and parameters: {'nlayers': 17, 'hidden_size': 64, 'dropout': 0.4290886754226526, 'learning_rate': 0.007600832031915443, 'batch_size': 9570, 'optimizer_name': 'Adam'}. Best is trial 899 with value: 0.0017655460917727903.[0m
[32m[I 2022-11-08 03:02:14,272][0m Trial 942 finished with value: 0.0018032952935380004 and parameters: {'nlayers': 12, 'hidden_size': 69, 'dropout': 0.40499337662988727, 'learning_rate': 0.0077304167546014615, 'batch_size': 9827, 'optimizer_name': 'Adam'}. Best is trial 899 with value: 0.0017655460917727903.[0m
[32m[I 2022-11-08 03:02:37,482][0m Trial 943 finished with value: 0.0017706013933540953 and parameters: {'nlayers': 14, 'hidden_size': 65, 'dropout': 0.3973581883565876, 'learning_rate': 0.009250344401044662, 'batch_size': 9999, 'optimizer_name': 'Adam'}. Best is trial 899 with value: 0.0017655460917727903.[0m
[32m[I 2022-11-08 03:03:01,666][0m Trial 944 finished with value: 0.0017716248720884324 and parameters: {'nlayers': 19, 'hidden_size': 62, 'dropout': 0.4264462516837367, 'learning_rate': 0.0021657859204294986, 'batch_size': 10000, 'optimizer_name': 'Adam'}. Best is trial 899 with value: 0.0017655460917727903.[0m
[32m[I 2022-11-08 03:03:22,723][0m Trial 945 finished with value: 0.0018352791883391464 and parameters: {'nlayers': 12, 'hidden_size': 69, 'dropout': 0.41608188046317446, 'learning_rate': 0.006455883810511641, 'batch_size': 9640, 'optimizer_name': 'Adam'}. Best is trial 899 with value: 0.0017655460917727903.[0m
[32m[I 2022-11-08 03:03:45,077][0m Trial 946 finished with value: 0.001796810511185188 and parameters: {'nlayers': 16, 'hidden_size': 59, 'dropout': 0.4155923547670491, 'learning_rate': 0.0023919673301011613, 'batch_size': 9821, 'optimizer_name': 'Adam'}. Best is trial 899 with value: 0.0017655460917727903.[0m
[32m[I 2022-11-08 03:04:10,697][0m Trial 947 finished with value: 0.0018597682014959423 and parameters: {'nlayers': 30, 'hidden_size': 65, 'dropout': 0.44720924365329423, 'learning_rate': 0.008195924891847606, 'batch_size': 9535, 'optimizer_name': 'Adam'}. Best is trial 899 with value: 0.0017655460917727903.[0m
[32m[I 2022-11-08 03:04:35,654][0m Trial 948 finished with value: 0.0017743350983620166 and parameters: {'nlayers': 21, 'hidden_size': 69, 'dropout': 0.4343168209734048, 'learning_rate': 0.0070688693552701624, 'batch_size': 9995, 'optimizer_name': 'Adam'}. Best is trial 899 with value: 0.0017655460917727903.[0m
[32m[I 2022-11-08 03:05:02,027][0m Trial 949 finished with value: 0.0018318800195570915 and parameters: {'nlayers': 37, 'hidden_size': 51, 'dropout': 0.42490482844205757, 'learning_rate': 0.0020075702366985225, 'batch_size': 9672, 'optimizer_name': 'Adam'}. Best is trial 899 with value: 0.0017655460917727903.[0m
[32m[I 2022-11-08 03:05:33,275][0m Trial 950 finished with value: 0.001917485050476993 and parameters: {'nlayers': 25, 'hidden_size': 179, 'dropout': 0.40761712886354456, 'learning_rate': 0.006223192166028481, 'batch_size': 9233, 'optimizer_name': 'Adam'}. Best is trial 899 with value: 0.0017655460917727903.[0m
[32m[I 2022-11-08 03:06:01,975][0m Trial 951 finished with value: 0.001797723566551476 and parameters: {'nlayers': 14, 'hidden_size': 204, 'dropout': 0.39980072149382834, 'learning_rate': 0.00267613526012971, 'batch_size': 9837, 'optimizer_name': 'Adam'}. Best is trial 899 with value: 0.0017655460917727903.[0m
[32m[I 2022-11-08 03:06:25,209][0m Trial 952 finished with value: 0.0018324160434097638 and parameters: {'nlayers': 18, 'hidden_size': 83, 'dropout': 0.42223236922726537, 'learning_rate': 0.0022967357821414994, 'batch_size': 9670, 'optimizer_name': 'RMSprop'}. Best is trial 899 with value: 0.0017655460917727903.[0m
[32m[I 2022-11-08 03:06:51,197][0m Trial 953 finished with value: 0.0018070978023369782 and parameters: {'nlayers': 11, 'hidden_size': 198, 'dropout': 0.4377302905127536, 'learning_rate': 0.009138352059714966, 'batch_size': 9820, 'optimizer_name': 'Adam'}. Best is trial 899 with value: 0.0017655460917727903.[0m
[32m[I 2022-11-08 03:07:12,894][0m Trial 954 finished with value: 0.001878516395000895 and parameters: {'nlayers': 16, 'hidden_size': 73, 'dropout': 0.4438354673946512, 'learning_rate': 0.0019449537622125465, 'batch_size': 9420, 'optimizer_name': 'Adam'}. Best is trial 899 with value: 0.0017655460917727903.[0m
[32m[I 2022-11-08 03:08:05,990][0m Trial 955 finished with value: 0.00200167705982294 and parameters: {'nlayers': 87, 'hidden_size': 147, 'dropout': 0.41496454507128033, 'learning_rate': 0.002971148667569221, 'batch_size': 8853, 'optimizer_name': 'Adam'}. Best is trial 899 with value: 0.0017655460917727903.[0m
[32m[I 2022-11-08 03:08:27,665][0m Trial 956 finished with value: 0.0017991454128383462 and parameters: {'nlayers': 13, 'hidden_size': 59, 'dropout': 0.4285190310281785, 'learning_rate': 0.006563409876035407, 'batch_size': 9821, 'optimizer_name': 'Adam'}. Best is trial 899 with value: 0.0017655460917727903.[0m
[32m[I 2022-11-08 03:08:50,790][0m Trial 957 finished with value: 0.0018352445703043077 and parameters: {'nlayers': 20, 'hidden_size': 88, 'dropout': 0.4311192173026242, 'learning_rate': 0.006455842058689984, 'batch_size': 9648, 'optimizer_name': 'Adam'}. Best is trial 899 with value: 0.0017655460917727903.[0m
[32m[I 2022-11-08 03:09:19,956][0m Trial 958 finished with value: 0.0019511430831445377 and parameters: {'nlayers': 23, 'hidden_size': 192, 'dropout': 0.4194633473203031, 'learning_rate': 0.006921825601217826, 'batch_size': 9072, 'optimizer_name': 'Adam'}. Best is trial 899 with value: 0.0017655460917727903.[0m
[32m[I 2022-11-08 03:09:43,112][0m Trial 959 finished with value: 0.0017978717997381257 and parameters: {'nlayers': 15, 'hidden_size': 82, 'dropout': 0.4069830109052385, 'learning_rate': 0.002181424332230048, 'batch_size': 9851, 'optimizer_name': 'Adam'}. Best is trial 899 with value: 0.0017655460917727903.[0m
[32m[I 2022-11-08 03:10:08,741][0m Trial 960 finished with value: 0.0018761898347576425 and parameters: {'nlayers': 11, 'hidden_size': 219, 'dropout': 0.3927705367408408, 'learning_rate': 0.0027813720647786614, 'batch_size': 9448, 'optimizer_name': 'Adam'}. Best is trial 899 with value: 0.0017655460917727903.[0m
[32m[I 2022-11-08 03:10:38,314][0m Trial 961 finished with value: 0.0017754619123936891 and parameters: {'nlayers': 17, 'hidden_size': 175, 'dropout': 0.43906565504116263, 'learning_rate': 0.0018581573102518217, 'batch_size': 9995, 'optimizer_name': 'Adam'}. Best is trial 899 with value: 0.0017655460917727903.[0m
[32m[I 2022-11-08 03:10:51,187][0m Trial 962 finished with value: 0.0024426376556346465 and parameters: {'nlayers': 18, 'hidden_size': 96, 'dropout': 0.42385899379466524, 'learning_rate': 0.002478949277368879, 'batch_size': 7245, 'optimizer_name': 'Adam'}. Best is trial 899 with value: 0.0017655460917727903.[0m
[32m[I 2022-11-08 03:11:13,574][0m Trial 963 finished with value: 0.0018247304343634826 and parameters: {'nlayers': 13, 'hidden_size': 95, 'dropout': 0.4457847048408975, 'learning_rate': 0.002172767132766569, 'batch_size': 9670, 'optimizer_name': 'Adam'}. Best is trial 899 with value: 0.0017655460917727903.[0m
[32m[I 2022-11-08 03:11:37,590][0m Trial 964 finished with value: 0.0018022172232555807 and parameters: {'nlayers': 11, 'hidden_size': 148, 'dropout': 0.12511502863690882, 'learning_rate': 0.002581362718889368, 'batch_size': 9833, 'optimizer_name': 'Adam'}. Best is trial 899 with value: 0.0017655460917727903.[0m
[32m[I 2022-11-08 03:12:00,982][0m Trial 965 finished with value: 0.001775371862417611 and parameters: {'nlayers': 15, 'hidden_size': 66, 'dropout': 0.41369792504774305, 'learning_rate': 0.0023948534234450734, 'batch_size': 9986, 'optimizer_name': 'Adam'}. Best is trial 899 with value: 0.0017655460917727903.[0m
