[32m[I 2022-11-08 08:07:35,798][0m Trial 1518 finished with value: 0.001803334154727275 and parameters: {'nlayers': 7, 'hidden_size': 5, 'dropout': 0.38557834533035085, 'learning_rate': 0.0017521407960300252, 'batch_size': 9807, 'optimizer_name': 'Adam'}. Best is trial 899 with value: 0.0017655460917727903.[0m
[32m[I 2022-11-08 08:07:54,433][0m Trial 1519 finished with value: 0.0018537054973893736 and parameters: {'nlayers': 4, 'hidden_size': 58, 'dropout': 0.3843598600505479, 'learning_rate': 0.0019213079761293667, 'batch_size': 9555, 'optimizer_name': 'Adam'}. Best is trial 899 with value: 0.0017655460917727903.[0m
[32m[I 2022-11-08 08:08:15,212][0m Trial 1520 finished with value: 0.0018006555721650796 and parameters: {'nlayers': 6, 'hidden_size': 122, 'dropout': 0.37323885689310726, 'learning_rate': 0.001647290304269544, 'batch_size': 9821, 'optimizer_name': 'Adam'}. Best is trial 899 with value: 0.0017655460917727903.[0m
[32m[I 2022-11-08 08:08:35,719][0m Trial 1521 finished with value: 0.0018434086806793926 and parameters: {'nlayers': 9, 'hidden_size': 84, 'dropout': 0.38881877810303783, 'learning_rate': 0.0018922754772421712, 'batch_size': 9640, 'optimizer_name': 'Adam'}. Best is trial 899 with value: 0.0017655460917727903.[0m
[32m[I 2022-11-08 08:09:05,808][0m Trial 1522 finished with value: 0.0018091071414159832 and parameters: {'nlayers': 29, 'hidden_size': 136, 'dropout': 0.34583821107257656, 'learning_rate': 0.0015451351965094125, 'batch_size': 9807, 'optimizer_name': 'Adam'}. Best is trial 899 with value: 0.0017655460917727903.[0m
[32m[I 2022-11-08 08:09:25,133][0m Trial 1523 finished with value: 0.0019047065890914435 and parameters: {'nlayers': 10, 'hidden_size': 73, 'dropout': 0.36050571895388256, 'learning_rate': 0.0006377900274773334, 'batch_size': 9335, 'optimizer_name': 'Adam'}. Best is trial 899 with value: 0.0017655460917727903.[0m
[32m[I 2022-11-08 08:09:51,209][0m Trial 1524 finished with value: 0.0017991832038496644 and parameters: {'nlayers': 47, 'hidden_size': 20, 'dropout': 0.3597150314914191, 'learning_rate': 0.0009568343831992223, 'batch_size': 9827, 'optimizer_name': 'Adam'}. Best is trial 899 with value: 0.0017655460917727903.[0m
[32m[I 2022-11-08 08:10:19,782][0m Trial 1525 finished with value: 0.0017786123453437603 and parameters: {'nlayers': 34, 'hidden_size': 104, 'dropout': 0.3902836530700341, 'learning_rate': 0.0046726519433370976, 'batch_size': 9994, 'optimizer_name': 'RMSprop'}. Best is trial 899 with value: 0.0017655460917727903.[0m
[32m[I 2022-11-08 08:11:41,792][0m Trial 1526 finished with value: 0.0017747717925821202 and parameters: {'nlayers': 67, 'hidden_size': 253, 'dropout': 0.3716702421549211, 'learning_rate': 0.0020354399230521772, 'batch_size': 9995, 'optimizer_name': 'Adam'}. Best is trial 899 with value: 0.0017655460917727903.[0m
[32m[I 2022-11-08 08:12:13,176][0m Trial 1527 finished with value: 0.0018352153642931927 and parameters: {'nlayers': 43, 'hidden_size': 91, 'dropout': 0.39981138702256747, 'learning_rate': 0.001268260918565336, 'batch_size': 9643, 'optimizer_name': 'Adam'}. Best is trial 899 with value: 0.0017655460917727903.[0m
[32m[I 2022-11-08 08:12:34,720][0m Trial 1528 finished with value: 0.0018579688598638407 and parameters: {'nlayers': 9, 'hidden_size': 130, 'dropout': 0.39714117502528756, 'learning_rate': 0.0020649539523842878, 'batch_size': 9547, 'optimizer_name': 'Adam'}. Best is trial 899 with value: 0.0017655460917727903.[0m
[32m[I 2022-11-08 08:13:11,949][0m Trial 1529 finished with value: 0.0018109571339159 and parameters: {'nlayers': 57, 'hidden_size': 99, 'dropout': 0.4188330276257653, 'learning_rate': 0.0020245419835847296, 'batch_size': 9804, 'optimizer_name': 'Adam'}. Best is trial 899 with value: 0.0017655460917727903.[0m
[32m[I 2022-11-08 08:13:41,748][0m Trial 1530 finished with value: 0.002155924630110145 and parameters: {'nlayers': 75, 'hidden_size': 65, 'dropout': 0.36508630810554027, 'learning_rate': 0.0018993047879729684, 'batch_size': 8243, 'optimizer_name': 'Adam'}. Best is trial 899 with value: 0.0017655460917727903.[0m
[32m[I 2022-11-08 08:14:02,688][0m Trial 1531 finished with value: 0.001807159148406866 and parameters: {'nlayers': 7, 'hidden_size': 109, 'dropout': 0.3803210359248103, 'learning_rate': 0.0007241478872650472, 'batch_size': 9826, 'optimizer_name': 'Adam'}. Best is trial 899 with value: 0.0017655460917727903.[0m
[32m[I 2022-11-08 08:14:24,633][0m Trial 1532 finished with value: 0.00187701549592002 and parameters: {'nlayers': 10, 'hidden_size': 141, 'dropout': 0.3548487674623266, 'learning_rate': 0.0016932031348314898, 'batch_size': 9464, 'optimizer_name': 'Adam'}. Best is trial 899 with value: 0.0017655460917727903.[0m
[32m[I 2022-11-08 08:14:55,137][0m Trial 1533 finished with value: 0.0017744186999143034 and parameters: {'nlayers': 39, 'hidden_size': 82, 'dropout': 0.3937941010227784, 'learning_rate': 0.002173629186558239, 'batch_size': 9995, 'optimizer_name': 'Adam'}. Best is trial 899 with value: 0.0017655460917727903.[0m
[32m[I 2022-11-08 08:15:31,450][0m Trial 1534 finished with value: 0.0018373935674288258 and parameters: {'nlayers': 41, 'hidden_size': 148, 'dropout': 0.1904451918053204, 'learning_rate': 0.007665007690618941, 'batch_size': 9660, 'optimizer_name': 'Adam'}. Best is trial 899 with value: 0.0017655460917727903.[0m
[32m[I 2022-11-08 08:16:12,469][0m Trial 1535 finished with value: 0.0018318069689649637 and parameters: {'nlayers': 62, 'hidden_size': 119, 'dropout': 0.4334024522037907, 'learning_rate': 0.006950495591621402, 'batch_size': 9675, 'optimizer_name': 'Adam'}. Best is trial 899 with value: 0.0017655460917727903.[0m
[32m[I 2022-11-08 08:16:31,749][0m Trial 1536 finished with value: 0.00180614008231656 and parameters: {'nlayers': 1, 'hidden_size': 113, 'dropout': 0.4144969910948802, 'learning_rate': 0.0017891797582402305, 'batch_size': 9837, 'optimizer_name': 'Adam'}. Best is trial 899 with value: 0.0017655460917727903.[0m
[32m[I 2022-11-08 08:16:58,535][0m Trial 1537 finished with value: 0.0018075640284938542 and parameters: {'nlayers': 45, 'hidden_size': 34, 'dropout': 0.17068084829502217, 'learning_rate': 0.0020854148186778376, 'batch_size': 9809, 'optimizer_name': 'RMSprop'}. Best is trial 899 with value: 0.0017655460917727903.[0m
[32m[I 2022-11-08 08:17:31,933][0m Trial 1538 finished with value: 0.0019095968918738959 and parameters: {'nlayers': 54, 'hidden_size': 99, 'dropout': 0.4057978541239146, 'learning_rate': 0.001446976406024376, 'batch_size': 9320, 'optimizer_name': 'Adam'}. Best is trial 899 with value: 0.0017655460917727903.[0m
[32m[I 2022-11-08 08:18:46,083][0m Trial 1539 finished with value: 0.0018588051610753302 and parameters: {'nlayers': 78, 'hidden_size': 216, 'dropout': 0.4293078286631918, 'learning_rate': 0.006602014396515799, 'batch_size': 9539, 'optimizer_name': 'Adam'}. Best is trial 899 with value: 0.0017655460917727903.[0m
[32m[I 2022-11-08 08:19:25,022][0m Trial 1540 finished with value: 0.0017786269602308947 and parameters: {'nlayers': 60, 'hidden_size': 106, 'dropout': 0.44288460677456815, 'learning_rate': 0.0010898802980527172, 'batch_size': 9994, 'optimizer_name': 'Adam'}. Best is trial 899 with value: 0.0017655460917727903.[0m
[32m[I 2022-11-08 08:19:46,796][0m Trial 1541 finished with value: 0.0028715797834413356 and parameters: {'nlayers': 70, 'hidden_size': 93, 'dropout': 0.21838076121255, 'learning_rate': 0.0018631591649246777, 'batch_size': 6173, 'optimizer_name': 'Adam'}. Best is trial 899 with value: 0.0017655460917727903.[0m
[32m[I 2022-11-08 08:20:10,732][0m Trial 1542 finished with value: 0.0017720306485891342 and parameters: {'nlayers': 11, 'hidden_size': 127, 'dropout': 0.17931316645320566, 'learning_rate': 0.007350973936655577, 'batch_size': 10000, 'optimizer_name': 'Adam'}. Best is trial 899 with value: 0.0017655460917727903.[0m
[32m[I 2022-11-08 08:21:07,895][0m Trial 1543 finished with value: 0.0018084521472454072 and parameters: {'nlayers': 36, 'hidden_size': 278, 'dropout': 0.45224303828021356, 'learning_rate': 0.0022451021309839235, 'batch_size': 10000, 'optimizer_name': 'SGD'}. Best is trial 899 with value: 0.0017655460917727903.[0m
[32m[I 2022-11-08 08:21:28,037][0m Trial 1544 finished with value: 0.0018343939507936902 and parameters: {'nlayers': 8, 'hidden_size': 88, 'dropout': 0.4855079569440033, 'learning_rate': 0.002187954889795858, 'batch_size': 9685, 'optimizer_name': 'Adam'}. Best is trial 899 with value: 0.0017655460917727903.[0m
[32m[I 2022-11-08 08:22:01,020][0m Trial 1545 finished with value: 0.001807240091545416 and parameters: {'nlayers': 68, 'hidden_size': 50, 'dropout': 0.47105992267659097, 'learning_rate': 0.0016065822686915517, 'batch_size': 9831, 'optimizer_name': 'Adam'}. Best is trial 899 with value: 0.0017655460917727903.[0m
[32m[I 2022-11-08 08:22:26,250][0m Trial 1546 finished with value: 0.0017705007821321487 and parameters: {'nlayers': 21, 'hidden_size': 74, 'dropout': 0.16545399123357102, 'learning_rate': 0.0019278338428800408, 'batch_size': 10000, 'optimizer_name': 'Adam'}. Best is trial 899 with value: 0.0017655460917727903.[0m
[32m[I 2022-11-08 08:22:56,442][0m Trial 1547 finished with value: 0.0018323793899656204 and parameters: {'nlayers': 43, 'hidden_size': 79, 'dropout': 0.4153550872563471, 'learning_rate': 0.0021747244819307933, 'batch_size': 9690, 'optimizer_name': 'Adam'}. Best is trial 899 with value: 0.0017655460917727903.[0m
[32m[I 2022-11-08 08:23:40,871][0m Trial 1548 finished with value: 0.0018921002234758685 and parameters: {'nlayers': 64, 'hidden_size': 137, 'dropout': 0.42128479371092376, 'learning_rate': 0.006333901803093325, 'batch_size': 9363, 'optimizer_name': 'Adam'}. Best is trial 899 with value: 0.0017655460917727903.[0m
[32m[I 2022-11-08 08:24:01,480][0m Trial 1549 finished with value: 0.0019525197553045956 and parameters: {'nlayers': 10, 'hidden_size': 151, 'dropout': 0.17544165929736855, 'learning_rate': 0.007875269471566932, 'batch_size': 9072, 'optimizer_name': 'Adam'}. Best is trial 899 with value: 0.0017655460917727903.[0m
[32m[I 2022-11-08 08:24:21,139][0m Trial 1550 finished with value: 0.0018045507728525808 and parameters: {'nlayers': 4, 'hidden_size': 69, 'dropout': 0.4030684823726828, 'learning_rate': 0.001961646121970367, 'batch_size': 9827, 'optimizer_name': 'RMSprop'}. Best is trial 899 with value: 0.0017655460917727903.[0m
[32m[I 2022-11-08 08:24:45,478][0m Trial 1551 finished with value: 0.0018622830992438503 and parameters: {'nlayers': 19, 'hidden_size': 114, 'dropout': 0.16731385247699165, 'learning_rate': 0.0017419868286873191, 'batch_size': 9516, 'optimizer_name': 'Adam'}. Best is trial 899 with value: 0.0017655460917727903.[0m
[32m[I 2022-11-08 08:25:13,133][0m Trial 1552 finished with value: 0.0018334904500835621 and parameters: {'nlayers': 39, 'hidden_size': 59, 'dropout': 0.3643972596976747, 'learning_rate': 0.0022868048200640773, 'batch_size': 9667, 'optimizer_name': 'Adam'}. Best is trial 899 with value: 0.0017655460917727903.[0m
[32m[I 2022-11-08 08:25:35,092][0m Trial 1553 finished with value: 0.0018056969100558261 and parameters: {'nlayers': 11, 'hidden_size': 97, 'dropout': 0.43996525332690034, 'learning_rate': 0.001337690619389195, 'batch_size': 9830, 'optimizer_name': 'Adam'}. Best is trial 899 with value: 0.0017655460917727903.[0m
[32m[I 2022-11-08 08:26:16,415][0m Trial 1554 finished with value: 0.0018127946608925119 and parameters: {'nlayers': 58, 'hidden_size': 125, 'dropout': 0.42922309028698147, 'learning_rate': 0.0004386036388320325, 'batch_size': 9811, 'optimizer_name': 'Adam'}. Best is trial 899 with value: 0.0017655460917727903.[0m
[32m[I 2022-11-08 08:26:23,167][0m Trial 1555 finished with value: 0.011027055061211282 and parameters: {'nlayers': 48, 'hidden_size': 109, 'dropout': 0.3942938532767188, 'learning_rate': 0.0020804279629275265, 'batch_size': 1611, 'optimizer_name': 'Adam'}. Best is trial 899 with value: 0.0017655460917727903.[0m
[32m[I 2022-11-08 08:26:55,552][0m Trial 1556 finished with value: 0.0017729520100076086 and parameters: {'nlayers': 41, 'hidden_size': 102, 'dropout': 0.4227942360068344, 'learning_rate': 0.007128877998334825, 'batch_size': 9996, 'optimizer_name': 'Adam'}. Best is trial 899 with value: 0.0017655460917727903.[0m
[32m[I 2022-11-08 08:27:25,315][0m Trial 1557 finished with value: 0.0018560636248071269 and parameters: {'nlayers': 32, 'hidden_size': 144, 'dropout': 0.46214310625809024, 'learning_rate': 0.0008540425398133108, 'batch_size': 9559, 'optimizer_name': 'Adam'}. Best is trial 899 with value: 0.0017655460917727903.[0m
[32m[I 2022-11-08 08:27:52,064][0m Trial 1558 finished with value: 0.0018248341140685968 and parameters: {'nlayers': 23, 'hidden_size': 121, 'dropout': 0.16334740648962162, 'learning_rate': 0.0023166156784631877, 'batch_size': 9677, 'optimizer_name': 'Adam'}. Best is trial 899 with value: 0.0017655460917727903.[0m
[32m[I 2022-11-08 08:28:14,328][0m Trial 1559 finished with value: 0.0017819516476301506 and parameters: {'nlayers': 7, 'hidden_size': 133, 'dropout': 0.20231766083766284, 'learning_rate': 0.0017597838736082907, 'batch_size': 9995, 'optimizer_name': 'Adam'}. Best is trial 899 with value: 0.0017655460917727903.[0m
[32m[I 2022-11-08 08:28:50,597][0m Trial 1560 finished with value: 0.0018101276376516636 and parameters: {'nlayers': 56, 'hidden_size': 89, 'dropout': 0.41183261140844185, 'learning_rate': 0.006816923479997269, 'batch_size': 9812, 'optimizer_name': 'Adam'}. Best is trial 899 with value: 0.0017655460917727903.[0m
[32m[I 2022-11-08 08:29:14,217][0m Trial 1561 finished with value: 0.0018704897681559164 and parameters: {'nlayers': 17, 'hidden_size': 115, 'dropout': 0.4487444084684785, 'learning_rate': 0.001946201018074722, 'batch_size': 9525, 'optimizer_name': 'Adam'}. Best is trial 899 with value: 0.0017655460917727903.[0m
[32m[I 2022-11-08 08:29:41,311][0m Trial 1562 finished with value: 0.0017733387559652329 and parameters: {'nlayers': 37, 'hidden_size': 45, 'dropout': 0.3754956439791461, 'learning_rate': 0.004367164943384372, 'batch_size': 10000, 'optimizer_name': 'RMSprop'}. Best is trial 899 with value: 0.0017655460917727903.[0m
[32m[I 2022-11-08 08:30:03,078][0m Trial 1563 finished with value: 0.001785635793209076 and parameters: {'nlayers': 13, 'hidden_size': 64, 'dropout': 0.17386403988897037, 'learning_rate': 0.0074715874641436125, 'batch_size': 10000, 'optimizer_name': 'SGD'}. Best is trial 899 with value: 0.0017655460917727903.[0m
[32m[I 2022-11-08 08:30:26,147][0m Trial 1564 finished with value: 0.0018244124783955778 and parameters: {'nlayers': 21, 'hidden_size': 80, 'dropout': 0.16298043780308236, 'learning_rate': 0.0025206487335450506, 'batch_size': 9707, 'optimizer_name': 'Adam'}. Best is trial 899 with value: 0.0017655460917727903.[0m
[32m[I 2022-11-08 08:30:40,108][0m Trial 1565 finished with value: 0.005668356661683619 and parameters: {'nlayers': 72, 'hidden_size': 106, 'dropout': 0.43304593984167206, 'learning_rate': 0.001601683534971428, 'batch_size': 3124, 'optimizer_name': 'Adam'}. Best is trial 899 with value: 0.0017655460917727903.[0m
[32m[I 2022-11-08 08:31:20,403][0m Trial 1566 finished with value: 0.0018094385259125666 and parameters: {'nlayers': 81, 'hidden_size': 96, 'dropout': 0.18519013666513873, 'learning_rate': 0.0021306953807551585, 'batch_size': 9798, 'optimizer_name': 'Adam'}. Best is trial 899 with value: 0.0017655460917727903.[0m
[32m[I 2022-11-08 08:31:41,034][0m Trial 1567 finished with value: 0.0019226717267239008 and parameters: {'nlayers': 9, 'hidden_size': 141, 'dropout': 0.1601739962156389, 'learning_rate': 0.0027952499349114916, 'batch_size': 9251, 'optimizer_name': 'Adam'}. Best is trial 899 with value: 0.0017655460917727903.[0m
[32m[I 2022-11-08 08:32:22,676][0m Trial 1568 finished with value: 0.0018698828664487884 and parameters: {'nlayers': 60, 'hidden_size': 131, 'dropout': 0.4066589877887949, 'learning_rate': 0.002343638135218189, 'batch_size': 9459, 'optimizer_name': 'Adam'}. Best is trial 899 with value: 0.0017655460917727903.[0m
[32m[I 2022-11-08 08:33:03,140][0m Trial 1569 finished with value: 0.001761963053552708 and parameters: {'nlayers': 66, 'hidden_size': 102, 'dropout': 0.17130962856649806, 'learning_rate': 0.001983036359383012, 'batch_size': 9999, 'optimizer_name': 'Adam'}. Best is trial 1569 with value: 0.001761963053552708.[0m
[32m[I 2022-11-08 08:33:41,869][0m Trial 1570 finished with value: 0.0018272626526733748 and parameters: {'nlayers': 65, 'hidden_size': 108, 'dropout': 0.19402289018396202, 'learning_rate': 0.0017974796554868866, 'batch_size': 9688, 'optimizer_name': 'Adam'}. Best is trial 1569 with value: 0.001761963053552708.[0m
[32m[I 2022-11-08 08:34:19,076][0m Trial 1571 finished with value: 0.0018052803925771982 and parameters: {'nlayers': 65, 'hidden_size': 104, 'dropout': 0.18788475750251588, 'learning_rate': 0.0014847272110524983, 'batch_size': 9812, 'optimizer_name': 'Adam'}. Best is trial 1569 with value: 0.001761963053552708.[0m
[32m[I 2022-11-08 08:34:58,810][0m Trial 1572 finished with value: 0.0018077150046322287 and parameters: {'nlayers': 62, 'hidden_size': 111, 'dropout': 0.17803458018710905, 'learning_rate': 0.0016364471144692746, 'batch_size': 9833, 'optimizer_name': 'Adam'}. Best is trial 1569 with value: 0.001761963053552708.[0m
[32m[I 2022-11-08 08:35:40,506][0m Trial 1573 finished with value: 0.001835697575944669 and parameters: {'nlayers': 69, 'hidden_size': 116, 'dropout': 0.18061323857841782, 'learning_rate': 0.0017891764898387568, 'batch_size': 9643, 'optimizer_name': 'Adam'}. Best is trial 1569 with value: 0.001761963053552708.[0m
[32m[I 2022-11-08 08:36:00,693][0m Trial 1574 finished with value: 0.003050247640858213 and parameters: {'nlayers': 65, 'hidden_size': 106, 'dropout': 0.17896488486273654, 'learning_rate': 0.0018739678589945066, 'batch_size': 5834, 'optimizer_name': 'Adam'}. Best is trial 1569 with value: 0.001761963053552708.[0m
[32m[I 2022-11-08 08:36:38,437][0m Trial 1575 finished with value: 0.0018043712529670877 and parameters: {'nlayers': 63, 'hidden_size': 102, 'dropout': 0.17531887751756134, 'learning_rate': 0.0019851918616367596, 'batch_size': 9819, 'optimizer_name': 'RMSprop'}. Best is trial 1569 with value: 0.001761963053552708.[0m
[32m[I 2022-11-08 08:37:51,549][0m Trial 1576 finished with value: 0.0017731278309143475 and parameters: {'nlayers': 66, 'hidden_size': 240, 'dropout': 0.1713603358386029, 'learning_rate': 0.001512833398509369, 'batch_size': 9999, 'optimizer_name': 'Adam'}. Best is trial 1569 with value: 0.001761963053552708.[0m
[32m[I 2022-11-08 08:38:33,273][0m Trial 1577 finished with value: 0.0017736832437926333 and parameters: {'nlayers': 68, 'hidden_size': 110, 'dropout': 0.1708342213083643, 'learning_rate': 0.0012787110305339014, 'batch_size': 9999, 'optimizer_name': 'Adam'}. Best is trial 1569 with value: 0.001761963053552708.[0m
[32m[I 2022-11-08 08:39:15,290][0m Trial 1578 finished with value: 0.0018677791529313975 and parameters: {'nlayers': 70, 'hidden_size': 115, 'dropout': 0.1837595606908435, 'learning_rate': 0.001970032161841392, 'batch_size': 9487, 'optimizer_name': 'Adam'}. Best is trial 1569 with value: 0.001761963053552708.[0m
[32m[I 2022-11-08 08:39:54,795][0m Trial 1579 finished with value: 0.0018321679564199651 and parameters: {'nlayers': 67, 'hidden_size': 120, 'dropout': 0.16657768482406407, 'learning_rate': 0.001707705755191759, 'batch_size': 9645, 'optimizer_name': 'Adam'}. Best is trial 1569 with value: 0.001761963053552708.[0m
[32m[I 2022-11-08 08:40:36,808][0m Trial 1580 finished with value: 0.001805723628174144 and parameters: {'nlayers': 68, 'hidden_size': 109, 'dropout': 0.19234018005833492, 'learning_rate': 0.0020375664641550063, 'batch_size': 9807, 'optimizer_name': 'Adam'}. Best is trial 1569 with value: 0.001761963053552708.[0m
[32m[I 2022-11-08 08:41:29,129][0m Trial 1581 finished with value: 0.0017704444498765845 and parameters: {'nlayers': 66, 'hidden_size': 151, 'dropout': 0.1704418291109861, 'learning_rate': 0.001908726544039598, 'batch_size': 9996, 'optimizer_name': 'Adam'}. Best is trial 1569 with value: 0.001761963053552708.[0m
[32m[I 2022-11-08 08:42:06,516][0m Trial 1582 finished with value: 0.0018904196198781332 and parameters: {'nlayers': 67, 'hidden_size': 101, 'dropout': 0.16002842152775995, 'learning_rate': 0.006033622679747541, 'batch_size': 9375, 'optimizer_name': 'Adam'}. Best is trial 1569 with value: 0.001761963053552708.[0m
[32m[I 2022-11-08 08:42:43,546][0m Trial 1583 finished with value: 0.0018398944921704293 and parameters: {'nlayers': 62, 'hidden_size': 103, 'dropout': 0.1854784274576361, 'learning_rate': 0.0021018488552750096, 'batch_size': 9819, 'optimizer_name': 'SGD'}. Best is trial 1569 with value: 0.001761963053552708.[0m
[32m[I 2022-11-08 08:43:23,677][0m Trial 1584 finished with value: 0.0018403401562417663 and parameters: {'nlayers': 66, 'hidden_size': 111, 'dropout': 0.16601568791584617, 'learning_rate': 0.0017362981241012096, 'batch_size': 9646, 'optimizer_name': 'Adam'}. Best is trial 1569 with value: 0.001761963053552708.[0m
[32m[I 2022-11-08 08:44:04,233][0m Trial 1585 finished with value: 0.001806616810433594 and parameters: {'nlayers': 69, 'hidden_size': 98, 'dropout': 0.16622618553923785, 'learning_rate': 0.002167497160096759, 'batch_size': 9828, 'optimizer_name': 'Adam'}. Best is trial 1569 with value: 0.001761963053552708.[0m
[32m[I 2022-11-08 08:44:47,864][0m Trial 1586 finished with value: 0.001772319543885045 and parameters: {'nlayers': 63, 'hidden_size': 122, 'dropout': 0.25783865866260613, 'learning_rate': 0.0011246282003637633, 'batch_size': 9999, 'optimizer_name': 'Adam'}. Best is trial 1569 with value: 0.001761963053552708.[0m
