[32m[I 2022-11-08 07:34:51,084][0m Trial 1449 finished with value: 0.0018522075841601326 and parameters: {'nlayers': 14, 'hidden_size': 111, 'dropout': 0.4232719808087161, 'learning_rate': 0.0025477609223387454, 'batch_size': 9538, 'optimizer_name': 'RMSprop'}. Best is trial 899 with value: 0.0017655460917727903.[0m
[32m[I 2022-11-08 07:35:12,324][0m Trial 1450 finished with value: 0.0018067580693507113 and parameters: {'nlayers': 9, 'hidden_size': 83, 'dropout': 0.44585228208788596, 'learning_rate': 0.0073936377252664075, 'batch_size': 9814, 'optimizer_name': 'RMSprop'}. Best is trial 899 with value: 0.0017655460917727903.[0m
[32m[I 2022-11-08 07:35:48,818][0m Trial 1451 finished with value: 0.001830194626920166 and parameters: {'nlayers': 60, 'hidden_size': 105, 'dropout': 0.4112472262213936, 'learning_rate': 0.006992355044473907, 'batch_size': 9656, 'optimizer_name': 'RMSprop'}. Best is trial 899 with value: 0.0017655460917727903.[0m
[32m[I 2022-11-08 07:36:11,655][0m Trial 1452 finished with value: 0.0018062893974265372 and parameters: {'nlayers': 12, 'hidden_size': 119, 'dropout': 0.4334072157169412, 'learning_rate': 0.008153443890912814, 'batch_size': 9825, 'optimizer_name': 'RMSprop'}. Best is trial 899 with value: 0.0017655460917727903.[0m
[32m[I 2022-11-08 07:36:35,416][0m Trial 1453 finished with value: 0.0017782054245471955 and parameters: {'nlayers': 16, 'hidden_size': 96, 'dropout': 0.39984999766778007, 'learning_rate': 0.0027410018562355645, 'batch_size': 10000, 'optimizer_name': 'RMSprop'}. Best is trial 899 with value: 0.0017655460917727903.[0m
[32m[I 2022-11-08 07:36:56,491][0m Trial 1454 finished with value: 0.0017727951512855737 and parameters: {'nlayers': 6, 'hidden_size': 77, 'dropout': 0.4492249339294533, 'learning_rate': 0.007975165330325242, 'batch_size': 9996, 'optimizer_name': 'Adam'}. Best is trial 899 with value: 0.0017655460917727903.[0m
[32m[I 2022-11-08 07:38:03,315][0m Trial 1455 finished with value: 0.0018644813657283082 and parameters: {'nlayers': 63, 'hidden_size': 222, 'dropout': 0.39277798158801214, 'learning_rate': 0.007653596557182057, 'batch_size': 9514, 'optimizer_name': 'RMSprop'}. Best is trial 899 with value: 0.0017655460917727903.[0m
[32m[I 2022-11-08 07:38:56,502][0m Trial 1456 finished with value: 0.0017986174353336508 and parameters: {'nlayers': 31, 'hidden_size': 292, 'dropout': 0.10826724420585111, 'learning_rate': 0.0025313838464089706, 'batch_size': 9829, 'optimizer_name': 'RMSprop'}. Best is trial 899 with value: 0.0017655460917727903.[0m
[32m[I 2022-11-08 07:39:26,166][0m Trial 1457 finished with value: 0.0017769016976784792 and parameters: {'nlayers': 44, 'hidden_size': 54, 'dropout': 0.4406935967218055, 'learning_rate': 0.007066560250461729, 'batch_size': 9998, 'optimizer_name': 'Adam'}. Best is trial 899 with value: 0.0017655460917727903.[0m
[32m[I 2022-11-08 07:39:48,544][0m Trial 1458 finished with value: 0.0018361997661083607 and parameters: {'nlayers': 14, 'hidden_size': 87, 'dropout': 0.11485095539318747, 'learning_rate': 0.002877343259822996, 'batch_size': 9669, 'optimizer_name': 'Adam'}. Best is trial 899 with value: 0.0017655460917727903.[0m
[32m[I 2022-11-08 07:40:12,423][0m Trial 1459 finished with value: 0.001890793745988979 and parameters: {'nlayers': 18, 'hidden_size': 132, 'dropout': 0.4252387698210715, 'learning_rate': 0.000564272545245554, 'batch_size': 9385, 'optimizer_name': 'Adam'}. Best is trial 899 with value: 0.0017655460917727903.[0m
[32m[I 2022-11-08 07:40:39,318][0m Trial 1460 finished with value: 0.0018058078946445089 and parameters: {'nlayers': 10, 'hidden_size': 234, 'dropout': 0.3806234743044303, 'learning_rate': 0.002342183584978362, 'batch_size': 9810, 'optimizer_name': 'Adam'}. Best is trial 899 with value: 0.0017655460917727903.[0m
[32m[I 2022-11-08 07:40:46,285][0m Trial 1461 finished with value: 0.005130483417264107 and parameters: {'nlayers': 38, 'hidden_size': 61, 'dropout': 0.42220546030307105, 'learning_rate': 0.0003144995154878761, 'batch_size': 3438, 'optimizer_name': 'Adam'}. Best is trial 899 with value: 0.0017655460917727903.[0m
[32m[I 2022-11-08 07:41:09,330][0m Trial 1462 finished with value: 0.0017693972803397425 and parameters: {'nlayers': 13, 'hidden_size': 112, 'dropout': 0.4730180448908499, 'learning_rate': 0.006666469639034534, 'batch_size': 9998, 'optimizer_name': 'RMSprop'}. Best is trial 899 with value: 0.0017655460917727903.[0m
[32m[I 2022-11-08 07:41:44,946][0m Trial 1463 finished with value: 0.0018348912486534023 and parameters: {'nlayers': 56, 'hidden_size': 103, 'dropout': 0.41411363068140783, 'learning_rate': 0.0026706223744007327, 'batch_size': 9652, 'optimizer_name': 'Adam'}. Best is trial 899 with value: 0.0017655460917727903.[0m
[32m[I 2022-11-08 07:42:12,359][0m Trial 1464 finished with value: 0.0017695025602181595 and parameters: {'nlayers': 20, 'hidden_size': 127, 'dropout': 0.46650935567425256, 'learning_rate': 0.009388378561351938, 'batch_size': 9998, 'optimizer_name': 'Adam'}. Best is trial 899 with value: 0.0017655460917727903.[0m
[32m[I 2022-11-08 07:43:39,203][0m Trial 1465 finished with value: 0.001771258783340454 and parameters: {'nlayers': 69, 'hidden_size': 259, 'dropout': 0.33713781690474726, 'learning_rate': 0.002435730817852432, 'batch_size': 10000, 'optimizer_name': 'Adam'}. Best is trial 899 with value: 0.0017655460917727903.[0m
[32m[I 2022-11-08 07:44:00,808][0m Trial 1466 finished with value: 0.0018554832989292193 and parameters: {'nlayers': 16, 'hidden_size': 68, 'dropout': 0.40419029219873737, 'learning_rate': 0.007295961045852174, 'batch_size': 9544, 'optimizer_name': 'Adam'}. Best is trial 899 with value: 0.0017655460917727903.[0m
[32m[I 2022-11-08 07:44:24,091][0m Trial 1467 finished with value: 0.0017736547380685806 and parameters: {'nlayers': 11, 'hidden_size': 95, 'dropout': 0.43216553962898746, 'learning_rate': 0.0022392283009526025, 'batch_size': 10000, 'optimizer_name': 'Adam'}. Best is trial 899 with value: 0.0017655460917727903.[0m
[32m[I 2022-11-08 07:44:56,263][0m Trial 1468 finished with value: 0.0018291171529687806 and parameters: {'nlayers': 43, 'hidden_size': 106, 'dropout': 0.4836315818720403, 'learning_rate': 0.002566276209347165, 'batch_size': 9712, 'optimizer_name': 'Adam'}. Best is trial 899 with value: 0.0017655460917727903.[0m
[32m[I 2022-11-08 07:45:35,853][0m Trial 1469 finished with value: 0.0017986671182838982 and parameters: {'nlayers': 65, 'hidden_size': 99, 'dropout': 0.11372857221805177, 'learning_rate': 0.0029146855525712142, 'batch_size': 9826, 'optimizer_name': 'Adam'}. Best is trial 899 with value: 0.0017655460917727903.[0m
[32m[I 2022-11-08 07:45:54,112][0m Trial 1470 finished with value: 0.0019191803908135995 and parameters: {'nlayers': 7, 'hidden_size': 75, 'dropout': 0.18718774800394228, 'learning_rate': 0.002375893772531202, 'batch_size': 9218, 'optimizer_name': 'Adam'}. Best is trial 899 with value: 0.0017655460917727903.[0m
[32m[I 2022-11-08 07:46:20,801][0m Trial 1471 finished with value: 0.0017762185752391816 and parameters: {'nlayers': 18, 'hidden_size': 136, 'dropout': 0.4401520074276353, 'learning_rate': 0.006500350862548826, 'batch_size': 10000, 'optimizer_name': 'Adam'}. Best is trial 899 with value: 0.0017655460917727903.[0m
[32m[I 2022-11-08 07:46:41,168][0m Trial 1472 finished with value: 0.0019782040527160155 and parameters: {'nlayers': 14, 'hidden_size': 117, 'dropout': 0.4541308038357966, 'learning_rate': 0.00214278544595461, 'batch_size': 8976, 'optimizer_name': 'Adam'}. Best is trial 899 with value: 0.0017655460917727903.[0m
[32m[I 2022-11-08 07:47:54,286][0m Trial 1473 finished with value: 0.002606248997527502 and parameters: {'nlayers': 92, 'hidden_size': 245, 'dropout': 0.3123778783655728, 'learning_rate': 0.003401866270765875, 'batch_size': 6803, 'optimizer_name': 'Adam'}. Best is trial 899 with value: 0.0017655460917727903.[0m
[32m[I 2022-11-08 07:48:14,093][0m Trial 1474 finished with value: 0.0018590542939009008 and parameters: {'nlayers': 12, 'hidden_size': 89, 'dropout': 0.4118380531916657, 'learning_rate': 0.002663195818483489, 'batch_size': 9505, 'optimizer_name': 'SGD'}. Best is trial 899 with value: 0.0017655460917727903.[0m
[32m[I 2022-11-08 07:48:28,087][0m Trial 1475 finished with value: 0.0023016184315678345 and parameters: {'nlayers': 16, 'hidden_size': 112, 'dropout': 0.42596899650160797, 'learning_rate': 0.003093171483379044, 'batch_size': 7665, 'optimizer_name': 'RMSprop'}. Best is trial 899 with value: 0.0017655460917727903.[0m
[32m[I 2022-11-08 07:49:02,022][0m Trial 1476 finished with value: 0.0018249268901848147 and parameters: {'nlayers': 41, 'hidden_size': 125, 'dropout': 0.1080398052390833, 'learning_rate': 0.002471523213640941, 'batch_size': 9703, 'optimizer_name': 'Adam'}. Best is trial 899 with value: 0.0017655460917727903.[0m
[32m[I 2022-11-08 07:49:40,496][0m Trial 1477 finished with value: 0.0018082124453511718 and parameters: {'nlayers': 85, 'hidden_size': 58, 'dropout': 0.23341399227011844, 'learning_rate': 0.00224664608516549, 'batch_size': 9798, 'optimizer_name': 'Adam'}. Best is trial 899 with value: 0.0017655460917727903.[0m
[32m[I 2022-11-08 07:50:15,313][0m Trial 1478 finished with value: 0.0018348744395003914 and parameters: {'nlayers': 54, 'hidden_size': 102, 'dropout': 0.4045811639292331, 'learning_rate': 0.007791602412864791, 'batch_size': 9687, 'optimizer_name': 'Adam'}. Best is trial 899 with value: 0.0017655460917727903.[0m
[32m[I 2022-11-08 07:50:35,136][0m Trial 1479 finished with value: 0.0018892992398038138 and parameters: {'nlayers': 9, 'hidden_size': 92, 'dropout': 0.493240607759798, 'learning_rate': 0.006842372987722002, 'batch_size': 9367, 'optimizer_name': 'Adam'}. Best is trial 899 with value: 0.0017655460917727903.[0m
[32m[I 2022-11-08 07:51:18,141][0m Trial 1480 finished with value: 0.0018042460688021597 and parameters: {'nlayers': 58, 'hidden_size': 133, 'dropout': 0.10017567369476632, 'learning_rate': 0.002652356062544253, 'batch_size': 9818, 'optimizer_name': 'Adam'}. Best is trial 899 with value: 0.0017655460917727903.[0m
[32m[I 2022-11-08 07:51:45,151][0m Trial 1481 finished with value: 0.001855864315925531 and parameters: {'nlayers': 37, 'hidden_size': 69, 'dropout': 0.4205593694753117, 'learning_rate': 0.002134804844311695, 'batch_size': 9552, 'optimizer_name': 'Adam'}. Best is trial 899 with value: 0.0017655460917727903.[0m
[32m[I 2022-11-08 07:51:51,312][0m Trial 1482 finished with value: 0.003965913567995175 and parameters: {'nlayers': 20, 'hidden_size': 51, 'dropout': 0.12044825286188239, 'learning_rate': 0.002387458891364567, 'batch_size': 4461, 'optimizer_name': 'Adam'}. Best is trial 899 with value: 0.0017655460917727903.[0m
[32m[I 2022-11-08 07:52:27,538][0m Trial 1483 finished with value: 0.0018105830613424638 and parameters: {'nlayers': 61, 'hidden_size': 84, 'dropout': 0.4998006486854028, 'learning_rate': 0.002792682822773584, 'batch_size': 9813, 'optimizer_name': 'Adam'}. Best is trial 899 with value: 0.0017655460917727903.[0m
[32m[I 2022-11-08 07:52:35,368][0m Trial 1484 finished with value: 0.003284729380620004 and parameters: {'nlayers': 14, 'hidden_size': 108, 'dropout': 0.431871095229747, 'learning_rate': 0.005845221523502102, 'batch_size': 5384, 'optimizer_name': 'Adam'}. Best is trial 899 with value: 0.0017655460917727903.[0m
[32m[I 2022-11-08 07:52:57,381][0m Trial 1485 finished with value: 0.0018075938244976836 and parameters: {'nlayers': 11, 'hidden_size': 81, 'dropout': 0.45443805660435843, 'learning_rate': 0.0020051840129403807, 'batch_size': 9804, 'optimizer_name': 'Adam'}. Best is trial 899 with value: 0.0017655460917727903.[0m
[32m[I 2022-11-08 07:53:36,032][0m Trial 1486 finished with value: 0.00183325215931214 and parameters: {'nlayers': 66, 'hidden_size': 98, 'dropout': 0.41530030862828754, 'learning_rate': 0.002505774342566215, 'batch_size': 9631, 'optimizer_name': 'Adam'}. Best is trial 899 with value: 0.0017655460917727903.[0m
[32m[I 2022-11-08 07:54:02,097][0m Trial 1487 finished with value: 0.0017745937733184627 and parameters: {'nlayers': 18, 'hidden_size': 121, 'dropout': 0.20860178361127124, 'learning_rate': 0.007416445080022994, 'batch_size': 9996, 'optimizer_name': 'Adam'}. Best is trial 899 with value: 0.0017655460917727903.[0m
[32m[I 2022-11-08 07:54:45,441][0m Trial 1488 finished with value: 0.0018048735128677466 and parameters: {'nlayers': 71, 'hidden_size': 116, 'dropout': 0.27900015590895827, 'learning_rate': 0.007119323551608781, 'batch_size': 9809, 'optimizer_name': 'RMSprop'}. Best is trial 899 with value: 0.0017655460917727903.[0m
[32m[I 2022-11-08 07:55:15,608][0m Trial 1489 finished with value: 0.0018633801508883034 and parameters: {'nlayers': 39, 'hidden_size': 103, 'dropout': 0.35931107054048034, 'learning_rate': 0.003996684088515069, 'batch_size': 9504, 'optimizer_name': 'Adam'}. Best is trial 899 with value: 0.0017655460917727903.[0m
[32m[I 2022-11-08 07:55:41,887][0m Trial 1490 finished with value: 0.0019382825622905634 and parameters: {'nlayers': 27, 'hidden_size': 93, 'dropout': 0.39706787493205853, 'learning_rate': 3.171741794236009e-05, 'batch_size': 9673, 'optimizer_name': 'Adam'}. Best is trial 899 with value: 0.0017655460917727903.[0m
[32m[I 2022-11-08 07:56:07,699][0m Trial 1491 finished with value: 0.0018042737035846382 and parameters: {'nlayers': 16, 'hidden_size': 139, 'dropout': 0.17729720098786997, 'learning_rate': 0.002233928502103165, 'batch_size': 9834, 'optimizer_name': 'Adam'}. Best is trial 899 with value: 0.0017655460917727903.[0m
[32m[I 2022-11-08 07:56:30,370][0m Trial 1492 finished with value: 0.0018057565757490658 and parameters: {'nlayers': 12, 'hidden_size': 111, 'dropout': 0.4621121973843023, 'learning_rate': 0.005337142134049538, 'batch_size': 9829, 'optimizer_name': 'Adam'}. Best is trial 899 with value: 0.0017655460917727903.[0m
[32m[I 2022-11-08 07:56:51,240][0m Trial 1493 finished with value: 0.0018967270557642033 and parameters: {'nlayers': 9, 'hidden_size': 131, 'dropout': 0.44377901682112414, 'learning_rate': 0.0018935223888254483, 'batch_size': 9342, 'optimizer_name': 'Adam'}. Best is trial 899 with value: 0.0017655460917727903.[0m
[32m[I 2022-11-08 07:57:12,753][0m Trial 1494 finished with value: 0.0018531132248736561 and parameters: {'nlayers': 14, 'hidden_size': 88, 'dropout': 0.11487726124860297, 'learning_rate': 0.002991863853759293, 'batch_size': 9549, 'optimizer_name': 'Adam'}. Best is trial 899 with value: 0.0017655460917727903.[0m
[32m[I 2022-11-08 07:57:42,861][0m Trial 1495 finished with value: 0.0018716901586385993 and parameters: {'nlayers': 45, 'hidden_size': 75, 'dropout': 0.42106443720932274, 'learning_rate': 0.0026212763824834144, 'batch_size': 9797, 'optimizer_name': 'SGD'}. Best is trial 899 with value: 0.0017655460917727903.[0m
[32m[I 2022-11-08 07:58:12,613][0m Trial 1496 finished with value: 0.0018056643143673351 and parameters: {'nlayers': 42, 'hidden_size': 63, 'dropout': 0.18141978611332685, 'learning_rate': 0.00040140909946918856, 'batch_size': 9839, 'optimizer_name': 'Adam'}. Best is trial 899 with value: 0.0017655460917727903.[0m
[32m[I 2022-11-08 07:58:52,352][0m Trial 1497 finished with value: 0.0017721803353458253 and parameters: {'nlayers': 62, 'hidden_size': 105, 'dropout': 0.12493215489001455, 'learning_rate': 0.0023382786020679927, 'batch_size': 9991, 'optimizer_name': 'Adam'}. Best is trial 899 with value: 0.0017655460917727903.[0m
[32m[I 2022-11-08 07:59:19,064][0m Trial 1498 finished with value: 0.001774333112534432 and parameters: {'nlayers': 19, 'hidden_size': 123, 'dropout': 0.34820581660340544, 'learning_rate': 0.002120940973977481, 'batch_size': 9995, 'optimizer_name': 'Adam'}. Best is trial 899 with value: 0.0017655460917727903.[0m
[32m[I 2022-11-08 07:59:55,085][0m Trial 1499 finished with value: 0.001775079488110478 and parameters: {'nlayers': 15, 'hidden_size': 287, 'dropout': 0.4346722219299797, 'learning_rate': 0.002798265994745244, 'batch_size': 9999, 'optimizer_name': 'Adam'}. Best is trial 899 with value: 0.0017655460917727903.[0m
[32m[I 2022-11-08 08:00:16,967][0m Trial 1500 finished with value: 0.0018370245456497535 and parameters: {'nlayers': 12, 'hidden_size': 97, 'dropout': 0.4763126573932281, 'learning_rate': 0.0018449223278651716, 'batch_size': 9632, 'optimizer_name': 'Adam'}. Best is trial 899 with value: 0.0017655460917727903.[0m
[32m[I 2022-11-08 08:00:38,708][0m Trial 1501 finished with value: 0.0018348852840685823 and parameters: {'nlayers': 17, 'hidden_size': 80, 'dropout': 0.2976590749490575, 'learning_rate': 0.002408497903619307, 'batch_size': 9659, 'optimizer_name': 'RMSprop'}. Best is trial 899 with value: 0.0017655460917727903.[0m
[32m[I 2022-11-08 08:01:27,590][0m Trial 1502 finished with value: 0.0017766809047377332 and parameters: {'nlayers': 73, 'hidden_size': 144, 'dropout': 0.388470235220461, 'learning_rate': 0.0062189436011245835, 'batch_size': 9998, 'optimizer_name': 'Adam'}. Best is trial 899 with value: 0.0017655460917727903.[0m
[32m[I 2022-11-08 08:02:06,135][0m Trial 1503 finished with value: 0.0018702907219858259 and parameters: {'nlayers': 59, 'hidden_size': 115, 'dropout': 0.17137517364774288, 'learning_rate': 0.0031940127615526035, 'batch_size': 9463, 'optimizer_name': 'Adam'}. Best is trial 899 with value: 0.0017655460917727903.[0m
[32m[I 2022-11-08 08:02:44,618][0m Trial 1504 finished with value: 0.001835199780539032 and parameters: {'nlayers': 64, 'hidden_size': 108, 'dropout': 0.4256547053409877, 'learning_rate': 0.002052056189947478, 'batch_size': 9682, 'optimizer_name': 'Adam'}. Best is trial 899 with value: 0.0017655460917727903.[0m
[32m[I 2022-11-08 08:03:12,419][0m Trial 1505 finished with value: 0.0018035625380110802 and parameters: {'nlayers': 21, 'hidden_size': 137, 'dropout': 0.4067348912293291, 'learning_rate': 0.0025697496527308525, 'batch_size': 9825, 'optimizer_name': 'Adam'}. Best is trial 899 with value: 0.0017655460917727903.[0m
[32m[I 2022-11-08 08:03:34,125][0m Trial 1506 finished with value: 0.0017675814962182024 and parameters: {'nlayers': 8, 'hidden_size': 70, 'dropout': 0.38103666275193093, 'learning_rate': 0.0017283187204194137, 'batch_size': 9999, 'optimizer_name': 'Adam'}. Best is trial 899 with value: 0.0017655460917727903.[0m
[32m[I 2022-11-08 08:03:54,614][0m Trial 1507 finished with value: 0.0017725671782638087 and parameters: {'nlayers': 3, 'hidden_size': 86, 'dropout': 0.3798947496281868, 'learning_rate': 0.0014517167184893496, 'batch_size': 9999, 'optimizer_name': 'Adam'}. Best is trial 899 with value: 0.0017655460917727903.[0m
[32m[I 2022-11-08 08:04:18,214][0m Trial 1508 finished with value: 0.0019385777052166393 and parameters: {'nlayers': 8, 'hidden_size': 270, 'dropout': 0.3927927734441568, 'learning_rate': 0.0012943667868571232, 'batch_size': 9167, 'optimizer_name': 'Adam'}. Best is trial 899 with value: 0.0017655460917727903.[0m
[32m[I 2022-11-08 08:04:38,226][0m Trial 1509 finished with value: 0.0018315980579960364 and parameters: {'nlayers': 5, 'hidden_size': 102, 'dropout': 0.4040658926095676, 'learning_rate': 0.001598111382912117, 'batch_size': 9665, 'optimizer_name': 'Adam'}. Best is trial 899 with value: 0.0017655460917727903.[0m
[32m[I 2022-11-08 08:04:58,933][0m Trial 1510 finished with value: 0.0018106133265285782 and parameters: {'nlayers': 6, 'hidden_size': 128, 'dropout': 0.41231331864836235, 'learning_rate': 0.001721650690718418, 'batch_size': 9809, 'optimizer_name': 'Adam'}. Best is trial 899 with value: 0.0017655460917727903.[0m
[32m[I 2022-11-08 08:05:16,767][0m Trial 1511 finished with value: 0.0018689467018380816 and parameters: {'nlayers': 2, 'hidden_size': 95, 'dropout': 0.40806833958009814, 'learning_rate': 0.001798498281523977, 'batch_size': 9485, 'optimizer_name': 'Adam'}. Best is trial 899 with value: 0.0017655460917727903.[0m
[32m[I 2022-11-08 08:05:32,922][0m Trial 1512 finished with value: 0.0020310731942679585 and parameters: {'nlayers': 6, 'hidden_size': 76, 'dropout': 0.3713617675466608, 'learning_rate': 0.0016878277239064615, 'batch_size': 8735, 'optimizer_name': 'RMSprop'}. Best is trial 899 with value: 0.0017655460917727903.[0m
[32m[I 2022-11-08 08:05:53,378][0m Trial 1513 finished with value: 0.0018028203164565581 and parameters: {'nlayers': 5, 'hidden_size': 117, 'dropout': 0.36851237856184405, 'learning_rate': 0.0014798095304072159, 'batch_size': 9815, 'optimizer_name': 'Adam'}. Best is trial 899 with value: 0.0017655460917727903.[0m
[32m[I 2022-11-08 08:06:13,008][0m Trial 1514 finished with value: 0.0018911868728296458 and parameters: {'nlayers': 8, 'hidden_size': 110, 'dropout': 0.37744892223429727, 'learning_rate': 0.009627924393353273, 'batch_size': 9368, 'optimizer_name': 'Adam'}. Best is trial 899 with value: 0.0017655460917727903.[0m
[32m[I 2022-11-08 08:06:33,822][0m Trial 1515 finished with value: 0.0018092530976122525 and parameters: {'nlayers': 7, 'hidden_size': 91, 'dropout': 0.39820972306698454, 'learning_rate': 0.0013506847960907523, 'batch_size': 9821, 'optimizer_name': 'Adam'}. Best is trial 899 with value: 0.0017655460917727903.[0m
[32m[I 2022-11-08 08:06:52,936][0m Trial 1516 finished with value: 0.00183581765621338 and parameters: {'nlayers': 4, 'hidden_size': 100, 'dropout': 0.38499406542127695, 'learning_rate': 0.0017216366699089247, 'batch_size': 9642, 'optimizer_name': 'Adam'}. Best is trial 899 with value: 0.0017655460917727903.[0m
[32m[I 2022-11-08 08:07:15,684][0m Trial 1517 finished with value: 0.001773339194059372 and parameters: {'nlayers': 8, 'hidden_size': 146, 'dropout': 0.3814058836075867, 'learning_rate': 0.0019276597327670057, 'batch_size': 10000, 'optimizer_name': 'SGD'}. Best is trial 899 with value: 0.0017655460917727903.[0m
